2016,Generative Shape Models: Joint Text Recognition and Segmentation with Very Little Training Data,We demonstrate that a generative model for object shapes can achieve state of the art results on challenging scene text recognition tasks  and with orders of magnitude fewer training images than required for competing discriminative methods. In addition to transcribing text from challenging images  our method performs fine-grained instance segmentation of characters. We show that our model is more robust to both affine transformations and non-affine deformations compared to previous approaches.,Generative Shape Models: Joint Text Recognition and

Segmentation with Very Little Training Data

Xinghua Lou  Ken Kansky  Wolfgang Lehrach  CC Laan

Vicarious FPC Inc.  San Francisco  USA

xinghua ken wolfgang cc@vicarious.com

Bhaskara Marthi  D. Scott Phoenix  Dileep George

Vicarious FPC Inc.  San Francisco  USA

bhaskara scott dileep@vicarious.com

Abstract

Abstract: We demonstrate that a generative model for object shapes can achieve
state of the art results on challenging scene text recognition tasks  and with or-
ders of magnitude fewer training images than required for competing discrim-
inative methods.
In addition to transcribing text from challenging images  our
method performs ﬁne-grained instance segmentation of characters. We show that
our model is more robust to both afﬁne transformations and non-afﬁne deforma-
tions compared to previous approaches.

1

Introduction

Classic optical character recognition (OCR) tools focus on reading text from well-prepared scanned
documents. They perform poorly when used for reading text from images of real world scenes [1].
Scene text exhibits very strong variation in font  appearance  and deformation  and image quality
can be lowered by many factors  including noise  blur  illumination change and structured back-
ground. Fig. 1 shows some representative images from two major scene text datasets: International
Conference on Document Analysis and Recognition (ICDAR) 2013 and Street View Text (SVT).

Figure 1: Examples of text in real world scenes: ICDAR 2013 (left two columns) and SVT (right
two columns). Unlike classic OCR that handles well-prepared scanned documents  scene text recog-
nition is difﬁcult because of the strong variation in font  background  appearance  and distortion.

Despite these challenges  the machine learning and computer vision community have recently wit-
nessed a surging interest in developing novel approaches for scene text recognition. This is driven
by numerous potential applications such as scene understanding for robotic control and augmented
reality  street sign reading for autonomous driving  and image feature extraction for large-scale im-
age search. In this paper we present a novel approach for robust scene text recognition. Speciﬁcally 
we study the problem of text recognition in a cropped image that contains a single word  which is
usually the output from some text localization method (see [2] for a thorough review on this topic).

30th Conference on Neural Information Processing Systems (NIPS 2016)  Barcelona  Spain.

Our core contribution is a novel generative shape model that shows strong generalization capabil-
ities. Unlike many previous approaches that are based on discriminative models and trained on
millions of real world images  our generative model only requires hundreds of training images 
yet still effectively captures afﬁne transformations and non-afﬁne deformations. To cope with the
strong variation of fonts in real scenes  we also propose a greedy approach for selecting representa-
tive fonts from a large database of fonts. Finally  we introduce a word parsing model that is trained
using structured output learning.
We evaluated our approach on ICDAR 2013 and SVT and achieved state-of-the-art performance
despite using several orders of magnitude less of training data. Our results show that instead of
relying on a massive amount of supervision to train a discriminative model  a generative model
trained on uncluttered fonts with properly encoded invariance generalizes well to text in natural
images and is more interpretable.

2 Related Work

We only consider literature on recognizing scene text in English. There are two paradigms for
solving this problem: character detection followed by word parsing  and simultaneous character
detection and word parsing.
Character detection followed by word parsing is the more popular paradigm. Essentially  a character
detection method ﬁrst ﬁnds candidate characters  and then a parsing model searches for the true
sequence of characters by optimizing some objective function. Many previous works following this
paradigm differ in the detection and parsing methods.
Character detection methods can be patch-based or bottom-up. Patch-based detection ﬁrst ﬁnds
patches of (hopefully) single characters using over-segmentation [3] or the stroke width transforma-
tion [4]  followed by running a character classiﬁer on each patch. Bottom-up detection ﬁrst creates
an image-level representation using engineered or learned features and then ﬁnds instances of char-
acters by aggregating image-level evidence and searching for strong activations at every pixel. Many
different representations have been proposed such as Strokelets [5]  convolutional neural networks
[6]  region-based features [7]  tree-structured deformable models [8] and simple shape template [9].
Both patch-based and bottom-up character detection have ﬂawed localization because they cannot
provide accurate segmentation boundaries of the characters.
Unlike detection  word parsing methods in literature show strong similarity. They are generally
sequence models that utilize attributes of individual as well as adjacent candidate characters. They
differ in model order and inference techniques. For example  [10] considered the problem as a high-
order Markov model in a Bayesian inference framework. A classic pairwise conditional random ﬁeld
was also used by [8  11  4]  and inference was carried out using message passing [11] and dynamic
programming [8  4]. Acknowledging that a pairwise model cannot encode as useful features as a
high-order character n-gram  [3] proposed a patch-based sequence model that encodes up to 4th-
order character n-grams and applied beam search to solve it.
A second paradigm is simultaneous character detection and word parsing  reading the text without an
explicit step for detecting the characters. For example  [12] proposed a graphical model that jointly
models the attributes  location  and class of characters as well as the language consistency of the
word they constitute. Inference was carried out using weighted ﬁnite-state transducers (WFSTs).
[13] took a drastically different approach: they used a lexicon of about 90k words to synthesize
about 8 million images of text  which were used to train a CNN that predicts a character at each
independent position. The main drawback of this “all-in-one” approach is weak invariance and
insufﬁcient robustness  since changes in any attribute such as spacing between characters may cause
the system to fail due to over-ﬁtting to the training data.

3 Model

Our approach follows the ﬁrst detection-parsing paradigm. First  candidate characters are detected
using a novel generative shape model trained on clean character images. Second  a parsing model is
used to infer the true word  and this parser is trained using max-margin structured output learning.

2

3.1 Generative Shape Model for Fonts

Unlike many vision problem such as distinguishing dogs from cats where many local discriminative
features can be informative  text in real scenes  printed or molded using some fonts  is not as easily
distinguishable from local features. For example  the curve “(cid:94)” at the bottom of “O” also exists
in “G”  “U” and “Q”. This special structure “(cid:96)” can be found in “B”  “E”  “F”  “H”  “P” and “R”.
Without a sense of the global structure  a naive accumulation of local features easily leads to false
detections in the presence of noise or when characters are printed tightly. We aim at building a model
that speciﬁcally accounts for the global structure  i.e.
the entire shape of characters. Our model
is generative such that during testing time we obtain a segmentation together with classiﬁcation 
making the ﬁnal word parsing much easier due to better explaining-away.
Model Construction
During training we build a graph representation from rendered clean images of fonts  as shown in
Fig. 2. Since we primarily care about shape  the basic image-level feature representation relies only
on edges  making our model invariant to appearance such as color and texture. Speciﬁcally  given a
clean font image we use 16 oriented ﬁlters to detect edges  followed by local suppression that keeps
at most one edge orientation active per pixel (Fig. 2a). Then  “landmark” features are generated by
selecting one edge at a time  suppressing any other edges within a ﬁxed radius  and repeat (Fig. 2b).
We then create a pool variable centered around each landmark point such that it allows translation
pooling in a window around the landmark (Fig. 2b). To coordinate the the pool choices between
adjacent landmarks (thus the shape of the letter)  we add “lateral constraints” between neighboring
pairs of pools that lie on the same edge contour (blue dashed lines in Fig. 2c). All lateral constraints
are elastic  allowing for some degree of afﬁne and non-afﬁne deformation. This allows our model
to generalize to different variations observed in real images such as noise  aspect change  blur  etc.
In addition to contour laterals  we add lateral constraints between distant pairs of pixels (red dashed
lines in Fig. 2c) to further constrain the shapes this model can represent. These distant laterals are
greedily added one at a time  from shortest to longest  between pairs of features that with the current
constraints can deform more than γ times the deformation allowed by adding a direct constraint
between the features (typically γ ≈ 3).

Figure 2: Model construction process for our generative shape model for fonts. Given a clean
character images  we detect 16 oriented edge features at every pixel (a). We perform a sparsiﬁcation
process that selects “landmark” features from the dense edge map (b) and then add pooling window
(b). We then add lateral constraints to constrain the shape model (c). A factor graph representation
of our model is partially shown in (d). (best viewed in color)

Formally  our model can be viewed as a factor graph shown in Fig. 2d. Each pool variable centered
on a landmark feature is considered a random variable and is associated with unary factors corre-
sponding to the translations of the landmark feature. Each lateral constraint is a pairwise factor. The
unary factors give positive scores when matching features are found in the test image. The pairwise
factor is parameterized with a single perturbation radius parameter  which is deﬁned as the largest
allowed change in the relative position of features in the adjacent pools. This perturbation radius
forbids extreme deformation  giving −∞ log probability if this lateral constraint is violated. During
testing  the state space of each random variable is the pooling window and lateral constraints are not
allowed to be violated.
During training  this model construction process is carried out independently for all letter images 
and each letter is rendered in multiple fonts.

3

Inference and Instance Detection The letter models can be considered to be tiling an input image
at all translations. Given a test image  ﬁnding all candidate character instances involves two steps: a
forward pass and backtracing.
The forward pass is a bottom-up procedure that accumulate evidence from the test image to com-
pute the marginal distribution of the shape model at each pixel location  similar to an activation
heatmap. To speed-up the computation  we simplify our graph (Fig. 2c) into a minimum spanning
tree  computed with edge weights equal to the pixel distance between features. Moreover  we make
the pooling window as large as the entire image to avoid a scanning procedure. The marginals in
the tree can be computed exactly and quickly with a single iteration of belief propagation. After
non-maximum suppression  a few positions that have the strongest activation are selected for back-
tracing. This process is guaranteed to overestimate the true marginals in the original loopy graphical
model  so this forward pass admits some false positives. Such false positives occur more often when
the image has a tight character layout or a prominent texture or background.
Given the estimated positions of character instances  backtracing is performed in the original loopy
graph to further reduce false positives and to output a segmentation (by connecting the “landmarks”)
of each instance in the test image. The backtracing procedure selects a single landmark feature 
constrains its position to one of the local maxima in its marginal from the forward pass  and then
performs MAP inference in the full loopy graph to estimate the positions of all other landmarks
in the model  which provides the segmentation. Because this inference is more accurate than the
forward pass  additional false positives can be pruned after backtracing.
In both the forward and backward pass  classic loopy belief propagation was sufﬁcient.
Greedy Font Model Selection One challenge in scene text reading is covering the huge variation
of fonts in uncontrolled  real world images.
It is not feasible to train on all fonts because it is
too computationally expensive and redundant. We resort to an automated greedy font selection
approach. Brieﬂy  for some letter we render images for all fonts and then use the resulting images
to train shape models. These shape models are then tested on every other rendered image  yielding
a compatibility score (amount of matching “landmark” features) between every pair of fonts of the
same letter. One font is considered representable by another if their compatibility score is greater
than a given threshold (=0.8). For each letter  we ﬁnd and keep the fonts that can represent most
other fonts and remove it from the font candidate set together with all the fonts it represents. This
selection process is repeated until 90% of all fonts are represented. Usually the remaining 10% fonts
are non-typical and rare in real scenes.

3.2 Word Parsing using Structured Output Learning

Parsing Model Our generative shape models were trained independently on all font images. There-
fore  no explaining-away is performed before parsing. The shape model shows high invariance and
sensitivity  yielding a rich list of candidate letters that contains many false positives. For example 
an image of letter “E” may also trigger the following: “F”  “I”  “L” and “c”. Word parsing refers to
inferring the true word from this list of candidate letters.

Figure 3: Our parsing model represented as a high-order factor graph. Given a test image  the
shape model generates a list of candidate letters. A factor graph is created by adding edges between
hypothetical neighboring letters and considering these edges as random variables. Four types of
factors are deﬁned: transition  smoothness  consistency  and singleton factors. The ﬁrst two factors
characterize the likelihood of parsing path  while the latter two ensure valid parsing output.

Our parsing model can be represented as a high-order factor graph in Fig. 3. First  we build hy-
pothetical edges between a candidate letter and every candidate letter on its right-hand side within
some distance. Two pseudo letters “*” and “#” are created  indicating start and end of the graph 

4

respectively. Edges are created from start to all possible head letters and similarly from end to
all possible tail letters. Each edge is considered as a binary random variable which  if activated 
indicates a pair of neighboring letters from the true word.
We deﬁne four types of factors. Transition factors (green  unary) describe the likelihood of a hypo-
thetical pair of neighboring letters being true. Similarly  smoothness factors (blue  pairwise) describe
the likelihood of a triplet of consecutive letters. Two additional factors are added as constraints to
ensure valid output. Consistency factors (red  high-order) ensure that if any candidate letter has an
activated inward edge  it must have one activated outward edge. This is sometimes referred to as
“ﬂow consistency”. Lastly  to satisfy the single word constraint  a singleton factor (purple  high-
order) is added such that there must be a single activated edge from “start”. Examples of these
factors are shown in Fig. 3.
Mathematically  assuming that potentials on the factors are provided  inferring the state of random
variables in the parsing factor graph is equivalent to solving the following optimization problem.


(cid:88)
(cid:88)
∀c ∈ C (cid:80)
u∈In(c) zu =(cid:80)
(cid:80)

v∈Out(c)

c∈C

φT
v (wT)zv +

(cid:88)

(cid:88)

c∈C

u∈In(c)
v∈Out(c)



ˆz = arg maxz

φS
u v(wS)zuzv

(1)

s.t.

v∈Out(c) zv 

v∈Out(∗) zv = 1 

∀c ∈ C ∀v ∈ Out(c)  zv ∈ {0  1}.

(2)
(3)
(4)
where  z = {zv} is the set of all binary random variables indexed by v; C is the set of all candidate
letters  and for candidate letter c in C  In(c) and Out(c) index the random variables that correspond
v (wT) is the potential of transition factor at v
to the inward and outward edges of c  respectively; φT
u v(wS) is the potential of smoothness factor from u to
(parameterized by weight vector wT) and φS
v (parameterized by weight vector wS); Constraints (2)–(4) ensure ﬂow consistency  singleton  and
the binary nature of all random variables.
Parameter Learning Another issue is proper parameterization of the factor potentials  i.e. φT
v (wT)
u v(wS). Due to the complex nature of real world images  high dimensional parsing features
and φS
are required. For one example  consecutive letters of the true word are usually evenly spaced. For
another example  a character n-gram model can be used to resolve ambiguous letter detections and
improve parsing quality. We use Wikipedia as the source for building our character n-gram model.
u v(wS) are linear models of some features and a weight vector. To learn the
Both φT
best weight vector that directly maps the input-output dependency of the parsing factor graph  we
used the maximum-margin structured output learning paradigm [14].
Brieﬂy  maximum-margin structured output learning attempts to learn a direct functional depen-
dency between structured input and output by maximizing the margin between the compatibility
score of the ground truth solution and that of the second best solution. It is an extension to the clas-
sic support vector machine (SVM) paradigm. Usually  the compatibility score is a linear function of
some so-called joint feature vector (i.e. parsing features) and feature weights to be learned (i.e. wT
and wS here). We designed 18 parsing features  including the score of individual candidate letters 
color consistency between hypothetical neighboring pairs  alignment of hypothetical consecutive
triplets  and character n-grams up to third order.
Re-ranking Lastly  top scoring words from the second-order Viterbi algorithm are re-ranked using
statistical word frequencies from Wikipedia.

v (wT) and φS

4 Experiments

4.1 Datasets

ICDAR ICDAR (“International Conference on Document Analysis and Recognition”) is a biannual
competition on text recognition. The ICDAR 2013 Robust Reading Competition was designed for
comparing scene text recognition approaches [1]. Unlike digital-born images like those used on the

5

web  real world image recognition is more challenging due to uncontrolled environmental and imag-
ing conditions that result in strong variation in font  blur  noise  distortion  non-uniform appearance 
and background structure. We worked on two datasets: ICDAR 2013 Segmentation dataset and IC-
DAR 2013 Recognition dataset. In this experiment  we only consider letters  ignoring punctuations
and digits. All test images are cropped and each image contains only a single word  see examples in
Fig. 1.
SVT The Street View Text (SVT) dataset [15] was harvested from Google Street View. Image text in
this dataset exhibits high variability and often has low resolution. SVT provides a small lexicon and
was created for lexicon-driven word recognition. In our experiments  we did not restrict the setting
to a given small lexicon and instead used a general  large English lexicon. SVT does not contain
symbols other than letters.

4.2 Model Training

Training Generative Shape Model To ensure sufﬁcient coverage of fonts  we obtained 492 fonts
from Google Fonts1. Manual font selection is biased and inaccurate  and it is not feasible to train
on all fonts (492 fonts times 52 letters gives 25584 training images). After the proposed greedy
font selection process for all letters  we retained 776 unique training images in total (equivalent to
a compression rate of 3% if we would have trained on all fonts for all letters). Fig. 4 shows the
selected fonts for letter “a” and “A”  respectively.

Figure 4: Results of greedy font selection for letter “a” and “A”. Given a large font database of 492
fonts  this process leverages the representativeness of our generative shape model to signiﬁcantly
reduce the number of training images required to cover all fonts.

Training Word Parsing Model Training the structured output prediction model is expensive in
terms of supervision because every training sample consists of many random variables  and the state
of every random variable has to be annotated (i.e. the entire parsing path). We prepared training data
for our parsing model automatically using the ICDAR 2013 Segmentation dataset [1] that provides
per-character segmentation of scene text. Brieﬂy  we ﬁrst detect characters and construct a parsing
graph for each image. We then ﬁnd the true path in the parsing graph (i.e. a sequence of activated
random variables) by matching the detected characters to the ground truth segmentation. In total 
we used 630 images for training the parser using PyStruct2.
Shape Model Invariance Study We studied the invariance of our model by testing on transfor-
mations of the training images. We considered scaling and rotation. For the former  our model
performs robust ﬁtting when the scaling varies between 130% and 70%. For the later  the angle of
robust ﬁtting is between -20 and +20 degrees.

4.3 Results and Comparison

Character Detection We ﬁrst tested our shape model on the ICDAR 2013 Segmentation dataset.
Since this is pre-parsing and no explaining-away is performed  we speciﬁcally looked for high recall.
A detected letter and a true segmented letter is considered a match only when the letter classes match
and their segmentation masks strongly overlap with ≥ 0.8 IoU (intersection-over-union). Trained on
fonts selected from Google Fonts  we obtained a very high 95.0% recall  which is signiﬁcantly better
than 68.7% by the best reported method on the dataset [1]. This attributes to the high invariance
encoded in our model from the lateral constraints. The generative nature of the model gives a
complete segmentation and classiﬁcation instead of only letter classiﬁcation (as most discriminative
models do). Fig. 5 shows some instances of letters detected by our model. They exhibit strong
variance in font and appearance. Note that two scales (×1  ×2) are used during testing.

1https://www.google.com/fonts
2https://pystruct.github.io

6

Figure 5: Examples of detected and segmented characters (“A”  “E” and “R”) from the ICDAR
2013 Segmentation dataset. Despite obvious differences in font  appearance  and imaging condition
and quality  our shape model shows high accuracy in localizing and segmenting them from the full
image. (best viewed in color and when zoomed in)

Word Parsing We compared our approach against top performing ones in the ICDAR 2013 Ro-
bust Reading Competition. Results are given in Table 4.3. Our model perform better than Google’s
PhotoOCR[3] with a margin of 2.3%. However  a more important message is that we achieved this
result using three orders of magnitude less training data: 1406 total images (776 letter font images
for training the shape models and 630 word images for training the parser) versus 5 million by
PhotoOCR. Two major factors attribute to our high efﬁciency. First  considering character detec-
tion  our model demonstrates strong generalization in practice. Data-intensive models like those in
PhotoOCR impose weaker structural priors and require signiﬁcantly more supervision. Second  con-
sidering word parsing  our generative model solves recognition and segmentation together  allowing
the use of highly accurate parsing features. On the other hand  PhotoOCR’s neural-network based
character classiﬁer is incapable of generating accurate character segmentation boundaries  making
the parsing quality bounded. Our observations on the SVT dataset are similar: using exactly the
same training data we achieved state-of-the-art 80.7% accuracy. Note that all reported results in our
experiments are case-sensitive. Fig. 6 demonstrates the robustness of our approach toward unusual
fonts  noise  blur  and distracting backgrounds.

Method
PicRead [1]
Deep Struc. Learn. [16]
PhotoOCR [3]
This paper

SVT

Training Data Size

ICDAR
63.1% 72.9% N/A
81.8% 71.7% 8 000 000 (synthetic)
84.3% 78.0% 7 900 000 (manually labeled + augmented)
