2018,Variational PDEs for Acceleration on Manifolds and Application to Diffeomorphisms,We consider the optimization of cost functionals on manifolds and derive a variational approach to accelerated methods on manifolds. We demonstrate the methodology on the infinite-dimensional manifold of diffeomorphisms  motivated by registration problems in computer vision. We build on the variational approach to accelerated optimization by Wibisono  Wilson and Jordan  which applies in finite dimensions  and generalize that approach to infinite dimensional manifolds. We derive the continuum evolution equations  which are partial differential equations (PDE)  and relate them to simple mechanical principles. Our approach can also be viewed as a generalization of the $L^2$ optimal mass transport problem. Our approach evolves an infinite number of particles endowed with mass  represented as a mass density. The density evolves with the optimization variable  and endows the particles with dynamics. This is different than current accelerated methods where only a single particle moves and hence the dynamics does not depend on the mass. We derive the theory  compute the PDEs for acceleration  and illustrate the behavior of this new accelerated optimization scheme.,Variational PDEs for Acceleration on Manifolds and

Application to Diffeomorphisms

Ganesh Sundaramoorthi

United Technologies Research Center

East Hartford  CT 06118

sundarga1@utrc.utc.com

Anthony Yezzi

School of Electrical & Computer Engineering

Georgia Institute of Technology  Atlanta  GA 30332

ayezzi@ece.gatech.edu

Abstract

We consider the optimization of cost functionals on inﬁnite dimensional mani-
folds and derive a variational approach to accelerated methods on manifolds. We
demonstrate the methodology on the inﬁnite-dimensional manifold of diffeomor-
phisms  motivated by optical ﬂow problems in computer vision. We build on a
variational approach to accelerated optimization in ﬁnite dimensions  and gener-
alize that approach to inﬁnite dimensional manifolds. We derive the continuum
evolution equations  which are partial differential equations (PDE)  and relate them
to mechanical principles. A particular case of our approach can be viewed as a
generalization of the L2 optimal mass transport problem. Our approach evolves
an inﬁnite number of particles endowed with mass  represented as a mass density.
The density evolves with the optimization variable  and endows the particles with
dynamics. This is different than current accelerated methods where only a single
particle moves and hence the dynamics does not depend on mass. We derive theory
and the PDEs for acceleration  and illustrate the behavior of this new scheme.

1

Introduction

Accelerated optimization methods have gained wide interest within the machine learning and opti-
mization communities (e.g.  [1  2  3  4  5  6  7  8  9  10  11  12  13]). They are known for optimal
convergence rates among schemes that use only gradient (ﬁrst order) information in the convex case.
In the non-convex case  they appear to provide robustness to shallow local minima. The intuitive
idea is that by considering a particle with mass that moves in an energy landscape  the particle
will gain momentum and surpass shallow local minimum and settle in in deeper and wider local
extrema. These methods have so far have only been used in ﬁnite dimensional optimization problems.
In this paper  we consider the generalization of these methods to inﬁnite dimensional manifolds.
We are motivated by applications in computer vision  e.g.  segmentation  3D reconstruction  and
optical ﬂow. In these problems  optimization is over inﬁnite dimensional manifolds (e.g.  curves 
surfaces  mappings). Recently there has been interest within machine learning in optimization on
ﬁnite dimensional manifolds  such as matrix groups  e.g.  [14  15  16]  in a non-variational framework 
and the methodology presented here can be adapted to those problems as well.
Recent work [17] has shown that the continuum limit of accelerated methods may be formulated
with variational principles. The resulting optimal continuum path is deﬁned by an ordinary differ-
ential equation (ODE)  which when discretized appropriately yields Nesterov’s method [13]. The
optimization problem is an action integral  which integrates the Bregman Lagrangian over paths.
The Bregman Lagrangian consists of a generalization of kinetic and potential energies. The kinetic
energy is deﬁned using the Bregman divergence; the potential energy is the cost function that is to be
optimized. We build on the approach of [17] by formulating accelerated optimization with an action
integral  but we generalize that approach to manifolds. Our approach is general for manifolds  but we

32nd Conference on Neural Information Processing Systems (NeurIPS 2018)  Montréal  Canada.

illustrate the idea here for the case of the inﬁnite dimensional manifold of diffeomorphisms of Rn. To
do this  we forgo the Bregman Lagrangian framework in [17] since that assumes that the variable over
which one optimizes is embedded in Rn  which is not the case for inﬁnite dimensional manifolds.
Instead  we adopt the formulation of action integrals in physics [18  19]  where kinetic energies that
are deﬁned through Riemannian metrics  which allows generalization beyond Euclidean geometries.
Our contributions are speciﬁcally: 1. We present a novel variational approach to accelerated optimiza-
tion on manifolds. 2. We adapt our approach to accelerated optimization on the inﬁnite dimensional
manifold diffeomorphisms  i.e.  smooth invertible mappings. 3. We introduce a Riemannian metric
for the purpose of acceleration on diffeomorphisms  which deﬁnes the kinetic energy of a mass
distribution. The metric is the same one in the ﬂuid mechanics formulation of the L2 mass transport
problem [20]. 4. We derive the PDE for accelerated optimization of any cost functional deﬁned on
diffeomorphisms  and relate it to ﬂuid mechanics principles. 5. We present a numerical discretization 
which requires entropy schemes [21]  and show the advantage over gradient descent.

1.1 Related Work

Optimal Mass Transport: Our work relates to the optimal mass transport problem (e.g.  [22  23 
20  24]). In this problem  two probability densities ρ0  ρ1 in Rn are given  and the goal is to ﬁnd
a transformation M : Rn → Rn so that the pushforward of ρ0 by M results in ρ1 such that M
Rn |M (x) − x|pρ0(x) dx where p ≥ 1. The value of the
minimum cost is called the Lp Wasserstein distance. For p = 2  [20] has shown that mass transport
can be formulated as a ﬂuid mechanics problem. In particular  the Wasserstein distance can be
formulated as a distance arising from a Riemannian metric on the space of probability densities. The
tangent space consists of vector ﬁelds that inﬁnitesimally displace the density  and the metric is the
2 ρ(x)|v(x)|2 dx.

has minimal cost. The cost is deﬁned as(cid:82)
kinetic energy of the mass distribution as it is displaced by the velocity  given by(cid:82)

Rn

1

The goal is to minimize(cid:82) 1

Optimal mass transport computes the optimal path that minimizes the integral of kinetic energy.
In our work  we minimize a potential on the manifold of diffeomorphisms  with acceleration. We
associate a mass density in Rn to the diffeomorphism that  as we optimize the potential  moves in Rn
via a push-forward of the diffeomorphism. This evolution arises as the stationary condition of the
action integral  i.e.  the difference of the kinetic and potential energies. One choice of kinetic energy
that we explore is the L2 Riemannian mass transport metric. The main difference of our approach is
that we compute stationary paths of the path integral of kinetic minus potential energies.
Diffeomorphic Registration: Our work relates to diffeomorphic image registration [25  26]  where
the goal is to compute registration (pixel-wise correspondence) between images as diffeomorphisms.
The optimization problem is formed on a path of velocity ﬁelds  which generates a diffeomorphism.
0 (cid:107)v(cid:107)2 dt where v is a time varying vector ﬁeld  and the optimization is
subject to the constraint that the mapping φ maps one image to the other  i.e.  I1 = I0 ◦ φ−1. This
minimizes an action integral where the action contains only a kinetic energy. The norm is a Sobolev
norm to ensure that the generated diffeomorphism is smooth. The problem is solved by a Sobolev
gradient descent (see also [27  28  29]) on the space of paths  which gives a geodesic.
Our framework instead uses accelerated gradient descent. Like [25  26]  it is derived from an action
integral  but the action has both a kinetic energy and a potential energy. In our work  one choice of
kinetic energy is an L2 metric weighted by mass rather than a Sobolev metric. One of our motivations
in this work is to get regularizing effects of Sobolev norms without using Sobolev norms  since that
requires inverting differential operators in the optimization  which can be computationally expensive.
Our approach allows us to generate diffeomorphisms without using Sobolev norms.
Optical Flow: The purpose of this paper is to derive the variational framework for acceleration on
manifolds  in particular diffeomorphisms. To demonstrate our ideas numerically  we show gains over
gradient descent on one possible application - variational optical ﬂow (e.g.  [30  31  32  33  34  29]).
Optical ﬂow  i.e.  determining pixel-wise correspondence between images  is fundamental to computer
vision and remains a challenge to solve  due to its non-convexity. The dominant general approach to
these problems involves iterative linearization of the cost functional around the current accumulated
optical ﬂow and its solution for an incremental displacement. This approach  in conjunction with
image pyramids  has been successful in many cases  but the there are still many cases  e.g.  large
displacement of thin structures where it fails.

2

Accelerated Optimization in Inﬁnite Dimensions: We present general methodology for accelerated
optimization on inﬁnite-dimensional manifolds  and illustrate it on diffeomorphisms (see [35] for
an extended version of this paper). The case of the manifold of curves and surfaces is considered in
[36]. Convergence rates of the resulting PDEs are not explored in this paper. However  in [37]  we
rigorously analyze stability conditions and time step restrictions for discretizations of accelerated
PDEs and show that they are signiﬁcantly more generous compared to gradient descent.

2 Background for Accelerated Optimization on Manifolds

q

Differential Geometry: We review basic manifold theory [38]. A manifold M is a space in which
every point p ∈ M has a (invertible) mapping fp from a neighborhood of p to a model space that is a
linear normed vector space  and has an additional compatibility condition that if the neighborhoods
for p and q overlap then the mapping fp ◦ f−1
is differentiable. Intuitively  a manifold is a space that
locally appears ﬂat. The manifold may be ﬁnite or inﬁnite dimensional when the model spaces are
ﬁnite or inﬁnite dimensional  respectively. The tangent space at a point p ∈ M is the equivalence
class  [γ]  of curves γ : [0  1] → M under the equivalence that γ(0) = p and (fp ◦ γ)(cid:48)(0) are the
same for each curve γ ∈ [γ]. Intuitively  these are the set of possible directions of movement at the
point p on the manifold. The tangent bundle  denoted T M  is T M = {(p  v) : p ∈ M  v ∈ TpM} 
i.e.  the space formed from the collection of all points and tangent spaces.
A Riemannian manifold is a manifold that has an inner product (called the metric) that exists on each
tangent space TpM  and smoothly varies on M. A Riemannian manifold allows one to formally
deﬁne the lengths of curves γ : [−1  1] → M on the manifold. This allows one to construct paths
of critical length  called geodesics  a generalization of a path of constant velocity. The Riemannian
metric allows one to deﬁne gradients of functions g : M → R deﬁned on the manifold: the gradient
∇g(p) ∈ TpM is deﬁned to be the vector that satisﬁes d
dε g(γ(ε))|ε=0 = (cid:104)∇g(p)  γ(cid:48)(0)(cid:105)  where
γ(0) = p  the left hand side is the directional derivative and the right hand side is the inner product.
Mechanics on Manifolds: We now review some of the formalism of classical mechanics on mani-
folds [18  19]. The subject of mechanics describes the principles governing the evolution of a particle
that moves on a manifold M. The equations governing a particle are Newton’s laws. There are two
viewpoints in mechanics  namely the Lagrangian and Hamiltonian viewpoints  which formulate more
general principles to derive Newton’s equations. In this paper  we use the Lagrangian formulation
to derive equations of motion for accelerated optimization on the manifold of diffeomorphisms.
Lagrangian mechanics obtains equations of motion through variational principles  which makes
it easier to generalize Newton’s laws beyond simple particle systems in R3  especially to the case
of manifolds. In Lagrangian mechanics  one starts with a Lagrangian L : T M → R where M
is a Riemannian manifold. One says that a curve γ : [−1  1] → M is a motion in a Lagrangian

system with Lagrangian L if it is an extremal of A = (cid:82) L(γ(t)  ˙γ(t)) dt. The previous integral

is called an action integral. Hamilton’s principle of stationary action states that the motion in
the Lagrangian system satisﬁes the condition that δA = 0  where δ denotes the variation  for all
variations of A induced by variations of the path γ that keep endpoints ﬁxed. The variation is deﬁned
ds A(˜γ(t  s))|s=0 where ˜γ : [−1  1]2 → M is a smooth family of curves (a variation of γ)
as δA := d
on the manifold such that ˜γ(t  0) = γ(t). The stationary conditions give rise to what is known as
Lagrange’s equations. A natural Lagrangian has the special form L = T − U where T : T M → R+
is the kinetic energy and U : M → R is the potential energy. The kinetic energy is deﬁned as
2 (cid:104)v  v(cid:105) where (cid:104)· ·(cid:105) is the Riemannian metric. In the case that one has a particle system
T (v) = 1
in R3  i.e.  a collection of particles with masses mi  in a natural Lagrangian system  one can show
that Hamilton’s principle of stationary action is equivalent to Newton’s law of motion  i.e.  that
dt (mi ˙ri) = − ∂U
where ri is the trajectory of the ith particle  and ˙ri is the velocity. This states
d
that mass times acceleration is the force  which is given by minus the derivative of the potential in a
conservative system. Thus  Hamilton’s principle is more general and allows us to more easily derive
equations of motion for more general systems  in particular those on manifolds.
In this paper  we will consider Lagrangian non-autonomous systems where the Lagrangian is also an
explicit function of time t  i.e.  L : T M × R → R. In particular  the kinetic and potential energies
can both be explicit functions of time: T : T M × R → R and U : M × R → R. Autonomous
systems have an energy conservation property and do not converge; for instance  one can think of a

∂ri

3

L(X  V  t) = ea(t)+γ(t)(cid:104)

L(X  V  t) = eγ(t)(cid:104)

(cid:105)

(cid:105)

moving pendulum with no friction  which oscillates forever. Since we wish to minimize an objective
functional  we want the system to converge and Lagrangian non-autonomous systems allow for this.
Variational Approach to Accelerated Optimization in Rn: We review the variational formulation
of accelerated gradient descent by [17]. This approach is based on the Bregman Lagrangian:

d(X + e−a(t)V  X) − eb(t)U (X)

 

where the potential energy U represents the cost to be minimized  and d(y  x) = h(y) − h(x) −
2|x|2 
∇h(x) · (y − x) where h is a given convex function. In the Euclidean case  where h(x) = 1
d(y  x) = 1

2|y − x|2  this simpliﬁes to

e−a(t)|V |2/2 − ea(t)+b(t)U (X)

 

2|V |2 is the kinetic energy of a unit mass particle in Rn. Nesterov’s methods [13  39  40 
where T = 1
12  41  11] belong to a subfamily of Bregman Lagrangians with various choices of a  b  γ.
The Bregman Lagrangian assumes that the underlying manifold is a subset of Rn  which is not true
of many manifolds including diffeomorphisms1. Therefore  we use the mechanics formulation  which
provides a formalism for general metrics though the Riemannian distance.

3 Accelerated Optimization on Manifolds Applied to Diffeomorphisms

In this section  we use the mechanics on manifolds to generalize accelerated optimization to inﬁnite
dimensional manifolds  in particular the manifold of diffeomorphisms of Rn for general n. Dif-
feomorphisms  denoted Diff(Rn)  are smooth mappings φ : Rn → Rn whose inverse exists and is
also smooth. The cost functional (the potential) is denoted U (φ) and our framework applies to any
potential. In the ﬁrst sub-section  we give the formulation and evolution equations for the case of
acceleration without energy dissipation  i.e.  the Lagrangian is autonomous  since it is relevant for
the case of energy dissipation. In the second sub-section  we formulate the dissipative case  which
generalizes [17] to diffeomorphisms. All proofs are found in supplementary material.

3.1 Acceleration Without Energy Dissipation

Formulation of the Action Integral: To formulate the action  we deﬁne the kinetic energy T on the
space of diffeomorphisms  which is deﬁned on the tangent space  denoted TφDiff(Rn)  to Diff(Rn)
at a diffeomorphism φ. The tangent space at φ is the set of perturbations v of φ that preserve the
diffeomorphism property  i.e.  for all small ε  φ + εv is a diffeomorphism. One can show that

TφDiff(Rn) = {v : φ(Rn) → Rn : v is in a Sobolev space } 

(1)
which is a set of smooth vector ﬁelds on φ(Rn) in which the vector ﬁeld at each point φ(x) displaces
φ(x) inﬁnitesimally. Since φ is a diffeomorphism  we have that φ(Rn) = Rn. However  we write
v : φ(Rn) → Rn to emphasize that the velocity ﬁelds in the tangent space are deﬁned on the
deformed domain  so that v is a Eulerian velocity.
We note a result from [42]  which will be the basis of our derivation of accelerated optimization on
Diff(Rn). Any (orientable) diffeomorphism may be generated by integrating a time-varying smooth
vector ﬁeld over time  i.e. 

∂tφt(x) = vt(φt(x)) 

(2)
where ∂t denotes partial derivative with respect to t  φt denotes a time varying family of diffeomor-
phisms evaluated at the time t  and vt is a time varying collection of vector ﬁelds evaluated at time t.
The path t → φt(x) for a ﬁxed x represents a trajectory of a particle starting at x.
The space on which the kinetic energy is deﬁned is now clear  but one more ingredient is needed
before we can deﬁne the kinetic energy. Any accelerated method will need a notion of mass  as a
mass-less ball will not accelerate. We imagine that an inﬁnite number of particles densely distributed
in Rn with mass exist and are displaced by the velocity ﬁeld v at every point. We represent the mass
1The Bregman distance can be generalized to manifolds using the exponential and logarithmic maps. However 
for many manifolds  including diffeomorphisms  computing these maps require solving an optimization problem.

x ∈ Rn 

4

distribution with a mass density ρ : Rn → R+  which is the mass divided by volume as the volume
shrinks. During the evolution to optimize the potential U  the particles are displaced continuously
and thus the density of these particles will in general change over time. We will assume that the
Rn ρ(x) dx = 1. The
evolution of a time varying density ρt as it is deformed by a time varying velocity is given by the
continuity equation  which is a local form of the conservation of mass  given by

system of particles in Rn is closed and so we impose mass preservation  i.e. (cid:82)
where div () denotes the divergence operator  given by div (F ) =(cid:80)n

(3)
i= ∂xiF i where ∂xi is the partial

∂tρ(x) + div (ρ(x)v(x)) = 0 

with respect to the ith coordinate and F i is the ith component of the vector ﬁeld.
We now have the ingredients to deﬁne the kinetic energy. We present one choice to illustrate the idea
of accelerated optimization. We deﬁne the kinetic energy as

x ∈ Rn

T (v) =

φ(Rn)

ρ(x)|v(x)|2 dx 

1
2

(4)

(cid:90)

(cid:90)

which matches the deﬁnition of the kinetic energy of a system of particles in physics.
We deﬁne the action integral  which is deﬁned on paths on Diff(Rn). A path of diffeomorphisms is
φ : [0 ∞) × Rn → Rn. We denote the diffeomorphism at a time t as φt. Since diffeomorphisms are
generated by velocity ﬁelds  we can deﬁne the action on paths of velocity ﬁelds. A path of velocity
ﬁelds is given by v : [0 ∞) × Rn → Rn. The kinetic energy is dependent on the mass density  thus 
a path of densities ρ : [0 ∞) × Rn → R+ is required  which represents the mass distribution as it is
deformed. The action integral is

A =

[T (vt) − U (φt)] dt 

(5)

(cid:90)

(cid:90) (cid:90)

x ∈ Rn

(cid:90) (cid:90)

where the integral is over time. The action is implicitly a function of three paths  i.e.  vt  φt and ρt.
These paths are coupled as φt depends on vt through (2)  and ρt depends on vt through (3).
Stationary Conditions for the Action: We treat the computation of the stationary conditions of the
action as a constrained optimization problem with respect to the two aforementioned constraints.
To do this  it is easier to formulate the action in terms of the path of the inverse diffeomorphisms
φ−1
  which we will call ψt. This is because the non-linear PDE constraint (2) can be equivalently
t
reformulated as the following linear transport PDE in the inverse mappings:

∂tψt(x) + [Dψt(x)]vt(x) = 0 

(6)
where D denotes the derivative (Jacobian) operator. To derive the stationary conditions with respect
to the constraints  we use the method of Lagrange multipliers. We denote by λ : [0 ∞) × Rn → Rn
the Lagrange multiplier according to (6). We denote µ : [0 ∞)× Rn → R as the Lagrange multiplier
for the continuity equation (3). Because we would like to be able to have possibly discontinuous
solutions of the continuity equation  we formulate it in its weak form by multiplying the constraint
by the Lagrange multiplier and integrating by parts thereby removing the derivatives on possibly
discontinuous ρ. This gives the action integral with Lagrange multipliers as

Rn

A =

[T (v) − U (φ)] dt +

λT [∂tψ + (Dψ)v] dx dt −

[∂tµ + ∇µ · v] ρ dx dt  (7)
where we have omitted the subscripts to avoid cluttering the notation. Notice that the potential U is
now a function of ψ  and the action depends on ρ  ψ  v and the Lagrange multipliers µ  λ.
We now compute variations of A as we perturb the paths by variations δρ  δv and δφ along the
paths. The variation with respect to ρ is deﬁned as δA · δρ = d
variations are deﬁned in a similar fashion. This results in the following theorem.
Theorem 3.1 (Evolution Equations for the Path of Least Action). The stationary conditions for
the path of the action integral (5) subject to the constraints (2) on the mapping and the continuity
equation (3) are given by the forward evolution equation

dε A(ρ + εδρ  v  ψ)(cid:12)(cid:12)ε=0  and the other

Rn

ρ

Dv
Dt

= −∇U (φ) 

or ∂tv = −(Dv)v − 1
ρ

∇U (φ) 

(8)

where Df
Dt := ∂tf + (Df )v is the material derivative. The previous equation describes the velocity
evolution. The forward evolution equation for the diffeomorphism is given by (2)  that of its inverse
mapping is given by (6)  and the forward evolution of its density is given by (3).

5

The ﬁrst equation in (8) is an analogue of Newton’s equations. Indeed  the equation says the time rate
of change of velocity along trajectories generated by the velocity ﬁeld multiplied by density is equal
to minus the gradient of the potential  which is Newton’s 2nd law.
Viscosity Solution and Regularity: The evolution equations given by Theorem 3.1 maintain the
mapping φt as a diffeomorphism. This is because we deﬁne the solution as the viscosity solution
(e.g.  [43  44  21]). The viscosity solution is deﬁned as follows. Deﬁne
∂tvε = −(Dvε)vε + ε∆vε − ρ−1∇U (φ) 

(9)
where ∆ denotes the spatial Laplacian  which is a smoothing operator. This leads to a smooth (C∞)
solution due to smoothing properties of the Laplacian. The viscosity solution is v = limε→0 vε. We
approximate the effects with small ε by using entropy conditions in our numerical implementation.
Since the velocity is smooth (C∞)  the integral of a smooth vector ﬁeld is a diffeomorphism [42].

3.2 Acceleration with Energy Dissipation

We now present the case of a non-autonomous Lagrangian. We consider time varying scalar functions
a  b : [0 ∞) → R+  and deﬁne the action integral as follows:

A =

[atT (vt) − btU (φt)] dt 

(10)

(cid:90)

where at  bt denote the values of the scalar at time t. It can be shown that the stationary conditions
result in the following evolution:
Theorem 3.2 (Evolution Equations for the Path of Least Action). The stationary conditions for the
path of the action integral (10) subject to the constraints (2) on the mapping and the continuity
equation (3) are given by the forward evolution equation

a∂tv + a(Dv)v + (∂ta)v = −(b/ρ)∇U (φ) 

(11)
which describes the evolution of the velocity. The same evolution equations as Theorem 3.1 for the
mappings (2) and (6)  and density (3) hold.
If we consider the case at = eγt−αt  bt = eαt+βt+γt where αt = log p − log t  βt = p log t +
