2010,Approximate Inference by Compilation to Arithmetic Circuits,Arithmetic circuits (ACs) exploit context-specific independence and determinism to allow exact inference even in networks with high treewidth. In this paper  we introduce the first ever approximate inference methods using ACs  for domains where exact inference remains intractable. We propose and evaluate a variety of techniques based on exact compilation  forward sampling  AC structure learning  Markov network parameter learning  variational inference  and Gibbs sampling. In experiments on eight challenging real-world domains  we find that the methods based on sampling and learning work best: one such method (AC2-F) is faster and usually more accurate than loopy belief propagation  mean field  and Gibbs sampling; another (AC2-G) has a running time similar to Gibbs sampling but is consistently more accurate than all baselines.,Approximate Inference by Compilation to

Arithmetic Circuits

Department of Computer and Information Science

Daniel Lowd

University of Oregon

Eugene  OR 97403-1202

lowd@cs.uoregon.edu

Pedro Domingos

Department of Computer Science and Engineering

University of Washington
Seattle  WA 98195-2350

pedrod@cs.washington.edu

Abstract

Arithmetic circuits (ACs) exploit context-speciﬁc independence and determinism
to allow exact inference even in networks with high treewidth. In this paper  we
introduce the ﬁrst ever approximate inference methods using ACs  for domains
where exact inference remains intractable. We propose and evaluate a variety of
techniques based on exact compilation  forward sampling  AC structure learning 
Markov network parameter learning  variational inference  and Gibbs sampling.
In experiments on eight challenging real-world domains  we ﬁnd that the methods
based on sampling and learning work best: one such method (AC2-F) is faster
and usually more accurate than loopy belief propagation  mean ﬁeld  and Gibbs
sampling; another (AC2-G) has a running time similar to Gibbs sampling but is
consistently more accurate than all baselines.

1

Introduction

Compilation to arithmetic circuits (ACs) [1] is one of the most effective methods for exact inference
in Bayesian networks. An AC represents a probability distribution as a directed acyclic graph of
addition and multiplication nodes  with real-valued parameters and indicator variables at the leaves.
This representation allows for linear-time exact inference in the size of the circuit. Compared to
a junction tree  an AC can be exponentially smaller by omitting unnecessary computations  or by
performing repeated subcomputations only once and referencing them multiple times. Given an
AC  we can efﬁciently condition on evidence or marginalize variables to yield a simpler AC for the
conditional or marginal distribution  respectively. We can also compute all marginals in parallel by
differentiating the circuit. These many attractive properties make ACs an interesting and important
representation  especially when answering many queries on the same domain. However  as with
junction trees  compiling a BN to an equivalent AC yields an exponentially-sized AC in the worst
case  preventing their application to many domains of interest.
In this paper  we introduce approximate compilation methods  allowing us to construct effective ACs
for previously intractable domains. For selecting circuit structure  we compare exact compilation of
a simpliﬁed network to learning it from samples. Structure selection is done once per domain  so the
cost is amortized over all future queries. For selecting circuit parameters  we compare variational
inference to maximum likelihood learning from samples. We ﬁnd that learning from samples works

1

best for both structure and parameters  achieving the highest accuracy on eight challenging  real-
world domains. Compared to loopy belief propagation  mean ﬁeld  and Gibbs sampling  our AC2-F
method  which selects parameters once per domain  is faster and usually more accurate. Our AC2-G
method  which optimizes parameters at query time  achieves higher accuracy on every domain with
a running time similar to Gibbs sampling.
The remainder of this paper is organized as follows.
In Section 2  we provide background on
Bayesian networks and arithmetic circuits. In Section 3  we present our methods and discuss re-
lated work. We evaluate the methods empirically in Section 4 and conclude in Section 5.

2 Background

2.1 Bayesian networks

Bayesian networks (BNs) exploit conditional independence to compactly represent a probability
distribution over a set of variables  {X1  . . .   Xn}. A BN consists of a directed  acyclic graph with
a node for each variable  and a set of conditional probability distributions (CPDs) describing the
probability of each variable  Xi  given its parents in the graph  denoted πi [2]. The full probability

distribution is the product of the CPDs: P (X) =Qn

i=1 P (Xi|πi).

Each variable in a BN is conditionally independent of its non-descendants given its parents. Depend-
ing on the how the CPDs are parametrized  there may be additional independencies. For discrete
domains  the simplest form of CPD is a conditional probability table  but this requires space expo-
nential in the number of parents of the variable. A more scalable approach is to use decision trees as
CPDs  taking advantage of context-speciﬁc independencies [3  4  5]. In a decision tree CPD for vari-
able Xi  each interior node is labeled with one of the parent variables  and each of its outgoing edges
is labeled with a value of that variable. Each leaf node is a multinomial representing the marginal
distribution of Xi conditioned on the parent values speciﬁed by its ancestor nodes and edges in the
tree.
Bayesian networks can be represented as log-linear models:

log P (X = x) = − log Z +P

i wifi(x)

(1)
where each fi is a feature  each wi is a real-valued weight  and Z is the partition function. In BNs  Z
is 1  since the conditional distributions ensure global normalization. After conditioning on evidence 
the resulting distribution may no longer be a BN  but it can still be represented as a log linear model.
The goal of inference in Bayesian networks and other graphical models is to answer arbitrary
marginal and conditional queries (i.e.  to compute the marginal distribution of a set of query vari-
ables  possibly conditioned on the values of a set of evidence variables). Popular methods include
variational inference  Gibbs sampling  and loopy belief propagation.
In variational inference  the goal is to select a tractable distribution Q that is as close as possible to
the original  intractable distribution P . Minimizing the KL divergence from P to Q (KL(P k Q)) is
generally intractable  so the “reverse” KL divergence is typically used instead:

KL(Qk P ) =X

Q(x) log Q(x)
P (x)

x

= −HQ(x) −X

i

wiEQ[fi] + log ZP

(2)

where HQ(x) is the entropy of Q  EQ is an expectation computed over the probability distribution Q 
ZP is the partition function of P   and wi and fi are the weights and features of P (see Equation 1).
This quantity can be minimized by ﬁxed-point iteration or by using a gradient-based numerical
optimization method. What makes the reverse KL divergence more tractable to optimize is that the
expectations are done over Q instead of P . This minimization also yields bounds on the log partition
function  or the probability of evidence in a BN. Speciﬁcally  because KL(Q k P ) is non-negative 

log ZP ≥ HQ(x) +P

i wiEQ[fi].

The most commonly applied variational method is mean ﬁeld  in which Q is chosen from the set
of fully factorized distributions. Generalized or structured mean ﬁeld operates on a set of clusters
(possibly overlapping)  or junction tree formed from a subset of the edges [6  7  8]. Selecting the
best tractable substructure is a difﬁcult problem. One approach is to greedily delete arcs until the
junction tree is tractable [6]. Alternately  Xing et al. [7] use weighted graph cuts to select clusters
for structured mean ﬁeld.

2

2.2 Arithmetic circuits

X

P

Qn
The probability distribution represented by a Bayesian network can be equivalently represented
by a multilinear function known as the network polynomial [1]: P (X1 = x1  . . .   Xn = xn) =
i=1 I(Xi = xi)P (Xi = xi|Πi = πi) where the sum ranges over all possible instantiations of
the variables  I() is the indicator function (1 if the argument is true  0 otherwise)  and the P (Xi|Πi)
are the parameters of the BN. The probability of any partial instantiation of the variables can now be
computed simply by setting to 1 all the indicators consistent with the instantiation  and to 0 all others.
This allows arbitrary marginal and conditional queries to be answered in time linear in the size of
the polynomial. Furthermore  differentiating the network with respect to its weight parameters (wi)
yields the probabilities of the corresponding features (fi).
The size of the network polynomial is exponential in the number of variables  but it can be more
compactly represented using an arithmetic circuit (AC). An AC is a rooted  directed acyclic graph
whose leaves are numeric constants or variables  and whose interior nodes are addition and multi-
plication operations. The value of the function for an input tuple is computed by setting the variable
leaves to the corresponding values and computing the value of each node from the values of its chil-
dren  starting at the leaves. In the case of the network polynomial  the leaves are the indicators and
network parameters. The AC avoids the redundancy present in the network polynomial  and can be
exponentially more compact.
Every junction tree has a corresponding AC  with an addition node for every instantiation of a sep-
arator  a multiplication node for every instantiation of a clique  and a summation node as the root.
Thus one way to compile a BN into an AC is via a junction tree. However  when the network con-
tains context-speciﬁc independences  a much more compact circuit can be obtained. Darwiche [1]
describes one way to do this  by encoding the network into a special logical form  factoring the
logical form  and extracting the corresponding AC.
Other exact inference methods include variable elimination with algebraic decision diagrams (which
can also be done with ACs [9])  AND/OR graphs [10]  bucket elimination [11]  and more.

3 Approximate Compilation of Arithmetic Circuits

In this section  we describe AC2 (Approximate Compilation of Arithmetic Circuits)  an approach
for constructing an AC to approximate a given BN. AC2 does this in two stages: structure search
and parameter optimization. The structure search is done in advance  once per network  while the
parameters may be selected at query time  conditioned on evidence. This amortizes the cost of
the structure search over all future queries.The parameter optimization allows us to ﬁne-tune the
circuit to speciﬁc pieces of evidence. Just as in variational inference methods such as mean ﬁeld 
we optimize the parameters of a tractable distribution to best approximate an intractable one. Note
that  if the BN could be compiled exactly  this step would be unnecessary  since the conditional
distribution would always be optimal.

3.1 Structure search

We considered two methods for generating circuit structures. The ﬁrst is to prune the BN structure
and then compile the simpliﬁed BN exactly. The second is to approximate the BN distribution with
a set of samples and learn a circuit from this pseudo-empirical data.

3.1.1 Pruning and compiling

Pruning and compiling a BN is somewhat analogous to edge deletion methods (e.g.  [6])  except
that instead of removing entire edges and building the full junction tree  we introduce context-
speciﬁc independencies and build an arithmetic circuit that can exploit them. This ﬁner-grained
simpliﬁcation offers the potential of much richer models or smaller circuits. However  it also offers
more challenging search problems that must be approximated heuristically.
We explored several techniques for greedily simplifying a network into a tractable AC by pruning
splits from its decision-tree CPDs. Ideally  we would like to have bounds on the error of our simpli-
ﬁed model  relative to the original. This can be accomplished by bounding the ratio of each log con-

3

ditional probability distribution  so that the approximated log probability of every instance is within
a constant factor of the truth  as done by the Multiplicative Approximation Scheme (MAS) [12].
However  we found that the bounds for our networks were very large  with ratios in the hundreds or
thousands. This occurs because our networks have probabilities close to 0 and 1 (with logs close to
negative inﬁnity and zero)  and because the bounds focus on the worst case.
Therefore  we chose to focus
instead on the average case by attempting to mini-
mize the KL divergence between the original model and the simpliﬁed approximation:
Q(x) where P is the original network and Q is the simpliﬁed approxi-
mate network  in which each of P ’s conditional probability distributions has been simpliﬁed. We
choose to optimize the KL divergence here because the reverse KL is prone to ﬁtting only a sin-
gle mode  and we want to avoid excluding any signiﬁcant parts of the distribution before seeing
evidence. Since Q’s structure is a subset of P ’s  we can decompose the KL divergence as follows:

KL(P k Q) =P

x P (x) log P (x)

KL(P k Q) =X

X

P (πi)X

P (xi|πi) log P (xi|πi)
Q(xi|πi)

i

πi

xi

(3)

where the summation is over all states of the Xi’s parents  Πi. In other words  the KL divergence
can be computed by adding the expected divergence of each local factor  where the expectation is
computed according to the global probability distribution. For the case of BNs with tree CPDs (as
described in Section 2.1)  this means that knowing the distribution of the parent variables allows us
to compute the change in KL divergence from pruning a tree CPD.
Unfortunately  computing the distribution of each variable’s parents is intractable and must be ap-
proximated in some way. We tried two different methods for computing these distributions: estimat-
ing the joint parent probabilities from a large number of samples (one million in our experiments)
(“P-Samp”)  and forming the product of the parent marginals estimated using mean ﬁeld (“P-MF”).
Given a method for computing the parent marginals  we remove the splits that least increase the
KL divergence. We implement this by starting from a fully pruned network and greedily adding the
splits that most decrease KL divergence. After every 10 splits  we check the number of edges by
compiling the candidate network to an AC using the C2D compiler. 1 We stop when the number of
edges exceeds our prespeciﬁed bound.

3.1.2 Learning from samples

The second approach we tried is learning a circuit from a set of generated samples. The samples
themselves are generated using forward sampling  in which each variable in the BN is sampled in
topological order according to its conditional distribution given its parents. The circuit learning
method we chose is the LearnAC algorithm by Lowd and Domingos [13]  which greedily learns
an AC representing a BN with decision tree CPDs by trading off log likelihood and circuit size.
We made one modiﬁcation to the the LearnAC (LAC) algorithm in order to learn circuits with a
ﬁxed number of edges. Instead of using a ﬁxed edge penalty  we start with an edge penalty of 100
and halve it every time we run out of candidate splits with non-negative scores. The effect of this
modiﬁed procedure is to conservatively selects splits that add few edges to the circuit at ﬁrst  and
become increasingly liberal until the edge limit is reached. Tuning the initial edge penalty can lead
to slightly better performance at the cost of additional training time. We also explored using the BN
structure to guide the AC structure search (for example  by excluding splits that would violate the
partial order of the original BN)  but these restrictions offered no signiﬁcant advantage in accuracy.
Many modiﬁcations to this procedure are possible. Larger edge budgets or different heuristics could
yield more accurate circuits. With additional engineering  the LearnAC algorithm could be adapted
to dynamically request only as many samples as necessary to be conﬁdent in its choices. For exam-
ple  Hulten and Domingos [14] have developed methods that scale learning algorithms to datasets
of arbitrary size; the same approach could be used here  except in a “pull” setting where the data is
generated on-demand. Spending a long time ﬁnding the most accurate circuit may be worthwhile 
since the cost is amortized over all queries.
We are not the ﬁrst to propose sampling as a method for converting intractable models into tractable
ones. Wang et al. [15] used a similar procedure for learning a latent tree model to approximate a

1Available at http://reasoning.cs.ucla.edu/c2d/.

4

BN. They found that the learned models had faster or more accurate inference on a wide range of
standard BNs (where exact inference is somewhat tractable). In a semi-supervised setting  Liang et
al. [16] trained a conditional random ﬁeld (CRF) from a small amount of labeled training data  used
the CRF to label additional examples  and learned independent logistic regression models from this
expanded dataset.

3.2 Parameter optimization

In this section  we describe three methods for selecting AC parameters: forward sampling  varia-
tional optimization  and Gibbs sampling.

3.2.1 Forward sampling

In AC2-F  we use forward sampling to generate a set of samples from the original BN (one million
in our experiments) and maximum likelihood estimation to estimate the AC parameters from those
samples. This can be done in closed form because  before conditioning on evidence  the AC structure
also represents a BN. AC2-F selects these parameters once per domain  before conditioning on any
evidence. This makes it very fast at query time.
AC2-F can be viewed as approximately minimizing the KL divergence KL(P k Q) between the
BN distribution P and the AC distribution Q. For conditional queries P (Y |X = xev)  we are more
interested in the divergence of the conditional distributions  KL(P (.|xev)k Q(.|xev)). The following
theorem bounds the conditional KL divergence as a function of the unconditional KL divergence:
Theorem 1. For discrete probability distributions P and Q  and evidence xev 

KL(P (.|xev)k Q(.|xev)) ≤

1

P (xev)

KL(P k Q)

(See the supplementary materials for the proof.) From this theorem  we expect AC2-F to work
better when evidence is likely (i.e.  P (xev) is not too small). For rare evidence  the conditional KL
divergence could be much larger than the unconditional KL divergence.

3.2.2 Variational optimization

Since AC2-F selects parameters based on the unconditioned BN  it may do poorly when conditioning
on rare evidence. An alternative is to choose AC parameters that (locally) minimize the reverse KL
divergence to the BN conditioned on evidence. Let P and Q be log-linear models  i.e.:

log Q(x) = − log ZQ +P

j vjgj(x)

(4)

The reverse KL divergence and its gradient can now be written as follows:

log P (x) = − log ZP +P
KL(Qk P ) =P
KL(Qk P ) =P

i wifi(x)

j vjEQ(gj) −P
k vk(EQ(gkgj) − Q(gk)Q(gj)) −P

i wiEQ(fi) + log ZP
ZQ

∂
∂vj

i vi(EQ(figj) − Q(fi)Q(gj))

(5)
where EQ(gkgj) is the expected value of gk(x) × gj(x) according to Q. In our application  P is
the BN conditioned on evidence and Q is the AC. Since inference in Q (the AC) is tractable  the
gradient can be computed exactly.
We can optimize this using any numerical optimization method  such as gradient descent. Due
to local optima  the results may depend on the optimization procedure and its initialization.
In
experiments  we used the limited memory BFGS algorithm (L-BFGS) [17]  initialized with AC2-F.
We now discuss how to compute the gradient efﬁciently in a circuit with e edges. By setting leaf
values and evaluating the circuit as described by Darwiche [1]  we can compute the probability of
any conjunctive feature Q(fi) (or Q(gk)) in O(e) operations. If we differentiate the circuit after
conditioning on a feature fi (or gk)  we can obtain the probabilities of the conjunctions Q(figj) (or
Q(gkgj)) for all gj in O(e) time. Therefore  if there are n features in P   and m features in Q  then
the total complexity of computing the derivative is O((n + m)e). Since there are typically fewer
features in Q than P   this simpliﬁes to O(ne).
These methods are applicable to any tractable structure represented as an AC  including low tree-
width models  mixture models  latent tree models  etc. We refer to this method as AC2-V.

5

3.2.3 Gibbs sampling

KL(P k Q)=P

i wiEP (fi) −P

While optimizing the reverse KL is a popular choice for approximate inference  there are certain
risks. Even if KL(Qk P ) is small  Q may assign very small or zero probabilities to important modes
of P . Furthermore  we are only guaranteed to ﬁnd a local optimum  which may be much worse
than the global optimum. The “regular” KL divergence  does not suffer these disadvantages  but is
impractical to compute since it involves expectations according to P :

∂
∂vj

j vjEP (gj) + log ZQ/ZP

KL(P k Q)= EQ(gj) − EP (gj)

(6)
(7)
Therefore  minimizing KL(P k Q) by gradient descent or L-BFGS requires computing the condi-
tional probability of each AC feature according to the BN  EP (gj). Note that these only need to be
computed once  since they are unaffected by the AC feature weights  vj. We chose to approximate
these expectations using Gibbs sampling  but an alternate inference method (e.g.  importance sam-
pling) could be substituted. The probabilities of the AC features according to the AC  EQ(gj)  can
be computed in parallel by differentiating the circuit  requiring time O(e).2 This is typically orders
of magnitude faster than the variational approach described above  since each optimization step runs
in O(e) instead of O(ne)  where n is the number of BN features. We refer to this method as AC2-G.

4 Experiments
In this section  we compare the proposed methods experimentally and demonstrate that approximate
compilation is an accurate and efﬁcient technique for inference in intractable networks.

4.1 Datasets

We wanted to evaluate our methods on challenging  realistic networks where exact inference is in-
tractable  even for the most sophisticated arithmetic circuit-based techniques. This ruled out most
traditional benchmarks  for which ACs can already perform exact inference [9]. We generated in-
tractable networks by learning them from eight real-world datasets using the WinMine Toolkit [18].
The WinMine Toolkit learns BNs with tree-structured CPDs  leading to complex models with high
tree-width. In theory  this additional structure can be exploited by existing arithmetic circuit tech-
niques  but in practice  compilation techniques ran out of memory on all eight networks. See Davis
and Domingos [19] and our supplementary material for more details on the datasets and the networks
learned from them  respectively.

4.2 Structure selection

In our ﬁrst set of experiments  we compared the structure selection algorithms from Section 3.1
according to their ability to approximate the original models. Since computing the KL divergence
directly is intractable  we approximated it using random samples x(i):

D(P||Q) =X

x

X

i

P (x) log P (x)
Q(x)

= EP [log(P (x)/Q(x))] ≈ 1
m

log(P (x(i))/Q(x(i)))

(8)

where m is the number of samples (10 000 in our experiments). These samples were distinct from
the training data  and the same set of samples was used to evaluate each algorithm.
For LearnAC  we trained circuits with a limit of 100 000 edges. All circuits were learned using
100 000 samples  and then the parameters were set using AC2-F with 1 million samples.3 Training
time ranged from 17 minutes (KDD Cup) to 8 hours (EachMovie). As an additional baseline  we also
learned tree-structured BNs from the same 1 million samples using the Chow-Liu algorithm [20].
Results are in Table 1. The learned arithmetic circuit (LAC) achieves the best performance on all
datasets  often by a wide margin. We also observe that  of the pruning methods  samples (P-Samp)
work better than mean ﬁeld marginals (P-MF). Chow-Liu trees (C-L) typically perform somewhere
between P-MF and P-Samp. For the rest of this paper  we focus on structures selected by LearnAC.
2To support optimization methods that perform line search (including L-BFGS)  we can similarly approxi-

mate KL(P k Q). log ZQ can also be computed in O(e) time.

3With 1 million samples  we ran into memory limitations that a more careful implementation might avoid.

6

Table 1: KL divergence of different
structure selection algorithms.

Table 2: Mean time for answering a single conditional
query  in seconds.

KDD Cup
Plants
Audio
Jester
Netﬂix
MSWeb
Book
EachMovie

P-MF
2.44
8.41
4.99
5.14
3.83
1.78
4.90
29.66

P-Samp
0.10
2.29
3.31
3.55
3.06
0.52
2.43
17.61

C-L
0.23
4.48
4.47
5.08
4.14
0.70
2.84
17.11

LAC
0.07
1.27
2.12
2.82
2.24
0.38
1.89
11.12

KDD Cup
Plants
Audio
Jester
Netﬂix
MSWeb
Book
EachMovie

AC2-F
0.022
0.022
0.023
0.019
0.021
0.022
0.020
0.022

AC2-V
3803
2741
4184
3448
3050
2831
5190
10204

AC2-G
11.2
11.2
14.4
13.8
12.3
12.2
16.1
28.6

BP
0.050
0.081
0.063
0.054
0.057
0.277
0.864
1.441

MF
0.025
0.073
0.048
0.057
0.053
0.046
0.059
0.342

Gibbs
2.5
2.8
3.4
3.3
3.3
4.3
6.6
11.0

Figure 1: Average conditional log likelihood of the query variables (y axis)  divided by the number
of query variables (x axis). Higher is better. Gibbs often performs too badly to appear in the frame.

4.3 Conditional probabilities

