2019,Neural Lyapunov Control,We propose new methods for learning control policies and neural network Lyapunov functions for nonlinear control problems  with provable guarantee of stability. The framework consists of a learner that attempts to find the control and Lyapunov functions  and a falsifier that finds counterexamples to quickly guide the learner towards solutions. The procedure terminates when no counterexample is found by the falsifier  in which case the controlled nonlinear system is provably stable. The approach significantly simplifies the process of Lyapunov control design  provides end-to-end correctness guarantee  and can obtain much larger regions of attraction than existing methods such as LQR and SOS/SDP. We show experiments on how the new methods obtain high-quality solutions for challenging robot control problems such as path tracking for wheeled vehicles and humanoid robot balancing.,Neural Lyapunov Control

Ya-Chien Chang

UCSD

yac021@eng.ucsd.edu

Nima Roohi

UCSD

nroohi@eng.ucsd.edu

Sicun Gao

UCSD

sicung@eng.ucsd.edu

Abstract

We propose new methods for learning control policies and neural network Lyapunov
functions for nonlinear control problems  with provable guarantee of stability. The
framework consists of a learner that attempts to ﬁnd the control and Lyapunov
functions  and a falsiﬁer that ﬁnds counterexamples to quickly guide the learner
towards solutions. The procedure terminates when no counterexample is found by
the falsiﬁer  in which case the controlled nonlinear system is provably stable. The
approach signiﬁcantly simpliﬁes the process of Lyapunov control design  provides
end-to-end correctness guarantee  and can obtain much larger regions of attraction
than existing methods such as LQR and SOS/SDP. We show experiments on how the
new methods obtain high-quality solutions for challenging robot control problems
such as path tracking for wheeled vehicles and humanoid robot balancing.

1

Introduction

Learning-based methods hold the promise of solving hard nonlinear control problems in robotics.
Most existing work focuses on learning control functions represented as neural networks through
repeated interactions of an unknown environment in the framework of deep reinforcement learning 
with notable success. However  there are still well-known issues that impede the immediate use of
these methods in practical control applications  including sample complexity  interpretability  and
safety [5]. Our work investigates a different direction: Can learning methods be valuable even in
the most classical setting of nonlinear control design? We focus on the challenging problem of
designing feedback controllers for stabilizing nonlinear dynamical systems with provable guarantee.
This problem captures the core difﬁculty of underactuated robotics [25]. We demonstrate that neural
networks and deep learning can ﬁnd provably stable controllers in a direct way and tackle the
full nonlinearity of the systems  and signiﬁcantly outperform existing methods based on linear or
polynomial approximations such as linear-quadratic regulators (LQR) [17] and sum-of-squares (SOS)
and semideﬁnite programming (SDP) [21]. The results show the promise of neural networks and
deep learning in improving the solutions of many challenging problems in nonlinear control.
The prevalent way of stabilizing nonlinear dynamical systems is to linearize the system dynamics
around an equilibrium  and formulate LQR problems to minimize deviation from the equilibrium.
LQR methods compute a linear feedback control policy  with stability guarantee within a small
neighborhood where linear approximation is accurate. However  the dependence on linearization
produces extremely conservative systems  and it explains why agile robot locomotion is hard [25].
To control nonlinear systems outside their linearizable regions  we need to rely on Lyapunov meth-
ods [13]. Following the intuition that a dynamical system stabilizes when its energy decreases over
time  Lyapunov methods construct a scalar ﬁeld that can force stabilization. These ﬁelds are highly
nonlinear and the need for function approximations has long been recognized [13]. Many existing
approaches rely on polynomial approximations of the dynamics and the search of sum-of-squares
polynomials as Lyapunov functions through semideﬁnite programming (SDP) [21]. A rich theory
has been developed around the approach  but in practice the polynomial approximations pose much
restriction on the systems and the Lyapunov landscape. Moreover  well-known numerical sensitivity

33rd Conference on Neural Information Processing Systems (NeurIPS 2019)  Vancouver  Canada.

issues in SDP [18] make it very hard to ﬁnd solutions that fully satisfy the Lyapunov conditions. In
contrast  we exploit the expressive power of neural networks  the convenience of gradient descent for
learning  and the completeness of nonlinear constraint solving methods to provide full guarantee of
Lyapunov conditions. We show that the combination of these techniques produces control designs
that can stabilize various nonlinear systems with veriﬁed regions of attraction that are much larger
than what can be obtained by existing control methods.
We propose an algorithmic framework for learning control functions and neural network Lyapunov
functions for nonlinear systems without any local approximation of their dynamics. The framework
consists of a learner and a falsiﬁer. The learner uses stochastic gradient descent to ﬁnd parameters
in both a control function and a neural Lyapunov function  by iteratively minimizing the Lyapunov
risk which measures the violation of the Lyapunov conditions. The falsiﬁer takes a control function
and Lyapunov function from the learner  and searches for counterexample state vectors that violate
the Lyapunov conditions. The counterexamples are added to the training set for the next iteration of
learning  generating an effective curriculum. The falsiﬁer uses delta-complete constraint solving [11] 
which guarantees that when no violation is found  the Lyapunov conditions are guaranteed to hold
for all states in the veriﬁed domain. In this framework  the learner and falsiﬁer are given tasks that
are difﬁcult in different ways and can not be achieved by the other side. Moreover  we show that the
framework provides the ﬂexibility for ﬁne-tuning the control performance by directly enlarging the
region of attraction on demand  by adding regulator terms in the learning cost.
We experimented with several challenging nonlinear control problems in robotics  such as drone
landing  wheeled vehicle path following  and humanoid robot balancing. We are able to ﬁnd new
control policies that produce certiﬁed region of attractions that are signiﬁcantly larger than what can
be established previously. We provide a detailed analysis of the performance comparison between the
proposed methods and the LQR/SOS/SDP methods.
Related Work. The recent work of Richards et. al. [24] has also proposed and shown the effectiveness
of using neural networks to learn safety certiﬁcates in a Lyapunov framework  but our goals and
approaches are different. Richards et. al. focus on discrete-time polynomial systems and the use of
neural networks to learn the region of attraction of a given controller. The Lyapunov conditions are
validated in relaxed forms through sampling. Special design of the neural architecture is required
to compensate the lack of complete checking over all states. In comparison  we focus on learning
the control and the Lyapunov function together with provable guarantee of stability in larger regions
of attraction. Our approach directly handles non-polynomial continuous dynamical systems  does
not assume control functions are given other than an initialization  and uses generic feed-forward
network representations without manual design. Our approach successfully works on many more
nonlinear systems  and ﬁnd new control functions that enlarge regions of attraction obtainable
from standard control methods. Related learning-based approaches for ﬁnding Lyapunov functions
include [6  7  10  22]. There is strong evidence that linear control functions are all we need for
solving highly nonlinear control problems through reinforcement learning as well [20]  suggesting
convergence of different learning approaches. In the control and robotics community  similar learner-
falsiﬁer frameworks have been proposed by [23  16] without using neural network representations.
The common assumption is the Lyapunov functions are high-degree polynomials. In these methods 
an explicit control function and Lyapunov function can not be learned together because of the bilinear
optimization problems that they generate. Our approach signiﬁcantly simpliﬁes the algorithms
in this direction and has worked reliably on much harder control problems compared to existing
methods. Several theoretical results on asymptotic Lyapunov stability [2  4  3  1] show that some
very simple dynamical systems do not admit a polynomial Lyapunov function of any degree  despite
being globally asymptotically stable. Such results further motivates the use of neural networks as a
more suitable function approximator. A large body of work in control uses SOS representations and
SDP optimization in the search for Lyapunov functions [14  21  9  15  19]. However  scalability and
numerical sensitivity issues have been the main challenge in practice. As is well known  the number
of semideﬁnite programs from SOS decomposition grows quickly for low degree polynomials [21].

2 Preliminaries

We consider the problem of designing control functions to stablize a dynamical system at an equilib-
rium point. We make extensive use of the following results from Lyapunov stability theory.

2

Deﬁnition 1 (Controlled Dynamical Systems). An n-dimensional controlled dynamical system is

dx
dt

= fu(x) 

x(0) = x0

(1)
where fu : D → Rn is a Lipschitz-continuous vector ﬁeld  and D ⊆ Rn is an open set with 0 ∈ D
that deﬁnes the state space of the system. Each x(t) ∈ D is a state vector. The feedback control is
deﬁned by a continuous function u : Rn → Rm  used as a component in the full dynamics fu.
Deﬁnition 2 (Asymptotic Stability). We say that system of (1) is stable at the origin if for any
ε ∈ R+  there exists δ(ε) ∈ R+ such that if (cid:107)x(0)(cid:107) < δ then (cid:107)x(t)(cid:107) < ε for all t ≥ 0. The system is
asymptotically stable at the origin if it is stable and also limt→∞ (cid:107)x(t)(cid:107) = 0 for all (cid:107)x(0)(cid:107) < δ.
Deﬁnition 3 (Lie Derivatives). The Lie derivative of a continuously differentiable scalar function
V : D → R over a vector ﬁeld fu is deﬁned as
∂V
∂xi

∇fuV (x) =

n(cid:88)

n(cid:88)

[fu]i(x)

dxi
dt

=

∂V
∂xi

i=1

i=1

It measures the rate of change of V along the direction of the system dynamics.
Proposition 1 (Lyapunov Functions for Asymptotic Stability). Consider a controlled system (1) with
equilibrium at the origin  i.e.  fu(0) = 0. Suppose there exists a continuously differentiable function
V : D → R that satisﬁes the following conditions:

V (0) = 0  and  ∀x ∈ D \ {0}  V (x) > 0 and ∇fu V (x) < 0.

(2)

Then  the system is asymptotically stable at the origin and V is called a Lyapunov function.

Linear-Quadratic Regulators (LQR) is a widely-adpoted optimal control strategy. LQR controllers
are guaranteed to work within a small neighborhood around the stationary point where the dynamics
can be approximated as linear systems. A detailed description can be found in [17].

3 Learning to Stabilize with Neural Lyapunov Functions

We now describe how to learn both a control function and a neural Lyapunov function together  so
that the Lyapunov conditions can be rigorously veriﬁed to ensure stability of the system. We provide
pseudocode of the algorithm in Algorithm 1.

3.1 Control and Lyapunov Function Learning

We design the hypothesis class of candidate Lyapunov functions to be multilayered feedforward
networks with tanh activation functions. It is important to note that unlike most other deep learning
applications  we can not use non-smooth networks  such as with ReLU activations. This is because we
will need to analytically determine whether the Lyapunov conditions hold for these neural networks 
which requires the existence of their Lie derivatives.
For a neural network Lyapunov function  its input is any state vector of the system in Deﬁnition (1)
and the output is a scalar value. We write θ to denote the parameter vector for a Lyapunov function
candidate Vθ. For notational convenience  we write u to denote both the control function and the
parameters that deﬁne the function. The learning process updates both the θ and u parameters to
improve the likelihood of satisfying the Lyapunov conditions  which we formulate as a cost function
named the Lyapunov risk. The Lyapunov risk measures the degree of violation of the following
Lyapunov conditions  as shown in Proposition (1). First  the value of Vθ (x) is positive; Second  the
value of the Lie derivative ∇fu Vθ (x) is negative; Third  the value of Vθ(0) is zero. Conceptually  the
overall Lyapunov control design problem is about minimizing the minimax cost of the form

(cid:19)

(cid:18)

inf
θ u

sup
x∈D

max(0 −Vθ(x)) + max(0 ∇fuVθ(x)) + V 2

θ (0)

.

The difﬁculty in control design problems is that the violation of the Lyapunov conditions can not just
be estimated  but needs to be fully guaranteed over all states in D. Thus  we need to rely on global
search with complete guarantee for the inner maximization part  which we delegate to the falsiﬁer
explained in Section 3.2. For the learning step  we deﬁne the following Lyapunov risk function.

3

Deﬁnition 4 (Lyapunov Risk). Consider a candidate Lyapunov function Vθ for a controlled dynamical
system fu from Deﬁnition 1. The Lyapunov risk is a deﬁned by the following function

max(0 −Vθ(x)) + max(0 ∇fu Vθ(x)) + V 2
(cid:19)

max(−Vθ(xi)  0) + max(0 ∇fu Vθ(xi))

(cid:19)

θ (0)

 

(3)

+ V 2

θ (0) 

(4)

(cid:18)

(cid:18)

N(cid:88)

i=1

Lρ (θ  u) = Ex∼ρ(D)

LN ρ (θ  u) =

1
N

where x is a random variable over the state space of the system with a distribution ρ. In practice  we
work with the Monte Carlo estimate named the empirical Lyapunov risk by drawing samples:

where xi  1 ≤ i ≤ N are samples of the state vectors sampled according to ρ(D).
It is clear that the empirical Lyapunov risk is an unbiased estimator of the Lyapunov risk function. It
is clear that LN ρ is an unbiased estimator of Lρ.
Note that Lρ is positive semideﬁnite  and any (θ  u) that corresponds to a true Lyapunov function
satisﬁes L(θ  u)=0. Thus  Lyapunov functions deﬁne global minimizers of the Lyapunov risk function.
Proposition 2. Let Vθo be a Lyapunov function for dynamical system fuo where uo is the control
parameters. Then (θo  uo) is a global minimizer for Lρ and Lρ(θo  uo) = 0.

Note that both Vθ and fu are highly nonlinear (even though u is almost always linear in practice) 
and thus L(θ  u) generates a highly complex landscape. Surprisingly  multilayer feedforward tanh
networks and stochastic gradient descent can quickly produce generalizable Lyapunov functions with
nice geometric properties  as we report in detail in the experiments. In Figure 1 (b)  we show an
example of how the Lyapunov risk is minimized over iterations on the inverted pendulum example.

Initialization and improvement of control performance over LQR. Because of the local nature
of stochastic gradient descent  it is hard to learn good control functions through random initialization
of control parameters. Instead  the parameters u in the control function are initialized to the LQR
solution  obtained for the linearized dynamics in a small neighborhood around the stationary point. On
the other hand  the initialization of the neural network Lyapunov functions can be completely random.
We observe that the ﬁnal learned controller often delivers signiﬁcantly better control solutions than
the initalization from LQR. Figure 1(a) shows how the learned control reduces oscillation of the
system behavior in the humanoid robot balancing example and achieve more stable control.

Figure 1: (a) Comparison between LQR and deep-learned controllers for humanoid balancing. (b)
The Lyapunov risk decreases quickly over iterations. (c) Counterexamples returned by falsiﬁers from
several epochs  which quickly guides the learner to focus on sepcial regions in the space.

3.2 Falsiﬁcation and Counterexample Generation

For each control and Lyapunov function pair (Vθ  u) that the learner obtains  the falsiﬁer’s task is to
ﬁnd states that violate the Lyapunov conditions in Proposition 1. We formulate the negations of the
Lyapunov conditions as a nonlinear constraint solving problem over real numbers. These falsiﬁcation
constraints are deﬁned as follows.

4

Deﬁnition 5 (Lyapunov Falsiﬁcation Constraints). Let V be a candidate Lyapunov function for a
dynamical system deﬁned by fu deﬁned in state space D. Let ε ∈ Q+ be a small constant parameter
that bounds the tolerable numerical error. The Lyapunov falsiﬁcation constraint is the following
ﬁrst-order logic formula over real numbers:
i ≥ ε
x2

V (x) ≤ 0 ∨ ∇fu V (x) ≥ 0

(cid:18) n(cid:88)

Φε(x) :=

(cid:19)

(cid:19)

(cid:18)

∧

i=1

√

ε (cid:28) min(1 ||D||2).

where x is bounded in the state space D of the system. The numerical error parameter ε is explicitly
introduced for controlling numerical sensitivity near the origin. Here ε is orders of magnitude smaller
than the range of the state variables  i.e. 
Remark 1. The numerical error parameter ε allows us to avoid pathological problems in numerical
algorithms such as arithmetic underﬂow. Values inside this tiny ball correspond to disturbances that
are physically insigniﬁcant. This parameter is important for eliminating from our framework the
numerical sensitivity issues commonly observed in SOS/SDP methods. Also note the ε-ball does not
affect properties of the Lyapunov level sets and regions of attraction outside it (i.e.  D \ Bε).
The falsiﬁer computes solutions of the falsiﬁcation constraint Φε(x). Solving the constraints requires
global minimization of a highly nonconvex functions (involving Lie derivatives of the neural network
Lyapunov function)  and it is a computationally expensive task (NP-hard). We rely on recent progress
in nonlinear constraint solving in SMT solvers such as dReal [11]  which has been used for similar
control design problems [16] that do not involve neural networks.
Example 1. Consider a candidate Lyapunov function V (x) = tanh(a1x1 + a2x2 + b) and dynamics
˙x1 = −x2

2 and ˙x2 = sin(x1). The falsiﬁcation constraint is of the following form

Φε(x) := (x2

1 + x2

2) ≥ ε∧ (tanh(a1x1 + a2x2 + b) ≤ 0∨ a1(1− tanh2(a1x1 + a2x2 + b))(−x2
2)
+ a2(1 − tanh2(a1x1 + a2x2 + b)) sin(x1) ≥ 0))

which is a nonlinear non-polynomial disjunctive constraint system. The actual examples used in our
experiments all use larger two-layer tanh networks and much more complex dynamics.

To completely certify the Lyapunov conditions  the constraint solving step for Φε(x) can never fail to
report solutions if there is any. This requirement is rigorously proved for algorithms in SMT solvers
such as dReal [12]  as a property called delta-completeness [11].
Deﬁnition 6 (Delta-Complete Algorithms). Let C be a class of quantiﬁer-free ﬁrst-order constraints.
Let δ ∈ Q+ be a ﬁxed constant. We say an algorithm A is δ-complete for C  if for any ϕ(x) ∈ C  A
always returns one of the following answers correctly: ϕ does not have a solution (unsatisﬁable)  or
there is a solution x = a that satisﬁes ϕδ(a). Here  ϕδ is deﬁned as a small syntactic variation of the
original constraint (precise deﬁnitions are in [11]).

In other words  if a delta-complete algorithm concludes that a formula Φε(x) is unsatisﬁable  then it is
guaranteed to not have any solution. In our context  this is exactly what we need for ensuring that the
Lyapunov condition holds over all state vectors. If Φε(x) is determined to be δ-satisﬁable  we obtain
counterexamples that are added to the training set for the learner. Note that the counterexamples are
simply state vectors without labels  and their Lyapunov risk will be determined by the learner  not
the falsiﬁer. Thus  although it is possible to have spurious counterexamples due to the δ error  they
are used as extra samples and do not harm correctness of the end result. In all  when delta-complete
algorithms in dReal return that the falsiﬁcation constraints are unsatisﬁable  we conclude that the
Lyapunov conditions are satisﬁed by the candidate Lyapunov and control functions. Figure 1(c)
shows a sequence of counterexamples found by the falsiﬁer to improve the learned results.
Remark 2. When solving Φε(x) with δ-complete constraint solving algorithms  we use δ (cid:28) ε to
reduce the number of spurious counterexamples. Following delta-completeness  the choice of δ does
not affect the guarantee for the validation of the Lyapunov conditions.

3.3 Tuning Region of Attraction

An important feature of the proposed learning framework is that we can adjust the cost functions
to learn control and Lyapunov functions favoring various additional properties. In fact  the most
practically important performance metric for a stabilizing controller is its region of attraction (ROA).

5

An ROA deﬁnes a forward invariant set that is guaranteed to contain all possible trajectories of
the system  and thus can conclusively prove safety properties. Note that the Lyapunov conditions
themselves do not directly ensure safety  because the system can deviate arbitrarily far before coming
back to the stable equilibrium. Formally  the ROA of an asymptotically stable system is deﬁned as:
Deﬁnition 7 (Region of Attraction). Let fu deﬁne a system asymptotically stable at the origin with
Lyapunov function V for domain D. A region of attraction R is a subset of D that contains the origin
and guarantees that the system never leaves R. Any level set of V completely contained in D deﬁnes
an ROA. That is  for β > 0  if Rβ = {V (x) ≤ β} ⊆ D  then Rβ is an ROA for the system.
(cid:80)N
To maximize the ROA produced by a pair of Lyapunov function and control function  we add a cost
term to the Lyapunov risk that regulates how quickly the Lyapunov function value increases with
i=1 (cid:107)xi(cid:107)2 − αVθ(xi) following
respect to the radius of the level sets  by using LN p(θ  u) + 1
N
Deﬁnition 4. Here α is tunable parameter. We observe that the regulator can have major effect on
the performance of the learned control functions. Figure 2 illustrates such an example  showing how
different control functions are obtained by regulating the Lyapunov risk to achieve larger ROA.

Figure 2: (a) Lyapunov function found by the initial LQR controller. (b) Lyapunov function found by
learning without tuning the ROA. (c) Lyapunov function found by learning after adding the ROA
tuning term. (d) Comparison of ROA for the different Lyapunov functions.

Set learning rate (0.01)  input dimension (# of state variables)  output dimension (1)
Initialize feedback controller u to LQR solution qlqr
Repeat:

(cid:46) Forward pass of neural network

(cid:46) Update weights using SGD

Vθ (x)   u (x) ← NNθ u (x)

∇fuVθ (x) ←(cid:80)Din

i=1

∂V
∂xi

[fu]i(x)
Compute Lyapunov risk L (θ  u)
θ ← θ + α∇θL (θ  u)
u ← u + α∇uL (θ  u)

Algorithm 1 Neural Lyapunov Control
1: function LEARNING(X  f  qlqr)
2:
3:
4:
5:
6:
7:
8:
9:
10:
11:
12: end function
13: function FALSIFICATION(f  u  Vθ  ε  δ)
14:
15:
16:
17: end function
18: function MAIN( )
19:

Until convergence
return Vθ  u

Encode conditions in Deﬁnition 5
Using SMT solver with δ to verify the conditions
return satisﬁability

20:
21:
22:
23:
end while
24:
25: end function

Add counterexamples to X
Vθ  u ← LEARNING(X  f  qlqr)
CE← FALSIFICATION(f  u  Vθ  ε  δ)

6

Input: dynamical system (f )  parameters of LQR (qlqr)  radius (ε)  precision (δ) and an
initial set of randomly sampled states in D
while Satisﬁable do

4 Experiments

We demonstrate that the proposed methods ﬁnd provably stable control and Lyapunov functions on
various nonlinear robot control problems. In all the examples  we use a learning rate of 0.01 for the
learner  an ε value of 0.25 and δ value of 0.01 for the falsiﬁer  and re-verify the result with smaller ε
in Table 1. We emphasize that the choices of these parameters do not affect the stability guarantees
on the ﬁnal design of the control and Lyapunov functions. We show that the region of attraction is
enlarged by 300% to 600% compared to LQR results in these examples. Full details of the results and
system dynamics are provided in the Appendix. Note that for the Caltech ducted fan and humanoid
balancing examples  we numerically relaxed the conditions slightly when the learning has converged 
so that the SMT solver dReal does not run into numerical issues. More details on the effect of such
relaxation can be found in the paper website [8].

Benchmarks

Inverted Pendulum

Path Following

Caltech Ducted Fan
Humanoid Balancing

Learning time

25.5
36.3

1455.16

6000

falsiﬁcation time

0.6
0.2
50.84
458.27

# samples

500
500
1000
1000

# iterations

430
610
3000
4000

ε

0.04
0.01
0.01
0.01

Table 1: Runtime statistics of the full procedures on four nonlinear control examples.

Inverted pendulum. The inverted pendulum is a standard nonlinear control problem for testing
