2019,Learning Data Manipulation for Augmentation and Weighting,Manipulating data  such as weighting data examples or augmenting with new instances  has been increasingly used to improve model training. Previous work has studied various rule- or learning-based approaches designed for specific types of data manipulation. In this work  we propose a new method that supports learning different manipulation schemes with the same gradient-based algorithm. Our approach builds upon a recent connection of supervised learning and reinforcement learning (RL)  and adapts an off-the-shelf reward learning algorithm from RL for joint data manipulation learning and model training. Different parameterization of the ``data reward'' function instantiates different manipulation schemes. We showcase data augmentation that learns a text transformation network  and data weighting that dynamically adapts the data sample importance. Experiments show the resulting algorithms significantly improve the image and text classification performance in low data regime and class-imbalance problems.,Learning Data Manipulation for Augmentation and

Weighting

Zhiting Hu1 2∗  Bowen Tan1∗  Ruslan Salakhutdinov1  Tom Mitchell1  Eric P. Xing1 2

{zhitingh btan2 rsalakhu tom.mitchell}@cs.cmu.edu  eric.xing@petuum.com

1Carnegie Mellon University  2Petuum Inc.

Abstract

Manipulating data  such as weighting data examples or augmenting with new
instances  has been increasingly used to improve model training. Previous work
has studied various rule- or learning-based approaches designed for speciﬁc types
of data manipulation. In this work  we propose a new method that supports learning
different manipulation schemes with the same gradient-based algorithm. Our
approach builds upon a recent connection of supervised learning and reinforcement
learning (RL)  and adapts an off-the-shelf reward learning algorithm from RL for
joint data manipulation learning and model training. Different parameterization
of the “data reward” function instantiates different manipulation schemes. We
showcase data augmentation that learns a text transformation network  and data
weighting that dynamically adapts the data sample importance. Experiments show
the resulting algorithms signiﬁcantly improve the image and text classiﬁcation
performance in low data regime and class-imbalance problems.

1

Introduction

The performance of machines often crucially depend on the amount and quality of the data used for
training. It has become increasingly ubiquitous to manipulate data to improve learning  especially in
low data regime or in presence of low-quality datasets (e.g.  imbalanced labels). For example  data
augmentation applies label-preserving transformations on original data points to expand the data size;
data weighting assigns an importance weight to each instance to adapt its effect on learning; and data
synthesis generates entire artiﬁcial examples. Different types of manipulation can be suitable for
different application settings.
Common data manipulation methods are usually designed manually  e.g.  augmenting by ﬂipping
an image or replacing a word with synonyms  and weighting with inverse class frequency or loss
values [10  32]. Recent work has studied automated approaches  such as learning the composition of
augmentation operators with reinforcement learning [38  5]  deriving sample weights adaptively from
a validation set via meta learning [39]  or learning a weighting network by inducing a curriculum [21].
These learning-based approaches have alleviated the engineering burden and produced impressive
results. However  the algorithms are usually designed speciﬁcally for certain types of manipulation
(e.g.  either augmentation or weighting) and thus have limited application scope in practice.
In this work  we propose a new approach that enables learning for different manipulation schemes
with the same single algorithm. Our approach draws inspiration from the recent work [46] that
shows equivalence between the data in supervised learning and the reward function in reinforcement
learning. We thus adapt an off-the-shelf reward learning algorithm [52] to the supervised setting
for automated data manipulation. The marriage of the two paradigms results in a simple yet general
algorithm  where various manipulation schemes are reduced to different parameterization of the

∗equal contribution

33rd Conference on Neural Information Processing Systems (NeurIPS 2019)  Vancouver  Canada.

data reward. Free parameters of manipulation are learned jointly with the target model through
efﬁcient gradient descent on validation examples. We demonstrate instantiations of the approach for
automatically ﬁne-tuning an augmentation network and learning data weights  respectively.
We conduct extensive experiments on text and image classiﬁcation in challenging situations of very
limited data and imbalanced labels. Both augmentation and weighting by our approach signiﬁcantly
improve over strong base models  even though the models are initialized with large-scale pretrained
networks such as BERT [7] for text and ResNet [14] for images. Our approach  besides its generality 
also outperforms a variety of dedicated rule- and learning-based methods for either augmentation
or weighting  respectively. Lastly  we observe that the two types of manipulation tend to excel in
different contexts: augmentation shows superiority over weighting with a small amount of data
available  while weighting is better at addressing class imbalance problems.
The way we derive the manipulation algorithm represents a general means of problem solving through
algorithm extrapolation between learning paradigms  which we discuss more in section 6.

2 Related Work

Rich types of data manipulation have been increasingly used in modern machine learning pipelines.
Previous work each has typically focused on a particular manipulation type. Data augmentation
that perturbs examples without changing the labels is widely used especially in vision [44  26] and
speech [24  36] domains. Common heuristic-based methods on images include cropping  mirroring 
rotation [26]  and so forth. Recent work has developed automated augmentation approaches [5  38 
28  37  47]. Xie et al. [50] additionally use large-scale unlabeled data. Cubuk et al. [5]  Ratner
et al. [38] learn to induce the composition of data transformation operators. Instead of treating
data augmentation as a policy in reinforcement learning [5]  we formulate manipulation as a reward
function and use efﬁcient stochastic gradient descent to learn the manipulation parameters. Text
data augmentation has also achieved impressive success  such as contextual augmentation [25  49] 
back-translation [42]  and manual approaches [48  2]. In addition to perturbing the input text as in
classiﬁcation tasks  text generation problems expose opportunities to adding noise also in the output
text  such as [35  51]. Recent work [46] shows output nosing in sequence generation can be treated as
an intermediate approach in between supervised learning and reinforcement learning  and developed
a new sequence learning algorithm that interpolates between the spectrum of existing algorithms. We
instantiate our approach for text contextual augmentation as in [25  49]  but enhance the previous
work by additionally ﬁne-tuning the augmentation network jointly with the target model.
Data weighting has been used in various algorithms  such as AdaBoost [10]  self-paced learning [27] 
hard-example mining [43]  and others [4  22]. These algorithms largely deﬁne sample weights based
on training loss. Recent work [21  8] learns a separate network to predict sample weights. Of
particular relevance to our work is [39] which induces sample weights using a validation set. The data
weighting mechanism instantiated by our framework has a key difference in that samples weights are
treated as parameters that are updated iteratively  instead of re-estimated from scratch at each step.
We show improved performance of our approach. Besides  our data manipulation approach is derived
based on a different perspective of reward learning  instead of meta-learning as in [39].
Another popular type of data manipulation involves data synthesis  which creates entire artiﬁcial
samples from scratch. GAN-based approaches have achieved impressive results for synthesizing
conditional image data [3  34]. In the text domain  controllable text generation [17] presents a
way of co-training the data generator and classiﬁer in a cyclic manner within a joint VAE [23] and
wake-sleep [15] framework. It is interesting to explore the instantiation of the present approach for
adaptive data synthesis in the future.

3 Background

We ﬁrst present the relevant work upon which our automated data manipulation is built. This section
also establishes the notations used throughout the paper.
Let x denote the input and y the output. For example  in text classiﬁcation  x can be a sentence and y
is the sentence label. Denote the model of interest as pθ(y|x)  where θ is the model parameters to be

2

learned. In supervised setting  given a set of training examples D = {(x∗  y∗)}  we learn the model
by maximizing the data log-likelihood.

Equivalence between Data and Reward The recent work [46] introduced a unifying perspective
of reformulating maximum likelihood supervised learning as a special instance of a policy optimiza-
tion framework. In this perspective  data examples providing supervision signals are equivalent to a
specialized reward function. Since the original framework [46] was derived for sequence generation
problems  here we present a slightly adapted formulation for our context of data manipulation.
To connect the maximum likelihood supervised learning with policy optimization  consider the
model pθ(y|x) as a policy that takes “action” y given the “state” x. Let R(x  y|D) ∈ R denote
a reward function  and p(x) be the empirical data distribution which is known given D. Further
assume a variational distribution q(x  y) that factorizes as q(x  y) = p(x)q(y|x). A variational
policy optimization objective is then written as:

L(q  θ) = Eq(x y) [R(x  y|D)] − αKL(cid:0)q(x  y)(cid:107)p(x)pθ(y|x)(cid:1) + βH(q) 

(1)
where KL(·(cid:107)·) is the Kullback–Leibler divergence; H(·) is the Shannon entropy; and α  β > 0 are
balancing weights. The objective is in the same form with the RL-as-inference formalism of policy
optimization [e.g.  6  29  1]. Intuitively  the objective maximizes the expected reward under q  and
enforces the model pθ to stay close to q  with a maximum entropy regularization over q. The problem
is solved with an EM procedure that optimizes q and θ alternatingly:

(cid:26) α log p(x)pθ(y|x) + R(x  y|D)

(cid:27)

/ Z 

(2)

E-step:

q

(cid:48)

M-step: θ

(x  y) = exp
(cid:48)

= arg maxθ

(cid:2) log pθ(y|x)(cid:3) 

α + β

Eq(cid:48)(x y)

where Z is the normalization term. With the established framework  it is easy to show that the above
optimization procedure reduces to maximum likelihood learning by taking α → 0  β = 1  and the
reward function:

(cid:26) 1

Rδ(x  y|D) =

if (x  y) ∈ D

−∞ otherwise.

(3)

That is  a sample (x  y) receives a unit reward only when it matches a training example in the
dataset  while the reward is negative inﬁnite in all other cases. To make the equivalence to maximum
likelihood learning clearer  note that the above M-step now reduces to

(4)
where the joint distribution p(x) exp{Rδ}/Z equals the empirical data distribution  which means the
M-step is in fact maximizing the data log-likelihood of the model pθ.

= arg maxθ

θ

Ep(x) exp{Rδ}/Z

(cid:48)

(cid:2) log pθ(y|x)(cid:3) 

Gradient-based Reward Learning There is a rich line of research on learning the reward in
reinforcement learning. Of particular interest to this work is [52] which learns a parametric intrinsic
reward that additively transforms the original task reward (a.k.a extrinsic reward) to improve the
policy optimization. For consistency of notations with above  formally  let pθ(y|x) be a policy where
y is an action and x is a state. Let Rin
φ be the intrinsic reward with parameters φ. In each iteration 
the policy parameter θ is updated to maximize the joint rewards  through:

(cid:48)

= θ + γ∇θLex+in(θ  φ) 

θ

(5)
where Lex+in is the expectation of the sum of extrinsic and intrinsic rewards; and γ is the step size.
The equation shows θ(cid:48) depends on φ  thus we can write as θ(cid:48) = θ(cid:48)(φ).
The next step is to optimize the intrinsic reward parameters φ. Recall that the ultimate measure of
the performance of a policy is the value of extrinsic reward it achieves. Therefore  a good intrinsic
reward is supposed to  when the policy is trained with it  increase the eventual extrinsic reward. The
update to φ is then written as:

(6)
That is  we want the expected extrinsic reward Lex(θ(cid:48)) of the new policy θ(cid:48) to be maximized. Since
θ(cid:48) is a function of φ  we can directly backpropagate the gradient through θ(cid:48) to φ.

(φ)).

(cid:48)
φ

= φ + γ∇φLex(θ

(cid:48)

3

Algorithm 1 Joint Learning of Model and Data Manipulation
Input: The target model pθ(y|x)

The data manipulation function Rφ(x  y|D)
Training set D  validation set Dv

1: Initialize model parameter θ and manipulation parameter φ
2: repeat
3:

Optimize θ on D enriched with data manipulation
through Eq.(7)
Optimize φ by maximizing data log-likelihood on Dv
through Eq.(8)
5: until convergence
Output: Learned model pθ∗ (y|x) and manipulation Rφ∗ (y  x|D)

4:

Figure 1: Algorithm Computation.
Blue arrows denote learning model θ.
Red arrows denote learning manipula-
tion φ. Solid arrows denote forward
pass. Dashed arrows denote backward
pass and parameter updates.

4 Learning Data Manipulation

4.1 Method

Parameterizing Data Manipulation We now develop our approach of learning data manipulation 
through a novel marriage of supervised learning and the above reward learning. Speciﬁcally  from
the policy optimization perspective  due to the δ-function reward (Eq.3)  the standard maximum
likelihood learning is restricted to use only the exact training examples D in a uniform way. A natural
idea of enabling data manipulation is to relax the strong restrictions of the δ-function reward and
instead use a relaxed reward Rφ(x  y|D) with parameters φ. The relaxed reward can be parameterized
in various ways  resulting in different types of manipulation. For example  when a sample (x  y)
matches a data instance  instead of returning constant 1 by Rδ  the new Rφ can return varying reward
values depending on the matched instance  resulting in a data weighting scheme. Alternatively  Rφ
can return a valid reward even when x matches a data example only in part  or (x  y) is an entire new
sample not in D  which in effect makes data augmentation and data synthesis  respectively  in which
cases φ is either a data transformer or a generator. In the next section  we demonstrate two particular
parameterizations for data augmentation and weighting  respectively.
We thus have shown that the diverse types of manipulation all boil down to a parameterized data
reward Rφ. Such an concise  uniform formulation of data manipulation has the advantage that  once
we devise a method of learning the manipulation parameters φ  the resulting algorithm can directly
be applied to automate any manipulation type. We present a learning algorithm next.

Learning Manipulation Parameters To learn the parameters φ in the manipulation reward
Rφ(x  y|D)  we could in principle adopt any off-the-shelf reward learning algorithm in the lit-
erature. In this work  we draw inspiration from the above gradient-based reward learning (section 3)
due to its simplicity and efﬁciency. Brieﬂy  the objective of φ is to maximize the ultimate measure
of the performance of model pθ(y|x)  which  in the context of supervised learning  is the model
performance on a held-out validation set.
The algorithm optimizes θ and φ alternatingly  corresponding to Eq.(5) and Eq.(6)  respectively.
More concretely  in each iteration  we ﬁrst update the model parameters θ in analogue to Eq.(5)
which optimizes intrinsic reward-enriched objective. Here  we optimize the log-likelihood of the
training set enriched with data manipulation. That is  we replace Rδ with Rφ in Eq.(4)  and obtain
the augmented M-step:

= arg maxθ

(7)
By noticing that the new θ(cid:48) depends on φ  we can write θ(cid:48) as a function of φ  namely  θ(cid:48) = θ(cid:48)(φ). The
practical implementation of the above update depends on the actual parameterization of manipulation
Rφ  which we discuss in more details in the next section.

Ep(x) exp{Rφ(x y|D)}/Z

(cid:48)

θ

(cid:2) log pθ(y|x)(cid:3).

4

Train Data!ValData!"ℒ(% ')%′(')Model%ℒ(%′('))''′ManipulationThe next step is to optimize φ in terms of the model validation performance  in analogue to Eq.(6).
Formally  let Dv be the validation set of data examples. The update is then:

(cid:48)
φ

= arg maxφ
= arg maxφ

Ep(x) exp{Rδ (x y|Dv )}/Z
E(x y)∼Dv

(cid:2) log pθ(cid:48) (y|x)(cid:3) 

(cid:2) log pθ(cid:48) (y|x)(cid:3)

(8)

where  since θ(cid:48) is a function of φ  the gradient is backpropagated to φ through θ(cid:48)(φ). Taking data
weighting for example where φ is the training sample weights (more details in section 4.2)  the update
is to optimize the weights of training samples so that the model performs best on the validation set.
The resulting algorithm is summarized in Algorithm 1. Figure 1 illustrates the computation ﬂow.
Learning the manipulation parameters effectively uses a held-out validation set. We show in our
experiments that a very small set of validation examples (e.g.  2 labels per class) is enough to
signiﬁcantly improve the model performance in low data regime.
It is worth noting that some previous work has also leveraged validation examples  such as learning
data augmentation with policy gradient [5] or inducing data weights with meta-learning [39]. Our
approach is inspired from a distinct paradigm of (intrinsic) reward learning. In contrast to [5] that
treats data augmentation as a policy  we instead formulate manipulation as a reward function and
enable efﬁcient stochastic gradient updates. Our approach is also more broadly applicable to diverse
data manipulation types than [39  5].

4.2

Instantiations: Augmentation & Weighting

As a case study  we show two parameterizations of Rφ which instantiate distinct data manipulation
schemes. The ﬁrst example learns augmentation for text data  a domain that has been less studied in
the literature compared to vision and speech [25  12]. The second instance focuses on automated data
weighting  which is applicable to any data domains.

Fine-tuning Text Augmentation
The recent work [25  49] developed a novel contextual augmentation approach for text data  in which
a powerful pretrained language model (LM)  such as BERT [7]  is used to generate substitutions
of words in a sentence. Speciﬁcally  given an observed sentence x∗  the method ﬁrst randomly
masks out a few words. The masked sentence is then fed to BERT which ﬁlls the masked positions
with new words. To preserve the original sentence class  the BERT LM is retroﬁtted as a label-
conditional model  and trained on the task training examples. The resulting model is then ﬁxed and
used to augment data during the training of target model. We denote the augmentation distribution as
gφ0 (x|x∗  y∗)  where φ0 is the ﬁxed BERT LM parameters.
The above process has two drawbacks. First  the LM is ﬁxed after ﬁtting to the task data. In the
subsequent phase of training the target model  the LM augments data without knowing the state of
the target model  which can lead to sub-optimal results. Second  in the cases where the task dataset
is small  the LM can be insufﬁciently trained for preserving the labels faithfully  resulting in noisy
augmented samples.
To address the difﬁculties  it is beneﬁcial to apply the proposed learning data manipulation algorithm
to additionally ﬁne-tune the LM jointly with target model training. As discussed in section 4  this
reduces to properly parameterizing the data reward function:

(cid:26) 1

φ (x  y|D) =
Raug

−∞ otherwise.

if x ∼ gφ(x|x∗  y)  (x∗  y) ∈ D

That is  a sample (x  y) receives a unit reward when y is the true label and x is the augmented sample
by the LM (instead of the exact original data x∗). Plugging the reward into Eq.(7)  we obtain the
data-augmented update for the model parameters:

Ex∼gφ(x|x∗ y)  (x∗ y)∼D(cid:2) log pθ(y|x)(cid:3).

(cid:48)

θ

= arg maxθ

That is  we pick an example from the training set  and use the LM to create augmented samples 
which are then used to update the target model. Regarding the update of augmentation parameters φ
(Eq.8)  since text samples are discrete  to enable efﬁcient gradient propagation through θ(cid:48) to φ  we
use a gumbel-softmax approximation [20] to x when sampling substitution words from the LM.

5

(9)

(10)

Learning Data Weights
We now demonstrate the instantiation of data weighting. We aim to assign an importance weight to
each training example to adapt its effect on model training. We automate the process by learning the
data weights. This is achieved by parameterizing Rφ as:

(cid:26) φi

φ (x  y|D) =
Rw

−∞ otherwise 

if (x  y) = (x∗

i   y∗

i )  (x∗

i   y∗

i ) ∈ D

(11)

(12)

where φi ∈ R is the weight associated with the ith example. Plugging Rw
weighted update for the model θ:

φ into Eq.(7)  we obtain the

(cid:48)

θ

= arg maxθ
= arg maxθ

E(x∗
E(x∗

i  y∗
i  y∗

(cid:2) log pθ(y
i )∼D(cid:2)softmax(φi) log pθ(y

i )∈D  i∼softmax(φi)

i )(cid:3)
i )(cid:3)

i |x
∗
∗
i |x
∗
∗

In practice  when minibatch stochastic optimization is used  we approximate the weighted sampling
by taking the softmax over the weights of only the minibatch examples. The data weights φ are
updated with Eq.(8). It is worth noting that the previous work [39] similarly derives data weights
based on their gradient directions on a validation set. Our algorithm differs in that the data weights are
parameters maintained and updated throughout the training  instead of re-estimated from scratch in
each iteration. Experiments show the parametric treatment achieves superior performance in various
settings. There are alternative parameterizations of Rφ other than Eq.(11). For example  replacing φi
in Eq.(11) with log φi in effect changes the softmax normalization in Eq.(12) to linear normalization 
which is used in [39].

5 Experiments

We empirically validate the proposed data manipulation approach through extensive experiments on
learning augmentation and weighting. We study both text and image classiﬁcation  in two difﬁcult
settings of low data regime and imbalanced labels1.

5.1 Experimental Setup

Base Models. We choose strong pretrained networks as our base models for both text and image
classiﬁcation. Speciﬁcally  on text data  we use the BERT (base  uncased) model [7]; while on
image data  we use ResNet-34 [14] pretrained on ImageNet. We show that  even with the large-
scale pretraining  data manipulation can still be very helpful to boost the model performance on
downstream tasks. Since our approach uses validation sets for manipulation parameter learning  for a
fair comparison with the base model  we train the base model in two ways. The ﬁrst is to train the
model on the training sets as usual and select the best step using the validation sets; the second is to
train on the merged training and validation sets for a ﬁxed number of steps. The step number is set to
the average number of steps selected in the ﬁrst method. We report the results of both methods.
Comparison Methods. We compare our approach with a variety of previous methods that were
designed for speciﬁc manipulation schemes: (1) For text data augmentation  we compare with the
latest model-based augmentation [49] which uses a ﬁxed conditional BERT language model for
word substitution (section 4.2). As with base models  we also tried ﬁtting the augmentatin model to
both the training data and the joint training-validation data  and did not observe signiﬁcant difference.
Following [49]  we also study a conventional approach that replaces words with their synonyms
using WordNet [33]. (2) For data weighting  we compare with the state-of-the-art approach [39]
that dynamically re-estimates sample weights in each iteration based on the validation set gradient
directions. We follow [39] and also evaluate the commonly-used proportion method that weights
data by inverse class frequency.
Training.
For both the BERT classiﬁer and the augmentation model (which is also based on
BERT)  we use Adam optimization with an initial learning rate of 4e-5. For ResNets  we use SGD
optimization with a learning rate of 1e-3. For text data augmentation  we augment each minibatch
by generating two or three samples for each data points (each with 1  2 or 3 substitutions)  and use
both the samples and the original data to train the model. For data weighting  to avoid exploding
value  we update the weight of each data point in a minibatch by decaying the previous weight value

1Code available at https://github.com/tanyuqian/learning-data-manipulation

6

Model
Base model: BERT [7]
Base model + val-data

Augment

Weight

Fixed augmentation [49]
Ours: Fine-tuned augmentation
Ren et al. [39]
Ours

SST-5 (40+2)
33.32 ± 4.04
35.86 ± 3.03
Synonym 32.45 ± 4.59
34.84 ± 2.76
37.03 ± 2.05
36.09 ± 2.26
36.51 ± 2.54

IMDB (40+5)
63.55 ± 5.35
63.65 ± 3.32
62.68 ± 3.94
63.65 ± 3.21
65.62 ± 3.32
63.01 ± 3.33
