2017,Dynamic Revenue Sharing,Many online platforms act as intermediaries between a seller and a set of buyers. Examples of such settings include online retailers (such as Ebay) selling items on behalf of sellers to buyers  or advertising exchanges (such as AdX) selling pageviews on behalf of publishers to advertisers. In such settings  revenue sharing is a central part of running such a marketplace for the intermediary  and fixed-percentage revenue sharing schemes are often used to split the revenue among the platform and the sellers. In particular  such revenue sharing schemes require the platform to (i) take at most a constant fraction \alpha of the revenue from auctions and (ii) pay the seller at least the seller declared opportunity cost c for each item sold. A straightforward way to satisfy the constraints is to set a reserve price at c / (1 - \alpha) for each item  but it is not the optimal solution on maximizing the profit of the intermediary.  While previous studies (by Mirrokni and Gomes  and by Niazadeh et al) focused on revenue-sharing schemes in static double auctions  in this paper  we take advantage of the repeated nature of the auctions. In particular  we introduce dynamic revenue sharing schemes where we balance the two constraints over different auctions to achieve higher profit and seller revenue. This is directly motivated by the practice of advertising exchanges where the fixed-percentage revenue-share should be met across all auctions and not in each auction. In this paper  we characterize the optimal revenue sharing scheme that satisfies both constraints in expectation. Finally  we empirically evaluate our revenue sharing scheme on real data.,Dynamic Revenue Sharing∗

Santiago Balseiro
Columbia University
New York City  NY

srb2155@columbia.edu

Max Lin
Google

New York City  NY
whlin@google.com

Vahab Mirrokni

Google

New York City  NY

mirrokni@google.com

Renato Paes Leme

Google

New York City  NY

renatoppl@google.com

Song Zuo†

Tsinghua University

Beijing  China

songzuo.z@gmail.com

Abstract

Many online platforms act as intermediaries between a seller and a set of buyers.
Examples of such settings include online retailers (such as Ebay) selling items
on behalf of sellers to buyers  or advertising exchanges (such as AdX) selling
pageviews on behalf of publishers to advertisers. In such settings  revenue sharing
is a central part of running such a marketplace for the intermediary  and ﬁxed-
percentage revenue sharing schemes are often used to split the revenue among the
platform and the sellers. In particular  such revenue sharing schemes require the
platform to (i) take at most a constant fraction α of the revenue from auctions and
(ii) pay the seller at least the seller declared opportunity cost c for each item sold.
A straightforward way to satisfy the constraints is to set a reserve price at c/(1− α)
for each item  but it is not the optimal solution on maximizing the proﬁt of the
intermediary.
While previous studies (by Mirrokni and Gomes  and by Niazadeh et al) focused on
revenue-sharing schemes in static double auctions  in this paper  we take advantage
of the repeated nature of the auctions. In particular  we introduce dynamic revenue
sharing schemes where we balance the two constraints over different auctions
to achieve higher proﬁt and seller revenue. This is directly motivated by the
practice of advertising exchanges where the ﬁxed-percentage revenue-share should
be met across all auctions and not in each auction. In this paper  we characterize
the optimal revenue sharing scheme that satisﬁes both constraints in expectation.
Finally  we empirically evaluate our revenue sharing scheme on real data.

1

Introduction

The space of internet advertising can be divided in two large areas: search ads and display ads. While
similar at ﬁrst glance  they are different both in terms of business constraints in the market as well as
algorithmic challenges. A notable difference is that in search ads the auctioneer and the seller are the
same party  as the same platform owns the search page and operates the auction. Thus search ads are
a one-sided market: the only agents outside the control of the auctioneer are buyers. In display ads 
on the other hand  the platform operates the auction but  in most cases  it does not own the pages in
∗We thank Jim Giles  Nitish Korula  Martin Pál  Rita Ren and Balu Sivan for the fruitful discussion and their
comments on early versions of this paper. We also thank the anonymous reviewers for their helpful comments.
A full version of this paper can be found at https://ssrn.com/abstract=2956715.
†The work was done when this author was an intern at Google. This author was supported by the National
Basic Research Program of China Grant 2011CBA00300  2011CBA00301  the Natural Science Foundation of
China Grant 61033001  61361136003  61303077  61561146398  a Tsinghua Initiative Scientiﬁc Research Grant
and a China Youth 1000-talent program.
31st Conference on Neural Information Processing Systems (NIPS 2017)  Long Beach  CA  USA.

which the ads are displayed  making the main problem the design of a two-sided market  referred to
as ad exchanges.
The problem of designing an ad exchange can be decomposed in two parts: the ﬁrst is to design
an auction  which will specify how an ad impression will be allocated among different prospective
buyers (advertisers) and how they will be charged from it. The second component is a revenue sharing
scheme  which speciﬁes how the revenue collected from buyers will be split between the seller (the
publisher) and the platform. Traditionally the problems of designing an auction and designing a
revenue sharing scheme have been merged in a single one called double auction design. This was the
traditional approach taken by [4]  [3] and more recently in the algorithmic work of [2  5]. The goals
in those approaches have been to maximize efﬁciency in the market  maximize proﬁt of the platform
and to characterize when the proﬁt maximizing policy is a simple one.
Those objectives however  do not entirely correspond to actual problem faced by advertising ex-
changes. Take platform-proﬁt-maximization  for example. The ad-exchange business is a highly
competitive environment. A web publisher (seller) can send their ad impressions to a dozen of
different exchanges. If an exchange tries to extract all the surplus in the form of proﬁt  web publishers
will surely migrate to a less greedy platform. In order to retain their inventory  exchanges must align
their incentives with the incentives of those of web publishers.
A good practical solution  which has been adopted by multiple real world platforms  is to declare a
ﬁxed revenue sharing scheme. The exchange promises it will keep at most an α-fraction of proﬁts 
where the constant α is typically the outcome of a business negotiation between the exchange and the
web publisher. After the fraction is agreed  the objective of the seller and the exchange are aligned.
The exchange maximizes proﬁts by maximizing the seller’s revenue.
If revenue sharing was the only constraint  the exchange could simply ignore sellers and run an
optimal auction among buyers. In practice  however  web-publishers have outside options  typically
in the form of reservation contracts  which should be taken into account by the exchange. Reservation
contracts are a very traditional form of selling display ads that predates ad exchanges  where buyers
and sellers make agreements ofﬂine specifying a volume of impressions to be transacted  a price per
impression and a penalty for not satisfying the contract. Those agreements are entered in a system (for
example Google’s Doubleclick for Publishers) that manages reservations on behalf of the publisher.
This reservation system determines for each arriving impression the best matching ofﬂine contract
that impression could be allocated to as well as the cost of not allocating that impression. The cost of
not allocating an impression takes into account the potential revenue from allocating to a contract and
the probability of paying a penalty for not satisfying the contract.
From our perspective  it is irrelevant how a cost is computed by reservation systems. It is sufﬁcient
to assume that for each impression  the publisher has an opportunity cost and it is only willing to
sell that particular impression in the exchange if its payout for that impression exceeds the cost.
Exchanges therefore  allow the publisher to submit a cost and only sell that impression if they are
able to pay the publisher at least the cost per that impression.
We design the following simple auction and revenue sharing scheme that we call the naïve policy:

• seller sends to the exchange an ad impression with cost c.
• exchange runs a second price auction with reserve r ≥ c/(1 − α).
• if the item is sold the exchange keeps an α fraction of the revenue and sends the remaining

1 − α fraction to the seller.

This scheme is pretty simple and intuitive for each participant in the market. It guarantees that if the
impression is sold  the revenue will be at least c/(1 − α) and therefore the seller’s payout will be at
least c. So both the minimum payout and revenue sharing constraints are satisﬁed with probability
1. This scheme has also the advantage of decoupling the auction and the revenue sharing problem.
The platform is free to use any auction among the buyers as long as it guarantees that whenever the
impression is matched  the revenue extracted from buyers is at least c/(1 − α).
Despite being simple  practical and allowing the exchange to experiment with the auction without
worrying about revenue sharing  this mechanism is sub-optimal both in terms of platform proﬁt and
publisher payout. The exchange might be willing to accept a revenue share lower than α if this grants
more freedom in optimizing the auction and extracting more revenue.
More generally  the exchange might exploit the repeated nature of the auction to improve revenue
even further by adjusting the revenue share dynamically based on the bids and the cost. In this setting 

2

we can think of the revenue share constraints to be enforced on average  i.e.  over a sequence of
auctions the platform is required to bound by α the ratio of the aggregate proﬁt and the aggregate
revenue collected from buyers. This allows the platform to increase the revenue share on certain
queries and reduce in others.
In the repeated auctions setting  the exchange is also allowed to treat the minimum cost constraint on
aggregate: the payout for the seller needs to be at least as large as the sum of costs of the impressions
matched. The exchange can implement this in practice by always paying the seller at least his cost
even if the revenue collected from buyers is less than the cost. This would cause the exchange to
operate at a loss for some impressions. But this can be advantageous for the exchange on aggregate if
it is able to offset these losses by leveraging other queries with larger proﬁt margins.
In this paper  we attempt to characterize the optimal scheme for repeated auctions and measure on
data the improvement with respect to the simple revenue sharing scheme discussed above.
Finally  while we discuss the main application of our results in the context of advertising exchanges 
our model and results apply to the broad space of platforms that serve as intermediaries between
buyers and sellers  and help run many repeated auctions over time. The issue of dynamic revenue
sharing also arises when Amazon or eBay act as a platform and splits revenues from a sale with
the sellers  or when ride-sharing services such as Uber or Lyft split the fare paid by the passenger
between the driver and the platform. Uber for example mentions in their website3 that: “Drivers
using the partner app are charged an Uber Fee as a percentage of each trip fare. The Uber Fee varies
by city and vehicle type and helps Uber cover costs such as technology  marketing and development
of new features within the app.”

1.1 Our Results and Techniques

We propose different designs of auctions and revenue sharing policies in exchanges and analyze
them both theoretically and empirically on data from a major ad exchange. We compare against the
naïve policy described above. We compare policies in terms of seller payout  exchange proﬁt and
match-rate (number of impressions sold). We note that match-rate is an important metric in practice 
since it represents the volume of inventory transacted in the exchange and it is a proxy for the volume
of the ad market this particular exchange is able to capture.
For the auction  we restrict our attention to second price auctions with reserve prices  since we aim at
using theory as a guide to inform decisions about practical designs that can be implemented in real
ad-exchanges. To be implementable in practice the designs need to follow the industry practice of
running second-price auctions with reserves. This design will be automatically incentive compatible
for buyers. On the seller side  instead of enforcing incentive compatibility  we will assume that
impression costs are reported truthfully. Note that the revenue sharing contract guarantees  at least
partially  when the constraint binds (which always happens in practice)  the goals of the seller and the
platform are partially aligned: maximizing proﬁt is the same as maximizing revenue. Thus  sellers
have little incentive to misreport their costs. In fact  this is one of the main reason that so many
real-world platforms such as Uber adopt ﬁxed revenue sharing contracts. In the ads market  moreover 
sellers are also typically viewed as less strategic and reactive agents. Thus  we believe that the latter
assumption is not too restrictive in practice.4
We will also assume Bayesian priors on buyer’s valuations and on seller’s costs. For the sake of
simplicity  we will start with the assumption that seller costs are constant and show in the full version
how to extend our results to the case where costs are sampled from a distribution.
We will focus on the exchange proﬁt as our main objective function. While this paper will take the
perspective of the exchange  the policies proposed will also improve seller’s payout with respect
to the naïve policy. The reason is simple: the naïve policy keeps exactly α fraction of the revenue
extracted from buyers as proﬁt. Any policy that keeps at most α and improves proﬁt  should improve
revenue extracted from buyers at least at the same rate and hence improve seller’s payout.
Single Period Revenue Sharing. We ﬁrst study the case where exchange is required to satisfy
the revenue sharing constraint in each period  i.e.  for each impression at most an α-fraction of the

3See https://www.uber.com/info/how-much-do-drivers-with-uber-make/
4While in this paper we focus on the dynamic optimization of revenue sharing schemes when agents report
truthfully  it is still an interesting avenue of research to study the broader market design question of designing
dynamic revenue sharing schemes while taking into account agents’ incentives.

3

revenue can be retained as proﬁt. We characterize the optimal policy. We ﬁrst show that the optimal
policy always sets the reserve price above the seller’s cost  but not necessarily above c/(1 − α). The
exchange might voluntarily want to decrease its revenue share if this grants freedom to set lower
reserve prices and extract more revenue from buyers.
When the opportunity cost of the seller is low  the optimal policy for the exchange ignores the seller’s
cost and prices according to the optimal reserve price. When the opportunity cost is high  pricing
according to c/(1 − α) is again not optimal because demand is inelastic at that price. The exchange
internalizes the opportunity cost  prices between c and c/(1 − α)  and reduces its revenue share if
necessary. For intermediate values of the opportunity cost  the exchange is better off employing the
naïve policy and pricing according to c/(1 − α).
Multi Period Revenue Sharing. We then study the case where the revenue share constraint is
imposed over the aggregate buyers’ payments. We provide intuition on the structure of the optimal
policy by ﬁrst solving a Lagrangian relaxation and then constructing an asymptotically optimal heuris-
tic policy (satisfying the original constraints) based on the optimal relaxation solution. In particular 
we introduce a Lagrange multiplier for the revenue sharing constraint to get the optimal solution
to the Lagrangian relaxation. The optimal revenue sharing policy obtained from the Lagrangian
relaxation pays the publisher a convex combination between his cost c and a fraction (1 − α) of the
revenue obtained from buyers. Depending on the value of the multiplier  the reserve price could be
below c  exposing the platform to the possibility of operating at a loss in some auctions.
The policy obtained from the Lagrangian relaxation  while intuitive  only satisﬁes the revenue sharing
and cost constraints in expectation. Because this is not feasible for the platform  we discuss heuristic
policies that approximate that policy in the limit  but satisfy the constraints surely in aggregate over
the T periods. Then we discuss an even stronger policy that satisﬁes the aggregate constraints for any
preﬁx  i.e.  at any given time t  the constraints are satisﬁed in aggregate from time 1 to t.
Comparative Statics. We compare the structure of the single period and multi period policies. The
ﬁrst insight is that the optimal multi-period policy uses lower reserve prices therefore matching more
queries. The key insight we obtain from the comparison is that multi-period revenue sharing policies
are particularly effective when markets are thick  i.e. when a second highest bid is above a rescaled
version of the cost often and cost are not too high.
Empirical Insights. To complement our theoretical results  we conduct an empirical study simu-
lating our revenue sharing policies on real world data from a major ad exchange. The data comes
from bids in a second price auction with reserves (for a single-slot)  which is truthful. Our study
conﬁrms the effectiveness of the multi period revenue sharing policies and single period revenue
sharing policies over the naïve policy. The results are consistent for different values of α: the proﬁt
lifts of single period revenue sharing policies are +1.23% ∼ +1.64% and the lifts of multi period
revenue sharing policies are roughly 5.5 to 7 times larger (+8.53% ∼ +9.55%).
We do an extended overview in Section 7  but leave the further details to the full version. We omit the
related work here  which can be can be found in the full version.

2 Preliminaries

Setting. We study a discrete-time ﬁnite horizon setting in which items arrive sequentially to an
intermediary. We index the sequence of items by t = 1  . . .   T . There are multiple buyers bidding in
the intermediary (the exchange) and the intermediary determines the winning bidder via a second
price auction. We assume that the bids from the buyers are drawn independently and identically
distributed across auctions  but potentially correlated across buyers for a given auction.
We will assume that the proﬁt function of the joint distribution of bids is quasi-concave. The expected
proﬁt function corresponds to the expected revenue of a second price auction with reserve price r and
opportunity cost c:

Π(r  c) = E(cid:2)1{bf ≥ r} (max(r  bs) − c)(cid:3) .

t and bs

t are the highest- and second-highest bid at time t. Our assumption on the bid

where bf
distribution will be as follows:
Assumption 2.1. The expected proﬁt function Π(r  c) is quasi-concave in r for each c.

4

The previous assumption is satisﬁed  for example  if bids are independent and identically distributed
according to a distribution with increasing hazard rates (see  e.g.  (author?) [1]).
Mechanism. The seller submitting the items sets an opportunity cost of c ≥ 0 for the items. The
proﬁt of the intermediary is the difference between the revenue collected from the buyers and the
payments made to the seller. The intermediary has agreed to a revenue sharing scheme that limits the
proﬁt of the intermediary to at most α ∈ (0  1) of the total revenue collected from the buyers.
The intermediary implements a non-anticipative adaptive policy π that maps the history at time t
: R+ → R+
t ∈ R+ for the second price auction and a payment function pπ
to a reserve price rπ
that determines the amount to be paid to the seller as a function of the buyers’ payments. That is 
t ≥ rπ
the item is sold whenever the highest bid is above the reserve price  or equivalently bf
t . The
intermediary’s revenue is equal to the buyers’ payments of max(rπ
t) and the seller’s revenue
t)). The intermediary’s proﬁt is given by the difference of the buyers’
is given by pπ
payments and the payments to the seller  i.e.  max(rπ
t)). From the perspective
of the buyers  the mechanism implemented by the intermediary is a second price auction with
(potentially dynamic) reserve price rπ
t . The intermediary’s problem amounts to maximizing proﬁts
subject to the revenue sharing constraint. The revenue sharing constraint can be imposed at every
single period or over multiple periods. We discuss each model at a time.
Naïve revenue sharing scheme. The most straightforward revenue sharing scheme is the one that
sets a reserve above c/(1 − α) and pay the sellers a (1 − α)-fraction of the revenue:

t) − pπ

t (max(rπ

t (max(rπ

t   bs

t   bs

t   bs

t   bs

t

t ≥ c
rπ

1−α  

t (x) = (1 − α)x.
pπ

r∗ = arg maxr≥c/(1−α) Π(r  0) .

(1)
t). Thus  the

Since the revenue sharing is ﬁxed  the intermediary’s proﬁt is given by α max(rπ
intermediary optimizes proﬁts by optimizing revenues  and the optimal reserve price is given by:

t   bs

The naïve revenue sharing scheme sets a reserve above c/(1 − α) and pays the seller (1 − α) of
the buyers’ payments. This guarantees that the payment to the seller is always no less than c  by
construction  because the payment of the buyers is at least the reserve price. Since the intermediary’s
proﬁt is a fraction α of the buyers’ payment  the seller’s cost does not appear in the objective  and the
objective of the seller is αΠ(r  0). Note  however  that the seller’s cost does appear as a constraint in
the intermediary’s optimization problem: the reserve price should be at least c/(1 − α).
This is the baseline that we will use to compare the proposed policies with in the experiment section.
This policy is suboptimal for various reasons. Consider for example the extreme case where the
buyers alway bid more than c and less than c/(1 − α). In this case  the proﬁt from the naïve revenue
sharing scheme is zero. However  the intermediary can still obtain a non-zero proﬁt by setting the
reserve somewhere between c and c/(1 − α)  which results in a revenue share less than α. If the
revenue sharing constraint is imposed over multiple periods instead of each single period  we are able
to dynamically balance out the deﬁcit and surplus of the revenue sharing constraint over time.

3 Single Period Revenue Sharing Scheme

(cid:80)T
t ≥ rπ
π
t (x) ≥ (1 − α)x  
s.t. pπ
t (x) ≥ c  
∀x .
pπ

t=1

∀x

In this case the revenue sharing scheme imposes that in every single period the proﬁt of the interme-
diary is at most α of the buyers’ payment. We start by formulating the proﬁt maximization problem
faced by the intermediary as a mathematical program with optimal value J S.
t (max(rπ

E(cid:2)1{bf

t } (max(rπ

t)))(cid:3)

J S (cid:44) max

t) − pπ

t   bs

t   bs

(2a)

(2b)
(2c)
The objective (2a) gives the proﬁt of the intermediary as the difference between the payments collected
from the buyers and the payments made to the seller. The revenue sharing constraint (2b) imposes that
intermediary’s proﬁt is at most a fraction α of the total revenue  or equivalently (x − pπ
t (x))/x ≤ α
where x is the payment from the buyers. The ﬂoor constraint (2c) imposes that the seller is paid at
least c. These constraints are imposed at every auction.
We next characterize the optimal decisions of the seller in the single period model. Some deﬁnitions
are in order. Let r∗(c) be an optimal reserve price in the second price auction if the seller’s cost is c:

r∗(c) = arg maxr≥0 Π(r  c).

5

To avoid trivialities we assume that the optimal reserve price is unique. Because the proﬁt function
Π(r  c) has increasing differences in (r  c) then the optimal reserve price is non-decreasing with the
cost  that is  r∗(c) ≥ r∗(c(cid:48)) for c ≥ c(cid:48).
Our main result in this section characterizes the optimal decision of the intermediary in this model.
t (x) = max(c  (1 − α)x) and
Theorem 3.1. The optimal decision of the intermediary is to set pπ
t = max{min{¯c  r∗(c)}  r∗(0)} where ¯c = c/(1 − α).
rπ
The reserve price ¯c = c/(1 − α) in the above theorem is the naïve reserve price that satisﬁes the
revenue sharing scheme by inﬂating the opportunity cost by 1/(1 − α). When the opportunity cost
c is very low (¯c ≤ r∗(0))  pricing according to ¯c is not optimal because demand is elastic at ¯c and
the intermediary can improve proﬁts by increasing the reserve price. Here the intermediary ignores
t = r∗(0) and pays the seller according to
the opportunity cost  prices optimally according to rπ
t (x) = (1 − α)x. When the opportunity cost c is very high (¯c ≥ r∗(c))  pricing according to ¯c
pπ
