2018,Understanding Batch Normalization,Batch normalization (BN) is a technique to normalize activations in intermediate layers of deep neural networks. Its tendency to improve accuracy and speed up training have established BN as a favorite technique in deep learning. Yet  despite its enormous success  there remains little consensus on the exact reason and mechanism behind these improvements. In this paper we take a step towards a better understanding of BN  following an empirical approach. We conduct several experiments  and show that BN primarily enables training with larger learning rates  which is the cause for faster convergence and better generalization. For networks without BN we demonstrate how large gradient updates can result in diverging loss and activations growing uncontrollably with network depth  which limits possible learning rates. BN avoids this problem by constantly correcting activations to be zero-mean and of unit standard deviation  which enables larger gradient steps  yields faster convergence and may help bypass sharp local minima. We further show various ways in which gradients and activations of deep unnormalized networks are ill-behaved. We contrast our results against recent findings in random matrix theory  shedding new light on classical initialization schemes and their consequences.,Understanding Batch Normalization

Johan Bjorck  Carla Gomes  Bart Selman  Kilian Q. Weinberger

Cornell University

{njb225 gomes selman kqw4} @cornell.edu

Abstract

Batch normalization (BN) is a technique to normalize activations in intermediate
layers of deep neural networks.
Its tendency to improve accuracy and speed
up training have established BN as a favorite technique in deep learning. Yet 
despite its enormous success  there remains little consensus on the exact reason
and mechanism behind these improvements. In this paper we take a step towards a
better understanding of BN  following an empirical approach. We conduct several
experiments  and show that BN primarily enables training with larger learning rates 
which is the cause for faster convergence and better generalization. For networks
without BN we demonstrate how large gradient updates can result in diverging loss
and activations growing uncontrollably with network depth  which limits possible
learning rates. BN avoids this problem by constantly correcting activations to
be zero-mean and of unit standard deviation  which enables larger gradient steps 
yields faster convergence and may help bypass sharp local minima. We further show
various ways in which gradients and activations of deep unnormalized networks are
ill-behaved. We contrast our results against recent ﬁndings in random matrix theory 
shedding new light on classical initialization schemes and their consequences.

1

Introduction

Normalizing the input data of neural networks to zero-mean and constant standard deviation has been
known for decades [29] to be beneﬁcial to neural network training. With the rise of deep networks 
Batch Normalization (BN) naturally extends this idea across the intermediate layers within a deep
network [23]  although for speed reasons the normalization is performed across mini-batches and not
the entire training set. Nowadays  there is little disagreement in the machine learning community that
BN accelerates training  enables higher learning rates  and improves generalization accuracy [23]
and BN has successfully proliferated throughout all areas of deep learning [2  17  21  46]. However 
despite its undeniable success  there is still little consensus on why the beneﬁts of BN are so
pronounced. In their original publication [23] Ioffe and Szegedy hypothesize that BN may alleviate
“internal covariate shift” – the tendency of the distribution of activations to drift during training  thus
affecting the inputs to subsequent layers. However  other explanations such as improved stability of
concurrent updates [13] or conditioning [42] have also been proposed.
Inspired by recent empirical insights into deep learning [25  36  57]  in this paper we aim to clarify
these vague intuitions by placing them on solid experimental footing. We show that the activations
and gradients in deep neural networks without BN tend to be heavy-tailed. In particular  during an
early on-set of divergence  a small subset of activations (typically in deep layer) “explode”. The
typical practice to avoid such divergence is to set the learning rate to be sufﬁciently small such that
no steep gradient direction can lead to divergence. However  small learning rates yield little progress
along ﬂat directions of the optimization landscape and may be more prone to convergence to sharp
local minima with possibly worse generalization performance [25].
BN avoids activation explosion by repeatedly correcting all activations to be zero-mean and of unit
standard deviation. With this “safety precaution”  it is possible to train networks with large learning

32nd Conference on Neural Information Processing Systems (NeurIPS 2018)  Montréal  Canada.

rates  as activations cannot grow incrontrollably since their means and variances are normalized.
SGD with large learning rates yields faster convergence along the ﬂat directions of the optimization
landscape and is less likely to get stuck in sharp minima.
We investigate the interval of viable learning rates for networks with and without BN and conclude
that BN is much more forgiving to very large learning rates. Experimentally  we demonstrate that the
activations in deep networks without BN grow dramatically with depth if the learning rate is too large.
Finally  we investigate the impact of random weight initialization on the gradients in the network
and make connections with recent results from random matrix theory that suggest that traditional
initialization schemes may not be well suited for networks with many layers — unless BN is used to
increase the network’s robustness against ill-conditioned weights.

1.1 The Batch Normalization Algorithm

As in [23]  we primarily consider BN for convolutional neural networks. Both the input and output of
a BN layer are four dimensional tensors  which we refer to as Ib c x y and Ob c x y  respectively. The
dimensions corresponding to examples within a batch b  channel c  and two spatial dimensions x  y
respectively. For input images the channels correspond to the RGB channels. BN applies the same
normalization for all activations in a given channel 
(cid:112)
Ib c x y − µc
(cid:80)
σ2
c + 

Here  BN subtracts the mean activation µc = 1|B|
b x y Ib c x y from all input activations in channel
c  where B contains all activations in channel c across all features b in the entire mini-batch and all
spatial x  y locations. Subsequently  BN divides the centered activation by the standard deviation σc
(plus  for numerical stability) which is calculated analogously. During testing  running averages of
the mean and variances are used. Normalization is followed by a channel-wise afﬁne transformation
parametrized through γc  βc  which are learned during training.

Ob c x y ← γc

+ βc

∀ b  c  x  y.

(1)

1.2 Experimental Setup

To investigate batch normalization we will use an experimental setup similar to the original Resnet
paper [17]: image classiﬁcation on CIFAR10 [27] with a 110 layer Resnet. We use SGD with
momentum and weight decay  employ standard data augmentation and image preprocessing tech-
niques and decrease learning rate when learning plateaus  all as in [17] and with the same parameter
values. The original network can be trained with initial learning rate 0.1 over 165 epochs  how-
ever which fails without BN. We always report the best results among initial learning rates from
{0.1  0.003  0.001  0.0003  0.0001  0.00003} and use enough epochs such that learning plateaus. For
further details  we refer to Appendix B in the online version [4].

2 Disentangling the beneﬁts of BN

Without batch normalization  we have found that the initial learning rate of the Resnet model needs
to be decreased to α = 0.0001 for convergence and training takes roughly 2400 epochs. We refer to
this architecture as an unnormalized network. As illustrated in Figure 1 this conﬁguration does not
attain the accuracy of its normalized counterpart. Thus  seemingly  batch normalization yields faster
training  higher accuracy and enable higher learning rates. To disentangle how these beneﬁts are
related  we train a batch normalized network using the learning rate and the number of epochs of an
unnormalized network  as well as an initial learning rate of α = 0.003 which requires 1320 epochs for
training. These results are also illustrated in Figure 1  where we see that a batch normalized networks
with such a low learning schedule performs no better than an unnormalized network. Additionally 
the train-test gap is much larger than for normalized networks using lr α = 0.1  indicating more
overﬁtting. A learning rate of α = 0.003 gives results in between these extremes. This suggests that
it is the higher learning rate that BN enables  which mediates the majority of its beneﬁts; it improves
regularization  accuracy and gives faster convergence. Similar results can be shown for variants of
BN  see Table 4 in Appendix K of the online version [4].

2

Figure 1: The training (left) and testing (right) accuracies as a function of progress through the training cycle.
We used a 110-layer Resnet with three distinct learning rates 0.0001  0.003  0.1. The smallest  0.0001 was
picked such that the network without BN converges. The ﬁgure shows that with matching learning rates  both
networks  with BN and without  result in comparable testing accuracies (red and green lines in right plot). In
contrast  larger learning rates yield higher test accuracy for BN networks  and diverge for unnormalized networks
(not shown). All results are averaged over ﬁve runs with std shown as shaded region around mean.

2.1 Learning rate and generalization

To explain these observations we consider a simple model of SGD; the loss function (cid:96)(x) is a sum
(cid:80)
over the losses of individual examples in our dataset (cid:96)(x) = 1
i=1 (cid:96)i(x). We model SGD as
N
sampling a set B of examples from the dataset with replacements  and then with learning rate α
i∈B ∇(cid:96)i(x). If we subtract and add α∇(cid:96)(x) from
estimate the gradient step as α∇SGD(x) = α|B|
(cid:88)
this expression we can restate the estimated gradient ∇SGD(x) as the true gradient  and a noise term
(cid:124) (cid:123)(cid:122) (cid:125)
We note that since we sample uniformly we have E(cid:2) α|B|
(cid:0)∇(cid:96)i(x) − ∇(cid:96)(x)(cid:1)(cid:3) = 0. Thus the
noise quantity C of a single gradient estimate such that C = E(cid:2)(cid:107)∇(cid:96)i(x) − ∇(cid:96)(x)||2(cid:3). Using basic

gradient estimate is unbiased  but will typically be noisy. Let us deﬁne an architecture dependent

α∇SGD(x) = α∇(cid:96)(x)

(cid:80)N
(cid:0)∇(cid:96)i(x) − ∇(cid:96)(x)(cid:1)
(cid:125)
(cid:123)(cid:122)
(cid:80)

error term

linear algebra and probability theory  see Apppendix D  we can upper-bound the noise of the gradient
step estimate given by SGD as

gradient

+

α
|B|

(cid:124)

i∈B

.

i∈B

E(cid:2)(cid:107)α∇(cid:96)(x) − α∇SGD(x)(cid:107)2(cid:3) ≤ α2

|B| C.

(2)

Depending on the tightness of this bound  it suggests that the noise in an SGD step is affected similarly
by the learning rate as by the inverse mini-batch size 1|B|. This has indeed been observed in practice
in the context of parallelizing neural networks [14  49] and derived in other theoretical models [24]. It
is widely believed that the noise in SGD has an important role in regularizing neural networks [6  57].
Most pertinent to us is the work of Keskar et al. [25]  where it is empirically demonstrated that large
mini-batches lead to convergence in sharp minima  which often generalize poorly. The intuition is
that larger SGD noise from smaller mini-batches prevents the network from getting “trapped” in
sharp minima and therefore bias it towards wider minima with better generalization. Our observation
from (2) implies that SGD noise is similarly affected by the learning rate as by the inverse mini-bath
size  suggesting that a higher learning rate would similarly bias the network towards wider minima.
We thus argue that the better generalization accuracy of networks with BN  as shown in Figure 1  can
be explained by the higher learning rates that BN enables.

3 Batch Normalization and Divergence

So far we have provided empirical evidence that the beneﬁts of batch normalization are primarily
caused by higher learning rates. We now investigate why BN facilitates training with higher learning
rates in the ﬁrst place. In our experiments  the maximum learning rates for unnormalized networks

3

have been limited by the tendency of neural networks to diverge for large rates  which typically
happens in the ﬁrst few mini-batches. We therefore focus on the gradients at initialization. When
comparing the gradients between batch normalized and unnormalized networks one consistently
ﬁnds that the gradients of comparable parameters are larger and distributed with heavier tails in
unnormalized networks. Representative distributions for gradients within a convolutional kernel are
illustrated in Figure 2.

Figure 2: Histograms over the gradients at initialization for (midpoint) layer 55 of a network with BN (left) and
without (right). For the unnormalized network  the gradients are distributed with heavy tails  whereas for the
normalized networks the gradients are concentrated around the mean. (Note that we have to use different scales
for the two plots because the gradients for the unnormalized network are almost two orders of magnitude larger
than for the normalized on.)

A natural way of investigating divergence is to look at the loss landscape along the gradient direction
during the ﬁrst few mini-batches that occur with the normal learning rate (0.1 with BN  0.0001
without). In Figure 3 we compare networks with and without BN in this regard. For each network
we compute the gradient on individual batches and plot the relative change in loss as a function of
the step-size (i.e. new_loss/old_loss). (Please note the different scales along the vertical axes.) For
unnormalized networks only small gradient steps lead to reductions in loss  whereas networks with
BN can use a far broader range of learning rates.
Let us deﬁne network divergence as the point when the loss of a mini-batch increases beyond
103 (a point from which networks have never managed to recover to acceptable accuracies in

Figure 3: Illustrations of the relative loss over a mini-batch as a function of the step-size (normalized by the loss
before the gradient step). Several representative batches and networks are shown  each one picked at the start of
the standard training procedure. Throughout all cases the network with BN (bottom row) is far more forgiving
and the loss decreases over larger ranges of α. Networks without BN show divergence for larger step sizes.

4

