2010,Improving Human Judgments by Decontaminating Sequential Dependencies,For over half a century  psychologists have been struck by how poor people are at expressing their internal sensations  impressions  and evaluations via rating scales. When individuals make judgments  they are incapable of using an absolute rating scale  and instead rely on reference points from recent experience. This relativity of judgment limits the usefulness of responses provided by individuals to surveys  questionnaires  and evaluation forms. Fortunately  the cognitive processes that transform internal states to responses are not simply noisy  but rather are influenced by recent experience in a lawful manner. We explore techniques to remove sequential dependencies  and thereby decontaminate a series of ratings to obtain more meaningful human judgments. In our formulation  decontamination is fundamentally a problem of inferring latent states (internal sensations) which  because of the relativity of judgment  have temporal dependencies. We propose a decontamination solution using a conditional random field with constraints motivated by psychological theories of relative judgment. Our exploration of decontamination models is supported by two experiments we conducted to obtain ground-truth rating data on a simple length estimation task. Our decontamination techniques yield an over 20% reduction in the error of human judgments.,Decontaminating Human Judgments
by Removing Sequential Dependencies

Michael C. Mozer ? Harold Pashler † Matthew Wilder ?
Robert V. Lindsey ? Matt C. Jones ◦ & Michael N. Jones‡

? Dept. of Computer Science  University of Colorado

†Dept. of Psychology  UCSD

◦Dept. of Psychology  University of Colorado

‡Dept. of Psychological and Brain Sciences  Indiana University

Abstract

For over half a century  psychologists have been struck by how poor people are at
expressing their internal sensations  impressions  and evaluations via rating scales.
When individuals make judgments  they are incapable of using an absolute rating
scale  and instead rely on reference points from recent experience. This relativity
of judgment limits the usefulness of responses provided by individuals to surveys 
questionnaires  and evaluation forms. Fortunately  the cognitive processes that
transform internal states to responses are not simply noisy  but rather are inﬂu-
enced by recent experience in a lawful manner. We explore techniques to remove
sequential dependencies  and thereby decontaminate a series of ratings to obtain
more meaningful human judgments. In our formulation  decontamination is fun-
damentally a problem of inferring latent states (internal sensations) which  be-
cause of the relativity of judgment  have temporal dependencies. We propose a
decontamination solution using a conditional random ﬁeld with constraints mo-
tivated by psychological theories of relative judgment. Our exploration of de-
contamination models is supported by two experiments we conducted to obtain
ground-truth rating data on a simple length estimation task. Our decontamination
techniques yield an over 20% reduction in the error of human judgments.

Introduction

1
Suppose you are asked to make a series of moral judgments by rating  on a 1–10 scale  various
actions  with a rating of 1 indicating ’not particularly bad or wrong’ and a rating of 10 indicating
’extremely evil.’ Consider the series of actions on the left.

(1) Stealing a towel from a hotel
(2) Keeping a dime you ﬁnd on the ground
(3) Poisoning a barking dog

(10) Testifying falsely for pay
(20) Using guns on striking workers
(30) Poisoning a barking dog

Now consider that instead you had been shown the series on the right. Even though individuals are
asked to make absolute judgments  the mean rating of statement (3) in the ﬁrst context is reliably
higher than the mean rating of the identical statement (30) in the second context (Parducci  1968).
The classic explanation of this phenomenon is cast in terms of anchoring or primacy: information
presented early in time serves as a basis for making judgments later in time (Tversky & Kahneman 
1974). In the Netﬂix contest  signiﬁcant attention was paid to anchoring effects by considering that
an individual who gives high ratings early in a session is likely to be biased toward higher ratings
later in a session (Koren  August 2009; Ellenberg  March 2008).
The need for anchors comes from the fact that individuals are poor at or incapable of making absolute
judgments and instead must rely on reference points to make relative judgments (e.g.  Laming  1984;
Parducci  1965  1968; Stewart  Brown  & Chater  2005). Where do these reference points come
from? There is a rich literature in experimental and theoretical psychology exploring sequential

1

dependencies suggesting that reference points change from one trial to the next in a systematic
manner. (We use the psychological jargon ‘trial’ to refer to a single judgment or rating in a series.)
Sequential dependencies occur in many common tasks in which an individual is asked to make
a series of responses  such as ﬁlling out surveys  questionnaires  and evaluations (e.g.  usability
ratings  pain assessment inventories). Every faculty member is aware of drift in grading that neces-
sitates comparing papers graded early on a stack with those graded later. Recency effects have been
demonstrated in domains as varied as legal reasoning and jury evidence interpretation (Furnham 
1986; Hogarth & Einhorn  1992) and clinical assessments (Mumma & Wilson  2006).
However  the most carefully controlled laboratory studies of sequential dependencies  dating back
to the the 1950’s (discussed by Miller  1956)  involve the rating of unidimensional stimuli  such as
the loudness of a tone or the length of a line. Human performance at rating stimuli is surprisingly
poor compared to an individual’s ability to discriminate the same stimuli. Regardless of the domain 
responses convey not much more than 2 bits of mutual information with the stimulus (Stewart et
al.  2005). Different types of judgment tasks have been studied including absolute identiﬁcation 
in which the individual’s task is to specify the distinct stimulus level (e.g.  10 levels of loudness) 
magnitude estimation  in which the task is to estimate the magnitude of a stimulus which may vary
continuously along a dimension  and categorization which is a hybrid task requiring individuals to
label stimuli by range. Because the number of responses in absolute identiﬁcation and categorization
tasks is often quite large  and because individuals are often not aware of the discreteness of stimuli in
absolute identiﬁcation tasks  there isn’t a qualitative difference among tasks. Feedback is typically
provided  especially in absolute identiﬁcation and categorization tasks. Without feedback  there are
no explicit anchors against which stimuli can be assessed.
The pattern of sequential effects observed is complex. Typically  experimental trial t  trial t−1 has a
large inﬂuence on ratings  and trials t− 2  t− 3  etc.  have successively diminishing inﬂuences. The
inﬂuence of recent trials is exerted by both the stimuli and responses  a fact which makes sense in
light of the assumption that individuals form their response on the current trial by analogy to recent
trials (i.e.  they determine a response to the current stimulus that has the same relationship as the
previous response had to the previous stimulus). Both assimilation and contrast effects occur: an
assimilative response on trial t occurs when the response moves in the direction of the stimulus or
response on trial t − k; a contrastive response is one that moves away. Interpreting recency effects
in terms of assimilation and contrast is nontrivial and theory dependent (DeCarlo & Cross  1990).
Many mathematical models have been developed to explain the phenomena of sequential effects in
judgment tasks. All adopt the assumption that the transduction of a stimulus to its internal represen-
tation is veridical. We refer to this internal representation as the sensation  as distinguished from the
external stimulus. (For judgments of nonphysical quantities such as emotional states and afﬁnities 
perhaps the terms impression or evaluation would be more appropriate than sensation.) Sequential
dependencies and other corruptions of the representation occur in the mapping of the sensation to a
response. According to all theories  this mapping requires reference to previous sensation-response
pairings. However  the theories differ with respect to the reference set. At one extreme  the theory of
Stewart et al. (2005) assumes that only the previous sensation-response pair matters. Other theories
assume that multiple sensation-response anchors are required  one ﬁxed and unchanging and another
varying from trial to trial (e.g.  DeCarlo & Cross  1990). And in categorization and absolute identiﬁ-
cation tasks  some theories posit anchors for each distinct response  which are adjusted trial-to-trial
(e.g.  Petrov & Anderson  2005). Range-frequency theory (Parducci  1965) claims that sequential
effects arise because the sensation-response mapping is adjusted to utilize the full response range 
and to produce roughly an equal number of responses of each type. This effect is the consequence
of many other theories  either explicitly or implicitly.
Because recent history interacts with the current stimulus to determine an individual’s response 
responses have a complex relationship with the underlying sensation  and do not provide as much
information about the internal state of the individual as one would hope. In the applied psychology
literature  awareness of sequential dependencies has led some researchers to explore strategies that
mitigate relativity of judgment  such as increasing the number of response categories and varying
the type and frequency of anchors (Mumma & Wilson  2006; Wedell  Parducci  & Lane  1990).
In contrast  our approach to extracting more information from human judgments is to develop auto-
matic techniques that recover the underlying sensation from a response that has been contaminated

2

by cognitive processes producing the response. We term this recovery process decontamination. As
we mentioned earlier  there is some precedent in the Netﬂix competition for developing empirical
approaches to decontamination. However  to the best of our knowledge  the competitors were not
focused on trial-to-trial effects  and their investigation was not systematic. Systematic investigation
requires ground truth knowledge of the individuals’ sensations.

2 Experiments

To collect ground-truth data for use in the design of decontamination techniques  we conducted two
behavioral experiments using stimuli whose magnitudes could be objectively determined. In both
experiments  participants were asked to judge the horizontal gap between two vertically aligned
dots on a computer monitor. The position of the dots on the monitor shifted randomly from trial
to trial. Participants were asked to respond to each dot pair using a 10-point rating scale  with 1
corresponding to the smallest gap they would see  and 10 corresponding to the largest.
The task requires absolute identiﬁcation of 10 distinct gaps. The participants were only told that
their task was to judge the distance between the dots. They were not told that only 10 unique stimuli
were presented  and were likely unaware of this fact (memory of exact absolute gaps is too poor)  and
thus the task is indistinguishable from a magnitude estimation or categorization task in which the gap
varied continuously. The experiment began with a practice block of ten trials. During the practice
block  participants were shown every one of the ten gaps in random order  and simultaneous with the
stimulus they were told—via text on the screen below the dots—the correct classiﬁcation. After the
practice blocks  no further feedback was provided. Although the psychology literature is replete with
line-length judgment studies (two recent examples: Lacouture  1997; Petrov & Anderson  2005)  the
vast majority provide feedback to participants on at least some trials beyond the practice block. We
wanted to avoid the anchoring provided by feedback in order that the task is more analogous to
the the type of survey tasks we wish to decontaminate  e.g.  the Netﬂix movie scores. Another
distinction between our experiments and previous experiments is an attempt to carefully control the
sequence structure  as described next.

2.1 Experiment Methodology

In Experiment 1  the practice block was followed by 2 blocks of 90 trials. Within a block  the trial
sequence was arranged such that each gap was preceded exactly once by each other gap  with the
exception that no repetitions occurred. Further  every ten trials in a block consisted of exactly one
presentation of each gap. In Experiment 2  the practice block was followed by 2 blocks of 100 trials.
The constraint on the sequence in Experiment 2 was looser than in Experiment 1: within a block 
each gap occurred exactly once preceded by each other gap. However  repetitions were included  and
there was no constraint on the subblocks of ten trials. The other key difference between experiments
was the gap lengths. In Experiment 1  gap g  with g ∈ {1  2  ...10} spanned a proportion .08g of the
screen width. In Experiment 2  gap g spanned a proportion .061 + .089g of the screen width. The
main reason for conducting Experiment 2 was that we found the gaps used in Experiment 1 resulted
in low error rates and few sequential effects for the smaller gaps. Other motivations for Experiment
2 will be explained later.
Both experiments were conducted via the web  using a web portal set up for psychology studies.
Participants were prescreened for their ability to understand English instructions  and were paid $4
for the 10–15 minutes required to complete the experiment. Two participants in Experiment 1 and
one participant in Experiment 2 were excluded from data analysis because their accuracy was below
20%. The portal was opened for long enough to obtain good data from 76 participants in each
Experiment. Individuals were allowed to participate in only one of the two experiments.

2.2 Results and Discussion of Human Experiments

Figure 1 summarizes the data from Experiments 1 and 2 (top and bottom rows  respectively). All
graphs depict the error on a trial  deﬁned as the signed difference Rt − St between the current
response  Rt  and the current stimulus level St. The left column plots the error on trial t as a function
of St−1 (along the abscissa) and St (the different colored lines  as speciﬁed by the key between the
graphs). Pairs of stimulus gaps (e.g.  G1 and G2) have been grouped together to simplify the graph.

3

Figure 1: Human data from Experiments 1 (top row) and 2 (bottom row).

The small bars around the point indicate one standard error of the mean. The variation along the
abscissa reﬂects sequential dependencies: assimilation is indicated by pairs of points with positive
slopes (larger values of St−1 result in larger Rt)  and contrast is indicated by negative slopes. The
pattern of results across the two experiments is remarkably consistent.
The middle column shows another depiction of sequential dependencies by characterizing the distri-
bution of errors (Rt− St ∈ {> 1  1  0 −1  < −1}) as a function of St− St−1. The predominance of
assimilative responses is reﬂected in more Rt > St responses when St − St−1 < 0  and vice-versa.
The rightmost column presents the lag proﬁle that characterizes how the stimulus on trial t − k for
k = 1...5 inﬂuences the response on trial t. The bars on each point indicate one standard error of
the mean. For the purpose of the current work  most relevant is that sequential dependencies in this
task may stretch back two or three trials.

3 Approaches To Decontamination

From a machine learning perspective  decontamination can be formulated in at least three different
ways. First  it could be considered an unsupervised infomax problem of determining a sensation
associated with each distinct stimulus such that the sensation sequence has high mutual information
with the response sequence. Second  it could be considered a supervised learning problem in which
a specialized model is constructed for each individual  using some minimal amount of ground-truth
data collected from that individual. Here  the ground truth is the stimulus-sensation correspondence 
which can be obtained—in principle  even with unknown stimuli—by laborious data collection tech-
niques  such as asking individuals to provide a full preference ordering or multiple partial orderings
over sets of stimuli  or asking individuals to provide multiple ratings of a stimulus in many different
contexts  so as to average out sequential effects. Third  decontamination models could be built based
on ground-truth data for one group of individuals and then tested on another group. In this paper 
we adopt this third formulation of the problem.
Formally  the decontamination problem involves inferring the sequence of (unobserved) sensations
given the complete response sequence. To introduce some notation  let Rp
t1 t2 denote the sequence
of responses made by participant p on trials t1 through t2 when shown a sequence of stimuli that

4

G1 G2G3 G4G5 G6G7 G8G9 G10−1−0.8−0.6−0.4−0.200.2Experiment 1R(t) − S(t)S(t−1)error as a function of S(t−1) and S(t) 12345−0.6−0.5−0.4−0.3−0.2−0.1lagR(t)−S(t)error as a function of lagged stimulus −9−8−7−6−5−4−3−2−1012345678900.20.40.60.81S(t)−S(t−1)P(R(t)−S(t))error as a function of stimulus difference G1 G2G3 G4G5 G6G7 G8G9 G10−1−0.500.5Experiment 2R(t) − S(t)S(t−1)12345−0.3−0.2−0.100.10.2lagR(t)−S(t)−9−8−7−6−5−4−3−2−1012345678900.20.40.60.81S(t)−S(t−1)P(R(t)−S(t))G1 G2G3 G4G5 G6G7 G8G9 G10G1 G2G3 G4G5 G6G7 G8G9 G10< −1−101>11 t and Rp

t   the response on trial t  given Sp

t1 t2.1 Decontamination can be cast as computing the expectation or
evoke the sensation sequence Sp
probability over Sp
1 T given Rp
1 T   where T is the total number of judgments made by the individual.
Although psychological theories of human judgment address an altogether different problem—that
of predicting Rp
1 t−1—they can inspire decontamination
techniques. Two classes of psychological theories correspond to two distinct function approximation
techniques. Many early models of sequential dependencies  culminating in the work of DeCarlo and
Cross (1990)  are framed in terms of autoregression. In contrast  other models favor highly ﬂexible 
nonlinear approaches that allow for similarity-based assimilation and contrast  and independent rep-
resentations for each response label (e.g.  Petrov & Anderson  2005). Given the discrete stimuli and
responses  a lookup table seems the most general characterization of these models.
We explore a two-dimensional space of decontamination techniques. The ﬁrst dimension of this
space is the model class: regression  lookup table  or an additive hybrid. We deﬁne our regression
model estimating St as:

REGt(m  n) = α + β · Rt−m+1 t + γ · St−n t−1 

(1)
where the model parameters β and γ are vectors  and α is a scalar. Similarly  we deﬁne our lookup
table LUTt(m  n) to produce an estimate of St by indexing over the m responses Rt−m+1 t and the
n sensations St−n t−1. Finally  we deﬁne an additive hybrid  REG⊕LUT(m  n) by ﬁrst constructing
a regression model  and then building a lookup table on the residual error  St − REGt(m  n). The
motivation for the hybrid is the complementarity of the two models  the regression model capturing
linear regularities and the lookup table representing arbitrary nonlinear relationships.
The second dimension in our space of decontamination techniques speciﬁes how inference is han-
dled. Decontamination is fundamentally a problem of inferring unobserved states. To utilize any
of the models above for n > 0  sensations St−n t−1 must be estimated. Although time ﬂows in
one direction  inference ﬂows in two: in psychological models  Rt is inﬂuenced by both St and
St−1; this translates to a dependence of St on both St−1 and St+1 when conditioned on R1 T . To
handle inference properly  we construct a linear-chain conditional random ﬁeld (Lafferty  McCal-
lum  & Pereira  2001; Sutton & McCallum  2007). As an alternative to the conditional random ﬁeld
(hereafter  CRF)  we also consider a simple approach in which we simply set n = 0 and discard the
sensation terms in our regression and lookup tables. At the other extreme  we can assume an oracle
that provides St−n t−1; this oracle approach offers an upper bound on achievable performance.
We explore the full Cartesian product of approaches consisting of models chosen from
{REG  LUT  REG⊕LUT} and inference techniques chosen from {SIMPLE  CRF  ORACLE}. The
SIMPLE and ORACLE approaches are straightforward classic statistics  but we need to explain how
the different models are incorporated into a CRF. The linear-chain CRF is a distribution

( TX

KX

)

P (S1 T|R1 T ) =

1

Z(R1 T )

exp

t=1

k=1

λkfk(t  St−1 t  R1 T )

(2)

with a given set of feature functions  {fk}. The linear combination of these functions determines the
potential at some time t  denoted Φt  where a higher potential reﬂects a more likely conﬁguration
of variables. To implement a CRF-REG model  we would like the potential to be high when the
regression equation is satisﬁed  e.g.  Φt = −(REGt(m  n) − St)2. Simply expanding this error
yields a collection of ﬁrst and second order terms. Folding the terms not involving the sensations
into the normalization constant  the following terms remain for REG(2  1): St  RtSt  S2
t   RtSt−1 
Rt−1St  and StSt−1.2 The regression potential function can be obtained by making each of these
terms into a real-valued feature  and determining the λ parameters in Equation 2 to yield the α  β 
and γ parameters in Equation 1.3
The CRF-LUT model could be implemented using indicator features  as is common in CRF models 
but this approach yields an explosion of free parameters: a feature would be required for each cell of

1We are switching terminology: in the discussion of our experiment  S refers to the stimulus. In the dis-
cussion of decontamination  S will refer to the sensation. The difference is minor because the stimulus and
sensation are in one-to-one correspondence.

2The terms Rt−1St−1 and S2
3As we explain shortly  the {λk} are determined by CRF training; our point here is that the CRF has the

t−1 are omitted because they correspond to RtSt and S2

t   respectively.

capacity to represent a least-squares regression solution.

5

the table and each value of St  yielding 104 free parameters for a gap detection task with a modest
CRF-LUT(2  1). Instead  we opted for the direct analog of the CRF-REG: encouraging conﬁgurations
in which St is consistent with LUTt(m  n) via potential Φt = −(LUTt(m  n) − St)2. This approach
yields three real-valued features: LUTt(m  n)2  St
2  and LUTt(m  n)St. (Remember that lookup
table values are indexed by St−1  and therefore cannot be folded into the normalization constant.)
Finally  the CRF-REG⊕LUT is a straightforward extension of the models we’ve described  based on
the potential Φt = −(REGt(m  n) + LUTt(m  n) − St)2  which still has only quadratic terms in
Stand St−1. Having now described a 3 × 3 space of decontamination approaches  we turn to the
details of our decontamination experiments.

3.1 Debiasing and Decompressing

Although our focus is on decontaminating sequential dependencies  or desequencing  the quality
of human judgments can be reduced by at least three other factors. First  individuals may have an
overall bias toward smaller or larger ratings. Second  individuals may show compression  possibly
nonlinear  of the response range. Third  there may be slow drift in the center or spread of the
response range  on a relatively long time scale. All of these factors are likely to be caused at least in
part by trial-to-trial sequential effects. For example  compression will be a natural consequence of
assimilation because the endpoints of the response scale will move toward the center. Nonetheless
we ﬁnd it useful to tease apart the factors that are easy to describe (bias  compression) from those
that are more subtle (assimilation  contrast).
In the data from our two experiments  we found no evidence of drift  as determined by the fact that
regression models with moving averages of the responses did not improve predictions. This ﬁnding
is not terribly surprising given that the entire experiment took only 10–15 minutes to complete.
We brieﬂy describe how we remove bias and compression from our data. Decompression can be
achieved with a LUT(1  0)  which maps each response into the expected sensation. For example  in
Experiment 1  the shortest stimuli reported as G1 and G2 with high accuracy  but the longest stimuli
tended to be underestimated by all participants. The LUT(1  0) compensates for this compression
by associating responses G8 and G9 with higher sensation levels if the table entries are ﬁlled based
on the training data according to: LUTt(1  0) ≡ E[St|Rt]. All of the higher order lookup tables 
LUT(m  n)  for m ≥ 1 and n ≥ 0  will also perform nonlinear decompression in the same manner.
The REG models alone will also achieve decompression  though only linear decompression.
We found ample evidence of individual biases in the use of the response scale. To debias the data 
t   and ensure the means
t − ¯Sp. Assuming that the mean sensation is
