2019,Neural networks grown and self-organized by noise,Living neural networks emerge through a process of growth and self-organization that begins with a single cell and results in a brain  an organized and functional computational device. Artificial neural networks  however  rely on human-designed  hand-programmed architectures for their remarkable performance. Can we develop artificial computational devices that can grow and self-organize without human intervention? In this paper  we propose a biologically inspired developmental algorithm that can ‘grow’ a functional  layered neural network from a single initial cell. The algorithm organizes inter-layer connections to construct retinotopic pooling layers. Our approach is inspired by the mechanisms employed by the early visual system to wire the retina to the lateral geniculate nucleus (LGN)  days before animals open their eyes.  The key ingredients for robust self-organization are an emergent spontaneous spatiotemporal activity wave in the first layer and a local learning rule in the second layer that ‘learns’ the underlying activity pattern in the first layer.  The algorithm is adaptable to a wide-range of input-layer geometries  robust to malfunctioning units in the first layer  and so can be used to successfully grow and self-organize pooling architectures of different pool-sizes and shapes. The algorithm provides a primitive procedure for constructing layered neural networks through growth and self-organization. We also demonstrate that networks grown from a single unit perform as well as hand-crafted networks on MNIST. Broadly  our work shows that biologically inspired developmental algorithms can be applied to autonomously grow functional `brains' in-silico.,Neural networks grown and self-organized by noise

Guruprasad Raghavan

Department of Bioengineering

Caltech

Pasadena  CA 91125

graghava@caltech.edu

Matt Thomson

Biology and Biological Engineering

Caltech

Pasadena  CA 91125

mthomson@caltech.edu

Abstract

Living neural networks emerge through a process of growth and self-organization
that begins with a single cell and results in a brain  an organized and functional
computational device. Artiﬁcial neural networks  however  rely on human-designed 
hand-programmed architectures for their remarkable performance. Can we develop
artiﬁcial computational devices that can grow and self-organize without human
intervention? In this paper  we propose a biologically inspired developmental
algorithm that can ‘grow’ a functional  layered neural network from a single initial
cell. The algorithm organizes inter-layer connections to construct retinotopic
pooling layers. Our approach is inspired by the mechanisms employed by the early
visual system to wire the retina to the lateral geniculate nucleus (LGN)  days before
animals open their eyes. The key ingredients for robust self-organization are an
emergent spontaneous spatiotemporal activity wave in the ﬁrst layer and a local
learning rule in the second layer that ‘learns’ the underlying activity pattern in the
ﬁrst layer. The algorithm is adaptable to a wide-range of input-layer geometries 
robust to malfunctioning units in the ﬁrst layer  and so can be used to successfully
grow and self-organize pooling architectures of different pool-sizes and shapes. The
algorithm provides a primitive procedure for constructing layered neural networks
through growth and self-organization. We also demonstrate that networks grown
from a single unit perform as well as hand-crafted networks on MNIST. Broadly 
our work shows that biologically inspired developmental algorithms can be applied
to autonomously grow functional ‘brains’ in-silico.

1

Introduction

Living neural networks in the brain perform an array of computational and information processing
tasks including sensory input processing [1  2]  storing and retrieving memory [3  4]  decision
making [5  6]  and more globally  generate the general phenomena of “intelligence”. In addition to
their information processing feats  brains are unique because they are computational devices that
actually self-organize their intelligence. In fact brains ultimately grow from single cells during
development. Engineering has yet to construct artiﬁcial computational systems that can self-organize
their intelligence. In this paper  inspired by neural development  we ask how artiﬁcial computational
devices might build themselves without human intervention.
Deep neural networks are one of the most powerful paradigms in Artiﬁcial Intelligence. Deep
neural networks have demonstrated human-like performance in tasks ranging from image and speech
recognition to game-playing [7  8  9]. Although the layered architecture plays an important role in the
success [10] of deep neural networks  the widely accepted state of art is to use a hand-programmed
network architecture [11] or to tune multiple architectural parameters  both requiring signiﬁcant
engineering investment. Convolutional neural networks  a speciﬁc class of DNNs  employ a hand

33rd Conference on Neural Information Processing Systems (NeurIPS 2019)  Vancouver  Canada.

programmed architecture that mimics the pooling topology of neural networks in the human visual
system.
Here  we develop strategies for growing a neural network autonomously from a single computa-
tional “cell" followed by self-organization of its architecture by implementing a wiring algorithm
inspired by the development of the mammalian visual system. The visual circuity  speciﬁcally the
wiring of the retina to the lateral geniculate nucleus (LGN) is stereotypic across organisms  as the
architecture always enforces pooling (retinal ganglion cells (RGC’s) pool their inputs to LGN cells)
and retinotopy. The pooling architecture (ﬁgure-1a) is robustly established early in development
through the emergence of spontaneous activity waves (ﬁgure-1b) that tile the light insensitive retina
[12]. As the synaptic connectivity between the different layers in the visual system get tuned in
an activity-dependent manner  the emergent activity waves serve as a signal to alter inter-layer
connectivity much before the onset of vision.

(a)

(b)

Figure 1: Wiring of the visual circuitry (a) Spatial pooling observed in wiring from the retina to
LGN and in CNN’s. (b) Synchronous Spontaneous bursts (retinal waves) in the light-insensitive
retina serve as a signal for wiring retina to the brain.

The main contribution of this paper is that we propose a developmental algorithm inspired by visual
system development to grow and self-organize a retinotopic pooling architecture  similar to modern
convolutional neural networks (CNNs). Once a pooling architecture emerges  any non-linear function
can be implemented by units in the second layer to morph it into functioning as a convolution or
a max/average pooling. We show that our algorithm is adaptable to a wide-range of input-layer
geometries  robust to malfunctioning units in the ﬁrst layer and can grow pooling architectures of
different shapes and sizes  making it capable of countering the key challenges accompanying growth.
We also demonstrate that ‘grown’ networks are functionally similar to that of hand-programmed
pooling networks  on conventional image classiﬁcation tasks. As CNN’s represent a model class
of deep networks  we believe the developmental strategy can be broadly implemented for the self-
organization of intelligent systems.

2 Related Work

Computational models for self-organizing neural networks dates back many years  with the ﬁrst
demonstration being Fukushima’s neocognitron [13  14]  a hierarchical multi-layered neural network
capable of visual pattern recognition through learning. Although weights connecting different layers
were modiﬁed in an unsupervised fashion  the network architecture was hard-coded  inspired by
Hubel and Wiesel’s [15] description of simple and complex cells in the visual cortex. Fukushima’s
neocognitron inspired modern-day convolutional neural networks (CNN) [16]. Although CNN’s
performed well on image-based tasks  they had a ﬁxed  hand-designed architecture whose weights
were altered by back-propagation. The use of a ﬁxed  hand-designed architecture for a neural network
changed with the advent of neural architecture search [17]  as neural architectures became malleable
to tuning by neuro-evolution strategies [18  19  20]  reinforcement learning [21] and multi-objective
searches [22  23]. Neuro-evolution strategies have been successful in training networks that perform
signiﬁcantly much better on CIFAR-10  CIFAR-100 and Image-Net datasets. As the objective
function being maximized is the predictive performance on a single dataset  the evolved networks

2

may not generalize well to multiple datasets. On the contrary  biological neural networks in the brain
grow architecture that can generalize very well to innumerable datasets. Neuroscientists have been
very interested in how the architecture in the visual cortex emerges during brain development. Meister
et al [12] suggested that spontaneous and spatially organized synchronized bursts prevalent in the
developing retina guide the self-organization of cortical receptive ﬁelds. In this light  mathematical
models of the retina and its emergent retinal waves were built [24]  and analytical solutions were
obtained regarding the self-organization of wiring between the retina and the LGN [25  26  27  28 
29]. Computational models have been essential for understanding how self-organization functions
in the brain  but haven’t been generalized to growing complex architectures that can compute. One
of the most successful attempts at growing a 3D model of neural tissue from simple precursor units
was demonstrated by Zubler et. al [30] that deﬁned a set of minimal rules that could result in the
growth of morphologically diverse neurons. Although the networks were grown from single units 
they weren’t functional as they weren’t equipped to perform any task. To bridge this gap  in this
paper we attempt to grow and self-organize functional neural networks from a single precursor unit.

3 Bio-inspired developmental algorithm

In our procedure  the pooling architecture emerges through two processes  growth of a layered
neural network followed by self-organization of its inter-layer connections to form deﬁned ‘pools’ or
receptive ﬁelds. As the protocol for growing a network is relatively straightforward  our emphasis
in the next few sections is on the self-organization process  following which we will combine the
growth of a layered neural network with its self-organization in the penultimate section of this paper.
We  ﬁrst  abstract the natural development strategy as a mathematical model around a set of input
sensor nodes in the ﬁrst layer (similar to retinal ganglion cells) and processing units in the second
layer (similar to cells in the LGN).
Self-organization comprises of two major elements: (1) A spatiotemporal wave generator in the
ﬁrst layer driven by noisy interactions between input-sensor nodes and (2) A local learning rule
implemented by units in the second layer to learn the “underlying” pattern of activity generated in the
ﬁrst layer. The two elements are inspired by mechanisms deployed by the early visual system. The
retina generates spontaneous activity waves that tile the light-insensitive retina; the activity waves
serve as input signals to wire the retina to higher visual areas in the brain [31  32].

3.1 Spontaneous spatiotemporal wave generator

The ﬁrst layer of the network can serve as a noise-driven spatiotemporal wave generator when (1)
its constituent sensor-nodes are modeled via an appropriate dynamical system and (2) when these
nodes are connected in a suitable topology. In this paper  we model each sensor node using the classic
Izikhevich neuron model [33] (dynamical system model)  while the input layer topology is that of
local-excitation and global-inhibition  a motif that is ubiquitous across various biological systems [34 
35]. A minimal dynamical systems model coupled with the local-excitation and global-inhibition
motif has been analytically examined in the supplemental materials to demonstrate that these key
ingredients are sufﬁcient to serve as a spatiotemporal wave generator.

Figure 2: Emergent spatiotemporal waves tile the ﬁrst layer. The red-nodes indicate active-nodes
(ﬁring)  black nodes refer to silent nodes and the arrows denote the direction of time.

The Izhikevich model captures the activity of every sensor node (vi(t)) through time  the noisy
behavior of individual nodes (through ηi(t)) and accounts for interactions between nodes deﬁned by
a synaptic adjacency matrix (Si j). The Izhikevich model equations are elaborated in Box-1. The
input layer topology (local excitation  global inhibition) is deﬁned by the synaptic adjacency matrix
(Si j). Every node in the ﬁrst layer makes excitatory connections with nodes within a deﬁned local
excitation radius. Si j = 5  when distance between nodes i and j are within the deﬁned excitation

3

radius of 2 units; dij ≤ 2. Each node has decaying inhibitory connections with other nodes present
above a deﬁned global inhibition radius (Si j = -2 exp(-dij/10)  when distance between nodes i and j
are above a deﬁned inhibition radius of 4 units; dij ≥ 4) (see supporting information).
On implementing a model of the resulting dynamical system  we observe the emergence of sponta-
neous spatiotemporal waves that tile the ﬁrst layer for speciﬁc parameter regimes (see ﬁgure 2 and
videos in supplemental materials).

Dynamical model for input-sensor nodes in the lower layer (layer-I):

dvi
dt

= 0.04v2

i + 5vi + 140 − ui +

Si jH(vj − 30) + ηi(t)

N(cid:88)

j=1

with the auxiliary after-spike reset:

dui
dt

vi(t) > 30  then :

= ai(bivi − ui)

(cid:26)vi(t + ∆t) = ci

ui(t + ∆t) = ui(t) + di

(1)

(2)

where: (1) vi is the activity of sensor node i; (2) ui captures the recovery of sensor node
i; (3) Si j is the connection weight between sensor-nodes i and j; (4) N is the number of
sensor-nodes in layer-I; (5) Parameters ai and bi are set to 0.02 and 0.2 respectively  while
ci and di are sampled from the distributions U(−65 −50) and U(2  8) respectively. Once
set for every node  they remain constant during the process of self-organization. The initial
values for vi(0) and ui(0) are set to -65 and -13 respectively for all nodes. These values
are taken from Izhikevich’s neuron model [33]; (6) ηi(t) models the noisy behavior of every
node i in the system  where < ηi(t)ηj(t(cid:48)) > = σ2 δi jδ(t − t(cid:48)). Here  δi j  δ(t − t(cid:48)) are
Kronecker-delta and Dirac-delta functions respectively  and σ2 = 9; (7) H is the unit step
function:

(cid:26)1 

0 

vi ≥ 30
vi < 30.

H(vi − 30) =

3.2 Local learning rule

Having constructed a spontaneous spatiotemporal wave generator in layer-I  we implement a local
learning rule in layer-II that can learn the activity wave pattern in the ﬁrst layer and modify its
inter-layer connections to generate a pooling architecture. Many neuron inspired learning rules can
learn a sparse code from a set of input examples [36]. Here  we model processing units as rectiﬁed
linear units (ReLU) and implement a modiﬁed Hebbian rule for tuning the inter-layer weights to
achieve the same. Individual ReLU units compete with one another in a winner take all fashion.

Figure 3: Learning rule

Initially  every processing unit in the second layer is connected to all input-sensor nodes in the ﬁrst
layer. As the emergent activity wave tiles the ﬁrst layer  at most a single processing unit in the second
layer is activated due to the winner-take-all competition. The weights connecting the activated unit in
the second layer to the input-sensor nodes in the ﬁrst layer are updated by the modiﬁed Hebbian rule

4

(Box-2). Weights connecting active input-sensor nodes and activated processing units are reinforced
while weights connecting inactive input-sensor nodes and activated processing units decay (cells
that ﬁre together  wire together). Inter-layer weights are updated continuously throughout the self-
organization process  ultimately resulting in the pooling architecture (See ﬁgure-3 and supplemental
materials).

Modifying inter-layer weights

(cid:26)wi j(t) + ηlearnH(vi(t) − 30)yj(t + 1)

wi j(t + 1) =

wi j(t)

yj(t + 1) > 0
otherwise

where: (1) wi j(t) is the weight of connection between sensor-node i and processing unit j
at time ‘t’ (inter-layer connection); (2) ηlearn is the learning rate; (3) H(vi(t) − 30) is the
activity of sensor node i at time ‘t’; and (4) yj(t) is the activation of processing unit j at time
‘t’.

Once all the weights wi j(t + 1) have been evaluated for a processing unit j  they are mean-
normalized to prevent a weight blow-up. Mean normalization ensures that the mean strength
of weights for processing unit j remains constant during the self-organization process.

Having coupled the spontaneous spatiotemporal wave generator and the local learning rule  we
observe that an initially fully connected two-layer network (ﬁgure-4a) becomes a pooling architecture 
wherein input-sensor nodes that are in close proximity to each other in the ﬁrst layer have a very high
probability of connecting to the same processing unit in the second layer (ﬁgure-4b & 4c). More
than 95% of the sensor-nodes in layer-I connect to processing units in layer-II (higher layer) through
well-deﬁned pools  ensuring that spatial patches of nodes connected to units in layer-II tile the input
layer (ﬁgure-4d). Tiling the input layer ensures that most sensor nodes have an established means of
sending information to higher layers after the self-organization of the pooling layer.

Figure 4: Self-organization of Pooling layers. (a) The initial conﬁguration  wherein all nodes in the
lower layer are connected to every unit in the higher layer. (b) After the self-organization process  a
pooling architecture emerges  wherein every unit in layer-II is connected to a spatial patch of nodes
in layer-I. (a b) Here  connections from nodes in layer-I to a single unit in layer-II (higher layer) are
shown. (c) Each contour represents a spatial patch of nodes in layer-I connected to a single unit in
layer-II. (d) More than 95% of the nodes in layer-I are connected to units in the layer-II through
well-deﬁned pools  as the spatial patches tile layer-I completely.

4 Features of the developmental algorithm

In this section  we show that spatiotemporal waves can emerge and travel over layers with arbitrary
geometries and even in the presence of defective sensor-nodes. As the local structure of sensor-node
connectivity (local excitation and global inhibition) in the input layer in conserved over a broad range
of macroscale geometries (ﬁgure 5a-d)  we observe traveling activity waves on input layers with
arbitrary geometries and in input-layers that have defects or holes. The coupling of the traveling
activity wave in layer-I and a learning rule in layer-II results in the emergence of pooling architecture
(refer to SI for an analytical treatment).
Furthermore  we demonstrate that the size and shape of the emergent spatiotemporal wave can be
tuned by altering the topology of sensor-nodes in the layer. Coupling the emergent wave in layer-I
with a learning rule in layer-II leads to localized receptive ﬁelds that tile the input layer.

5

Together  the wave and the learning rule endow the developmental algorithm with useful properties:
(i) Flexibility: Spatial patches of sensor-nodes connected to units in layer-II can be established over
arbitrary input-layer geometries. In Figure-5a  we show that an emergent spatiotemporal wave on
a torus-shaped input layer coupled with the local learning rule (section-3.2) in layer-II  results in
a pooling architecture. We also show that the developmental algorithm can self-organize networks
on arbitrary curved surfaces (Figure-5b). Flexibility to form pooling layers on arbitrary input-layer
geometries is useful for processing data acquired from unconventional sensors  like charge-coupled
devices that mimic the retina [37]. The ability to self-organize pooling layers on curved surfaces
makes it extremely useful for spherical image analysis. Spherical images acquired by omnidirectional
cameras [38] placed on drones are becoming increasingly ubiquitous  and their analysis necessitates
neural networks that can tile 3-dimensional surfaces. (ii) Robustness: Spatial patches of sensor-nodes
connected to units in layer-II can be established in the presence of defective sensor nodes in layer-I.
As shown in ﬁgure-5b  we initially self-organize a pooling architecture for a fully functioning set of
sensor-nodes in the input-layer. To test robustness  we ablate a few sensor-nodes in the input-layer
(captioned ’DN’). Following this perturbation  we observe that the pooling architecture re-emerges 
wherein spatial-pools of sensor-nodes  barring the damaged ones  re-form and connect to units in
layer-II. (iii) Reconﬁgurable: The size and shape of spatial pools generated can be modulated by
tuning the structure of the emergent traveling wave (ﬁgure-5c & 5d). In ﬁgure-5e  we show that
the size of spatial-pools can be altered in a controlled manner by modifying the topology of layer-I
nodes. Wave-x in the legend corresponds to an emergent wave generated in layer-I when every node
in layer-I makes excitatory connections to other nodes in its 2 unit radius and inhibitory connections
to every node above x unit radius. This topological change alters the properties of the emergent
wave  subsequently changing the resultant spatial-pool size. The histograms corresponding to these
legends capture the distribution of spatial-pool sizes over all pools generated by a given wave-x.
The histogram also highlights that the size of emergent spatial-pools are tightly regulated for every
wave-conﬁguration.

5 Growing a neural network

As the developmental algorithm (introduced in section 3) is ﬂexible to varying scaffold geometries
and tolerant to malfunctioning nodes  it can be implemented for growing a system  enabling us to
push AI in the direction towards being more ’life-like’ by reducing human involvement in the design
of complex functioning architectures. The growth paradigm implemented in this section has been
inspired by mechanisms that regulate neocortical development [39  40].
The process of growing a layered neural network involves two major sub-processes. One  every
‘node’ can divide horizontally to produce daughter nodes that populates the same layer; two  every
node can divide vertically to produce daughter processing units that migrate upwards to populate
higher layers. Division is stochastic and is controlled by a set of random variables. Having deﬁned
the 3D scaffold  we seed a single unit (ﬁgure-6a). As horizontal and vertical division ensues to form
the layered neural network  inter-layer connections are modiﬁed based on the emergent activity wave
in layer-I and a learning rule (section-3.2) in layer-II  to form a pooling architecture. A detailed
description of the growth rule-set coupled with a ﬂow chart governing the growth of the network is
appended to the supplemental materials.
Having intertwined the growth of the system and self-organization of inter-layer connections  we make
the following observations: (1) spatiotemporal waves emerge in the ﬁrst layer much before the entire
layer is populated (ﬁgure-6b)  (2) self-organization of inter-layer connections commences before the
layered network is fully constructed (ﬁgure-6c) and (3) Over time  the system reaches a steady state as
the number of ‘cells’ in the layered network remains constant and most processing units in the second
layer connect to a pool of nodes in the ﬁrst layer  resulting in the pooling architecture (ﬁgure-6d).
Videos of networks growing on arbitrary scaffolds are added to the supplemental materials.

6 Growing functional neural networks

In the previous section  we demonstrated that we can successfully grow multi-layered pooling
networks from a single unit. In this section  we show that these networks are functional.

6

Figure 5: Features of the developmental algorithm. (a) Self-organization of pooling layers for
arbitrary input-layer geometry. (a) The left most image is a snapshot of the traveling wave as
it traverses layer-I; Layer-I has sensor-nodes arranged in an annulus geometry; red nodes refer to
ﬁring nodes. On coupling the spatiotemporal wave in layer-I to a learning rule in layer-II  a pooling
architecture emerges. The central image refers to the 3d visualization of the pooling architecture 
while each subplot in the right-most image depicts the spatial patch of nodes in layer-I connected to
a single processing unit in layer-II. (b) Self-organizing pooling layers on a sphere. (b-ii) Upstream
units connect to spatial patches of nodes on the sphere. (c) Self-organizing networks on Poincare
disks with a hyperbolic distribution of input sensor nodes (c-ii) Snapshot of a traveling bump. (c-iii)
Receptive ﬁelds of units in layer-II. (d) Self-organization of pooling layers are robust to input
layer defects (d) The ﬁgure on the left depicts a self-organized pooling layer when all input nodes are
functioning. Once these inter-layer connections are established  a small subset of nodes are damaged
to assess if the pooling architecture can robustly re-form. The set of nodes within the grey boundary 
titled ‘DN’  are defective nodes. The ﬁgure on the right corresponds to pooling layers that have
adapted to the defects in the input layer  hence not receiving any input from the defective nodes.(e)
