2015,Segregated Graphs and Marginals of Chain Graph Models,Bayesian networks are a popular representation of asymmetric (for example causal) relationships between random variables. Markov random fields (MRFs) are a complementary model of symmetric relationships used in computer vision  spatial modeling  and social and gene expression networks.  A chain graph model under the Lauritzen-Wermuth-Frydenberg interpretation (hereafter a chain graph model) generalizes both Bayesian networks and MRFs  and can represent asymmetric and symmetric relationships together.As in other graphical models  the set of marginals from distributions in a chain graph model induced by the presence of hidden variables forms a complex model.  One recent approach to the study of marginal graphical models is to consider a well-behaved supermodel.  Such a supermodel of marginals of Bayesian networks  defined only by conditional independences  and termed the ordinary Markov model  was studied at length in (Evans and Richardson  2014).In this paper  we show that special mixed graphs which we call segregated graphs can be associated  via a Markov property  with supermodels of a marginal of chain graphs defined only by conditional independences.  Special features of segregated graphs imply the existence of a very natural factorization for these supermodels  and imply many existing results on the chain graph model  and ordinary Markov model carry over.  Our results suggest that segregated graphs define an analogue of the ordinary Markov model for marginals of chain graph models.,Segregated Graphs and Marginals of Chain Graph

Models

Ilya Shpitser

Department of Computer Science

Johns Hopkins University
ilyas@cs.jhu.edu

Abstract

Bayesian networks are a popular representation of asymmetric (for example
causal) relationships between random variables. Markov random ﬁelds (MRFs)
are a complementary model of symmetric relationships used in computer vision 
spatial modeling  and social and gene expression networks. A chain graph model
under the Lauritzen-Wermuth-Frydenberg interpretation (hereafter a chain graph
model) generalizes both Bayesian networks and MRFs  and can represent asym-
metric and symmetric relationships together.
As in other graphical models  the set of marginals from distributions in a chain
graph model induced by the presence of hidden variables forms a complex model.
One recent approach to the study of marginal graphical models is to consider a
well-behaved supermodel. Such a supermodel of marginals of Bayesian networks 
deﬁned only by conditional independences  and termed the ordinary Markov
model  was studied at length in [6].
In this paper  we show that special mixed graphs which we call segregated graphs
can be associated  via a Markov property  with supermodels of marginals of chain
graphs deﬁned only by conditional independences. Special features of segregated
graphs imply the existence of a very natural factorization for these supermod-
els  and imply many existing results on the chain graph model  and the ordinary
Markov model carry over. Our results suggest that segregated graphs deﬁne an
analogue of the ordinary Markov model for marginals of chain graph models.
We illustrate the utility of segregated graphs for analyzing outcome interference
in causal inference via simulated datasets.

1

Introduction

Graphical models are a ﬂexible and widely used tool for modeling and inference in high dimensional
settings. Directed acyclic graph (DAG) models  also known as Bayesian networks [11  8]  are often
used to model relationships with an inherent asymmetry  perhaps induced by a temporal order on
variables  or cause-effect relationships. Models represented by undirected graphs (UGs)  such as
Markov random ﬁelds (MRFs)  are used to model symmetric relationships  for instance proximity in
social graphs  expression co-occurrence in gene networks  coinciding magnetization of neighboring
atoms  or similar colors of neighboring pixels in an image.
Some graphical models can represent both symmetric and asymmetric relationships together. One
such model is the chain graph model under the Lauritzen-Wermuth-Frydenberg interpretation  which
we will shorten to “the chain graph model.” We will not consider the chain graph model under the
Andersen-Madigan-Perlman (AMP) interpretation  or other chain graph models [22  1] discussed in
[4] in this paper. Just as the DAG models and MRFs  the chain graph model has a set of equivalent
(under some assumptions) deﬁnitions via a set of Markov properties  and a factorization.

1

Modeling and inference in multivariate settings is complicated by the presence of hidden  yet rel-
evant variables. Their presence motivates the study of marginal graphical models. Marginal DAG
models are complicated objects  inducing not only conditional independence constraints  but also
more general equality constraints such as the “Verma constraint” [21]  and inequality constraints
such as the instrumental variable inequality [3]  and the Bell inequality in quantum mechanics [2].
One approach to studying marginal DAG models has therefore been to consider tractable supermod-
els deﬁned by some easily characterized set of constraints  and represented by a mixed graph. One
such supermodel  deﬁned only by conditional independence constraints induced by the underlying
hidden variable DAG on the observed margin  is the ordinary Markov model  studied in depth in [6].
Another supermodel  deﬁned by generalized independence constraints including the Verma con-
straint [21] as a special case  is the nested Markov model [16]. There is a rich literature on Markov
properties of mixed graphs  and corresponding independence models. See for instance [15  14  7].
In this paper  we adapt a similar approach to the study of marginal chain graph models. Speciﬁcally 
we consider a supermodel deﬁned only by conditional independences on observed variables of a
hidden variable chain graph  and ignore generalized equality constraints and inequalities. We show
that we can associate this supermodel with special mixed graphs which we call segregated graphs via
a global Markov property. Special features of segregated graphs imply the existence of a convenient
factorization  which we show is equivalent to the Markov property for positive distributions. This
equivalence  along with properties of the factorization  implies many existing results on the chain
graph model  and the ordinary Markov model carry over.
The paper is organized as follows. Section 2 describes a motivating example from causal inference
for the use of hidden variable chain graphs  with details deferred until section 6. In section 3  we in-
troduce the necessary background on graphs and probability theory  deﬁne segregated graphs (SGs)
and an associated global Markov property  and show that the global Markov properties for DAG
models  chain graph models  and the ordinary Markov model induced by hidden variable DAGs are
special cases. In section 4  we deﬁne the model of conditional independence induced by hidden vari-
able chain graphs  and show it can always be represented by a SG via an appropriate global Markov
property. In section 5  we deﬁne segregated factorization and show that under positivity  the global
Markov property in section 4 and segregated factorization are equivalent. In section 6  we introduce
causal inference and interference analysis as an application domain for hidden variable chain graph
models  and thus for SGs  and discuss a simulation study that illustrates our results and shows how
parameters of the model represented by a SG can directly encode parameters representing outcome
interference in the underlying hidden variable chain graph. Section 7 contains our conclusions. We
will provide outlines of arguments for our claims below  but will generally defer detailed proofs to
the supplementary material.

2 Motivating Example: Interference in Causal Inference

Consider a dataset obtained from a placebo-controlled vaccination trial  described in [20]  consisting
of mother/child pairs where the children were vaccinated against pertussis. We suspect that though
mothers were not vaccinated directly  the fact that children were vaccinated  and each mother will
generally only contract pertussis from her child  the child’s vaccine may have a protective effect
on the mother. At the same time  if only the mothers but not children were vaccinated  we would
expect the same protective effect to operate in reverse. This is an example of interference  an effect
of treatment on experimental units other than those to which the treatment was administered. The
relationship between the outcomes of mother and child due to interference in this case has some
features of a causal relationship  but is symmetric.
We model this study by a chain graph shown in Fig. 1 (a)  see section 6 for a justiﬁcation of
this model. Here B1 is the vaccine (or placebo) given to children  and Y1 is the children’s out-
comes. B2 is the treatment given to mothers (in our case no treatment)  and Y2 is the mothers’
outcomes. Directed edges represent the direct causal effect of treatment on unit  and the undirected
edge represents the interference relationship among the mother/child outcome pair. In this model
(B1 ⊥⊥ B2) (mother and child treatment are assigned independently)  and (Y1 ⊥⊥ B2 | B1  Y1) 
(Y2 ⊥⊥ B1 | B2  Y1) (mother’s outcome is independent of child’s treatment  if we know child’s
outcome  and mother’s treatment  and vice versa). Since treatments in this study were randomly
assigned  there are no unobserved confounders.

2

B1

B2

Y1

Y2

(a)

B1

A W

U

Y1

Y2

(b)

A W

Y1

Y2

B1

(c)

A W

Y1

Y2

B1

(d)

(a) A chain graph representing the mother/child vaccination example in [20].

(b) A
Figure 1:
more complex vaccination example with a followup booster shot. (c) A naive generalization of the
latent projection idea applied to (b)  where ↔ and − edges meet. (d) A segregated graph preserving
conditional independences in (b) not involving U.

Consider  however  a more complex example  where both mother and child are given the initial
vaccine A  but possibly based on results W of a followup visit  children are given a booster B1  and
we consider the child’s (Y1) and the mother’s (Y2) outcomes  where the same kind of interference
relationship is operating. We model the child’s unobserved health status  which inﬂuences both W
and Y1  by a (possibly very high dimensional) hidden variable U. The result is a hidden variable
chain graph in Fig. 1 (b). Since U is unobserved and possibly very complex  modeling it directly
may lead to model misspeciﬁcation. An alternative  explored for instance in [13  6  16]  is to consider
a model deﬁned by conditional independences induced by the hidden variable model in Fig. 1 (b)
on observed variables A  B1  W  Y1  Y2.
A simple approach that directly generalizes what had been done in DAG models is to encode con-
ditional independences via a path separation criterion on a mixed graph constructed from a hidden
variable chain graph via a latent projection operation [21]. The difﬁculty with this approach is that
simple generalizations of latent projections to the chain graph case may yield graphs where ↔ and
− edges met  as happens in Fig. 1 (c). This is an undesirable feature of a graphical representation 
since existing factorization and parameterization results for chain graphs or ordinary Markov mod-
els  which decompose the joint distribution into pieces corresponding to sets connected by − or ↔
edges  do not generalize.
In the remainder of the paper  we show that for any hidden variable chain graph it is always possible
to construct a (not necessarily unique) mixed graph called a segregated graph (SG) where ↔ and
− edges do not meet  and which preserves all conditional independences on the observed variables.
One SG for our example is shown in Fig. 1 (d). Conditional independences implied by this graph
are B1 ⊥⊥ A1 | W and Y2 ⊥⊥ W  B1 | A1  Y1. Properties of SGs imply existing results on chain
graphs and the ordinary Markov model carry over with little change. For example  we may directly
apply the parameterization in [6]  and the ﬁtting algorithm in [5] to the model corresponding to Fig.
1 (d) if the state spaces are discrete  as we illustrate in section 6.1. The construction we give for
SGs may replace undirected edges by directed edges in a way that may break the symmetry of the
underlying interference relationship. Thus  directed edges in a SG do not have a straightforward
causal interpretation.

3 Background and Preliminaries
We will consider mixed graphs with three types of edges  undirected (−)  directed (↔)  and di-
rected (→)  where a pair of vertices is connected either by a single edge  or a pair of edges one
of which is directed and one bidirected. We will denote an edge as an ordered pair of vertices
with a subscript indicating the type of edge  for example (AB)→. We will suppress the sub-
script if edge orientation is not important. An alternating sequence of nodes and edges of the form
A1  (A1A2)  A2  (A2A3)  A3  . . . Ai−1  (Ai−1Ai)  Ai where we allow Ai = Aj if i (cid:54)= j±1 is called
a walk (in some references also a route). We will denote walks by lowercase Greek letters. A walk
with non-repeating edges is called a trail. A trial with non-repeating vertices is called a path. A
directed cycle is a trail of the form A1  (A1A2)→  A2  . . .   Ai  (AiA1)→  A1. A partially directed
cycle is a trail with − → edges  and at least one → edge where there exists a way to orient − edges
to create a directed cycle. We will sometimes write a path from A to B where intermediate vertices
are not important  but edge orientation is as  for example  A → ◦ − . . . − ◦ − B.

3

A mixed graph with no − and ↔ edges  and no directed cycles is called a directed acyclic graph
(DAG). A mixed graph with no − edges  and no directed cycles is called an acyclic directed mixed
graph (ADMG). A mixed graph with no ↔ edges  and no partially directed cycles is called a chain
graph (CG). A segregated graph (SG) is a mixed graph with no partially directed cycles where no
path of the form Ai(AiAj)−Aj(AjAk)↔Ak exists. DAGs are special cases of ADMGs and CGs
which are special cases of SGs.
We consider sets of distributions over a set V deﬁned by independence constraints linked to above
types of graphs via (global) Markov properties. We will refer to V as either vertices in a graph or
random variables in a distribution  it will be clear from context what we mean.
A Markov model of a graph G deﬁned via a global Markov property has the general form

(cid:12)(cid:12)(cid:12)(∀A ˙∪B ˙∪C ⊆ V)  (A ⊥⊥ B | C)G ⇒ (A ⊥⊥ B | C)p(V)

P(G) ≡(cid:110)

(cid:111)

p(V)

 

where the consequent means “A is independent of B conditional on C in p(V) ” and the antecedent
means “A is separated from B given C according to a certain walk separation property in G.” Since
DAGs  ADMGs  and CGs are special cases of SGs  we will deﬁne the appropriate path separation
property for SGs  which will recover known separation properties in DAGs  ADMGs and CGs as
special cases.
A walk α contained in another walk β is called a subwalk of β. A maximal subwalk in β where
all edges are undirected is called a section of β. A section may consist of a single node and no
edges. We say a section α of a walk β is a collider section if edges in β immediately preceding and
following α contain arrowheads into α. Otherwise  α is a non-collider section. A walk β from A
to B is said to be s-separated by a set C in a SG G if there exists a collider section α that does not
contain an element of C  or a non-collider section that does (such a section is called blocked). A is
said to be s-separated from B given C in a SG G if every walk from a vertex in A to a vertex in B
is s-separated by C  and is s-connected given C otherwise.

Lemma 3.1 The Markov properties deﬁned by superactive routes (walks) [17] in CGs  m-
separation [14] in ADMGs  and d-separation [11] in DAGs are special cases of the Markov property
deﬁned by s-separation in SGs.

(cid:111)

.

4 A Segregated Graph Representation of CG Independence Models
For a SG G  and W ⊂ V  deﬁne the model P(G)W to be the set of distributions where all conditional

W p(V) implied by G hold. That is

(cid:12)(cid:12)(cid:12)(∀A ˙∪B ˙∪C ⊆ V \ W)  (A ⊥⊥ B | C)G ⇒ (A ⊥⊥ B | C)p(V)

p(V \ W)

independences in(cid:80)
P(G)W ≡(cid:110)

P(G1)W1 may equal P(G2)W2 even if G1  W1 and G2  W2 are distinct. If W is empty  P(G)W
simply reduces to the Markov model deﬁned by s-separation on the entire graph.
We are going to show that there is always a SG that represents the conditional independences that
deﬁne P(G)W  using a special type of vertex we call sensitive. A vertex V in an SG G is sensitive
if for any other vertex W   if W → ◦ − . . . − ◦ − V exists in G  then W → V exists in G. We
ﬁrst show that if V is sensitive  we can orient all undirected edges away from V and this results in
a new SG that gives the same set of conditional independence via s-separation. This is Lemma 4.1.
Next  we show that for any V with a child Z with adjacent undirected edges  if Z is not sensitive 
we can make it sensitive by adding appropriate edges  and this results in a new SG that preserves all
conditional independences that do not involve V . This is Lemma 4.3. Given above  for any vertex V
in a SG G  we can construct a new SG that preserves all conditional independences in G that do not
involve V   and where no children of V have adjacent undirected edges. This is Lemma 4.4. We then
“project out V ” to get another SG that preserves all conditional independences not involving V in G.
This is Theorem 4.1. We are then done  Corollary 4.1 states that there is always a (not necessarily
unique) SG for the conditional independence structure of a marginal of a CG.
Lemma 4.1 For V sensitive in a SG G  let G(cid:104)V (cid:105) be the graph be obtained from G by replacing all −
edges adjacent to V by → edges pointing away from V . Then G(cid:104)V (cid:105) is an SG  and P(G) = P(G(cid:104)V (cid:105)).

4

The intuition here is that directed edges differ from undirected edges due to collider bias induced by
the former. That is  dependence between parents of a block is created by conditioning on variables
in the block. But a sensitive vertex in a block is already dependent on all the parents in the block  so
orienting undirected edges away from such a vertex and making it a block parent does not change
the set of advertised independences.
Lemma 4.2 Let G be an SG  and G(cid:48) a graph obtained from adding an edge W → V for two non-
adjacent vertices W  V where W → ◦ − . . . − ◦ − V exists in G. Then G(cid:48) is an SG.
Lemma 4.3 For any V in an SG G  let GV be obtained from G by adding W → Z  whenever
W → ◦ − . . . − ◦ − Z ← V exists in G. Then GV is an SG  and P(G)V = P(GV )V .

This lemma establishes that two graphs  one an edge supergraph of the other  agree on the conditional
independences not involving V . Certainly the subgraph advertises at least as many constraints as the
supergraph. To see the converse  note that deﬁnition of s-separation  coupled with our inability to
condition on V can always be used to create dependence between W and Z  the vertices joined by
an edge in the supergraph explicitly. This dependence can be created regardless of the conditioning
set  either via the path W → ◦− . . .−◦− Z  or via the walk path W → ◦− . . .−◦− Z ← V → Z.
It can thus be shown that adding these edges does not remove any independences.
Lemma 4.4 Let V be a vertex in a SG G with at least two vertices. Then there exists an SG GV
where V → ◦ − ◦ does not exist  and P(G)V = P(GV )V .

(cid:3)
Proof: This follows by an inductive application of Lemmas 4.1  4.2  and 4.3.
Note that Lemma 4.4 does not guarantee that the graph GV is unique. In fact  depending on the order
in which we apply the induction  we may obtain different SGs with the required property.
Theorem 4.1 If G is an SG with at least 2 vertices V  and V ∈ V  there exists an SG GV with
vertices V \ {V } such that P(G)V = P(GV )V .
This theorem exploits previous results to construct a graph which agrees with G on all independences
not involving V and which does not contain children of V that are a part of the block with size greater
than two. Given a graph with this structure  we can adapt the latent projection construction to yield
a SG that preserves all independences.
Corollary 4.1 Let G be an SG with vertices V. Then for any W ⊂ V  there exists an SG G∗ with
vertices V \ W such that P(G)W = P(G∗).

5 Segregated Factorization

We now show that  for positive distributions  the Markov property we deﬁned and a certain factor-
ization for SGs give the same model.
A set of vertices that form a connected component in a graph obtained from G by dropping all edges
except ↔  and where no vertex is adjacent to a − edge in G is called a district in G. A non-trivial
block is a set of vertices forming a connected component of size two or more in a graph obtained
from G by dropping all edges except −. We denote the set of districts  and non-trivial blocks in G
by D(G)  and B∗(G)  respectively. It is trivial to show that in a SG G with vertices V  D(G)  and
B∗(G) partition V.
For a vertex set S in G  deﬁne pasG(S) ≡ {W (cid:54)∈ S | (W V )→ is in G  V ∈ S}  and pa∗
G(S) ≡
pasG(S) ∪ S. For A ⊆ V in G  let GA be the subgraph of G containing only vertices in A and
edges between them. The anterior of a set S  denoted by antG(S) is the set of vertices V with a
(cid:83)
partially directed path into a node in S. A set A ⊆ V is called anterial in G if whenever V ∈ A 
antG(V ) ⊆ A. We denote the set of non-empty anterial subsets of V in G by A(G). Let Da(G) ≡
A∈A(G) D(GA). A clique in an UG G is a maximal connected component. The set of cliques in an
UG G will be denoted by C(G). A vertex ordering ≺ is topological for a SG G if whenever V ≺ W  
W (cid:54)∈ antG(V ). For a vertex V in G  and a topological ≺  deﬁne preG ≺(V ) ≡ {W (cid:54)= V | W ≺ V }.

5

A1

Y1

A1

Y 1
1

Y 2
1

A1

Y 1
1

Y 2
1

C

C

C

. . .

. . .

Y

A

(a)

Y2

A2

(b)

Y 1
2

Y 2
2

A2

(c)

Y 1
2

Y 2
2

A2

(d)

Figure 2:
(a) A simple causal DAG model. (b) (c) Causal DAG models for interference. (d) A
causal DAG representing a Markov chain with an equilibrium distribution in the chain graph model
in Fig. 1 (a).

G (S))a) φC(C)  where φC(C) is a mapping from values of C to non-negative reals.

Given a SG G  deﬁne the augmented graph Ga to be an undirected graph with the same vertex set as
G where A  B share an undirected edge in Ga if A  B are connected by a walk consisting exclusively
of collider sections in G (note that this trivially includes all A  B that share an edge). We say p(V)
satisﬁes the augmented global Markov property with respect to a SG G if for any A ∈ A(G)  p(A)
satisﬁes the UG global Markov property with respect to (GA)a. We denote a model  that is a set of
p(V) satisfying this property with respect to G  as P a(G).
nels [8] (cid:8)fS(S | pasG(S))(cid:12)(cid:12)S ∈ Da(G) ∪ B∗(G)(cid:9) such that for every A ∈ A(G)  p(A) =
By analogy with the ordinary Markov model and the chain graph model  we say that p(V)
(cid:81)
to a SG G if there exists a set of ker-
obeys the segregated factorization with respect
(cid:81)
S∈D(GA)∪B∗(GA) fS(S | pasG(S))  and for every S ∈ B∗(G)  fS(S | pasG(S)) =
C∈C((Gpa∗
S ∈ B∗(G)  and fS(S | pasG(S)) =(cid:81)
Lemma 5.1 If p(V) factorizes with respect to G then fS(S | pasG(S)) = p(S | pasG(S)) for every
V ∈S p(V | preG ≺(V ) ∩ antG(S)) for every S ∈ Da(G) and
any topological ordering ≺ on G.
Theorem 5.1 If p(V) factorizes with respect to a SG G  then p(V) ∈ P a(G).
Lemma 5.2 If there exists a walk α in G between A ∈ A  B ∈ B with all non-collider sections not
intersecting C  and all collider sections in antG(A ∪ B ∪ C)  then there exist A∗ ∈ A  B∗ ∈ B
such that A∗ and B∗ are s-connected given C in G.
Theorem 5.2 P(G) = P a(G).
Theorem 5.3 For a SG G  if p(V) ∈ P(G) and is positive  then p(V) factorizes with respect to G.
Corollary 5.1 For any SG G  if p(V) is positive  then p(V) ∈ P(G) if and only if p(V) factorizes
with respect to G.

6 Causal Inference and Interference Analysis

In this section we brieﬂy describe interference analysis in causal inference  as a motivation for the
use of SGs. Causal inference is concerned with using observational data to infer cause effect re-
lationships as encoded by interventions (setting variable valus from “outside the model.”). Causal
DAGs are often used as a tool  where directed arrows represent causal relationships  not just sta-
tistical relevance. See [12] for an extensive discussion of causal inference. Much of recent work
on interference in causal inference  see for instance [10  19]  has generalized causal DAG models
to settings where an intervention given to a subjects affects other subjects. A classic example is
herd immunity in epidemiology – vaccinating a subset of subjects can render all subjects  even those
who were not vaccinated  immune. Interference is typically encoded by having vertices in a causal
diagram represent not response variability in a population  but responses of individual units  or ap-
propriately deﬁned groups of units  where interference only occurs between groups  not within a

6

(a)

(b)

(c)

Figure 3: (a) χ2 density with 14 degrees of freedom (red) and a histogram of observed deviances of
