2019,Learning metrics for persistence-based summaries and applications for graph classification,Recently a new feature representation and data analysis methodology based on a topological tool called persistent homology (and its persistence diagram summary) has gained much momentum. A series of methods have been developed to map a persistence diagram to a vector representation so as to facilitate the downstream use of machine learning tools. In these approaches  the importance (weight) of different persistence features are usually pre-set. However often in practice  the choice of the weight-function should depend on the nature of the specific data at hand. It is thus highly desirable to learn a best weight-function (and thus metric for persistence diagrams) from labelled data. We study this problem and develop a new weighted kernel  called WKPI  for persistence summaries  as well as an optimization framework to learn the weight (and thus kernel). We apply the learned kernel to the challenging task of graph classification  and show that our WKPI-based classification framework obtains similar or (sometimes significantly) better results than the best results from a range of previous graph classification frameworks on a collection of benchmark datasets.,Learning metrics for persistence-based summaries

and applications for graph classiﬁcation

Qi Zhao

Yusu Wang

zhao.2017@osu.edu

yusu@cse.ohio-state.edu

Computer Science and Engineering Department

The Ohio State University

Columbus  OH 43221

Abstract

Recently a new feature representation framework based on a topological tool called
persistent homology (and its persistence diagram summary) has gained much
momentum. A series of methods have been developed to map a persistence diagram
to a vector representation so as to facilitate the downstream use of machine learning
tools. In these approaches  the importance (weight) of different persistence features
are usually pre-set. However often in practice  the choice of the weight-function
should depend on the nature of the speciﬁc data at hand. It is thus highly desirable
to learn a best weight-function (and thus metric for persistence diagrams) from
labelled data. We study this problem and develop a new weighted kernel  called
WKPI  for persistence summaries  as well as an optimization framework to learn
the weight (and thus kernel). We apply the learned kernel to the challenging task
of graph classiﬁcation  and show that our WKPI-based classiﬁcation framework
obtains similar or (sometimes signiﬁcantly) better results than the best results
from a range of previous graph classiﬁcation frameworks on benchmark datasets.

1

Introduction

In recent years a new data analysis methodology based on a topological tool called persistent
homology has started to attract momentum. The persistent homology is one of the most important
developments in the ﬁeld of topological data analysis  and there have been fundamental developments
both on the theoretical front (e.g  [23  10  13  8  14  5])  and on algorithms / implementations (e.g 
[43  4  15  20  29  3]). On the high level  given a domain X with a function f : X → R on it  the
persistent homology summarizes “features” of X across multiple scales simultaneously in a single
summary called the persistence diagram (see the second picture in Figure 1). A persistence diagram
consists of a multiset of points in the plane  where each point p = (b  d) intuitively corresponds to
the birth-time (b) and death-time (d) of some (topological) features of X w.r.t. f. Hence it provides a
concise representation of X  capturing multi-scale features of it simultaneously. Furthermore  the
persistent homology framework can be applied to complex data (e.g  3D shapes  or graphs)  and
different summaries could be constructed by putting different descriptor functions on input data.
Due to these reasons  a new persistence-based feature vectorization and data analysis framework
(Figure 1) has become popular. Speciﬁcally  given a collection of objects  say a set of graphs modeling
chemical compounds  one can ﬁrst convert each shape to a persistence-based representation. The
input data can now be viewed as a set of points in a persistence-based feature space. Equipping this
space with appropriate distance or kernel  one can then perform downstream data analysis tasks (e.g 
clustering).

33rd Conference on Neural Information Processing Systems (NeurIPS 2019)  Vancouver  Canada.

Figure 1: A persistence-based data analysis framework.

The original distances for persistence diagram summaries unfortunately do not lend themselves easily
to machine learning tasks. Hence in the last few years  starting from the persistence landscape [7] 
there have been a series of methods developed to map a persistence diagram to a vector representation
to facilitate machine learning tools [41  1  33  12  35]. Recent ones include Persistence Scale-Space
kernel [41]  Persistence Images [1]  Persistence Weighted Gaussian kernel (PWGK) [33]  Sliced
Wasserstein kernel [12]  and Persistence Fisher kernel [34].
In these approaches  when computing the distance or kernel between persistence summaries  the
importance (weight) of different persistence features are often pre-determined. In persistence images
[1] and PWGK [33]  the importance of having a weight-function for the birth-death plane (containing
the persistence points) has been emphasized and explicitly included in the formulation of their kernels.
However  before using these kernels  the weight-function needs to be pre-set.
On the other hand  as recognized by [26]  the choice of the weight-function should depend on the
nature of the speciﬁc type of data at hand. For example  for the persistence diagrams computed
from atomic conﬁgurations of molecules  features with small persistence could capture the local
packing patterns which are of utmost importance and thus should be given a larger weight; while
in many other scenarios  small persistence leads to noise with low importance. However  in general
researchers performing data analysis tasks may not have such prior insights on input data. Thus it is
natural and highly desirable to learn a best weight-function from labelled data.

Our work. We study the problem of learning an appropriate metric (kernel) for persistence sum-
maries from labelled data  and apply the learnt kernel to the challenging graph classiﬁcation task.
(1) Metric learning for persistence summaries: We propose a new weighted-kernel (called WKPI) 
for persistence summaries based on persistence images representations. Our WKPI kernel is positive
semi-deﬁnite and its induced distance is stable. A weight-function used in this kernel directly encodes
the importance of different locations in the persistence diagram. We next model the metric learning
problem for persistence summaries as the problem of learning (the parameters of) this weight-function
from a certain function class. In particular  the metric-learning is formulated as an optimization
problem over a speciﬁc cost function we propose. This cost function has a simple matrix view which
helps both conceptually clarify its meaning and simplify the implementation of its optimization.
(2) Graph classiﬁcation application: Given a set of objects with class labels  we ﬁrst learn a best
WKPI-kernel as described above  and then use the learned WKPI to further classify objects. We
implemented this WKPI-classiﬁcation framework  and apply it to a range of graph data sets. Graph
classiﬁcation is an important problem  and there has been a large literature on developing effective
graph representations (e.g  [25  40  2  32  44  47  38]  including the very recent persistent-homology
enhanced WL-kernel [42])  and graph neural networks (e.g  graph neural networks [48  39  46  45 
35  31]) to classify graphs. The problem is challenging as graph data are less structured. We perform
our WKPI-classiﬁcation framework on various benchmark graph data sets as well as new neuron-
cell data sets. Our learnt WKPI performs consistently better than other persistence-based kernels.
Most importantly  when compared with existing state-of-the-art graph classiﬁcation frameworks  our
framework shows similar or (sometimes signiﬁcantly) better performance in almost all cases than the
best results by existing approaches.
We note that [26] is the ﬁrst to recognize the importance of using labelled data to learn a task-optimal
representation of topological signatures. They developed an end-to-end deep neural network for
this purpose  using a novel and elegant design of the input layer to implicitly learn a task-speciﬁc

2

(a)

(b)

(c)

Figure 2: (a): As we sweep the curve bottom-up in increasing f-values  at certain critical moments
new 0-th homological features (connected components) are created  or destroyed (i.e  components
merge). For example  a component is created when passing x4 and killed when passing x6  giving
rise to the persistence-point (f4  f6) in the persistence diagram (fi := f (xi)). (b) shows the graph of
a persistence surface (where z-axis is the function ρA)  and (c) is its corresponding persistence image.

representation. Very recently  in a parallel and independent development of our work  Carrière
et al. [11] built an interesting new neural network based on the DeepSet architecture [49]  which
can achieve an end-to-end learning for multiple persistence representations in a uniﬁed manner.
Compared to these developments  we instead explicitly formulate the metric-learning problem for
persistence-summaries  and decouple the metric-learning (which can also be viewed as representation-
learning) component from the downstream data analysis tasks. Also as shown in Section 4  our
WKPI-classiﬁcation framework (using SVM) achieves better results on graph classiﬁcation datasets.

2 Persistence-based framework

We ﬁrst give an informal description of persistent homology below. See [22] for more detailed
exposition on the subject.
Suppose we are given a shape X (in our later graph classiﬁcation application  X is a graph).
Imagine we inspect X through a ﬁltration of X  which is a sequence of growing subsets of X:
X1 ⊆ X2 ⊆ ··· ⊆ Xn = X. As we scan X  sometimes a new feature appears in Xi  and
sometimes an existing feature disappears upon entering Xj. Using the topological object called
homology classes to describe these features (intuitively components  independent loops  voids  and
their high dimensional counter-parts)  the birth and death of topological features can be captured by
the persistent homology  in the form of a persistence diagram DgX. Speciﬁcally  for each dimension
k  DgkX consists of a multi-set of points in the plane (which we call the birth-death plane R2): each
point (b  d) in it  called a persistence-point  indicates that a certain k-dimensional homological feature
is created upon entering Xb and destroyed upon entering Xd. In the remainder of the paper  we often
omit the dimension k for simplicity: when multiple dimensions are used for persistence features  we
will apply our construction to each dimension and concatenate the resulting vector representations.
A common way to obtain a meaningful ﬁltration of X is via the sublevel-set ﬁltration induced by
a descriptor function f on X. More speciﬁcally  given a function f : X → R  let X≤a := {x ∈
X | f (x) ≤ a} be its sublevel-set at a. Let a1 < a2 < ··· < an be n real values. The sublevel-set
ﬁltration w.r.t. f is: X≤a1 ⊆ X≤a2 ⊆ ··· ⊆ X≤an ; and its persistence diagram is denoted by Dgf.
Each persistence-point p = (ai  aj) ∈ Dgf indicates the function values when some topological
features are created (when entering X≤ai) and destroyed (in X≤aj )  and the persistence of this
feature is its life-time pers(p) = |aj − ai|. See Figure 2 (a) for a simple example where X = R. If
one sweeps X top-down in decreasing function values  one gets the persistence diagram induced by
the super-levelset ﬁltration of X w.r.t. f in an analogous way. Finally  if one tracks the change of
topological features in the levelset f−1(a)  one obtains the so-called levelset zigzag persistence [9]
(which contains the information captured by the extended persistence [17]).

Graph Setting. Given a graph G = (V  E)  a descriptor function f deﬁned on V or E will induce
a ﬁltration and its persistence diagrams. Suppose f : V → R is deﬁned on the node set of G
(e.g  the node degree). Then we can extend f to E by setting f (u  v) = max{f (u)  f (v)}  and
the sublevel-set at a is deﬁned as G≤a := {σ ∈ V ∪ E | f (σ) ≤ a}. Similarly  if we are given
f : E → R  then we can extend f to V by setting f (u) = minu∈e e∈E f (e). When scanning G

3

fx1x2x3x4x5x6x7x8(f1 f8)(f2 f7)(f4 f6)(f3 f5)birthtimedeathtimeaXvia the sublevel-set ﬁltration of f  connected components in the swept subgraphs will be created
and merged  and new cycles will be created. The formal events are encoded in the 0-dimensional
persistence diagram. The the 1-dimensional features (cycles)  however  we note that cycles created
will never be killed  as they are present in the total space X = G. To this end  we use the so-called
extended persistence introduced in [17] which can record information of cycles.
Now given a collection of shapes Ξ  we can compute a persistence diagram DgX for each X ∈ Ξ 
which maps the set Ξ to a set of points in the space of persistence diagrams. There are natural
distances deﬁned for persistence diagrams  including the bottleneck distance and the Wasserstein
distance  both of which have been well studied (e.g  stability under them [16  18  14]) with efﬁcient
implementations available [27  28]. However  to facilitate downstream machine learning tasks  it
is desirable to further map the persistence diagrams to another “vector” representation. Below we
introduce one such representation  called the persistence images [1]  as our new kernel is based on it.

Let A be a persistence diagram (containing a multiset of persistence-points). Following [1]  set
T : R2 → R2 to be the linear transformation1 where for each (x  y) ∈ R2  T (x  y) = (x  y − x). Let
T (A) be the transformed diagram of A. Let φu : R2 → R be a differentiable probability distribution
with mean u ∈ R2 (e.g  the normalized Gaussian where for any z ∈ R2  φu(z) = 1
).

− (cid:107)z−u(cid:107)2

2τ 2

2πτ 2 e

Deﬁnition 2.1 ([1]) Let α : R2 → R be a non-negative weight-function for the persistence plane R2.
Given a persistence diagram A  its persistence surface ρA : R2 → R (w.r.t. α) is deﬁned as: for any

The persistence image is a discretization of the persistence surface. Speciﬁcally  ﬁx a grid on a
rectangular region in the plane with a collection P of N rectangles (pixels). The persistence image
for a diagram A is PIA = { PI[p] }p∈P consists of N numbers (i.e  a vector in RN )  one for each

z ∈ R2  ρA(z) =(cid:80)
pixel p in the grid P with PI[p] :=(cid:82)(cid:82)

u∈T (A) α(u)φu(z).

p ρA dydx.

The persistence image can be viewed as a vector in RN . One can then compute distance between
two persistence diagrams A1 and A2 by the L2-distance (cid:107)PI1 − PI2(cid:107)2 between their persistence
images (vectors) PI1 and PI2. The persistence images have several nice properties  including stability
guarantees; see [1] for more details.

3 Metric learning frameworks
Suppose we are given a set of n objects Ξ (sampled from a hidden data space S)  classiﬁed into
k classes. We want to use these labelled data to learn a good distance for (persistence image
representations of) objects from Ξ which hopefully is more appropriate at classifying objects in the
data space S. To do so  below we propose a new persistence-based kernel for persistence images 
and then formulate an optimization problem to learn the best weight-function so as to obtain a good
distance metric for Ξ (and data space S).

3.1 Weighted persistence image kernel (WKPI)
From now on  we ﬁx the grid P (of size N) to generate persistence images (so a persistence image
is a vector in RN ). Let ps be the center of the s-th pixel ps in P  for s ∈ {1  2 ···   N}. We now
propose a new kernel for persistence images. A weight-function refers to a non-negative real-valued
function on R2.

1In fact  we can deﬁne our kernel without transforming the persistence diagram. We use the transformation

simply to follow the same convention as persistence images.

4

Deﬁnition 3.1 Let ω : R2 → R be a weight-function. Given two persistence images PI
and PI(cid:48)  the (ω-)weighted persistence image kernel (WKPI) is deﬁned as: kw(PI  PI(cid:48))
:=

− (PI(s)−PI(cid:48) (s))2

2σ2

.

(cid:80)N

s=1 ω(ps)e

example  we could use k(PI  PI(cid:48)) = (cid:80)N

Remark 0: We could use the persistence surfaces (instead of persistence images) to deﬁne the kernel
(with the summation replaced by an integral). Since for computational purpose  one still needs to
approximate the integral in the kernel via some discretization  we choose to present our work using
persistence images directly. Our Lemma 3.2 and Theorem 3.4 still hold (with slightly different
stability bound) if we use the kernel deﬁned for persistence surfaces.
Remark 1: One can choose the weight-function from different function classes. Two popular choices
are: mixture of m 2D Gaussians; and degree-d polynomials on two variables.
Remark 2: There are other natural choices for deﬁning a weighted kernel for persistence images. For
  which we refer this as altWKPI.
Alternatively  one could use the weight function used in PWGK kernel [33] directly. Indeed  we have
implemented all these choices  and our experiments show that our WKPI kernel leads to better results
than these choices for almost all datasets (see Supplement Section 2). In addition  note that PWGK
kernel [33] contains cross terms ω(x) · ω(y) in its formulation  meaning that there are quadratic
number of terms (w.r.t the number of persistence points) to calculate the kernel  making it more
expensive to compute and learn for complex objects (e.g  for the neuron data set  a single neuron tree
could produce a persistence diagrams with hundreds of persistence points).

− ω(ps)(PI(s)−PI(cid:48) (s))2

s=1 e

2σ2

Lemma 3.2 The WKPI kernel is positive semi-deﬁnite.

The rather simple proof of the above lemma is in Supplement Section 1.1. By Lemma 3.2  the
WKPI kernel gives rise to a Hilbert space. We can now introduce the WKPI-distance  which is the
pseudo-metric induced by the inner product on this Hilbert space.

Deﬁnition 3.3 Given two persistence diagrams A and B  let PIA and PIB be their corresponding
persistence images. Given a weight-function ω : R2 → R  the (ω-weighted) WKPI-distance is:

Dω(A  B) :=(cid:112)kw(PIA  PIA) + kw(PIB  PIB) − 2kw(PIA  PIB).

Stability of WKPI-distance. Given two persistence diagrams A and B  two traditional distances
between them are the bottleneck distance dB(A  B) and the p-th Wasserstein distance dW p(A  B).
Stability of these two distances w.r.t. changes of input objects or functions deﬁned on them have
been studied [16  18  14]. Similar to the stability study on persistence images  below we prove
WKPI-distance is stable w.r.t. small perturbation in persistence diagrams as measured by dW 1. (Very
informally  view two persistence diagrams A and B as two (appropriate) measures (with special
care taken to the diagonals)  and dW 1(A  B) is roughly the “earth-mover” distance between them to
convert the measure corresponding to A to that for B.)
To simplify the presentation of Theorem 3.4  we use unweighted persistence images w.r.t. Gaussian 
meaning in Deﬁnition 2.1  (1) the weight function α is the constant function α = 1; and (2) the
distribution φu is the Gaussian φu(z) = 1
. (Our result below can be extended to the
case where φu is not Gaussian.) The proof of the theorem below follows from results of [1] and can
be found in Supplement Section 1.2.
Theorem 3.4 Given a weight-function ω : R2 → R  set cw = (cid:107)ω(cid:107)∞ = supz∈R2 ω(z). Given two
persistence diagrams A and B  with corresponding persistence images PIA and PIB  we have that:
· 1
σ·τ · dW 1(A  B)  where σ is the width of the Gaussian used to deﬁne our
WKPI kernel (Def. 3.1)  and τ is that for the Gaussian φu to deﬁne persistence images (Def. 2.1).

Dω(A  B) ≤(cid:113) 20cw

− (cid:107)z−u(cid:107)2

2πτ 2 e

2τ 2

π

5

Remarks: We can obtain a more general bound for the case where the distribution φu is not Gaussian.
Furthermore  we can obtain a similar bound when our WKPI-kernel and its induced WKPI-distance
is deﬁned using persistence surfaces instead of persistence images.

3.2 Optimization problem for metric-learning
Suppose we are given a collection of objects Ξ = {X1  . . .   Xn} (sampled from some hidden data
space S)  already classiﬁed (labeled) to k classes C1  . . .  Ck. In what follows  we say that i ∈ Cj if Xi
has class-label j. We ﬁrst compute the persistence diagram Ai for each object Xi ∈ Ξ. (The precise
ﬁltration we use to do so will depend on the speciﬁc type of objects. Later in Section 4  we will
describe ﬁltrations used for graph data). Let {A1  . . .   An} be the resulting set of persistence diagrams.
Given a weight-function ω  its induced WKPI-distance between Ai and Aj can also be thought of as a
distance for the original objects Xi and Xj; that is  we can set Dω(Xi  Xj) := Dω(Ai  Aj). Our goal
is to learn a good distance metric for the data space S (where Ξ are sampled from) from the labels.
We will formulate this as learning a best weight-function ω∗ so that its induced WKPI-distance ﬁts
the class-labels of Xi’s best. Speciﬁcally  for any t ∈ {1  2 ···   k}  set:

costω(t  t) =

Dω

2(Ai  Aj);

and

costω(t ·) =

(cid:88)

Dω

2(Ai  Aj).

i∈Ct j∈{1 2 ···  n}

(cid:88)

i j∈Ct

Intuitively  costω(t  t) is the total in-class (square) distances for Ct; while costω(t ·) is the total
distance from objects in class Ct to all objects in Ξ. A good metric should lead to relatively smaller
distance between objects from the same class  but larger distance between objects from different
classes. We thus propose the following optimization problem  which is related to k-way spectral
clustering where the distance for an edge (Ai  Aj) is D2
Deﬁnition 3.5 (Optimization problem) Given a weight-function ω : R2 → R  the total-cost of
cost(t ·) . The optimal distance
problem aims to ﬁnd the best weight-function ω∗ from a certain function class F so that the total-cost
is minimized; that is: T C∗ = minω∈F T C(ω); and ω∗ = argminω∈F T C(ω).

its induced WKPI-distance over Ξ is deﬁned as: T C(ω) :=(cid:80)k

ω(Ai  Aj):

cost(t t)

t=1

Matrix view of optimization problem. We observe that our cost function can be re-formulated
into a matrix form. This provides us with a perspective from the Laplacian matrix of certain graphs to
understand the cost function  and helps to simplify the implementation of our optimization problem 
as several programming languages popular in machine learning (e.g Python and Matlab) handle
matrix operations more efﬁciently (than using loops). More precisely  recall our input is a set Ξ of n
objects with labels from k classes. We set up the following matrices:

L = G − Λ; Λ =(cid:2)Λij
(cid:3)
(cid:3)
G =(cid:2)gij
(cid:3)
H =(cid:2)hti

n×n  where Λij = Dω

n×n  where gij =

2(Ai  Aj) for i  j ∈ {1  2 ···   n};
(cid:96)=1 Λi(cid:96)

(cid:26)(cid:80)n
(cid:40)

0
1√
costω(t ·)

0

if i = j
if i (cid:54)= j
i ∈ Ct
otherwise

k×n where hti =

Viewing Λ as distance matrix of objects {X1  . . .   Xn}  L is then its Laplacian matrix. We have the
following main theorem  which essentially is similar to the trace-minimization view of k-way spectral
clustering (see e.g  Section 6.5 of [30]). The proof for our speciﬁc setting is in Supplement 1.3.
Theorem 3.6 The total-cost can also be represented by T C(ω) = k − Tr(HLH T )  where Tr(·) is
the trace of a matrix. Furthermore  HGH T = I  where I is the k × k identity matrix.

Note that all matrices  L  G  Λ  and H  are dependent on the (parameters of) weight-function ω  and
in the following corollary of Theorem 3.6  we use the subscript of ω to emphasize this dependence.

Corollary 3.7 The Optimal distance problem is equivalent to

(cid:0)k − Tr(HωLωH T
ω )(cid:1) 

min

ω

subject to HωGωH T

ω = I.

6

σ2
r

∂xr

t=1 htLhT

− (zx−xr )2+(zy−yr )2

the best parameters for the weight-function ω∗ to minimize T r(HLH T ) =(cid:80)k

Solving the optimization problem.
In our implementation  we use (stochastic) gradient descent to
ﬁnd a (locally) optimal weight-function ω∗ for the minization problem. Speciﬁcally  given a collection
of objects Ξ with labels from k classes  we ﬁrst compute their persistence diagrams via appropriate
ﬁltrations  and obtain a resulting set of persistence diagrams {A1  . . .   An}. We then aim to ﬁnd
t subject to
HGH T = I (via Corollary 3.7). For example  assume that the weight-function ω is from the class F
of mixture of m number of 2D non-negatively weighted (spherical) Gaussians. Each weight-function
ω : R2 → R ∈ F is thus determined by 4m parameters {xr  yr  σr  wr | r ∈ {1  2 ···   m}} with
. We then use (stochastic) gradient decent to ﬁnd the best parameters
ω(z) = wre
to minimize T r(HLH T ) subject to HGH T = I. Note that the set of persistence diagrams / images
will be ﬁxed through the optimization process.
From the proof of Theorem 3.6 (in Supplement 1.3)  it turns out that condition HGH T = I is
satisﬁed as long as the multiplicative weight wr of each Gaussian in the mixture is non-negative.
