2008,Gaussian-process factor analysis for low-dimensional single-trial analysis of neural population activity,We consider the problem of extracting smooth low-dimensional ``neural trajectories'' that summarize the activity recorded simultaneously from tens to hundreds of neurons on individual experimental trials. Beyond the benefit of visualizing the high-dimensional noisy spiking activity in a compact denoised form  such trajectories can offer insight into the dynamics of the neural circuitry underlying the recorded activity. Current methods for extracting neural trajectories involve a two-stage process: the data are first ``denoised'' by smoothing over time  then a static dimensionality reduction technique is applied. We first describe extensions of the two-stage methods that allow the degree of smoothing to be chosen in a principled way  and account for spiking variability that may vary both across neurons and across time. We then present a novel method for extracting neural trajectories  Gaussian-process factor analysis (GPFA)  which unifies the smoothing and dimensionality reduction operations in a common probabilistic framework. We applied these methods to the activity of 61 neurons recorded simultaneously in macaque premotor and motor cortices during reach planning and execution. By adopting a goodness-of-fit metric that measures how well the activity of each neuron can be predicted by all other recorded neurons  we found that GPFA provided a better characterization of the population activity than the two-stage methods. From the extracted single-trial neural trajectories  we directly observed a convergence in neural state during motor planning  an effect suggestive of attractor dynamics that was shown indirectly by previous studies.,Gaussian-process factor analysis for low-dimensional

single-trial analysis of neural population activity

Byron M. Yu1 2 4  John P. Cunningham1  Gopal Santhanam1 

Stephen I. Ryu1 3  Krishna V. Shenoy1 2

1Department of Electrical Engineering  2Neurosciences Program 

3Department of Neurosurgery  Stanford University  Stanford  CA 94305

{byronyu jcunnin gopals seoulman shenoy}@stanford.edu

Maneesh Sahani4

4Gatsby Computational Neuroscience Unit  UCL

London  WC1N 3AR  UK

maneesh@gatsby.ucl.ac.uk

Abstract

We consider the problem of extracting smooth  low-dimensional neural trajecto-
ries that summarize the activity recorded simultaneously from tens to hundreds of
neurons on individual experimental trials. Current methods for extracting neural
trajectories involve a two-stage process: the data are ﬁrst “denoised” by smooth-
ing over time  then a static dimensionality reduction technique is applied. We ﬁrst
describe extensions of the two-stage methods that allow the degree of smoothing
to be chosen in a principled way  and account for spiking variability that may vary
both across neurons and across time. We then present a novel method for extract-
ing neural trajectories  Gaussian-process factor analysis (GPFA)  which uniﬁes
the smoothing and dimensionality reduction operations in a common probabilis-
tic framework. We applied these methods to the activity of 61 neurons recorded
simultaneously in macaque premotor and motor cortices during reach planning
and execution. By adopting a goodness-of-ﬁt metric that measures how well the
activity of each neuron can be predicted by all other recorded neurons  we found
that GPFA provided a better characterization of the population activity than the
two-stage methods.

1

Introduction

Neural responses are typically studied by averaging noisy spiking activity across multiple experi-
mental trials to obtain ﬁring rates that vary smoothly over time. However  particularly in cognitive
tasks (such as motor planning or decision making) where the neural responses are more a reﬂection
of internal processing rather than external stimulus drive  the timecourse of the neural responses may
differ on nominally identical trials. In such settings  it is critical that the neural data not be averaged
across trials  but instead be analyzed on a trial-by-trial basis [1  2  3  4].

Single-trial analyses can leverage the simultaneous monitoring of large populations of neurons in
vivo  currently ranging from tens to hundreds in awake  behaving animals. The approach adopted
by recent studies is to consider each neuron being recorded as a noisy sensor reﬂecting the time-
evolution of an underlying neural process [3  5  6  7  8  9  10]. The goal is to uncover this neural
process by extracting a smooth  low-dimensional neural trajectory from the noisy  high-dimensional
recorded activity on a single-trial basis. The neural trajectory provides a compact representation of

1

the high-dimensional recorded activity as it evolves over time  thereby facilitating data visualization
and studies of neural dynamics under different experimental conditions.

A common method to extract neural trajectories is to ﬁrst estimate a smooth ﬁring rate proﬁle for
each neuron on a single trial (e.g.  by convolving each spike train with a Gaussian kernel)  then
apply a static dimensionality reduction technique (e.g.  principal components analysis  PCA) [8  11].
Smooth ﬁring rate proﬁles may also be obtained by averaging across a small number of trials (if the
neural timecourses are believed to be similar on different trials) [6  7  9  10]  or by applying more
advanced statistical methods for estimating ﬁring rate proﬁles from single spike trains [12  13].
Numerous linear and non-linear dimensionality reduction techniques exist  but to our knowledge
only PCA [8  9  11] and locally linear embedding (LLE) [6  7  10  14] have been applied in this
context to neural data.

While this two-stage method of performing smoothing then dimensionality reduction has provided
informative low-dimensional views of neural population activity  there are several aspects that can be
improved. (i) For kernel smoothing  the degree of smoothness is often chosen in an ad hoc way. We
would instead like to learn the appropriate degree of smoothness from the data. Because the opera-
tions of kernel smoothing  PCA  and LLE are all non-probabilistic  standard likelihood techniques
for model selection are not applicable. Even if a probabilistic dimensionality reduction algorithm is
used  the likelihoods would not be comparable because different smoothing kernels yield different
smoothed data. (ii) The same kernel width is typically used for all spike trains  which implicitly
assumes that the neural population activity evolves with a single timescale. We would instead like
to allow for the possibility that the system operates under multiple timescales. (iii) PCA and LLE
have no explicit noise model and  therefore  have difﬁculty distinguishing between spiking noise
(whose variance may vary both across neurons and across time) and changes in the underlying low-
dimensional neural state. (iv) Because the smoothing and dimensionality reduction are performed
sequentially  there is no way for the dimensionality reduction algorithm to inﬂuence the degree or
form of smoothing used. This is relevant both to the identiﬁcation of the low-dimensional space  as
well as to the extraction of single-trial neural trajectories.

We ﬁrst brieﬂy describe relatively straightforward extensions of the two-stage methods that can help
to address issues (i) and (iii) above. For (i)  we adopt a goodness-of-ﬁt metric that measures how
well the activity of each neuron can be predicted by the activity of all other recorded neurons  based
on data not used for model ﬁtting. This metric can be used to compare different smoothing kernels
and allows for the degree of smoothness to be chosen in a principled way. In Section 6  we will use
this as a common metric by which different methods for extracting neural trajectories are compared.
For (iii)  we can apply the square-root transform to stabilize the spiking noise variance and factor
analysis (FA) [15] to explicitly model possibly different independent noise variances for different
neurons. These extensions are detailed in Sections 2 and 3.

Next  we introduce Gaussian-process factor analysis (GPFA)  which uniﬁes the smoothing and di-
mensionality reduction operations in a common probabilistic framework. GPFA takes steps toward
addressing all of the issues (i)–(iv) described above  and is shown in Section 6 to provide a bet-
ter characterization of the recorded population activity than the two-stage methods. Because GPFA
performs the smoothing and dimensionality reduction operations simultaneously rather than sequen-
tially  the degree of smoothness and the relationship between the low-dimensional neural trajectory
and the high-dimensional recorded activity can be jointly optimized. Different dimensions in the
low-dimensional space (within which the neural state evolves) can have different timescales  whose
optimal values can be found automatically by ﬁtting the GPFA model to the recorded activity. As in
FA  GPFA speciﬁes an explicit noise model that allows different neurons to have different indepen-
dent noise variances. The time series model involves Gaussian processes (GP)  which only require
the speciﬁcation of the correlation structure of the neural state over time.

A critical assumption when attempting to extract a low-dimensional neural trajectory is that the
recorded activity evolves within a low-dimensional manifold. Previous studies have typically as-
sumed that the neural trajectories lie in a three-dimensional space for ease of visualization. In this
work  we will investigate whether this low-dimensional assumption is justiﬁed in the context of
motor preparation and execution and  if so  attempt to identify the appropriate dimensionality. Sec-
tions 2 and 3 detail GPFA and the goodness-of-ﬁt metric  respectively. Section 4 relates GPFA to
dynamical systems approaches. After describing the experimental setup in Section 5  we apply the

2

developed methods to neural activity recorded in premotor and motor cortices during reach planning
and execution in Section 6.

2 Gaussian-process factor analysis

The motivation for GPFA can be traced back to the use of PCA for extracting informative low-
dimensional views of high-dimensional neural data. Consider spike counts taken in non-overlapping
time bins. PCA (or its probabilistic form  PPCA [15]) attempts to ﬁnd the directions in the high-
dimensional data with greatest variance. This is problematic for neural data for two reasons. First 
because neurons with higher mean counts are known to exhibit higher count variances  the directions
found by PCA tend to be dominated by the most active neurons. Second  PCA assumes that the
spiking noise variance is time independent; however  neurons are known to change their ﬁring rates 
and therefore noise variances  over time. A possible solution is to replace the Gaussian likelihood
model of PPCA with a point-process [5] or Poisson [3] likelihood model. Here  we consider a
simpler approach that preserves computational tractability. The square-root transform is known to
both stabilize the variance of Poisson counts and allow Poisson counts to be more closely modeled
by a Gaussian distribution  especially at low Poisson means [16]. Thus  the two issues above can
be largely resolved by applying PCA/PPCA to square-rooted spike counts  rather than raw spike
counts. However  the spiking noise can deviate from a Poisson distribution [17]  in which case the
noise variance is not entirely stabilized. As will be shown in Section 6  the square-rooted counts
can be better characterized by further replacing PCA/PPCA with FA [15]  which allows different
neurons to have different independent noise variances.

In this work  we extend FA for use with time series data. PCA  PPCA  and FA are all static dimen-
sionality reduction techniques. In other words  none of them take into account time labels when
applied to time series data; the time series data are simply treated as a collection of data points.
GPFA is an extension of FA that can leverage the time label information to provide more powerful
dimensionality reduction. The GPFA model is simply a set of factor analyzers (one per timepoint 
each with identical parameters) that are linked together in the low-dimensional state space by a
Gaussian process (GP) [18] prior. Introducing the GP allows for the speciﬁcation of a correlation
structure across the low-dimensional states at different timepoints. For example  if the system under-
lying the time series data is believed to evolve smoothly over time  we can specify that the system’s
state should be more similar between nearby timepoints than between faraway timepoints. Extract-
ing a smooth  low-dimensional neural trajectory can therefore be viewed as a compromise between
the low-dimensional projection of each data point found by FA and the desire to string them together
using a smooth function over time. The GPFA model can also be obtained by letting time indices
play the role of inputs in the semiparametric latent factor model [19].
The following is a mathematical description of GPFA. Let y: t ∈ R
q×1 be the high-dimensional
vector of square-rooted spike counts recorded at timepoint t ∈ {1  . . .   T}  where q is the number of
neurons being recorded simultaneously. We seek to extract a corresponding low-dimensional latent
neural state x: t ∈ R
p×1 at each timepoint  where p is the dimensionality of the state space (p < q).
For notational convenience  we group the neural states from all timepoints into a neural trajectory
denoted by the matrix X = [x: 1  . . .   x: T ] ∈ R
p×T . Similarly  the observations can be grouped
into a matrix Y = [y: 1  . . .   y: T ] ∈ R
q×T . We deﬁne a linear-Gaussian relationship between the
observations y: t and neural states x: t

y: t | x: t ∼ N (Cx: t + d  R)  

q×p  d ∈ R

q×1  and R ∈ R

(1)
where C ∈ R
q×q are model parameters to be learned. As in FA  we
constrain the covariance matrix R to be diagonal  where the diagonal elements are the independent
noise variances of each neuron. In general  different neurons can have different independent noise
variances. Although a Gaussian is not strictly a distribution on square-rooted counts  its use in (1)
preserves computational tractability.
The neural states x: t at different timepoints are related through Gaussian processes  which embody
the notion that the neural trajectories should be smooth. We deﬁne a separate GP for each dimension
of the state space indexed by i ∈ {1  . . .   p}

xi : ∼ N (0  Ki)  

3

(2)

1×T is the ith row of X and Ki ∈ R

where xi : ∈ R
T×T is the covariance matrix for the ith GP
[20]. The form of the GP covariance can be chosen to provide different smoothing properties on the
neural trajectories. In this work  we chose the commonly-used squared exponential (SE) covariance
function

(cid:3)

(cid:2)
−(t1 − t2)2
2 · τ 2

+ σ2

n i · δt1 t2  

Ki(t1  t2) =σ 2

f i · exp

i

(3)
where Ki(t1  t2) denotes the (t1  t2)th entry of Ki and t1  t2 ∈ {1  . . .   T}. The SE covariance
f i ∈ R+  characteristic timescale τi ∈ R+  and noise variance
is deﬁned by its signal variance σ2
n i ∈ R+. Due to redundancy in the scale of X and C  we ﬁx the scale of X and allow C to
σ2
be learned unconstrained  without loss of generality. By direct analogy to FA  we deﬁned the prior
distribution of the neural state x: t at each timepoint t to be N (0  I) by setting σ2
f i = 1 − σ2
n i 
n i ≤ 1. Furthermore  because we seek to extract smooth neural trajectories  we set σ2
where 0 < σ2
to a small value (10−3). Thus  the timescale τi is the only (hyper)parameter of the SE covariance
that is learned. The SE is an example of a stationary covariance; other stationary and non-stationary
GP covariances [18] can be applied in a seamless way.
The parameters of the GPFA model can be learned in a straightforward way using the expectation-
maximization (EM) algorithm. In the E-step  the Gaussian posterior distribution P (X | Y ) can
be computed exactly because the x: t and y: t across all timepoints are jointly Gaussian  by deﬁni-
tion. In the M-step  the parameters updates for C  d  and R can be expressed in closed form. The
characteristic timescales τi can be updated using any gradient optimization technique. Note that the
degree of smoothness (deﬁned by the timescales) and the relationship between the low-dimensional
neural trajectory and the high-dimensional recorded activity (deﬁned by C) are jointly optimized.
Furthermore  a different timescale is learned for each state dimension indexed by i. For the results
shown in Section 6  the parameters C  d  and R were initialized using FA  and the τi were initialized
to 100 ms. Although the learned timescales were initialization-dependent  their distributions were
similar for different initializations. In particular  most learned timescales were less than 150 ms  but
there were usually one or two larger timescales around 300 and 500 ms.

n i

Cx: t ∈ R

q×p are orthonormal and ˜x: t = DCV (cid:2)

Once the GPFA model is learned  we can apply a post-processing step to orthonormalize the columns
of C. Applying the singular value decomposition  Cx: t can be rewritten as UC (DCV (cid:2)
Cx: t)  where
the columns of UC ∈ R
p×1 is referred to as the
orthonormalized neural state at timepoint t. While each dimension of x: t possesses a single char-
acteristic timescale  each dimension of ˜x: t represents a mixture of timescales deﬁned by the columns
of VC. An advantage of considering ˜x: t rather than x: t is that the elements of ˜x: t (and the corre-
sponding columns of UC) are ordered by the amount of data covariance explained. In contrast  the
elements of x: t (and the corresponding columns of C) have no particular order. Especially when
the number of state dimensions p is large  the ordering facilitates the identiﬁcation and visualization
of the dimensions of the orthonormalized neural trajectory that are most important for explaining
the recorded activity. Because the columns of UC are orthonormal  one can readily picture how the
low-dimensional trajectory relates to the high-dimensional space of recorded activity  in much the
same spirit as for PCA. This orthonormalization procedure is also applicable to PPCA and FA. In
fact  it is through this orthonormalization procedure that the principal directions found by PPCA are
equated to those found by PCA.

3 Leave-neuron-out prediction error

We would like to directly compare GPFA to the two-stage methods described in Section 1. Neither
the classic approach of comparing cross-validated likelihoods nor the Bayesian approach of com-
paring marginal likelihoods is applicable here  for the same reason that they cannot be used to select
the appropriate degree of smoothness in the two-stage methods. Namely  when the data are altered
by different pre-smoothing operations (or the lack thereof in the case of GPFA)  the likelihoods
are no longer comparable. Instead  we adopted the goodness-of-ﬁt metric mentioned in Section 1 
whereby a prediction error is computed based on trials not used for model ﬁtting. The idea is to
leave out one neuron at a time and ask how well each method is able to predict the activity of that
neuron  given the activity of all other recorded neurons. For GPFA  the model prediction for neuron
j is ˆyj : = E [yj : | Y−j :]  where yj : is the jth row of Y and Y−j : ∈ R
(q−1)×T represents all but

4

the jth row of Y . The model prediction can be computed analytically because all variables in Y
are jointly Gaussian  by deﬁnition. Model predictions using PPCA and FA are analogous  but each
timepoint is considered individually. The prediction error is deﬁned as the sum-of-squared errors
between the model prediction and the observed square-rooted spike count across all neurons and
timepoints.
One way to compute the GPFA model prediction is via the low-dimensional state space. One can
ﬁrst estimate the neural trajectory using all but the jth neuron P (X | Y−j :)  then map this estimate
back out into the space of recorded activity for the jth neuron using (1) to obtain ˆyj :. Equivalently 
one can convert P (X | Y−j :) into its orthonormalized form before mapping it out into the space
of recorded activity using the jth row of UC. Because the orthonormalized dimensions are ordered 
we can evaluate the prediction error using only the top ˜p orthonormalized dimensions of ˜x: t  where
˜p ∈ {1  . . .   p}. This reduced GPFA model can make use of a larger number p of timescales than its
effective dimensionality ˜p.

4 Linear and non-linear dynamical systems

xi t+1 | xi t ∼ N (cid:4)

(cid:5)

aixi t  σ2
i

.

Another way to extract neural trajectories is by deﬁning a parametric dynamical model that describes
how the low-dimensional neural state evolves over time. A ﬁrst-order linear auto-regressive (AR)
model [5] captures linear Markovian dynamics. Such a model can be expressed as a Gaussian
process  since the state variables are jointly Gaussian. This can be shown by deﬁning a separate
ﬁrst-order AR model for each state dimension indexed by i ∈ {1  . . .   p}

(4)
Given enough time (t → ∞) and| ai| < 1  the model will settle into a stationary state that is
equivalent to (2) with

Ki(t1  t2) = σ2
1 − a2

i

i

|t1−t2|
a
i

 

(5)

as in [21]. Different covariance structures Ki can be obtained by going from a ﬁrst-order to an
nth-order AR model. One drawback of this approach is that it is usually not easy to construct an
nth-order AR model with a speciﬁed covariance structure. In contrast  the GP approach described in
Section 2 requires only the speciﬁcation of the covariance structure  thus allowing different smooth-
ing properties to be applied in a seamless way. AR models are generally less computationally de-
manding than those based on GP  but this advantage shrinks as the order of the AR model grows.
n i · δt1 t2 as in (3). The
Another difference is that (5) does not contain an independent noise term σ2
innovations noise σ2
i in (4) is involved in setting the smoothness of the time series  as shown in (5).
Thus  (4) would need to be augmented to explicitly capture departures from the AR model.

One may also consider deﬁning a non-linear dynamical model [3]  which typically has a richer set of
dynamical behaviors than linear models. The identiﬁcation of the model parameters provides insight
into the dynamical rules governing the time-evolution of the system under study. However  espe-
cially in exploratory data analyses  it may be unclear what form this model should take. Even if an
appropriate non-linear model can be identiﬁed  learning such a model can be unstable and slow due
to approximations required [3]. In contrast  learning the GPFA model is stable and approximation-
free  as described in Section 2. The use of GPFA can be viewed as a practical way of going beyond
a ﬁrst-order linear AR model without having to commit to a particular non-linear system  while
retaining computational tractability.

5 Behavioral task and neural recordings

The details of the neural recordings and behavioral task can be found elsewhere [22]. Brieﬂy  a
rhesus macaque performed delayed center-out reaches to visual targets presented on a fronto-parallel
screen. On a given trial  the peripheral reach target was presented at one of 14 possible locations –
two distances (60 and 100 mm) and seven directions (0  45  90  135  180  225  315°). Delay periods
were randomly chosen between 200 and 700 ms. Neural activity was recorded using a 96-electrode
array (Cyberkinetics  Foxborough  MA) in dorsal premotor and motor cortices. Only those units (61
single and multi-units  experiment G20040123) with robust delay period activity were included in
our analyses.

5

× 104

3.05

r
o
r
r
e
 
n
o
i
t
c
d
e
r
P

i

3

2.95

100 ms
25 ms
100 ms

50 ms

25 ms
50 ms

5
State dimensionality  p

10

15

6 Results

Figure 1: Prediction errors of two-stage methods (PPCA:
red  FA: green)  ﬁrst-order AR model (blue)  GPFA (dashed
black)  and reduced GPFA (solid black)  computed using 4-
fold cross-validation. Labels at right are standard deviations
of Gaussian kernels (referred to as kernel widths) for the two-
stage methods. For reduced GPFA  the horizontal axis corre-
sponds to ˜p rather than p  where the prediction error is com-
puted using only the top ˜p orthonormalized dimensions of a
GPFA model ﬁt with p = 15. Star indicates minimum of
solid black curve. Analyses in this ﬁgure are based on 56 tri-
als for the reach target at distance 60 mm and direction 135°.

We considered neural data for one reach target at a time  ranging from 200 ms before reach target
onset to movement end. This period comprised the 200 ms pre-target time  the randomly chosen
delay period (200–700 ms)  the monkey’s reaction time (mean±s.d.: 293±48 ms)  and the duration
of the monkey’s reach (269±40 ms). Spike counts were taken in non-overlapping 20 ms bins 
then square-rooted. For the two-stage methods  these square-rooted counts were smoothed over
time using a Gaussian kernel. We also considered smoothing spike trains directly  which yielded
qualitatively similar results for the two-stage methods.

Using the goodness-of-ﬁt metric described in Section 3  we can ﬁnd the appropriate degree of
smoothness for the two-stage methods. Fig. 1 shows the prediction error for PPCA (red) and FA
(green) for different kernel widths and state dimensionalities. There are two primary ﬁndings. First 
FA yielded lower prediction error than PPCA across a range of kernel widths and state dimension-
alities. The reason is that FA allows different neurons to have different independent noise variances.
