2013,Point Based Value Iteration with Optimal Belief Compression for Dec-POMDPs,This paper presents four major results towards solving decentralized partially observable Markov decision problems (DecPOMDPs) culminating in an algorithm that outperforms all existing algorithms on all but one standard infinite-horizon benchmark problems. (1) We give an integer program that solves collaborative Bayesian games (CBGs). The program is notable because its linear relaxation is very often integral. (2) We show that a DecPOMDP with bounded belief can be converted to a POMDP (albeit with actions exponential in the number of beliefs). These actions correspond to strategies of a CBG. (3) We present a method to transform any DecPOMDP into a DecPOMDP with bounded beliefs (the number of beliefs is a free parameter) using optimal (not lossless) belief compression. (4) We show that the combination of these results opens the door for new classes of DecPOMDP algorithms based on previous POMDP algorithms. We choose one such algorithm  point-based valued iteration  and modify it to produce the first tractable value iteration method for DecPOMDPs which outperforms existing algorithms.,Point Based Value Iteration with Optimal Belief

Compression for Dec-POMDPs

Liam MacDermed
College of Computing

Georgia Institute of Technology

Atlanta  GA 30332

liam@cc.gatech.edu

Charles L. Isbell

College of Computing

Georgia Institute of Technology

Atlanta  GA 30332

isbell@cc.gatech.edu

Abstract

We present four major results towards solving decentralized partially observable
Markov decision problems (DecPOMDPs) culminating in an algorithm that out-
performs all existing algorithms on all but one standard inﬁnite-horizon bench-
mark problems. (1) We give an integer program that solves collaborative Bayesian
games (CBGs). The program is notable because its linear relaxation is very often
integral. (2) We show that a DecPOMDP with bounded belief can be converted
to a POMDP (albeit with actions exponential in the number of beliefs). These ac-
tions correspond to strategies of a CBG. (3) We present a method to transform any
DecPOMDP into a DecPOMDP with bounded beliefs (the number of beliefs is a
free parameter) using optimal (not lossless) belief compression. (4) We show that
the combination of these results opens the door for new classes of DecPOMDP al-
gorithms based on previous POMDP algorithms. We choose one such algorithm 
point-based valued iteration  and modify it to produce the ﬁrst tractable value it-
eration method for DecPOMDPs that outperforms existing algorithms.

1

Introduction

Decentralized partially observable Markov decision processes (DecPOMDPs) are a popular model
for cooperative multi-agent decision problems; however  they are NEXP-complete to solve [15].
Unlike single agent POMDPs  DecPOMDPs suffer from a doubly-exponential curse of history [16].
Not only do agents have to reason about the observations they see  but also about the possible
observations of other agents. This causes agents to view their world as non-Markovian because
even if an agent returns to the same underlying state of the world  the dynamics of the world may
appear to change due to other agent’s holding different beliefs and taking different actions. Also 
for POMDPs  a sufﬁcient belief space is the set of probability distributions over possible states. In
the case of DecPOMDPs an agent must reason about the beliefs of other agents (who are recursively
reasoning about beliefs as well)  leading to nested beliefs that can make it impossible to losslessly
reduce an agent’s knowledge to less than its full observation history.
This lack of a compact belief-space has prevented value-based dynamic programming methods from
being used to solve DecPOMDPs. While value methods have been quite successful at solving
POMDPs  all current DecPOMDP approaches are policy-based methods  where policies are se-
quentially improved and evaluated at each iteration. Even using policy methods  the curse of history
is still a big problem  and current methods deal with it in a number of different ways. [5] simply
removed beliefs with low probability. Some use heuristics to prune (or never explore) particular
belief regions [19  17  12  11]. Other approaches merge beliefs together (i.e.  belief compression)
[5  6]. This can sometimes be done losslessly [13]  but such methods have limited applicability
and still usually result in an exponential explosion of beliefs. There have also been approaches that
attempt to operate directly on the inﬁnitely nested belief structure [4]  but these are approximations

1

of unknown accuracy (if we stop at the nth nested belief the nth + 1 could dramatically change the
outcome). All of these approaches have gotten reasonable empirical results in a few limited domains
but ultimately scale and generalize poorly.
Our solution to the curse of history is simple: to assume that it doesn’t exist  or more precisely  that
the number of possible beliefs at any point in time is bounded. While simple  the consequences of
this assumption turn out to be quite powerful: a bounded-belief DecPOMDP can be converted into
an equivalent POMDP. This conversion is accomplished by viewing the problem as a sequence of
cooperative Bayesian Games (CBGs). While this view is well established  our use of it is novel. We
give an efﬁcient method for solving these CBGs and show that any DecPOMDP can be accurately
approximated by a DecPOMDP with bounded beliefs. These results enable us to utilize existing
POMDP algorithms  which we explore by modifying the PERSEUS algorithm [18]. Our resulting
algorithm is the ﬁrst true value-iteration algorithm for DecPOMDPs (where no policy information
need be retained from iteration to iteration) and outperforms existing algorithms.

2 DecPOMDPs as a sequence of cooperative Bayesian Games

players. A =(cid:81)n

i=1 Ai is the set of joint-actions. S is the set of states. O =(cid:81)n

Many current approaches for solving DecPOMDPs view the decision problem faced by agents as
a sequence of CBGs [5]. This view arises from ﬁrst noting that a complete policy must prescribe
an action for every belief-state of an agent. This can take the form of a strategy (a mapping from
belief to action) for each time-step; therefore at each time-step agents must choose strategies such
that the expectation over their joint-actions and beliefs maximizes the sum of their immediate reward
combined with the utility of their continuation policy. This decision problem is equivalent to a CBG.
Formally  we deﬁne a DecPOMDP as the tuple (cid:104)N  A  S  O  P  R  s(0)(cid:105) where: N is the set of n
i=1 Oi is the set of
joint-observations. P : S × A → ∆(S × O) is the probability transition function with P (s(cid:48)  (cid:126)o|s  (cid:126)a)
being the probability of ending up in state s(cid:48) with observations (cid:126)o after taking joint-action (cid:126)a in state
s. R : S × A → R is the shared reward function. And s(0) ∈ ∆(S) is the initial state distribution.
The CBG consists of a common-knowledge distribution over all possible joint-beliefs along with
a reward for each joint-action/belief. Naively  each observation history corresponds to a belief. If
beliefs are more compact (i.e.  through belief compression)  then multiple histories can correspond
to the same belief. The joint-belief distribution is commonly known because it depends only on
the initial state and player’s policies  which are both commonly known (due to common planning or
rationality). These beliefs are the types of the Bayesian game. We can compute the current common-
knowledge distribution (without belief compression) recursively: The probability that joint-type

θt+1 = (cid:104)(cid:126)o  θt(cid:105) at time t + 1 is given by: τ t+1((cid:104)(cid:126)o  θt(cid:105)) =(cid:80)
(cid:88)
(cid:88)
game are ideally the immediate reward R =(cid:80)

P r[st+1 (cid:104)(cid:126)o  θt(cid:105)] =

(cid:80)

θt

st

st+1 P r[st+1 (cid:104)(cid:126)o  θt(cid:105)] where:

P (st+1  (cid:126)o|st  πθt)P r[st  θt]

(1)

The actions of the Bayesian game are the same as in the DecPOMDP. The rewards to the Bayesian
θt R(st  πθt)P r[st  θt] along with the utility of
the best continuation policy. However  knowing the best utility is tantamount to solving the problem.
Instead  an estimation can be used. Current approaches estimate the value of the DecPOMDP as if it
were an MDP [19]  a POMDP [17]  or with delayed communication [12]. In each case  the solution
to the Bayesian game is used as a heuristic to guide policy search.

st

3 An Integer Program for Solving Collaborative Bayesian Games

Many DecPOMDP algorithms use the idea that a DecPOMDP can be viewed as a sequence of
CBGs to divide policy optimization into smaller sub-problems; however  solving CBGs themselves
is NP-complete [15]. Previous approaches have solved Bayesian games by enumerating all strate-
gies  with iterated best response (which is only locally optimal) or branch and bound search [10].
Here we present a novel integer linear program that solves for an optimal pure strategy Bayes-Nash
equilibrium (which always exists for games with common payoffs). While integer programming is
still NP-complete  our formulation has a huge advantage: the linear relaxation is itself a correlated
communication equilibrium [7]  empirically very often integral (above 98% for our experiments in
section 7). This allows us to optimally solve our Bayesian games very efﬁciently.

2

Our integer linear program for Bayesian game (cid:104)N  A  Θ  τ  R(cid:105) optimizes over Boolean variables
x(cid:126)a θ  one for each joint-action for each joint-type. Each variable represents the probability of joint-
action (cid:126)a being taken if the agent’s types are θ. Constraints must be imposed on these variables to
insure that they form a proper probability distribution and that from each agent’s perspective  its
action is conditionally independent of other agents’ types.
These restrictions can be expressed by the following linear constraints (equation (2)):

For each agent i  joint-type θ  and partial joint-actions of other agents (cid:126)a−i

(cid:88)

for each θ ∈ Θ: (cid:88)

(cid:126)a∈A

x(cid:126)a θ = x(cid:104)(cid:126)a−i θ−i(cid:105)

ai∈Ai
x(cid:126)a θ = 1 and for each θ ∈ Θ  (cid:126)a ∈ A: x(cid:126)a θ ≥ 0

(2)

In order to make the description of the conditional independence constraints more concise  we use
the additional variables x(cid:104)(cid:126)a−i θ−i(cid:105). These can be immediately substituted out. These represent the
posterior probability that agent i  after becoming type θi  thinks other agents will take actions (cid:126)a−i
when having types θ−i. These constraints enforce that an agent’s posterior probabilities are unaf-
fected by other agent’s observations. Any feasible assignment of variables x(cid:126)a θ represents a valid
agent-normal-form correlated equilibria (ANFCE) strategy for the agents  and any integral solution
is a valid pure strategy BNE. In order to ﬁnd the optimal solution for a game with distribution over
types τ ∈ ∆(Θ) and rewards R : Θ × A → Rn we can solve the integer program: Maximize

(cid:80) τθR(θ  (cid:126)a)x(cid:126)a θ over variables x(cid:126)a θ ∈ {0  1} subject to constraints (2).

An ANFCE generalizes Bayes-Nash equilibria: a pure strategy ANFCE is a BNE. We can view
ANFCEs as having a mediator that each agent tells its type to and receives an action recommendation
from. An ANFCE is then a probability distribution across joint type/actions such that agents do not
want to lie to the mediator nor deviate from the mediator’s recommendation. More importantly  they
cannot deduce any information about other agent’s types from the mediator’s recommendation. We
cannot use an ANFCE directly  because it requires communication; however  a deterministic (i.e. 
integral) ANFCE requires no communication and is a BNE.

4 Bounded Belief DecPOMDPs

Here we show that we can convert a bounded belief DecPOMDP (BB-DecPOMDP) into an equiva-
lent POMDP (that we call the belief-POMDP). A BB-DecPOMDP is a DecPOMDP where each
agent i has a ﬁxed upper bound |Θi| for the number of beliefs at each time-step. The belief-
POMDP’s states are factored  containing each agent’s belief along with the DecPOMDP’s state.
The POMDP’s actions are joint-strategies. Recently  Dibangoye et al. [3] showed that a ﬁnite hori-
zon DecPOMDP can be converted into a ﬁnite horizon POMDP where a probability distribution
over histories is a sufﬁcient statistic that can be used as the POMDP’s state. We extend this result to
inﬁnite horizon problems when beliefs are bounded (note that a ﬁnite horizon problem always has
bounded belief). The main insight here is that we do not have to remember histories  only a distri-
bution over belief-labels (without any (cid:127)a priori connection to the belief itself) as a sufﬁcient statistic.
As such the same POMDP states can be used for all time-steps  enabling inﬁnite horizon problems
to be solved.
In order to create the belief-POMDP we ﬁrst transform observations so that they correspond one-to-
one with beliefs for each agent. This can be achieved naively by folding the previous belief into the
new observation so that each agent receives a [previous-belief  observation] pair; however  because
an agent has at most |Θi| beliefs we can partition these histories into at most |Θi| information-
equivalent groups. Each group corresponds to a distinct belief and instead of the [previous-belief 
observation] pair we only need to provide the new belief’s label.
Second  we factor our state to include each agent’s observation (now a belief-label) along with
the original underlying state. This transformation increases the state space polynomially. Third 
recall that a belief is the sum of information that an agent uses to make decisions. If agents know
each other’s policies (e.g.  by constructing a distributed policy together) then our modiﬁed state
(which includes beliefs for each agent) fully determines the dynamics of the system. States now

3

appear Markovian again. Therefore  a probability distribution across states is once again a sufﬁcient
plan-time statistic (as proven in [3] and [9]). This distribution exactly corresponds to the Bayesian
prior (after receiving the belief-observation) of the common knowledge distribution of the current
Bayesian game being played as given by equation (1).
Finally  its important to note that beliefs do not directly affect rewards or transitions. They therefore
have no meaning beyond the prior distribution they induce. We can therefore freely relabel and
reorder beliefs without changing the decision problem. This allows belief-observations in one time-
step to use the same observation labels in the next time-step  even if the beliefs are different (in which
case the distribution will be different). We can use this fact to fold our mapping from histories to
belief-labels into the belief-POMDP’s transition function.
We now formally deﬁne the belief-POMDP (cid:104)A(cid:48)  S(cid:48)  O(cid:48)  P (cid:48)  R(cid:48)  s(cid:48)(0)(cid:105) converted from BB-
DecPOMDP (cid:104)N  A  S  O  P  R  s(0)(cid:105) (with belief labels Θi for each agent). The belief-POMDP
(cid:81)|Θi|
has factored states (cid:104)ω  θ1 ···   θn(cid:105) ∈ S(cid:48) where ω ∈ S is the underlying state and θi ∈ Θi is
j=1 Ai is the set of actions (one ac-
[θ o]=θ(cid:48) P (ω(cid:48)  o|ω (cid:104)aθ1  ···   aθn(cid:105)) (a sum
is the action agent i would take if holding belief θi.
(cid:48)(0)
ω = s(0) is the initial state distribution with each agent

agent i’s belief. O(cid:48) = {} (no observations). A(cid:48) = (cid:81)n
tion for each agent for each belief). P (cid:48)(s(cid:48)|s  a)  = (cid:80)

i=1

(A(cid:48) = {Θ → A}). The action space thus has size(cid:81)

over equivalent joint-beliefs) where aθi
R(cid:48)(s  a) = R(ω (cid:104)aθ1 ···   aθn(cid:105)) and s
having the same belief.
Actions in this belief-POMDP are pure strategies for each agent specifying what each agent should
do for every belief they might have.
In other words it is a mapping from observation to action
i |Ai||Θi| which is exponentially more actions
than the number of joint-actions in the BB-DecPOMDP. Both the transition and reward functions
use the modiﬁed joint-action (cid:104)aθ1 ···   aθn(cid:105) which is the action that would be taken once agents see
their beliefs and follow action a ∈ A. This makes the single agent in the belief-POMDP act like
a centralized mediator playing the sequence of Bayesian games induced by the BB-DecPOMDP.
At every time-step this centralized mediator must give a strategy to each agent (a solution to the
current Bayesian game). The mediator only knows what is commonly known and thus receives no
observations.
This belief-POMDP is decision equivalent to the BB-DecPOMDP. The two models induce the same
sequence of CBGs; therefore  there is a natural one-to-one mapping between polices of the two
models that yield identical utilities. We show this constructively by providing the mapping:
Lemma 4.1. Given BB-DecPOMDP (cid:104)N  A  O  Θ  S  P  R  s(0)(cid:105) with policy π : ∆(S)×O → A and
belief-POMDP (cid:104)A(cid:48)  S(cid:48)  O(cid:48)  P (cid:48)  R(cid:48)  s(cid:48)(0)(cid:105) as deﬁned above  with policy π(cid:48) : ∆(S(cid:48)) → {O(cid:48) → A(cid:48)}
then if π(s(t))i o = π(cid:48)
π(cid:48)(s(cid:48)(0)) (the expected utility of the two policies
are equal).

i(s(t)  o)  then Vπ(s(0)) = V (cid:48)

We have shown that BB-DecPOMDPs can be turned into POMDPs but this does not mean that we
can easily solve these POMDPs using existing methods. The action-space of the belief-POMDP
is exponential with respect to the number of observations of the BB-DecPOMDP. Most existing
POMDP algorithms assume that actions can be enumerated efﬁciently  which isn’t possible beyond
the simplest belief-POMDP. One notable exception is an extension to PERSEUS that randomly
samples actions [18]. This approach works for some domains; however  often for decentralized
problems only one particular strategy proves effective  making a randomized approach less useful.
Luckily  the optimal strategy is the solution to a CBG  which we have already shown how to solve.
We can then use existing POMDP algorithms and replace action maximization with an integer linear
program. We show how to do this for PERSEUS below. First  we make this result more useful by
giving a method to convert a DecPOMDP into a BB-DecPOMDP.

5 Optimal belief compression

We present here a novel and optimal belief compression method that transforms any DecPOMDP
into a BB-DecPOMDP. The idea is to let agents themselves decide how they want to merge their
beliefs and to add this decision directly into the problem’s structure. This pushes the onus of belief
compression onto the BB-DecPOMDP solver instead of an explicit approximation method. We give
agents the ability to optimally compress their own beliefs by interleaving each normal time-step

4

(where we fully expand each belief) with a compression time-step (where the agents must explicitly
decide how to best merge beliefs). We call these phases belief expansion and belief compression 
respectively.
The ﬁrst phase acts like the original DecPOMDP without any belief compression: the observation
given to each agent is its previous belief along with the DecPOMDP’s observation. No information
is lost during this phase; each observation for each agent-type (agents holding the same belief are
the same type) results in a distinct belief. This belief expansion occurs with the same transitions and
rewards as the original DecPOMDP.
The dynamics of the second phase are unrelated to the DecPOMDP. Instead  an agent’s actions are
decisions about how to compress its belief. In this phase  each agent-type must choose its next
belief but they only have a ﬁxed number of beliefs to choose from (the number of beliefs ti is a free
parameter). All agent-types that choose the same belief will be unable to distinguish themselves in
the next time-step; the belief label in the next time-step will equal the action index they take in the
belief compression phase. All rewards are zero. This second phase can be seen as a purely mental
phase and does not affect the environment beyond changes to beliefs although as a technical matter 
we convert our discount factor to its square root to account for these new interleaved states.
Given a DecPOMDP (cid:104)N  A  S  O  P  R  s(0)(cid:105) (with states ω ∈ S and observations σ ∈ O) we
formally deﬁne the BB-DecPOMDP approximation model (cid:104)N(cid:48)  A(cid:48)  O(cid:48)  S(cid:48)  P (cid:48)  R(cid:48)  s(cid:48)(0)(cid:105) with belief
set size parameters t1 ···   tn as:

i = {a1 ···   amax(|Ai|  ti)}

• N(cid:48) = N and A(cid:48)
• O(cid:48)
• S(cid:48) = S×O(cid:48) with factored state s = (cid:104)ω  σ1  θ1 ···   σn  θn(cid:105) ∈ S(cid:48).
if ∀i : σi = ∅  σ(cid:48)
if ∀i : σi (cid:54)= ∅  σ(cid:48)
• P (cid:48)(s(cid:48)|s  a) =
otherwise

i = {Oi ∅}×{1  2 ···   ti} with factored observation oi = (cid:104)σi  θi(cid:105) ∈ O(cid:48)
i (cid:54)= ∅ and θ(cid:48)
i = ∅ and θ(cid:48)

1 ···   σ(cid:48)

n(cid:105)|ω  a)

(cid:40) P (ω(cid:48) (cid:104)σ(cid:48)
(cid:26) R(ω  a)

1
0

i = θi
i = ai  ω(cid:48) = ω

• R(cid:48)(s  a) =

• s(cid:48)(0) =(cid:10)s(0) ∅1  1 ···  ∅n  1(cid:11) is the initial state distribution

if ∀i : σi = ∅
otherwise

0

We have constructed the BB-DecPOMDP such that at each time-step agents receive two observa-
tions: an observation factor σ  and their belief factor θ (i.e.  type). The observation factor is ∅ at
the expansion phase and the most recent observation  as given by the DecPOMDP  when starting the
compression phase. The observation factor therefore distinguishes which phase the model is cur-
rently in. Agents should either all have σ = ∅ or none of them. The probability of transitioning to a
state where some agents have the empty set observation while others don’t is always zero. Note that
transitions during the contraction phase are deterministic (probability one) and the underlying state
ω does not change. The action set sizes may be different in the two phases  however we can easily
get around this problem by mapping any action outside of the designated actions to an equivalent
one inside the designated action. The new BB-DecPOMDP’s state size is |S(cid:48)| = |S|(|O| + 1)ntn.

6 Point-based value iteration for BB-DecPOMDPs

We have now shown that a DecPOMDP can be approximated by a BB-DecPOMDP (using optimal
belief-compression) and that this BB-DecPOMDP can be converted into a belief-POMDP where
selecting an optimal action is equivalent to solving a collaborative Bayesian game (CBG). We have
given a (relatively) efﬁcient integer linear program for solving these CBG. The combination of
these three results opens the door for new classes of DecPOMDP algorithms based on previous
POMDP algorithms. The only difference between existing POMDP algorithms and one tailored for
BB-DecPOMDPs is that instead of maximizing over actions (which are exponential in the belief-
POMDP)  we must solve a stage-game CBG equivalent to the stage decision problem.
Here  we develop an algorithm for DecPOMDPs based on the PERSEUS algorithm [18] for
POMDPs  a speciﬁc version of point-based value iteration (PBVI) [16]. Our value function rep-
resentation is a standard convex and piecewise linear value-vector representation over the belief

5

simplex. This is the same representation that PERSEUS and most other value based POMDP al-
gorithms use. It consists of a set of hyperplanes Γ = {α1  α2 ···   αm} where αi ∈ R|S|. These
hyperplanes each represent the value of a particular policy across beliefs. The value function is then
the maximum over all hyperplanes. For a belief b ∈ R|S| its value as given by the value function Γ
is VΓ(b) = maxα∈Γ α · b. Such a representation acts as both a value function and an implicit policy.
While each α vector corresponds to the value achieved by following an unspeciﬁed policy  we can
reconstruct that policy by computing the best one-step strategy  computing the successor state  and
repeating the process.
The high-level outline of our point-based algorithm is the same as PERSEUS. First  we sample
common-knowledge beliefs and collect them into a belief set B. This is done by taking random
actions from a given starting belief and recording the resulting belief states. We then start with a
poor approximation of the value function and improve it over successive iterations by performing
a one-step backup for each belief b ∈ B. Each backup produces a policy which yields a value-
vector to improve the value function. PERSEUS improves standard PBVI during each iteration by
skipping beliefs already improved by another backup. This reduces the number of backups needed.
In order to operate on belief-POMDPs  we replace PERSEUS’ backup operation with one that uses
our integer program.
In order to backup a particular belief point we must maximize the utility of a strategy x. The
estimated value(cid:80)
utility is computed using the immediate reward combined with our value-function’s current estimate
(cid:80)
of a chosen continuation policy that has value vector α. Thus  a resulting belief b(cid:48) will achieve
s b(cid:48)(s)α(s). The resulting belief b(cid:48) after taking action (cid:126)a from belief b is b(cid:48)(s(cid:48)) =
s b(s)P (s(cid:48)|s  (cid:126)a). Putting these together  along with the probabilities x(cid:126)a s of taking action (cid:126)a in

