2019,Depth-First Proof-Number Search with Heuristic Edge Cost and Application to Chemical Synthesis Planning,Search techniques  such as Monte Carlo Tree Search (MCTS) and Proof-Number Search (PNS)  are effective in playing and solving games.  However  the understanding of their performance in industrial applications is still limited.  We investigate MCTS and Depth-First Proof-Number (DFPN) Search  a PNS variant  in the domain of Retrosynthetic Analysis (RA). 
We find that DFPN's strengths  that justify its success in games  have limited value in RA  and that an enhanced MCTS variant by Segler et al. significantly outperforms DFPN.  We address this disadvantage of DFPN in RA with a novel approach to combine DFPN with Heuristic Edge Initialization.  Our new search algorithm DFPN-E outperforms the enhanced MCTS in search time by a factor of 3 on average  with comparable success rates.,Depth-First Proof-Number Search with Heuristic
Edge Cost and Application to Chemical Synthesis

Planning

Akihiro Kishimoto
IBM Research  Ireland

Beat Buesser

IBM Research  Ireland

Bei Chen

IBM Research  Ireland

Adi Botea
Eaton  Ireland∗

Abstract

Search techniques  such as Monte Carlo Tree Search (MCTS) and Proof-Number
Search (PNS)  are effective in playing and solving games. However  the understand-
ing of their performance in industrial applications is still limited. We investigate
MCTS and Depth-First Proof-Number (DFPN) Search  a PNS variant  in the do-
main of Retrosynthetic Analysis (RA). We ﬁnd that DFPN’s strengths  that justify
its success in games  have limited value in RA  and that an enhanced MCTS variant
by Segler et al. signiﬁcantly outperforms DFPN. We address this disadvantage
of DFPN in RA with a novel approach to combine DFPN with Heuristic Edge
Initialization. Our new search algorithm DFPN-E outperforms the enhanced MCTS
in search time by a factor of 3 on average  with comparable success rates.

1

Introduction

Search is a core AI technique  especially in games [5  27  31] and domain-independent planning
[3  12]. Historically  new search algorithms and novel combinations of existing algorithms have led
to signiﬁcant performance improvements. Another way to achieve progress is to transfer successful
approaches from one domain to another. This paper combines both strategies.
Proof-Number Search (PNS) [1] and Monte Carlo Tree Search (MCTS) [18] are two notable al-
gorithms that have been extensively studied in solving games/game positions and playing games 
respectively. Their success has been demonstrated by solving the game of checkers [27] and by
achieving super-human strength in playing the game of Go [31].
Due to recent advances in AI  chemistry is being reconsidered as an AI research domain [14]. We
focus on chemical synthesis planning  the task of planning chemical reaction routes to synthesize
a given organic molecule. Retrosynthetic Analysis (RA) is a technique going backwards from the
target molecule towards a library of usually smaller  starting molecules. This task can be modeled
similarly to solving games [11] and can be tackled with search algorithms such as PNS and MCTS
[11  29]. However  since no direct performance comparison between PNS and MCTS has been made 
their search performance in RA is not well understood.
We investigate the search performance of MCTS and Depth-First Proof-Number (DFPN) Search
[21]  a variant of PNS  in RA. PNS variants [1  21] are designed to efﬁciently identify the smallest
amount of work needed to solve a game position. The game research community largely agrees that
this advantage is one reason why PNS variants have been a popular choice in solving difﬁcult games
or game positions [16  21  27]  with solution lengths exceeding 1500 steps. However  we discover
that DFPN performs poorly in the domain of RA. We ﬁnd that DFPN’s signiﬁcant performance
degradation is due to RA’s lopsided search space  which alternates large branching factors with
very small ones. To address this  we introduce DFPN-E  a novel algorithm to combine DFPN with

∗Work performed while the author was afﬁliated with IBM Research  Ireland.

33rd Conference on Neural Information Processing Systems (NeurIPS 2019)  Vancouver  Canada.

Figure 1: Example of reaction rule. Esteriﬁcation reaction adapted from [11].

Heuristic Edge Initialization. We empirically evaluate DFPN-E and an enhanced MCTS variant [29]
on a dataset of complex target molecules extracted from the US patent literature. We demonstrate that
DFPN-E outperforms this enhanced MCTS in search time  with competitive success rates of ﬁnding
successful synthesis routes.

2 Chemical Synthesis Planning

Chemical synthesis planning is the task of creating a sequence of chemical reactions (or reaction
pathway) that synthesizes a target organic molecule by using existing (e.g.  commercially available)
starting materials. Chemists perform retrosynthetic analysis (RA)  a systematic analysis that re-
cursively splits a target molecule into simpler reactant molecules with reactions they expect to be
feasible  until they ﬁnd a branching reverse route from the target to starting materials. Automated
retrosynthetic analysis has been an open problem for 50 years  e.g.  [6  7  33]  because of its scientiﬁc
importance in chemistry as well as its direct applications to pharmaceutical and material industries.
RA takes as input a target molecule  a library of starting materials and a database of reactions. A
molecule is represented as a graph where nodes and links correspond to atoms and chemical bonds 
respectively. A starting material database contains deﬁnitions of available starting molecules. A
reaction database has a set of reaction rules specifying graph substructures of molecules that must be
present to allow the application of the reaction. Reaction rules can be constructed manually [11  33]
or automatically [19  29].
Since RA explores the space backwards  from the target molecule  reaction rules are applied in
a reverse (or retrosynthetic) manner. When checking if a reaction rule can be applied to a target
molecule  RA checks if the target has a substructure speciﬁed in the product of the rule. If this is the
case  the target is split into the reactant molecules speciﬁed in the reaction rule. Unless a reactant
molecule P appears in the starting material database  P needs to be synthesized  recursively applying
a reaction rule to P . A molecule may have multiple matching substructures where a reaction rule can
be applied. In this paper  all these are considered as different moves.
Figure 1 illustrates a reaction rule for producing an ester from an alcohol and anhydride. The carbon
atoms located in numbers 1  5 and 7 are omitted. To activate this reaction  an alcohol and anhydride
molecules need to have substructures as illustrated in the ﬁgure. An ester is produced by modifying
the substructures speciﬁed there and keeping the remaining substructures unchanged.
Our focus is to elucidate the behavior of MCTS and PNS in the search space of RA  modeled in [11] 
where each reaction rule captures only substructural modiﬁcations between a product and its reactants.
In practice  reaction rules need to consider constraints such as protecting groups  side compounds 
temperature and yield [33]. This is beyond the scope of our paper.
While RA is often modeled as single-agent search (OR search)  e.g.  [19  29  33]  Heifets and Jurisica
model RA as a problem similar to solving a game position in two-player games such as chess and Go
[11]. Their model allows to efﬁciently split a problem into a set of independent subproblems that can
be solved with AND/OR search. In their game position solving framework  two players alternately
play moves. Terminologies of wins and losses are used from a viewpoint of the ﬁrst player. The ﬁrst
player attempts to synthesize a target molecule  while the second player (or opponent) attempts to
prevent it. A position of the ﬁrst player corresponds to a molecule they want to synthesize. A move
of the ﬁrst player is a reaction rule applicable to that molecule in a reverse manner. On the other hand 
a position for the opponent corresponds to a set of precursor molecules generated by a reaction rule.
A move for the opponent is to select one of the precursor molecules in their position. In Figure 1  an
application of this rule corresponds to a move of the ﬁrst player if it is applicable. The opponent has
two moves  one choosing an alcohol and the other choosing an anhydride.

2

A molecule in the starting material database is a winning terminal position  while a molecule to no
applicable reaction rule is a loss terminal position. At a position for the ﬁrst player  if at least one
move leads to a win  that position is a win  as one reaction to synthesize the molecule exists. If all
legal moves lead to losses  the position is a loss (i.e.  no pathway exists to synthesize it). At a position
for the opponent  if all moves (precursor molecules presented to the ﬁrst player) lead to wins  the
position is a win (all precursors are successfully generated). Otherwise  the position is a loss.
The size of the RA search space can be very large. The branching factor at OR nodes is typically
estimated as 80 and a synthetic route may require up several tens of synthetic steps [33]. In addition 
complex molecules may require over 100 steps [11]. Like in many games  the search space of RA is
cyclic since a sequence of reaction rules may create repeated states  e.g.  oxidation and reduction 
while a solution may not contain a cycle (see the next section for the deﬁnition of a solution).
Unlike in many games  successor state generation is a serious bottleneck in RA  because checking
an applicability of a reaction rule requires to solve subgraph matching  which is an NP-complete
problem. For example  Kishimoto et al. [14] discuss that the implementation in [11] generates at
most several tens of molecules per second  as compared to millions of positions per second in a game
such as chess.

3 Background

This section gives an overview of PNS and MCTS. See [4  17] for more comprehensive surveys.

3.1 AND/OR Search and Proof-Number Search Variants

In our model  OR and AND nodes correspond to the ﬁrst player and the opponent  respectively. OR
and AND nodes alternate along a given pathway in the search tree. A “move” represents an edge
(transition) in a search tree. Once the AND/OR search ﬁnds a solution  the value of the root node is
determined to be either a win or a loss. Node n is called proven if the value of n is proven to be a
win that is also called a proof. Node n is called disproven if the value of n is proven to be a loss. A
disproof is also used to express a loss. The value of n is unknown or unproven if n is neither proven
nor disproven.
A proof tree T of node r theoretically ensures that r is proven. T has the following properties: (1)
The root node r is in T   (2) for each internal OR node n in T   at least one child of n is in T   (3) for
each internal AND node n in T   all the children of n are in T   and (4) all terminal nodes in T have
values of wins. A disproof tree  that provides a disproof  is analogously deﬁned.
An efﬁcient AND/OR search aims at ﬁnding a proof or disproof tree as quickly as possible. PNS
uses proof and disproof numbers to estimate the difﬁculty of ﬁnding a proof or a disproof for node
n [1]. The proof number pn(n) for node n is deﬁned as the minimum number of leaf nodes to be
proven to ﬁnd a proof for n. A node with a smaller proof number is more promising to ﬁnd a proof.
Analogously  the disproof number dn(n) for n is the minimum number of leaf nodes to be disproven
to ﬁnd a disproof for n. For proven terminal node n  pn(n) = 0 and dn(n) = ∞  and pn(n) = ∞
and dn(n) = 0 for disproven terminal node n. At an internal node n with a set of children S(n) 
proving one child leads to a proof for an OR node n  while all children must be proven for a proof
of an AND node n (and vice versa for disproof). Hence  pn(n) and dn(n) are: For an internal
s∈S(n) dn(s). For an internal AND node
s∈S(n) pn(s) and dn(n) = mins∈S(n) dn(s). Figure 2(left) illustrates an example of
proof and disproof numbers  where numbers on the top and bottom inside each node indicate proof
and disproof numbers  respectively.
PNS [1] maintains proof and disproof numbers of each node in a search tree. Starting with the root
until reaching a leaf node  PNS traverses down a tree in a best-ﬁrst manner by selecting a child with
the smallest proof number at each internal OR node  and a child with the smallest disproof number
at each internal AND node (selection). PNS then expands the selected leaf node (expansion)  and
recalculates proof and disproof numbers of the nodes along the path back to the root (backup). For
example  in Figure 2(right)  PNS selects path A → C → F   generates two new leaf nodes H and I 
and updates proof and disproof numbers at F   C and A. PNS repeats these steps until ﬁnding either a
proof or disproof or exhausting its time/memory resources.

OR node n  pn(n) = mins∈S(n) pn(s) and dn(n) =(cid:80)
n  pn(n) =(cid:80)

3

Figure 2: Example of PNS

Depth-First Proof-Number (DFPN) search [21] is a PNS variant that reformulates best-ﬁrst PNS to
depth-ﬁrst search. DFPN has been successfully used to solve difﬁcult games or game positions in
many games  e.g.  [2  21  27]  often involving a solution with several hundred steps [13  21].
DFPN re-expands fewer internal nodes than best-ﬁrst PNS as well as operates in limited memory.
A large part of the available memory is allocated to the transposition table (TT). The TT caches
the proof and disproof numbers of examined nodes. DFPN introduces thresholds for proof and
disproof numbers: thpn(n) and thdn(n) which are set to initially large values at the root node.
DFPN recalculates pn(n) and dn(n) by using the proof and disproof numbers of n’s children. When
thpn(n) ≤ pn(n) or thdn(n) ≤ dn(n) holds for an unproven node n  DFPN identiﬁes that there are
more promising nodes than n and postpones the examination of n. Otherwise  DFPN selects a child
s1 with the smallest (dis)proof number for a further examination  with the following thresholds: For
OR node n  thpn(s1) = min(thpn(n)  pn(s2) + 1) and thdn(s1) = thdn(n)− dn(n) + dn(s1). For
AND node n  thpn(s1) = thpn(n) − pn(n) + pn(s1) and thdn(s1) = min(thdn(n)  dn(s2) + 1) 
where s2 is a child with the second smallest (dis)proof number among a list of children of an OR
(AND) node n. DFPN tends to gradually increment the thresholds as search progresses.
The basic PNS sets pn(n) = dn(n) = 1 for an unproven leaf n. Heuristic Initialization enhances PNS
variants including DFPN+ [21] by initializing pn(n) = hpn(n) and dn(n) = hdn(n) at unproven
leaf n  where hpn(n) and hdn(n) are evaluation functions for proof and disproof numbers. Existing
work on creating hpn(n) and hdn(n) for games includes manual [16  35] and machine learning
[9  21] approaches. Even if DFPN reduces re-expansions of internal nodes compared to basic PNS 
it still often suffers from the high overhead of such a re-examination  resulting in examining only
small portions of the new search spaces. To alleviate this issue  approaches to increase thpn(n) and
thpn(n) have been developed [16  21  24].

3.2 Monte Carlo Tree Search

MCTS is based on a best-ﬁrst search that repeats the selection  expansion  and backup steps. Most
MCTS algorithms except [32] perform Monte Carlo samplings to calculate a heuristic value of a leaf
node [8  18]. A sampling at a leaf estimates a probability of a win by randomly selecting moves
until it reaches a terminal position. For more accurate evaluations  samplings select moves with
non-uniform probabilities  considering game board conﬁgurations [10  31]. Additionally  MCTS can
use evaluation functions for leaf-node evaluations with [31] or without [32] sampling.
One conceptual difference between MCTS and PNS is that MCTS aims to balance a trade-off between
exploration and exploitation. A move with a high reward (e.g.  high winning ratio) must be selected
to have a higher chance to win a game (exploitation). On the other hand  a move with a low reward
must also be selected to overcome an inaccuracy due to a small number of examinations of the move
(exploration). A variety of formulas [10  18  34] have been presented to achieve the right balance.
Let n be the current node  A(n) be a set of legal moves for n  and Q(n  ai) be an accumulated reward
for move ai. To select the best move abest in RA  consider Segler et al.’s formula [29]  originally
presented in [26  31]: abest = arg max
) where N (n  ai) is
ai∈A(n)

( Q(n ai)
N (n ai) + cP (n  ai)

the number of visits to ai at n  P (n  ai) is a prior probability of move ai at n  and c is a constant
empirically preset. In RA  P (n  ai) corresponds to a probability that one step retrosynthesis with
reaction rule ai is successfully applied to molecule n. A neural network is trained to estimate P (n  ai)

√(cid:80)

a∈A(n) N (n a)
1+N (n ai)

4

Figure 3: Proof number limitation in lopsided search space

[29  30]. As in UCT [18]  the ﬁrst and second terms of the above formula take exploitation and
exploration into account. However  the above second term more gradually reduces the exploration
factor than UCT and encourages to explore the search space based on P (s  ai) encoding domain-
speciﬁc knowledge.
Let bi be a sequence of selected moves in a search tree leading to node n from the root  L(bi) be
its length  and nj be a node with selected move aj on bi. Segler et al. deﬁne Q(n  a) to prefer
a move with a higher winning ratio as well as a shorter pathway leading to a win: Q(n  a) =
) where Ii(n  a) is a function indicating whether
move a at node n is selected at the i-th traversal  k is a damping constant (0 ≤ k ≤ 1)  Lmax is the
maximum tree depth  and zi is a reward received depending on whether a sampling leads to a win or
not. A cut-off depth dr stops a sampling that reached no terminal node.

(cid:80)n
i=1 Ii(n  a)zi max(0  1 − L(bi)−(cid:80)

kP (nj  aj )

aj∈bi
Lmax

4 Proof-Number Search with Heuristic Edge Initialization

In ﬁnding a proof at the root  PNS tends to select a path that has nodes with small proof numbers.
Since the proof numbers of OR children are summed up to calculate the proof number of an AND
node  PNS prefers selecting an AND node that has a small number of moves. In games where
PNS variants have been successfully applied  e.g.  [16  21  27]  the number of available moves can
change signiﬁcantly between consecutive game positions. Such a property of the opponent’s move
distribution in the game search space allows PNS variants to have various values of proof numbers 
successfully identifying promising portions of the search space.
RA raises a new challenge due to different characteristics of its search space. In RA  many reaction
rules are applicable to a molecule  increasing the number of moves at OR nodes. However  most of
the reaction rules have only one precursor. There are at most a few reactants in the most complicated
reaction rules. In other words  the search space is lopsided  since the branching factor at OR nodes is
large  while it is very small at AND nodes. In the lopsided search space  PNS variants have difﬁculties
in identifying moves with higher chances of leading to proofs. For example  assume that the AND
nodes illustrated in Figure 3 always have only one move each. Then  even if there are many moves
at OR nodes  pn(n) = 1 holds for any node n in the ﬁgure  thus preventing PNS variants from
identifying a most promising path leading to a proof. In this ﬁgure  DFPN is turned into simple 
inefﬁcient depth-ﬁrst search with no depth limit.
Heuristic initialization at leaf nodes can assign a variety of proof numbers to leaf nodes and turns PNS
variants into greedy search in the lopsided search space. This approach suffers from performance
degradation when an evaluation function hpn(n) assigns an inaccurate proof number to a leaf. Assume
that hpn(n) evaluates all leaf nodes illustrated in Figure 3  only the left leaf node l has a proof  and
hpn(l) > hpn(m) holds for any other leaf m. Then  PNS needs to examine all the nodes in this
ﬁgure  before leaf l is examined.
Our DFPN with Heuristic Edge Initialization (DFPN-E) addresses a limitation arising in the lopsided
search space. DFPN with heuristic initialization of leaf nodes attempts to sum up the values of the
leaf nodes that can be part of a proof tree. Based on more informed heuristics values calculated by a
set of the leaf nodes  DFPN with heuristic initialization determines a leaf to expand next. In contrast 
DFPN-E assigns a heuristic cost to an edge from an OR node to an AND node  which estimates the
difﬁculty of ﬁnding a proof. In addition to the number of leaf nodes needed to ﬁnd a proof  DFPN-E
attempts to estimate the total cost of the edges needed to be included in a proof tree.

5

A leaf node to expand next is determined by this estimated effort. Once DFPN-E proves that an edge
can lead to a proof  it does not need any effort to ﬁnd a proof. DFPN-E  therefore  updates the edge
cost to zero. Formally  we deﬁne pn(n) for an internal OR node n as follows:

(cid:26)0

pn(n) =

mins∈S(n)(h(n  s) + pn(s))

(mins∈S(n) pn(s) = 0)
(otherwise)

where h(n  s) is an evaluation function evaluating an edge from node n to its child s. In addition 
the evaluation value is non-negative for any n and s. The remaining cases of calculating pn(n) and
dn(n) as well as the child selection scheme are the same as described in the previous section for PNS.
Heifets’ and Jurisica’s PNS implementation [11] is regarded as a special case of h(n  s) = 1 for any
n and s. In this case  their PNS implementation is almost identical to iterative deepening based on
depth except that it always returns to the root whenever a leaf is expanded. While an advantage of
PNS in solving games is to examine the search space as deep as possible without any depth limit 
their approach no longer inherits this advantage  losing the capability of ﬁnding long pathways.
As in DFPN  DFPN-E uses two thresholds thpn(n) and thdn(n): one for the proof number and the
other for the disproof number  enabling DFPN-E to search as long as thpn(n) > pn(n) ∧ thdn(n) >
dn(n) holds. Let sbest be a child chosen for an examination at an OR node n. DFPN-E updates
thpn(n) in a combination of [21] with [16]:

thpn(sbest) = min(thpn(n)  pn(s2) + δ) − h(n  sbest)

where s2 is a child where pn(s2) is the second smallest proof number with our modiﬁcation among a
list of n’s children  and δ is an integer for threshold controlling to decrease the node reexamination
overhead [16]. The remaining cases are identical to original DFPN [21].
Our evaluation function h(n  s) is based on a one-step retrosynthesis prediction combined with the
idea behind so-called forced moves in games. First  as described in [30]  our approach encodes a
molecule into a ﬁngerprint that is a ﬁxed bit vector. A neural network  described in the next section 
receives the ﬁngerprint as input. The neural network has R nodes in its output layer where R is the
number of reaction rules in the reaction database. The neural network predicts a probability P (n  a)
that reaction rule a is applied to a molecule n in a reverse manner. Then  we deﬁne h(n  s) as follows:

h(n  s) = min(Mpn (cid:98)− log(P (n  ai) + ) + 1(cid:99))

with Mpn a constant  ai the reaction rule to generate a child s at OR node n  and  a small constant.
Finally  let ai−1 be the reaction rule applied just before ai in the current search tree. On top of the
above h(n  s)  our approach sets h(n  s) = 0  if (1) ai−1 = ai holds and (2) the largest molecule in
s is smaller than that in n. We deﬁne the size of a molecule as the number of atoms. The intuition
behind the latter heuristic rule is that a simpler precursor molecule could often be used to synthesize
a product  as the feasibility of a simpler molecule tends be easier to verify. In addition  applying the
same rule encourages DFPN-E to keep simplifying the molecule structure. Forced moves in games
have similar principles to guide search towards positions that can be more easily veriﬁed.

5 Experimental Results

This section is dedicated to empirical evaluations of our algorithms.

5.1 Setup

Our implementation easily solves the benchmark instances in [11] with their reaction and starting
material databases  except instance #18 that has a special symmetric structure. Therefore  for our
empirical evaluation  we create more difﬁcult benchmarks from reactions extracted from the text
mining of US patents from 1976–2013 provided by Lowe2 [20]. We ﬁrst select unique reactions
that RDKit3 can correctly parse  and split them into a training set and a test set. The training set
contains 681 866 reactions in patents ﬁled before ones in the test set. We use the training set to create
databases of reaction rules and starting materials  and train a neural network.

2https://bitbucket.org/dan2097/patent-reaction-extraction/downloads
3https://www.rdkit.org/

6

We automatically construct reaction rules  as commonly done in the literature  e.g.  [19  29]. We
keep only the largest molecule in the product of each reaction. From each reaction  we then extract a
reaction core and its direct neighbors as a candidate for a reaction rule. If that candidate appears at
least 8 times in the training set  we keep it. We obtain 1550 reaction rules. Molecules present in the
training set are included in the starting material database  which ends up having 977 435 molecules.
The training set of Segler et al. [29] is more than 18 times larger than ours (12.4 million version 681
