2019,Elliptical Perturbations for Differential Privacy,We study elliptical distributions in locally convex vector spaces  and determine conditions when they can or cannot be used to satisfy differential privacy (DP). A requisite condition for a sanitized statistical summary to satisfy DP is that the corresponding privacy mechanism must induce equivalent probability measures for all possible input databases. We show that elliptical distributions with the same dispersion operator  $C$  are equivalent if the difference of their means lies in the Cameron-Martin space of $C$. In the case of releasing finite-dimensional summaries using elliptical perturbations  we show that the privacy parameter $\ep$ can be computed in terms of a one-dimensional maximization problem. We apply this result to consider multivariate Laplace  $t$  Gaussian  and $K$-norm noise. Surprisingly  we show that the multivariate Laplace noise does not achieve $\ep$-DP in any dimension greater than one. Finally  we show that when the dimension of the space is infinite  no elliptical distribution can be used to give $\ep$-DP; only $(\epsilon \delta)$-DP is possible.,Elliptical Perturbations for Differential Privacy

Matthew Reimherr ∗
Department of Statistics

Pennsylvania State University

University Park  PA 16802

mreimherr@psu.edu

Department of Statistics

Pennsylvania State University

University Park  PA 16802

Jordan Awan †

awan@psu.edu

Abstract

We study elliptical distributions in locally convex vector spaces  and determine
conditions when they can or cannot be used to satisfy differential privacy (DP).
A requisite condition for a sanitized statistical summary to satisfy DP is that the
corresponding privacy mechanism must induce equivalent probability measures
for all possible input databases. We show that elliptical distributions with the
same dispersion operator  C  are equivalent if the difference of their means lies
in the Cameron-Martin space of C. In the case of releasing ﬁnite-dimensional
summaries using elliptical perturbations  we show that the privacy parameter 
can be computed in terms of a one-dimensional maximization problem. We apply
this result to consider multivariate Laplace  t  Gaussian  and K-norm noise. Sur-
prisingly  we show that the multivariate Laplace noise does not achieve -DP in
any dimension greater than one. Finally  we show that when the dimension of the
space is inﬁnite  no elliptical distribution can be used to give -DP; only (  δ)-DP
is possible.

1

Introduction

Inﬁnite dimensional objects and parameters arise commonly in nonparametric statistics  shape anal-
ysis  and functional data analysis. Several recent works have made strides towards extending tools
for differential privacy (DP) to handle such settings. Some of the ﬁrst results in this area were given
in Hall et al. (2013)  with a particular emphasis on Gaussian perturbations and point-wise releases of
statistical summaries represented as univariate functions. This work was extended to more general
Banach and Hilbert space based summaries by Mirshani et al. (2017)  which included protections for
public releases based on path level summaries  nonlinear transformations of functional summaries 
and full function releases as well. However  Gaussian perturbations are not always satisfactory since
they cannot be used to achieve pure DP (-DP)  which requires heavier tailed distributions. Rather 
for pure DP  the most popular distribution is the Laplace mechanism  whose tails are “just right" for
achieving DP in ﬁnite dimensional summaries (Dwork et al.  2006).
When one moves from univariate to multivariate settings  generalizing the Laplace mechanism is
not as simple as generalizing the Gaussian. Often  when the Laplace mechanism is used in mul-
tivariate settings  iid Laplace random variables are used. However  this approach fails to capture
the multivariate dependence structure of the data or parameter of interest. Furthermore  in inﬁnite
dimensional settings  adding iid noise is usually not an option if one wishes to remain in a particular
function space. To address these issues  we study the use of elliptical distributions to satisfy DP 
which allow for a dispersion operator and are closely related to Gaussian distributions. Elliptical
∗Research supported in part by NSF DMS 1712826  NSF SES 1853209  and the Simons Institute for the
†Research supported in part by NSF SES-153443 and NSF SES-1853209.

Theory of Computing at UC Berkeley.

33rd Conference on Neural Information Processing Systems (NeurIPS 2019)  Vancouver  Canada.

processes offer a nice option for designing DP mechanisms for multivariate and inﬁnite-dimensional
data as they allow for the customization of both the tail behavior and dependence structure  which
can be tailored to the problem at hand. Recently Bun and Steinke (2019) explored several alterna-
tive univariate distributions for achieving privacy such as Cauchy  Student’s T  Laplace Log-Normal 
Uniform Log-Normal  and Arsinh-Normal  which can be extended to elliptical distributions.
We are interested in releasing a sanitized version of a statistic T : D → X  where D is a metric
space  representing the space of possible input databases  D  and X is a locally convex vector space.

To achieve differential privacy  we will release (cid:101)T = T (D) + σX  where σ is a positive scalar  and X

is a random element of X. In particular  we consider X which are drawn from elliptical distributions 
of which the multivariate Laplace and Gaussian distributions are special cases. Most linear spaces
are locally convex vector spaces  including all Hilbert Spaces  Banach Spaces  Frechet spaces  and
product spaces of normed vector spaces  meaning that our results will hold quite broadly.
We consider the setting where the statistical summary and privacy mechanism are truly inﬁnite
dimensional  meaning that the problem cannot be embedded into a ﬁnite dimensional subspace
where multivariate privacy tools can be used. There are both interesting mathematical and practical
motivations for this perspective. First  our setting can be viewed as a limit of multivariate problems;
if one has privacy over the full inﬁnite dimensional space  then this ensures that the noise is well
behaved when releasing multivariate summaries  regardless of how many are released. Second  one
does not need to ensure that every database uses the same ﬁnite dimensional subspace  allowing
practitioners to use whatever methods and summaries they prefer. And third  our setting is very
convenient when addressing multiple queries. In particular  one does not need to spend a fraction of
the privacy budget for every query. Instead  the amount spent for each subsequent query decreases
dramatically  eventually leveling out to a maximum  or (  δ). To accomplish this  one does not
need to “store” the inﬁnite dimensional noise  instead  we can generate as much of the noise as is
needed for a particular query while conditioning on any noise values generated for prior queries.
We also provide a surprising result showing that -DP can only be achieved for a ﬁnite number of
summaries or point-wise evaluations; in inﬁnite dimensions no elliptical perturbation is capable of
achieving -DP over the full function space  one can only achieve (  δ)-DP. This is in stark contrast
with what is known from the univariate or multivariate literature on DP.
While elliptical distributions are being used more frequently in statistics and machine learning (e.g.
Schmidt  2003; Frahm et al.  2003; Soloveychik and Wiesel  2014; Couillet et al.  2016; Sun et al. 
2016; Goes et al.  2017; Ollila and Raninen  2019)  some fundamental questions regarding elliptical
distributions in function spaces remain underdeveloped. For data privacy  the question of equiva-
lence/orthogonality of elliptical measures is particularly important. In terms of data privacy  if a
perturbation in a dataset produces a private summary that is orthogonal (in a probabilistic sense) to
the old one  then the summaries cannot be differentialy private since they can be distinguished with
probability one. We show that several conditions for making this determination transfer nicely from
the Gaussian setting  but not all. While conditions on the location function remain the same  con-
ditions on the dispersion function change. Furthermore  that all elliptical measures are equivalent
or orthogonal need no longer hold without additional assumptions. Regardless  for the purposes of
privacy  determining equivalence/orthogonality based on the location is the primary requirement.
Related Work: Our general approach of adding noise from a data-independent distribution to a
summary statistic is one of the simplest and most common methods of achieving DP. This approach
was ﬁrst developed using the Laplace mechanism (Dwork et al.  2006)  and has since been expanded
to include a larger variety of distributions. Ghosh et al. (2009) showed that when the data is a count 
then the optimal noise adding distribution is discrete Laplace. Geng and Viswanath (2016) extended
this result to the continuous setting  developing the staircase distribution which is closely related to
discrete Laplace. In the multivariate setting  the most common solution is to add iid Laplace noise
to each coordinate (Dwork and Roth  2014). However  Hardt and Talwar (2010) and Awan and
Slavkovi´c (2019) demonstrate that capturing the covariance structure in the data  via the K-norm
mechanism can substantially reduce the amount of noise required.
After adding noise to summary statistics  researchers have shown that many complex statistical and
machine learning tasks can be produced by post-processing  such as linear regression (Zhang et al. 
2012)  maximum likelihood estimation (Karwa and Slavkovi´c  2016)  hypothesis testing (Vu and
Slavkovi´c  2009; Gaboardi et al.  2016; Awan and Slavkovi´c  2018)  posterior inference (Williams
and Mcsherry  2010; Karwa et al.  2016)  or general asymptotic analysis (Wang et al.  2018).

2

To date  the only additive mechanism in inﬁnite-dimensions is the Gaussian mechanism  developed
by Hall et al. (2013) and Mirshani et al. (2017). However  there has been other work on developing
privacy tools for these spaces. Awan et al. (2019) show that the exponential mechanism (McSherry
and Talwar  2007) can be used in arbitrary Hilbert spaces  by integrating with respect to a ﬁxed
probability measure such as a Gaussian process. An alternative approach proposed by Alda and
Rubinstein (2017) uses Bernstein polynomial approximations to release private functions. Recently 
Smith et al. (2018) utilized the techniques of Hall et al. (2013) to develop private Gaussian process
regression. Similar to the pufferﬁsh approach (Kifer and Machanavajjhala  2014)  they assume that
the predictors are public  and use the known covariance structure to tailor the noise distribution.
Organization: In Section 2  we review the necessary background on locally convex vector spaces 
elliptical distributions  and differential privacy. In Section 3  we study the equivalence and orthog-
onality of elliptical measures  and give a condition that ensures that two elliptical measures are
equivalent. In Section 4  we investigate using elliptical perturbations to achieve DP. First  we con-
sider the ﬁnite dimensional case in Section 4.1  and in Theorem 3 we give a condition for elliptical
perturbations to satisfy -DP as well as a method of computing . In Section 4.2 we show that if the
dimension of the space is inﬁnite  then no elliptical perturbation can satisfy -DP. In fact  we show
that every elliptical distribution can only achieve (  δ)-DP for a positive δ. We give short proof
sketches throughout the document  with detailed proofs left to the Supplementary Material.

2 Elliptical Distributions
Elliptical distributions  whether over Rd or a more general vector space can be deﬁned in a variety
of equivalent ways. Intuitively  an elliptical distribution is one in which its density contours form
hyperellipses. However  this presupposes that the measure is absolutely continuous with respect to
Lebesgue measure. Thus  it is often useful in multivariate settings to use alternative deﬁnitions that
are more easy to generalize  but which are equivalent to the shape of the density contours when they
exist. This is not unique to elliptical measures  such alternative deﬁnitions are often useful when
working with inﬁnite dimensional objects (e.g. Bosq  2000). Throughout  we focus our attention on
an arbitrary  real  locally convex vector space (from here on LCS)  X  but we will restrict ourselves
to simpler spaces (e.g. Banach  Hilbert  or Euclidean spaces) as needed or for illustration. For
ease of reference  recall the following concepts from functional analysis (see Rudin (1991) for an
introduction).

those operations are well deﬁned).

• A set  X  is called a vector space if it is closed under addition and scalar multiplication (and
• A vector space  X  is called a topological vector space  if it is equipped with a topology
under which addition and scalar multiplication are continuous.
• A topological vector space X is called locally convex if its topology is generated by a
separated family of semi-norms  {pα : α ∈ I}  where I is an arbitrary index set and
separated means that for all nonzero x ∈ X there exists α ∈ I such that pα(x) (cid:54)= 0. A base
for the topology is given by sets of the form Aα  = {x ∈ X : pα(x) < }.

• The topological dual  X∗  is the collection of all continuous linear functionals on X.

The assumption that the seminorms are separated is not always included in the deﬁnition  but is
equivalent to assuming that the space is Hausdorff. Recall that a topology deﬁnes the open sets  a
collection of subsets that is closed under uncountable unions  ﬁnite intersections  and contains both
X and ∅. We use this level of generality to include as many settings as possible into our framework.
In particular  all ﬁnite dimensional Euclidean spaces  normed vector spaces  Hilbert Spaces  Banach
Spaces  and Frechet spaces are types of LCS. In addition  uncountable product spaces of normed
spaces  which are often used in the mathematical foundations of stochastic processes  are LCS as
well (when equipped with the product topology). To ﬁnd practical examples of spaces that are not
locally convex spaces  one either has to consider nonlinear spaces  such as manifolds  or equip a
space with an “odd" metric (such as Lp for p < 1).
Example 1 (LCS Examples). The deﬁnition of LCS in terms of seminorms is perhaps unintuitive
at ﬁrst  but can be motivated by product spaces such as R[0 1] = {f : [0  1] → R}. The space R[0 1]
is in a sense “too large” to accommodate a norm  but it is easy to deﬁne a family of semi-norms
that measure the magnitude of the function coordinate-wise. Here α ∈ I := [0  1] and we deﬁne

3

pα(f ) = |f (α)|. Note that for any particular α  pα is not a norm  since pα(f−g) = 0 does not imply
that f = g. However  the entire collection of semi-norms separates points since pα(f − g) = 0 for
all α ∈ [0  1] implies that f = g.
It is easy to see that any normed space ﬁts the deﬁnition of LCS. For C[0  1]  we set I = {1} and

deﬁne p1(f ) = supt∈[0 1] |f (t)|  and for L2[0  1] we set I = {1} and deﬁne p1(f ) =(cid:82) f 2(t)dt.

When working with a LCS one commonly uses one of two σ-algebras. The Borel σ-algebra  B  is the
smallest σ-algebra that contains the open sets. The cylinder σ-algebra  C  is the smallest σ-algebra
that makes all continuous linear functionals measurable. In general we have C ⊆ B  but these two
σ-algebras are not equal unless the space has additional structure  e.g. separable Banach spaces.
This creates complications in inﬁnite dimensional settings. For example  the technical theory for
stochastic processes often starts with product spaces such as R[0 1]. There  the two sigma algebras
are not the same  which is an issue for privacy as one desires privacy over B  not just C. This
is because only the events in the chosen σ-algebra are protected  and a larger σ-algebra offers a
stronger privacy guarantee. More importantly  C does not contain most sets of interest  including
continuous functions  linear functions  polynomials  constant functions  etc.
(Billingsley  1979 
Problem 36.6). To overcome this challenge  Mirshani et al. (2017) used Cameron-Martin theory  to
obtain DP over all of B through careful use of densities in inﬁnite dimensional spaces. This theory
is built upon Gaussian processes; however  we will show that several of their key results  especially
those needed for privacy  extend directly to elliptical distributions. Throughout this paper  we assume
X is equipped with its Borel σ-algebra when discussing measures  measurability  and DP.
Often it is convenient to deﬁne probability measures over abstract spaces in terms of their character-
istic functionals (i.e. Fourier transforms)  which uniquely determine measures in any LCS.
Deﬁnition 1 (Fang  2017). A measure  P   over a locally convex space X is called elliptical if and

only if its characteristic functional  (cid:101)P : X∗ → C  has the form

exp{ig(x)} dP (x) = eig(µ)φ0(C(g  g)) 

(cid:101)P (g) =

(cid:90)

X

where µ ∈ X  C is a symmetric  positive deﬁnite  continuous bilinear form on X∗ × X∗  and φ0 is a
positive deﬁnite function over R  which is continuous at 0 and satisﬁes φ0(0) = 1.
Deﬁnition 1 implies that the distribution of P is uniquely determined by knowing µ  C  and φ0. The
object µ denotes the center of the distribution; we will say a distribution is centered if µ = 0. The
object C is often called the covariance or dispersion operator. In general  C can either be identiﬁed
as an operator or bilinear form (in fact a (0  2) tensor). We avoid introducing extra notation we will
let C(g) denote the operator version and C(f  g) the bilinear form.
We begin by presenting a second characterization of elliptical measures. This is a well known result 
but we are unaware of a reference for this level of generality. We cite Fang (2017)  which covers the
multivariate case  but the proof is the same for general LCS.
Theorem 1 (Fang  2017). Let X ∈ X be an elliptically distributed random variable. Then there
exists a mean zero Gaussian process Z ∈ X with covariance operator C  an element µ ∈ X  and a
strictly positive random variable V ∈ R+  that is independent of Z  and satisﬁes X
This result is often phrased as “every elliptical distribution is a scalar mixture of Gaussian pro-
cesses." While it is  of course  a fascinating result in its own right  it also provides a simple method
of generating and simulating from arbitrary elliptical distributions.
Due to this corollary  we will index every elliptical measure using µ  C  and the mixing distribution
of V   which we will denote as ψ  and use the notation E(µ  C  ψ). Equivalently  we could index
using the φ0 from Deﬁnition 1  but our results in Section 3 are easier to present in terms of ψ.
We conclude by stating a general deﬁnition of DP  which makes sense over any measurable space 
though we state it here for LCS. The concept of differential privacy was ﬁrst introduced in Dwork
et al. (2006) and Dwork (2006). Over time researchers have worked to make the deﬁnition more
precise and ﬂexible  such as Wasserman and Zhou (2010) who state it in terms of conditional distri-
butions. For a general  axiomatic treatment of formal privacy  see Kifer et al. (2012).
Deﬁnition 2. Let (D  d) be a metric space and {PD : D ∈ D} be a family of probability measures
over a locally convex topological vector space X. We say the family achieves (  δ)-differential

L
= µ + V Z.

4

privacy if for any d(D  D(cid:48)) ≤ 1 and any measurable A  we have
PD(A) ≤ ePD(cid:48)(A) + δ.

(1)
Intuitively  D represents the universe of possible input databases. One then refers to {PD : D ∈ D}
as the privacy mechanism. The most common setting when discussing DP is when D is a product
space and the metric is the Hamming distance. However  the Hamming distance (which counts
differences in coordinates) is insensitive to the magnitude of the difference between two inputs D
and D(cid:48)  thus one may wish to consider alternatives and so we take the more general approach. As
discussed earlier  while DP can be deﬁned with any σ-algebra  we assume that X is equipped with
the Borel σ-algebra as it offers more intuitive guarantees. We refer to (  δ)-DP as approximate DP
when δ > 0 and as pure-DP when δ = 0. When using pure DP  we often just write -DP.
Another way of viewing -DP (that is  taking δ = 0) is through the equivalence/orthogonality of
probability measures. As was discussed in Awan et al. (2019)  in an -DP mechanism the individual
measures that make up the mechanism are all equivalent in a probabilistic sense (meaning they agree
on the zero sets). Conversely  if the measures are orthogonal then the mechanism cannot even be
(  δ)-DP. This perspective was used in Mirshani et al. (2017) for the case of Gaussian mechanisms.
However  the corresponding theory for elliptical distributions is less developed. In the next section
we extend several fundamental results of Gaussian processes to elliptical distributions.

3 Equivalence and Orthogonality of Elliptical Measures

A classic result from probability theory is that any two Gaussian processes are either equivalent or
orthogonal (that is  as probability measures they either agree on the zero sets or concentrate their
mass on disjoint sets). Recall that by the Radon-Nikodym theorem  if two measures are equivalent
then there exists a density of one with respect to the other (and vice versa). What we will now show
is that this property  to a degree  extends to any elliptical family. Furthermore  we will show that
the conditions for establishing this equivalence/orthogonality are nearly the same as for Gaussian
processes. We begin with a fairly simple yet surprisingly useful technical lemma.
Lemma 1. Let (Ω F  P ) be a probability space. Let X 1 : Ω → X and X 2 : Ω → X denote two
random elements of X  and let T 1 : Ω → R and T 2 : Ω → R be two random variables. Let P i
denote the probability measure over X induced by X i and let Qi denote the measure over R induced
t denote the conditional measure of X i given T i = t. If Q1 and Q2 are equivalent and
by T i. Let P i
t and P 2
P 1

t are equivalent for almost all t (wrt Q1) then so are P 1 and P 2.

0 and P 1

0 = P 1

1 are orthogonal and set P 2

Implicit in Lemma 1 is that the con-
The proof of Lemma 1 is in the Supplementary Material.
ditional distributions exist. This is not an issue in our setting as the conditional distributions can
be explicitly constructed for elliptical processes  however  for general processes and spaces one
can encounter nontrivial technical problems. We refer the interested reader to Hoffmann-Jørgensen
(1972)  Bogachev (1998  THM A.3.11)  and Kallenberg (2006  Chapter 6) for further discussion.
Interestingly  the reverse statement is not true. That is  even if all of the conditional distributions
are orthogonal  the unconditional measures need not be orthogonal. To see this  suppose that T is
1 and
0 or 1 with equal probability. Now  assume that P 1
0 . Clearly the conditional distributions are orthogonal  but not only are the unconditional
1 = P 1
P 2
measures equivalent  they are actually the same!
Regardless  our goal is more speciﬁc; we want to establish conditions under which E(µ1  C  ψ) and
E(µ2  C  ψ) are orthogonal when they share the same ψ and C. In terms of DP  µ1 and µ2 represent
the private summary from two different databases. If ψ is a point mass  then the two measures are
Gaussian and the conditions are known. The question is  to what degree do such conditions extend
to other mixtures? Theorem 2 shows that the same conditions for Gaussian processes (with the same
covariance  but different means) apply to any elliptical family. Given Corollary 1  this may seem
obvious  but Lemma 1 implies that the matter is surprisingly delicate. For example  two Gaussian
processes with the same mean  but where one has a covariance equal to a scalar c (cid:54)= 1 multiple of
the other  are actually orthogonal (in inﬁnite dimensions). This need not hold for arbitrary elliptical
families as the scalar can be absorbed by the mixing coefﬁcient (and then apply Lemma 1).
Our ﬁrst major result establishes a condition under which DP cannot be achieved  regardless of
the magnitude of the noise. First  let us deﬁne a subspace of X using the bilinear form C (more

5

product (cid:104)· ·(cid:105)K on the dual space X∗ given by (cid:104)f  g(cid:105)K := C(f  g) = (cid:82) f (x)g(x)dP (x)  where P

detail can be found in Bogachev (1998); Mirshani et al. (2017)). In particular  C induces an inner
is a Gaussian measure with mean zero and covariance C. Then  we can view X∗ as a subspace of
L2(X  P )  the space of P -square integrable functions from X → R. By assumption  (cid:104)· ·(cid:105)K is a
continuous  symmetric  and positive deﬁnite bilinear form and thus a valid inner product. However 
X∗ is not complete with respect to this inner product when X is inﬁnite dimensional  so let K denote
its completion. Finally  consider the subset H ⊂ X  such that for h ∈ H the operation Th : K → R
given by Th(g) := g(h) is continuous in the K topology. Then H is called the Cameron-Martin
space of C (or equivalently  of the mean zero Gaussian process with C as its covariance). Intuitively 
the functionals in K are much “rougher" than those in X∗ and thus the elements of H are much more
