2016,Catching heuristics are optimal control policies,Two seemingly contradictory theories attempt to explain how humans move to intercept an airborne ball. One theory posits that humans predict the ball trajectory to optimally plan future actions; the other claims that  instead of performing such complicated computations  humans employ heuristics to reactively choose appropriate actions based on immediate visual feedback. In this paper  we show that interception strategies appearing to be heuristics can be understood as computational solutions to the optimal control problem faced by a ball-catching agent acting under uncertainty. Modeling catching as a continuous partially observable Markov decision process and employing stochastic optimal control theory  we discover that the four main heuristics described in the literature are optimal solutions if the catcher has sufficient time to continuously visually track the ball. Specifically  by varying model parameters such as noise  time to ground contact  and perceptual latency  we show that different strategies arise under different circumstances. The catcher's policy switches between generating reactive and predictive behavior based on the ratio of system to observation noise and the ratio between reaction time and task duration. Thus  we provide a rational account of human ball-catching behavior and a unifying explanation for seemingly contradictory theories of target interception on the basis of stochastic optimal control.,Catching heuristics are optimal control policies

Boris Belousov*  Gerhard Neumann*  Constantin A. Rothkopf**  Jan Peters*

*Department of Computer Science  TU Darmstadt

**Cognitive Science Center & Department of Psychology  TU Darmstadt

Abstract

Two seemingly contradictory theories attempt to explain how humans move to
intercept an airborne ball. One theory posits that humans predict the ball trajectory
to optimally plan future actions; the other claims that  instead of performing such
complicated computations  humans employ heuristics to reactively choose appro-
priate actions based on immediate visual feedback. In this paper  we show that
interception strategies appearing to be heuristics can be understood as computa-
tional solutions to the optimal control problem faced by a ball-catching agent acting
under uncertainty. Modeling catching as a continuous partially observable Markov
decision process and employing stochastic optimal control theory  we discover
that the four main heuristics described in the literature are optimal solutions if the
catcher has sufﬁcient time to continuously visually track the ball. Speciﬁcally  by
varying model parameters such as noise  time to ground contact  and perceptual
latency  we show that different strategies arise under different circumstances. The
catcher’s policy switches between generating reactive and predictive behavior based
on the ratio of system to observation noise and the ratio between reaction time
and task duration. Thus  we provide a rational account of human ball-catching
behavior and a unifying explanation for seemingly contradictory theories of target
interception on the basis of stochastic optimal control.

Introduction

1
Humans exhibit impressive abilities of intercepting moving targets as exempliﬁed in sports such as
baseball [6]. Despite the ubiquity of this visuomotor capability  explaining how humans manage to
catch ﬂying objects is a long-standing problem in cognitive science and human motor control. What
makes this problem computationally difﬁcult for humans are the involved perceptual uncertainties 
high sensory noise  and long action delays compared to artiﬁcial control systems and robots. Thus 
understanding action generation in human ball interception from a computational point of view
may yield important insights on human visuomotor control. Surprisingly  there is no generally
accepted model that explains empirical observations of human interception of airborne balls. McIn-
tyre et al. [15] and Hayhoe et al. [13] claim that humans employ an internal model of the physical
world to predict where the ball will hit the ground and how to catch it. Such internal models allow for
planning and potentially optimal action generation  e.g.  they enable optimal catching strategies where
humans predict the interception point and move there as fast as mechanically possible to await the ball.
Clearly  there exist situations where latencies of the catching task require such strategies (e.g.  when
a catcher moves the arm to receive the pitcher’s ball). By contrast  Gigerenzer & Brighton [11] argue
that the world is far too complex for sufﬁciently precise modeling (e.g.  a catcher or an outﬁelder
in baseball would have to take air resistance  wind  and spin of the ball into account to predict its
trajectory). Thus  humans supposedly extract few simple but robust features that sufﬁce for successful
execution of tasks such as catching. Here  immediate feedback is employed to guide action generation
instead of detailed modeling. Policies based on these features are called heuristics and the claim
is that humans possess a bag of such tricks  the “adaptive toolbox”. For a baseball outﬁelder  a
successful heuristic could be “Fix your gaze on the ball  start running  and adjust your running speed
so that the angle of gaze remains constant” [10]. Thus  at the core  ﬁnding a unifying computational
account of the human interception of moving targets also contributes to the long-lasting debate about
the nature of human rationality [20].

30th Conference on Neural Information Processing Systems (NIPS 2016)  Barcelona  Spain.

In this paper  we propose that these seemingly contradictory views can be uniﬁed using a single
computational model based on a continuous partially observable Markov decison process model
(POMDP). In this model  the intercepting agent is assumed to choose optimal actions that take
uncertainty about future movement into account. This model prescribes that both the catcher and the
outﬁelder act optimally for their respective situation and uncertainty. We show that an outﬁelder agent
using a highly stochastic internal model for prediction will indeed resort to purely reactive polices
resembling established heuristics from the literature. The intuitive reason for such short-sighted
behavior being optimal is that ball predictions over sufﬁciently long time horizons with highly
stochastic models effectively become guessing. Similarly  our model will yield optimally planned
actions based on predictions if the uncertainty encountered by the catcher agent is low while the
latency is non-negligible in comparison to the movement duration. Moreover  we identify catching
scenarios where the only strategy to intercept the ball requires to turn away from it and run as fast as
possible. While such strategies cannot be explained by the heuristics proposed so far  the optimal
control approach yields a plausible policy exhibiting both reactive and feedforward behavior. While
other motor tasks (e.g.  reaching movements [9  22]  locomotion [1]) have been explained in terms of
stochastic optimal control theory  to the best of our knowledge this paper is the ﬁrst to explain ball
catching within this computational framework. We show that the four previously described empirical
heuristics are actually optimal control policies. Moreover  our approach allows predictions for settings
that cannot be explained by heuristics and have not been studied before. As catching behavior has
previously been described as a prime example of humans not following complex computations but
using simple heuristics  this study opens an important perspective on the fundamental question of
human rationality.
2 Related work
A number of heuristics have been proposed to explain how humans catch balls  see [27  8  16] for an
overview. We focus on three theories well-supported by experiments: Chapman’s theory  the general-
ized optic acceleration cancellation (GOAC) theory  and the linear optical trajectory (LOT) theory.
Chapman [6] considered a simple kinematic problem (see Fig-
ure 1) where the ball B follows a parabolic trajectory B0:N
while the agent C follows C0:N to intercept it. Only the position
of the agent is relevant—his gaze is always directed towards the
ball. Angle α is the elevation angle; angle γ is the bearing angle
with respect to direction C0B0 (or C2G2 which is parallel). Due
to delayed reaction  the agent starts running when the ball is
already in the air. Chapman proposed two heuristics  i.e.  the
optic acceleration cancellation (OAC) that prescribes maintain-
ing d tan α/dt = const  and the constant bearing angle (CBA) 
which requires γ = const. However  Chapman did not explain
how these heuristics cope with disturbances and observations.
To incorporate visual observations  McLeod et al. [16] intro-
duced the ﬁeld of view of the agent into Chapman’s theory and
coupled the agent’s running velocity to the location of the ball
in the visual ﬁeld. Instead of the CBA heuristic  a tracking
heuristic is employed to form the generalized optic acceleration
cancellation (GOAC) theory. This tracking heuristic allows re-
actions to uncertain observations. In our example in Figure 1 
Figure 1: Well-known heuristics.
the agent might have moved from C0 to C2 while maintaining a
constant γ. To keep fulﬁlling this heuristic  the ball needs to arrive at B2 at the same time. However 
if the ball is already at B(cid:48)
2  the agent will see it falling into the right side of his ﬁeld of view and he
will speed up. Thus  the agent internally tracks the angle δ between CD and C0B0 and attempts to
adjust δ to γ.
In Chapman’s theory and the GOAC theory  the elevation angle α and the bearing angle γ are
controlled independently. As such  separate control strategies are implausible  therefore McBeath
et al. [14] proposed the linear optical trajectory (LOT) heuristic that controls both angles jointly.
LOT suggests that the catching agent runs such that the projection of the ball trajectory onto the
plane perpendicular to the direction CD remains linear  which implies that ζ = ∠E2B0F2 remains
constant. As tan ζ = tan α2/ tan β2 can be observed from the pyramid B0F2C2E2 with the right
angles at F2  there exist a coupling between the elevation angle α and the horizontal optical angle β
(deﬁned as the angle between CB0 and CD)  which can be used for directing the agent.

2

In contrast to the literature on outﬁelder’s catching in baseball  other strands of research in human
motor control have focused on predictive models [17] and optimality of behavior [9  22]. Tasks
similar to the catcher’s in baseball have yielded evidence for prediction. Humans were shown to
anticipate where a tennis ball will hit the ﬂoor when thrown with a bounce [13]  and humans also
appear to use an internal model of gravity to estimate time-to-contact when catching balls [15].
Optimal control theory has been used to explain reaching movements (with cost functions such
as minimum-jerk [9]  minimum-torque-change [23] and minimum end-point variance [12])  motor
coordination [22]  and locomotion (as minimizing metabolic energy [1])
3 Modeling ball catching under uncertainty as an optimal control problem
To parsimoniously model the catching agent  we rely on an optimal control formulation (Sec. 3.1)
where the agent is described in terms of state-transitions  observations and a cost function (Sec. 3.2).
3.1 Optimal control under uncertainty
In optimal control  the interaction of the agent with the environment is described by a stochastic
dynamic model or system (e.g.  describing ball ﬂight and odometry). The system’s state

xk+1 = f (xk  uk) + k+1 

k = 0 . . . N − 1 

zk = h(xk) + δk 

k = 1 . . . N 

(1)
at the next time step k + 1 is given as a noisy function of the state xk ∈ Rn and the action uk ∈ Rm
at the current time step k. The mean state dynamics f are perturbed by zero-mean stationary white
Gaussian noise k ∼ N (0  Q) with a constant system noise covariance matrix Q modeling the
uncertainty in the system (e.g.  the uncertainty in the agent’s and ball’s positions).
The state of the system is not always fully observed (e.g.  the catching agent can only observe a
ball when he looks at it)  lower-dimensional than the system’s state (e.g.  only ball positions can
directly be observed) and the observations are generally noisy (e.g.  visuomotor noise affects ball
position estimates). Thus  at every time step k  sensory input provides a noisy lower-dimensional
measurement zk ∈ Rp of the true underlying system state xk ∈ Rn with p < n described by
(2)
where h is a deterministic observation function and δk ∼ N (0  Rk) is zero-mean non-stationary
white Gaussian noise with a state-dependent covariance matrix Rk = R(xk). For catching  such
state-dependency is crucial to modeling the effect of the human visual ﬁeld. When the ball is
at its center  measurements are least uncertain; whereas when the ball is outside the visual ﬁeld 
observations are maximally uncertain.
The agent obviously can only generate actions based on the observations collected so far  while
affecting his and the environment’s true next state. The history of observations allows forming
probability distributions over the state at different time-steps called beliefs. Taking the uncertainty
in (1) and (2) into account  the agent needs to plan and control in the belief space (i.e.  the space of
probability distributions over states) rather than in the state space. We approximate belief bk about
the state of the system at time k by a Gaussian distribution with mean µk and variance Σk. For
brevity  we write bk = (µk  Σk)  associating the belief with its sufﬁcient statistics. Belief dynamics
(bk−1  uk−1  zk) → bk is approximated by the extended Kalman ﬁlter [21  Chapter 3.3].
A cost function J can be a parsimonious description of the agent’s objective. The agent will choose
the next action by optimizing such a cost function with respect to all future actions at every time-step.
To make the resulting optimal control computations numerically tractable  future observations need
to be assumed to coincide with their most likely values (see e.g.  [19  5]). Thus  at every time step 
the agent solves a constrained nonlinear optimization problem
J(µ0:N   Σ0:N ; u0:N−1)
uk ∈ Ufeasible 
µk ∈ Xfeasible 

which returns an optimal sequence of controls u0:N−1 minimizing the objective function J. The
agent executes the ﬁrst action  obtains a new observation  and replans again; such an approach is
known as model predictive control. The policy resulting from such computations is sub-optimal
because of open-loop planning and limited time horizon  but with growing time horizon it approaches
the optimal policy. Reaction time τr can be incorporated by delaying the observations. An interesting
property of this model is that the catching agent decides on his own in an optimal way when to gather
information by looking at the ball and when to exploit already acquired knowledge depending on the
level of uncertainty he agrees to tolerate.

k = 0 . . . N − 1 
k = 0 . . . N 

min
u0:N−1
s.t.

(3)

3

3.2 A computational model of the catching agent for belief-space optimal control
Here we explain the modeling assumptions concerning states  actions  state transitions  and observa-
tions. After that we describe the cost function that the agent has to minimize.

States and actions. The state of the system x consists of the location and velocity of the ball in
3D space  the location and velocity of the catching agent in the ground plane  and the agent’s gaze
direction represented by a unit 3D vector. The agent’s actions u consist of the force applied to the
center of mass and the rate of change of the gaze direction.
State transitions and observations. Several model components are essential to faithfully describe
catching behavior. First  the state transfer is described by the damped dynamics of the agent’s center
of mass ¨rc = F − λ ˙rc  where rc = [x  y] are the agent’s Cartesian coordinates  F is the applied
force resulting from the agent’s actions  and λ is the damping coefﬁcient. Damping ensures that the
catching agent’s velocity does not grow without bound when the maximum force is applied. The
magnitude of the maximal force and the friction coefﬁcient are chosen to ﬁt Usain Bolt’s sprint
data1. Second  the gaze vector’s direction d is controlled through the ﬁrst derivatives of the two
angles that deﬁne it. These are the angle between d and its projection onto the xy-plane and the
angle between d’s projection onto the xy-plane and the x-axis. Such parametrization of the actions
allows for realistically fast changes of gaze direction. Third  the maximal running speed depends
on the gaze direction  e.g.  running backwards is slower than running forward or even sideways.
This relationship can be incorporated through dependence of the maximal applicable force F max
on the direction d. It can be expressed by limiting the magnitude of the maximal applicable force
|F max(θ)| = F1 + F2 cos θ  where θ is the angle between F (i.e.  the direction into which the catcher
accelerates) and the projection of the catcher’s gaze direction d onto the xy-plane. The parameters F1
and F2 are chosen to ﬁt human data on forward and backwards running2. The resulting continuous
time dynamics of agent and ball are converted into discrete time state transfers using the classical
Runga-Kutta method. Fourth  the observation uncertainty depends on the state  which reﬂects the
fact that humans’ visual resolution falls off across the visual ﬁeld with increasing distance from the
fovea. When the ball falls to the side of the agent’s ﬁeld of view  the uncertainty about ball’s position
grows according to σ2
min) depending on the distance to the ball s and
the angle Ω between gaze direction d and the vector pointing from the agent towards the ball. The
parameters {σmin  σmax} control the scale of the noise. The ball is modeled as a parabolic ﬂight
b .
perturbed by Gaussian noise with variance σ2
Cost function. The catching agent has to trade-off success (i.e.  catching the ball) with effort.
In other words  he aims at maximizing the probability of catching the ball with minimal effort. A
ball is assumed to be caught if it is within reach  i.e.  not further away from the catching agent
than εthreshold at the ﬁnal time. Thus  the probability of catching the ball can be expressed as
Pr(|µb − µc| ≤ εthreshold)  where µb and µc are the predicted positions of the ball and the agent at
the ﬁnal time (i.e.  parts of the belief state of the agent). Since such beliefs are modeled as Gaussians 
this probability has a unique global maximum at µb = µc and ΣN → 0+. Therefore  a ﬁnal cost
2 + w1 tr ΣN can approximate the negated log-probability of successfully
Jﬁnal = w0(cid:107)µb − µc(cid:107)2
catching the ball while rendering the optimal control problem solvable. The weights w0 and w1
are set to optimally approximate this negated log-probability. The desire of the agent to be energy
k M uk with the ﬁxed
duration τ of the discretized time steps and a diagonal weight matrix M to trade-off controls. Finally 
we add a term that penalizes agent’s uncertainty at every time step Jrunning = τ w2
k=0 tr Σk that
encodes the agent preference of certainty over uncertainty. It appears naturally in optimal control
problems when the maximum likelihood observations assumption is relaxed [24] and captures how
ﬁnal uncertainty distributes over the preceding time steps  but has to be added explicitly within
the model predictive control framework in order to account for replanning at every time step. The
complete cost function is thus given by the sum
(cid:125)
J = Jﬁnal+Jrunning+Jenergy = w0(cid:107)µb−µc(cid:107)2

efﬁcient is encoded as a penalty on the control signals Jenergy = τ(cid:80) N−1

max(1 − cos Ω) + σ2

(cid:80) N−1

(cid:88)N−1
(cid:123)(cid:122)

(cid:88)N−1
(cid:123)(cid:122)

k=0 uT

k M uk

+ w1 tr ΣN

2

+ τ w2

k=0 tr Σk

+ τ

o = s(σ2

k=0 uT

(cid:123)(cid:122)

(cid:124)

(cid:123)(cid:122)

(cid:125)

(cid:125)

(cid:124)

(cid:124)

ﬁnal position

ﬁnal uncertainity

running uncertainty

total energy

that the catching agent has to minimize in order to successfully intercept the ball.

1Usain Bolt’s world record sprint data http://datagenetics.com/blog/july32013/index.html
2World records for backwards running http://www.recordholders.org/en/list/backwards-running.html

4

(cid:124)

(cid:125)

Implementation details

3.3
To solve Problem (3)  we use the covariance-free multiple shooting method [18] for trajectory
optimization [7  3] in the belief space. Derivatives of the cost function are computed using CasADi [2].
Non-linear optimization is carried out by Ipopt [26]. L-BFGS and warm-starts used.
4 Simulated experiments and results
In this section  we present the results of two simulated scenarios and a comparative evaluation. First 
using the optimal control approach  we show that continuous tracking (where the ball always remains
in the ﬁeld of view of the outﬁelder) naturally leads to the heuristics from literature [6  16  14] if
the catching agent is sufﬁciently fast in comparison to the ball independent of whether he is running
forward  backwards  or sideways. Subsequently  we show that more complex behavior arises when
the ball is too fast to be caught while running only sideways or backwards (e.g.  as in soccer or long
passes in American football). Here  tracking is interrupted as the agent needs to turn away from the
ball to run forward. While the heuristics break  our optimal control formulation exhibits plausible
strategies similar to those employed by human catchers. Finally  we systematically study the effects
of noise and time delay onto the agent’s policy. The optimal control policies arising from our model
switch between reactive and predictive behaviors depending on uncertainty and latency.

[16].

4.1 Continuous tracking of an outﬁelder—heuristics hold
To directly compare our model against empirical catching data that has been described as
resulting from a heuristic  we reproduce the settings from [16] where a ball ﬂew 15 m in
3 s and a human subject starting about 6 m away from the impact point had to intercept it.
The optimal control
policy can deal with
such situations and
yields the behavior
observed by McLeod
et al.
In
fact  even when dou-
bling all distances
the reactive control
policy exhibits all
four major heuristics
(OAC  GOAC  CBA
Figure 2: A typical simulated trajectory of a successful catch in the contin-
and LOT) with ap-
uous tracking scenario as encountered by the outﬁelder. The uncertainty in
proximately the same
the belief state is kept low by the agent by ﬁxating the ball. Such empirically
precision as in the
observed scenarios [6  16  14] have led to the proposition of the heuristics
original human exper-
which arise naturally from our optimal control formulation.
iments.
Figure 2
shows a typical simulated catch viewed from above. The ball and the agent’s true trajectories
are depicted in green (note that the ball is frequently hidden behind the belief state trajectory). The
agent’s observations and the mean belief trajectory of the ball are represented by magenta crosses and
a magenta line  respectively. The belief uncertainty is indicated by the cyan ellipsoids that capture
95% of the probability mass. The gaze vectors of the agent are shown as red arrows. The catching
agent starts sufﬁciently close to the interception point to continuously visually track the ball  therefore
he is able to efﬁciently reduce his uncertainty on the ball’s position and successfully intercept it
while keeping it in sight. Note that the agent does not follow a straight trajectory but a curved one in
agreement with human experiments [16].
Figure 3 shows plots of the relevant angles over time to compare the behavior exhibited by human
catchers to the optimal catching policy. The tangent of the elevation angle tan α grows linearly
with time  as predicted by the optic acceleration cancellation heuristic (OAC). The bearing angle
γ remains constant (within a 5 deg margin) as predicted by the constant bearing angle heuristic
(CBA). The rotation angle δ oscillates around γ as predicted by the generalized optic acceleration
cancellation theory (GOAC). The tangent of the horizontal optical angle tan β is proportional to
tan α  as predicted by the linear optical trajectory theory (LOT). The small oscillations in the rotation
angle and in the horizontal optical angle are due to reaction delay and uncertainty; they are also
predicted by GOAC and LOT. Thus  in this well-studied case  the model produces an optimal policy
that exhibits behavior which is fully in accordance with the heuristics.

5

05101520253035Distancex[m]0246810Distancey[m]Catcher’strajectoryCatcher’sgazeBalltrajectoryObservedballtrajectoryBelieftrajectory meanBelieftrajectory covarianceInterrupted tracking during long passes—heuristics break but prediction is required

Figure 3: During simulations of successful catches for the continuous tracking scenario encountered
by the outﬁelder (shown in Figure 2)  the policies resulting from our optimal control formulation
always fulﬁll the heuristics (OAC  GOAC  CBA  and LOT) from literature with approximately the
same precision as in the original human experiments.
4.2
The competing theory to the heuristics claims that a predictive internal model allows humans to
intercept the ball [15  13]. Brancazio [4] points out that "the best outﬁelders can even turn their
