2019,Private Testing of Distributions via Sample Permutations,Statistical tests are at the heart of many scientific tasks.
To validate their hypothesis  researchers in medical and 
social sciences use individuals' data. The sensitivity of 
participants' data requires the design of statistical tests that 
ensure the privacy of the individuals in the most efficient way. 
In this paper  we use the framework of property testing to design algorithms to test the properties of the distribution that the data is drawn from with respect to differential privacy. 
In particular  we investigate testing two fundamental properties of distributions:  (1) testing the equivalence of two distributions when we have unequal numbers of 
samples from the two distributions. 
(2) Testing independence of two random variables. 
In both cases  we show that our testers achieve near optimal sample complexity (up to logarithmic factors). 
Moreover  our dependence on the privacy parameter is an additive term  which indicates that differential privacy can be obtained 
in most regimes of parameters for free.,Private Testing of Distributions via Sample

Permutations

Maryam Aliakbarpour

CSAIL  MIT

maryama@mit.edu

Daniel Kane

University of California  San Diego

dakane@ucsd.edu

Ilias Diakonikolas

University of Wisconsin  Madison
ilias.diakonikolas@gmail.com

Ronitt Rubinfeld
CSAIL  MIT  TAU

ronitt@csail.mit.edu

Abstract

Statistical tests are at the heart of many scientiﬁc tasks. To validate their hypothe-
ses  researchers in medical and social sciences use individuals’ data. The sensi-
tivity of participants’ data requires the design of statistical tests that ensure the
privacy of the individuals in the most efﬁcient way.
In this paper  we use the
framework of property testing to design algorithms to test the properties of the dis-
tribution that the data is drawn from with respect to differential privacy. In particu-
lar  we investigate testing two fundamental properties of distributions: (1) testing
the equivalence of two distributions when we have unequal numbers of samples
from the two distributions. (2) Testing independence of two random variables. In
both cases  we show that our testers achieve near optimal sample complexity (up
to logarithmic factors). Moreover  our dependence on the privacy parameter is an
additive term  which indicates that differential privacy can be obtained in most
regimes of parameters for free.

1

Introduction

We study questions in statistical hypothesis testing  a ﬁeld of statistics with fundamental importance
in scientiﬁc discovery. At a high level  given samples from an unknown statistical model  the goal of
a hypothesis test is to determine whether the model has a desired property. The ﬁrst — and arguably
the most fundamental — objective in hypothesis testing is to make an accurate determination with
as few samples as possible. In this work  we focus on understanding the trade off between sample
size and an additional important criterion — preserving the privacy of the underlying data sets.
Early work in statistics [Pea00  NP33] studied the asymptotic regime  where the sample size goes to
inﬁnity. In this paper  we are interested in obtaining ﬁnite sample bounds in the minimax setting that
has been extensively studied in the computer science and information theory communities during the
past couple of decades. More speciﬁcally  we will work with the formalism of distribution property
testing [BFR+00  BFR+13]: Given samples from a collection of unknown probability distributions
over discrete domains  do the underlying distributions satisfy a desired property P or are they “far”
from satisfying the property? (The deﬁnition of “far” is typically quantiﬁed via some global error
metric  e.g.  the total variation distance. See Preliminaries section.) The goal is to develop testers
for various properties with information-theoretically optimal sample complexity  which is typically
sublinear in the domain sizes of the underlying distributions. We note that  in recent years  such
sample-optimal methods have been obtained for testing a range of properties  including identity
testing (“goodness-of-ﬁt”)  closeness testing (“equivalence testing” or “two-sample testing”)  and
independence testing.

33rd Conference on Neural Information Processing Systems (NeurIPS 2019)  Vancouver  Canada.

The primary goal in classical statistics theory is to minimize the sample size of inference tasks. In
recent years  a wide range of settings involves performing hypothesis testing tasks on sensitive data
representing speciﬁc individuals  such as data describing medical or other behavioral phenomena.
In such cases  the outputs of standard tests may reveal private information that should not be di-
vulged. Differential privacy [Dwo09  DR14a] is a formal framework (see Preliminaries section) that
may allow us to obtain the scientiﬁc beneﬁt of statistical tests without compromising the privacy of
the underlying individuals. Intuitively  differential privacy postulates that similar data sets should
have statistically close outputs; and that once this guarantee is achieved  then provable privacy is
preserved. Differentially private data analysis is a very active research area  in which a wealth of
techniques have been developed for a range of tasks.
When designing a differentially private hypothesis testing algorithm  there are two criteria to balance.
On the one hand  we require that the algorithm satisﬁes the differential privacy condition on any
input dataset. On the other hand  we require that the algorithm is a valid statistical hypothesis tester
(i.e.  it correctly distinguishes inputs satisfying property P from inputs that are far from satisfying
P). These competing criteria suggest that  in general  the sample size required to ensure both of
them grows compared to the non-private setting. Recent work [CDK17  ADR18  ASZ18] has shown
that for basic tasks  such as identity testing and equivalence testing  the sample size increase of a
differentially private tester compared to its non-private analogue is negligible.
In this work  we continue this line of investigation. We give a new general technique that yields
sample-efﬁcient differentially private testers and apply it for two fundamental statistical tasks: the
problem of equivalence testing with unequal sized samples and the problem of independence testing
(deﬁned in the following paragraph). Notably  prior techniques were inherently unable to provide
sample-efﬁcient private testers for either of these problems.

Our Contributions. The main contribution of this work is a general technique for preserving
privacy that in particular can be used to obtain sample-efﬁcient and differentially private hypothesis
testers based on the algorithmic technique in the work of [DK16]. This technique can be applied
to several testing problems and in particular  yields the only known sample optimal testers for the
following testing problems:

Equivalence Testing with Unequal Sized Samples: Given a target error parameter ϵ > 0  s1 indepen-
dent draws from an unknown distribution p over [n]  and s2 draws from an unknown distribution q
over [n]  distinguish the case that p = q from the case that ∥p (cid:0) q∥1 (cid:21) ϵ:
Independence Testing: Given a target error parameter ϵ > 0  and s independent draws from an
unknown distribution p over [n] (cid:2) [m]  distinguish the case that p is a product distribution (i.e.  its
two coordinates are independent) versus ϵ-far  in ℓ1-distance  from any product distribution.
These problems have been extensively investigated in distribution testing during the past
decade [BFF+01  LRR11  CDVV14  VV14  AJOS14  ADK15  BV15  DK16] and sample-optimal
testers are known for them in the non-private setting [DK16]. In this work  we design the ﬁrst dif-
ferentially private testers for these problems with optimal (or near-optimal) sample complexity. In
particular  we show that the sample complexity of both these problems in the private setting is nearly
the same as in the non-private setting  i.e.  privacy comes essentially for free.
In this work  we focus on privatizing the optimal non-private testers for the above problems presented
in [DK16]. The algorithmic technique of [DK16] splits samples into two groups — “ﬂattening
samples” and “testing samples” — that are used in very different ways. To obtain privacy guarantees 
we must design algorithms that have low sensitivity to the samples — that is  changing one sample
does not have much effect on the outcome. Previous works in private testers for hypothesis testing
are based on algorithms that use the samples analogously to the use of the “testing samples” in
[DK16]. One can similarly use those techniques to design algorithms with low sensitivity with
respect to the “testing samples” in our setting. However  since using “ﬂattening samples” is a key to
achieve testers with the optimal sample complexity  we need to obtain low sensitivity with respect to
the “ﬂattening samples”. As the output of the testing algorithm can be very sensitive to small changes
in the set of “ﬂattening samples”  more care is required in designing low sensitivity algorithms for
using the “ﬂattening samples”  In a nutshell  what we present is a technique for designing private
testers which considers the output of the algorithm in [DK16] on every permutation of the samples
and outputs a result that is based on the aggregate. In order to show that this approach gives the
correct answer  we have to show that not only the expectation of the result is the same as that of

2

the non-private tester (which is straightforward)  but also the variance is small enough so that the
resulting output is correct with high probability (which does not follow from the calculation of the
variance of the non-private testers). For the independence testing problem  we need an extra step
to reduce sensitivity further. We ﬁrst show that trying every permutation results in low sensitivity
in the typical case (over the random samples)  and thus gives a private tester. In the non-typical
case  more care must be taken — we give an algorithm for modifying the samples in such a way
that we can reduce to the typical case. We describe the challenges and techniques in more detail
in Section 3. Though our methods are mainly tailored for use with the [DK16] testers  there are
several other distribution property testing algorithms which use samples in similar sensitive manners 
e.g.  [CDGR16]— the hope is that these techniques will be fruitful in allowing those algorithms to
be made differentially private as well.

Related Work The ﬁeld of distribution property testing [BFR+00] has been extensively investi-
gated in the past couple of decades  see [Rub12  Can15  Gol17]. A large body of the literature has
focused on characterizing the sample size needed to test properties of arbitrary discrete distributions.
This regime is fairly well understood: for many properties of interest there exist sample-efﬁcient
testers [Pan08  CDVV14  VV14  DKN15b  ADK15  CDGR16  DK16  DGPP16  CDS17  Gol17 
DGPP17  BC17  DKS18  CDKS17b]. More recently  an emerging body of work has concenter-
ated on leveraging a priori structure of the underlying distributions to obtain signiﬁcantly improved
sample complexities [BKR04  DDS+13  DKN15b  DKN15a  CDKS17a  DP17  DKN17  DKP19].
Differential privacy was ﬁrst introduced in [DMNS06]. Recently  a new line of research studies dis-
tribution testing and learning problems with respect to differential privacy [DHS15  CDK17  ADR18 
ASZ18]. The focus of these works is on testing identity and closeness of distributions  leaving other
properties mostly unexplored. Other models for distribution testing problems with respect to differ-
ential privacy have been studied [WLK15  GLRV16  KR17  KFS17]. In most of these latter works 
only a type I error guarantee is provided  which is a signiﬁcantly weaker guarantee compare to ours.
In addition  other settings for privacy  e.g  local privacy  is investigated [She18  GR18  ACFT19].

2 Preliminaries

jxijk

i2[n]

(cid:138) 1

(cid:128)∑

2.1 Deﬁnitions
Notation: We use [n] to denote the set f1; 2; : : : ; ng. We consider discrete distributions over a
ﬁnite domain  in particular  over [n] without loss of generality. For a distribution p  we write p(i)
to denote the probability of element i in [n]. One can assume each distribution has an associated
probability function p : [n] ! [0; 1] such that p(i)’s are non-negative and
i2[n] p(i) = 1. For
set S (cid:18) [n]  p(S) denotes the total probability of the elements in S (i.e. 
i2S p(i)). Note that
one can think of each discrete distribution over [n] as a vector in Rn where the i-th coordinate is
the probability of element i. Having said that  we can deﬁne the ℓk-norm of a distribution in the
same manner as of a vector: For a vector x 2 Rn and any k > 0  the ℓk-norm of x is equal to
k   and is denoted by ∥x∥k. In addition  the ℓk-distance between two distributions p
and q over [n] is equal to ∥p (cid:0) q∥k. Throughout this paper  we use the ℓ1-distance to measure the
discrepancy between distributions  which is equivalent to the total variation distance up to a factor of
two. In particular  we say distribution p is ϵ-far from distribution q if ∥p(cid:0) q∥1 (cid:21) ϵ. We use Lap((cid:21))
to denote the zero mean Laplace distribution with parameter (cid:21). The probability density function of
the Laplace distribution with parameter (cid:21) at point x 2 R is Lap(x; (cid:21)) = ee
=(2b). We use the
notation for the distribution and a random variable exchangeably where the difference is clear from
the context.
Distribution Testing: Formally  we deﬁne a property P to be a set of distributions. We say a
distribution p has the property P if p 2 P; and  we say p is ϵ-far from having the property P when
p is ϵ-far from all distributions in P. Assume an algorithm has sample access to a distribution p. We
say the algorithm is an (ϵ; (cid:14))-tester for property P  if the following holds with probability at least
1 (cid:0) (cid:14):

∑
∑

(cid:0)jxj=b

(cid:15) Completeness case: If p has the property P  then the algorithm outputs accept.
(cid:15) Soundness case: If p is ϵ-far from P  then the algorithm outputs reject.

3

Analogously  one can generalize the above deﬁnition to the case that we have sample access to two
distributions. In particular  given sample access to two distributions p and q over [n]  an (ϵ; (cid:14))-tester
for testing closeness of p and q distinguishes the following cases with probability at least 1 (cid:0) (cid:14):

(cid:15) Completeness case: If p is equal to q  then the algorithm outputs accept.
(cid:15) Soundness case: If p is ϵ-far from q  then the algorithm outputs reject.

n

Testing closeness of distributions via ﬂattening technique:
In this paper  we build on the non-
private closeness tester presented in [DK16  CDVV14]. Here  we give an overview of the closeness
tester  and the ﬂattening technique which turn it into a tester with the optimal sample complexity.
Suppose we have sample access to two distributions p and q on the domain [n]. Let s be a parameter
∑
that determines the expected number of samples. We draw Poi(s) samples from p and q. For each
i 2 [n]  let Xi and Yi denote the number of occurrences of element i in the sample sets from p
and q respectively. In [CDVV14]  the authors proposed the following statistic to test the closeness
i=1(Xi (cid:0) Yi)2 (cid:0) Xi (cid:0) Yi : The expected value of Z is proportional to the
of p and q: Z =
squared ℓ2-distance of p and q which enables us to use Z for testing closeness of p and q. While
this statistic is mainly measuring the ℓ2-distance  one can use it for testing in ℓ1-distance as well by
using trivial inequalities between the distances. By careful analysis of the variance of Z  it is shown
that Z concentrates around its expectation when we draw at least s = (cid:2)(n=(ϵ2 max(∥p∥2;∥q∥2)))
samples1. More speciﬁcally  it is shown that in the case where p = q  Z is below a threshold
parameter  (cid:28); and when p is ϵ-far from q  Z is at least (cid:28) with high probability. Thus  we can test
the closeness of p and q by computing Z from a large enough sample set and comparing it with the
threshold (cid:28).
The above algorithm would be sample-efﬁcient only when max(∥p∥2;∥q∥2) is not too large.
In [DK16]  the authors provide a technique  called ﬂattening  that decreases the ℓ2-norm of a distri-
bution. Using this technique  they map p and q to two other distributions at least one of which has
smaller ℓ2-norm. Then  they obtain a sample-optimal ℓ1-closeness tester for p and q by showing its
equivalence to closeness testers for the two distributions obtained after ﬂattening.
We discuss the ﬂattening technique in more detail. To ﬂatten a distribution p  we need a (multi)set
of the domain elements denoted by F . This set is usually obtained by drawing samples from the un-
derlying distributions  and the elements in F are called ﬂattening samples. Using ﬂattening samples 
we transform p to another distribution p(F ) over a larger domain in a way that the ℓ2-norm of p(F )
is small. We build the new domain for p(F ) as follows: For each element i in the domain of p  we
ﬁrst count the number of occurrences of i in F   namely ki  and put bi := ki + 1 elements associated
to i in the new domain. We refer to the elements of the new domain as buckets. We deﬁne p(F ) to
be the distribution that assigns the probability mass of p(i)=bi to all the bi buckets of i for all i in
the domain. Note that one can generate a sample from p(F ) upon receiving a sample from p: For a
fresh sample X = i drawn from p  the ﬂattening procedure maps it to a randomly selected bucket j
∑
= (i; j) as a sample from p(F ). The above procedure
among the bi buckets of i. Then  it outputs X
has several important properties which help us later in our analysis:
(cid:15) By the above construction  it is clear that the size of the new domain is
i bi = n + jFj.
Thus  as long as jFj is not larger than n (in the regime where we have sublinear number of
samples)  the size of domain increases only by a constant factor.
(cid:15) It is shown that if F contains Poi(k) samples from p  then the expected ℓ2-norm of p(F ) is
at most 1=k.
(cid:15) If we ﬂatten two distributions using the same ass ignments for the buckets (i.e.  the ﬂat-
tening set F )  the ℓ1-distance between the two distributions remains unchanged. Thus  it
sufﬁces to test closeness of p(F ) and q(F ) for testing the closeness of p and q.

′

′   from a universe [n] are neighboring if and only
Privacy: We say two sample sets  X and X
if their Hamming distance is one (meaning that they differ in exactly one sample). A randomized
algorithm A is (cid:24)-private if for any subset S of the possible outputs of the algorithm  faccept  rejectg
in the context of this paper  and for any two neighboring X and X

′  the following holds:

1In fact  as a byproduct of our analysis  one can show it sufﬁces to have s (cid:21) (cid:2)(n=(ϵ2 min(∥p∥2;∥q∥2))).

Pr[[[A(X) 2 S ]]] (cid:20) e(cid:24) (cid:1) Pr[[[A(X

′

) 2 S ]]] :

4

For a function f over sample sets  the sensitivity of f is deﬁned as follows:

∆(f ) = max
X;X′

jf (X) (cid:0) f (X

′

)j ;

where the maximum is taken over all possible sample sets that differ in only one sample. A standard
method for making functions private is the Laplace mechanism [DR14b]. In this mechanism  to
make a function f (cid:24)-differentially private  one adds Laplace noise to the output of function: ^f (X) :=
f (X) + Lap(∆(f )=(cid:24)). It is easy to show that ^f satisﬁes the deﬁnition of differential privacy with
parameter (cid:24).

3 General approach for making closeness-based testers private

As we mentioned earlier  several properties can be tested via a reduction to the ﬂattening-based
closeness tester. These reductions and the resulting optimal testers were presented in [DK16]. In
this section  we focus on describing a general approach for making such testers differentially private.
We start by explaining the structure of the existing reductions in the non-private setting. Next  we
explain our main idea for making the reductions and the testers private  which is to derandomize the
non-private tester. Then we give the characteristics of the reductions that can be turned into a private
algorithm (see Deﬁnition 3.2). In particular  if any property can be tested via a desired reduction to
the closeness testing problem  it can be also privately tested with a reduction to our general private
closeness tester. At the end  we describe our algorithm and prove its correctness in the full version.

3.1 Reduction procedure in non-private setting

In this section  we elaborate on the structure of the reductions to the closeness tester with the use
of the ﬂattening technique proposed in [DK16]. Suppose we aim to test whether a distribution2 has
property P or it is ϵ-far from any distribution in P via a reduction to the ﬂattening-based closeness
tester in the non-private setting. The reduction has the following structure: Upon receiving a sample
set from the underlying distribution  the reduction procedure splits the samples into two sets test
samples  denoted by T   and ﬂattening samples  denoted by F . The reduction procedure uses these
sample sets as follows:

(cid:15) Test samples: The reduction procedure use the test samples to generate samples from two
distributions p and q over a domain of size n. The distributions p and q are designed in
such a way that if the underlying distribution has the property P  then p and q are the same;
and if the underlying distribution is ϵ-far from any distribution that has the property  then
p and q are (cid:2)(ϵ)-far from each other as well. This transformation is essentially the core of
the reduction to the testing closeness problem.
(cid:15) Flattening samples: In addition to samples from p and q  the reduction procedure gener-
ates n positive integers b1; b2; : : : ; bn that indicate the number of buckets for each domain
element. These numbers are used for ﬂattening of p and q. (See the Preliminaries section
for more details.)

An example of such reductions is testing independence. Suppose d is a distribution over [n] (cid:2) [m] 
and our goal is to test whether the two coordinates of the samples drawn from d are independent
or not. It is not hard to see that this problem is equivalent to testing whether p := d is equal to
q := d1 (cid:2) d2  where d1 and d2 are the two marginal distributions of d. For more examples  see
[DK16].
After the reduction procedure generates samples from p and q  and the number of buckets for each
domain element  we use the ﬂattening-based closeness tester for the testing closeness of p and q.
As we explain in the Preliminaries section  ﬁrst  we transform p and q to p(F ) and q(F ) on the new
domain:

D = f(i; j)ji 2 [n] and j 2 [bi]g :

The hope is that after ﬂattening the ℓ2-norm of at least one of the resulting distributions is small.
Recall that the probability of each element (i; j) in D  i.e.  a bucket  according to p(F ) is p(i)=bi.

2We may have more than one underlying distributions.

5

|

{z

} |

Sample set X from the underlying distribution(s)

{z

}

Reduction procedure

Flattening Samples

Test Samples

F

T

provides the number of
buckets for element i: bi

provides
samples
from p

provides
samples
from q

Computes

Z

Compares Z with a threshold (cid:28):
If Z (cid:20) (cid:28)  outputs accept;
Otherwise  outputs reject.

Figure 1: Standard reduction procedure to testing closeness of two distributions.

The closeness tester transforms samples from p to samples from p(F ) (and similarly for q). For each
sample i from p  the closeness tester assigns it to the bucket (i; j)  where j is picked uniformly at
random from [bi]. We denote the number of occurrences of bucket (i; j) in the sample set from
p(F ) (and q(F )) by vi;j;1 (and vi;j;2). The ﬂattening-based closeness tester computes the following
statistic Z:

(vi;j;1 (cid:0) vi;j;2)2 (cid:0) vi;j;1 (cid:0) vi;j;2 ;

(1)

n∑

bi∑

Z :=

i=1

j=1

and compares it with a threshold to establish whether p(F ) and q(F ) are equal or (cid:2)(ϵ)-far from each
other. Since the transformation to p(F ) and q(F ) does not change the ℓ1-distance between p and q 
the output of the tester determines whether d has the property P or ϵ-far from it. See Figure 1 for an
overview of this process.

3.2 Derandomizing the non-private tester

To develop a differentially private algorithm for closeness testing with ﬂattening  we “derandomize”
the standard non-private closeness tester provided in [DK16  CDVV14]. The derandomization of the
tester results in a stable statistic  which means if we change one sample in the sample set  the value
of the statistics does not change drastically. The stability implies that the statistic has low sensitivity 
and it can be privatized using fewer number of extra samples.
In the previous section  we explained how the reduction and the tester work. Note that there
are two steps that the algorithm can make random choices: (i) The algorithm splits the samples
into two sets F and T (ﬂattening and test samples): Upon receiving a set of s + k samples 
X = fx1; x2; : : : ; xs+kg  where s and k is the number of test samples and the number of ﬂat-
tening samples respectively  usually the algorithm assigns the ﬁrst s samples to the test set  and the
rest to the ﬂattening set. Equivalently  we can view this step as follows: the algorithm permutes the
