2016,Learning to Communicate with Deep Multi-Agent Reinforcement Learning,We consider the problem of multiple agents sensing and acting in environments with the goal of maximising their shared utility. In these environments  agents must learn communication protocols in order to share information that is needed to solve the tasks. By embracing deep neural networks  we are able to demonstrate end-to-end learning of protocols in complex environments inspired by communication riddles and multi-agent computer vision problems with partial observability. We propose two approaches for learning in these domains: Reinforced Inter-Agent Learning (RIAL) and Differentiable Inter-Agent Learning (DIAL). The former uses deep Q-learning  while the latter exploits the fact that  during learning  agents can backpropagate error derivatives through (noisy) communication channels. Hence  this approach uses centralised learning but decentralised execution. Our experiments introduce new environments for studying the learning of communication protocols and present a set of engineering innovations that are essential for success in these domains.,Learning to Communicate with

Deep Multi-Agent Reinforcement Learning

Jakob N. Foerster1 †

jakob.foerster@cs.ox.ac.uk

Yannis M. Assael1 †

yannis.assael@cs.ox.ac.uk

Nando de Freitas1 2 3

nandodefreitas@google.com

Shimon Whiteson1

shimon.whiteson@cs.ox.ac.uk

1University of Oxford  United Kingdom

2Canadian Institute for Advanced Research  CIFAR NCAP Program

3Google DeepMind

Abstract

We consider the problem of multiple agents sensing and acting in environments
with the goal of maximising their shared utility. In these environments  agents must
learn communication protocols in order to share information that is needed to solve
the tasks. By embracing deep neural networks  we are able to demonstrate end-
to-end learning of protocols in complex environments inspired by communication
riddles and multi-agent computer vision problems with partial observability. We
propose two approaches for learning in these domains: Reinforced Inter-Agent
Learning (RIAL) and Differentiable Inter-Agent Learning (DIAL). The former uses
deep Q-learning  while the latter exploits the fact that  during learning  agents can
backpropagate error derivatives through (noisy) communication channels. Hence 
this approach uses centralised learning but decentralised execution. Our experi-
ments introduce new environments for studying the learning of communication
protocols and present a set of engineering innovations that are essential for success
in these domains.

1

Introduction

How language and communication emerge among intelligent agents has long been a topic of intense
debate. Among the many unresolved questions are: Why does language use discrete structures?
What role does the environment play? What is innate and what is learned? And so on. Some of the
debates on these questions have been so ﬁery that in 1866 the French Academy of Sciences banned
publications about the origin of human language.
The rapid progress in recent years of machine learning  and deep learning in particular  opens the
door to a new perspective on this debate. How can agents use machine learning to automatically
discover the communication protocols they need to coordinate their behaviour? What  if anything 
can deep learning offer to such agents? What insights can we glean from the success or failure of
agents that learn to communicate?
In this paper  we take the ﬁrst steps towards answering these questions. Our approach is programmatic:
ﬁrst  we propose a set of multi-agent benchmark tasks that require communication; then  we formulate
several learning algorithms for these tasks; ﬁnally  we analyse how these algorithms learn  or fail to
learn  communication protocols for the agents.

†These authors contributed equally to this work.
30th Conference on Neural Information Processing Systems (NIPS 2016)  Barcelona  Spain.

The tasks that we consider are fully cooperative  partially observable  sequential multi-agent decision
making problems. All the agents share the goal of maximising the same discounted sum of rewards.
While no agent can observe the underlying Markov state  each agent receives a private observation
correlated with that state. In addition to taking actions that affect the environment  each agent can
also communicate with its fellow agents via a discrete limited-bandwidth channel. Due to the partial
observability and limited channel capacity  the agents must discover a communication protocol that
enables them to coordinate their behaviour and solve the task.
We focus on settings with centralised learning but decentralised execution. In other words  com-
munication between agents is not restricted during learning  which is performed by a centralised
algorithm; however  during execution of the learned policies  the agents can communicate only via the
limited-bandwidth channel. While not all real-world problems can be solved in this way  a great many
can  e.g.  when training a group of robots on a simulator. Centralised planning and decentralised
execution is also a standard paradigm for multi-agent planning [1  2].
To address this setting  we formulate two approaches. The ﬁrst  reinforced inter-agent learning
(RIAL)  uses deep Q-learning [3] with a recurrent network to address partial observability. In one
variant of this approach  which we refer to as independent Q-learning  the agents each learn their
own network parameters  treating the other agents as part of the environment. Another variant trains
a single network whose parameters are shared among all agents. Execution remains decentralised  at
which point they receive different observations leading to different behaviour.
The second approach  differentiable inter-agent learning (DIAL)  is based on the insight that cen-
tralised learning affords more opportunities to improve learning than just parameter sharing. In
particular  while RIAL is end-to-end trainable within an agent  it is not end-to-end trainable across
agents  i.e.  no gradients are passed between agents. The second approach allows real-valued mes-
sages to pass between agents during centralised learning  thereby treating communication actions as
bottleneck connections between agents. As a result  gradients can be pushed through the communica-
tion channel  yielding a system that is end-to-end trainable even across agents. During decentralised
execution  real-valued messages are discretised and mapped to the discrete set of communication
actions allowed by the task. Because DIAL passes gradients from agent to agent  it is an inherently
deep learning approach.
Experiments on two benchmark tasks  based on the MNIST dataset and a well known riddle  show 
not only can these methods solve these tasks  they often discover elegant communication protocols
along the way. To our knowledge  this is the ﬁrst time that either differentiable communication or
reinforcement learning with deep neural networks has succeeded in learning communication protocols
in complex environments involving sequences and raw images. The results also show that deep
learning  by better exploiting the opportunities of centralised learning  is a uniquely powerful tool
for learning such protocols. Finally  this study advances several engineering innovations that are
essential for learning communication protocols in our proposed benchmarks.

2 Related Work

Research on communication spans many ﬁelds  e.g. linguistics  psychology  evolution and AI. In AI 
it is split along a few axes: a) predeﬁned or learned communication protocols  b) planning or learning
methods  c) evolution or RL  and d) cooperative or competitive settings.
Given the topic of our paper  we focus on related work that deals with the cooperative learning of
communication protocols. Out of the plethora of work on multi-agent RL with communication 
e.g.  [4–7]  only a few fall into this category. Most assume a pre-deﬁned communication protocol 
rather than trying to learn protocols. One exception is the work of Kasai et al. [7]  in which
tabular Q-learning agents have to learn the content of a message to solve a predator-prey task with
communication. Another example of open-ended communication learning in a multi-agent task is
given in [8]. Here evolutionary methods are used for learning the protocols which are evaluated
on a similar predator-prey task. Their approach uses a ﬁtness function that is carefully designed to
accelerate learning. In general  heuristics and handcrafted rules have prevailed widely in this line of
research. Moreover  typical tasks have been necessarily small so that global optimisation methods 
such as evolutionary algorithms  can be applied. The use of deep representations and gradient-based
optimisation as advocated in this paper is an important departure  essential for scalability and further

2

progress. A similar rationale is provided in [9]  another example of making an RL problem end-to-end
differentiable.
Unlike the recent work in [10]  we consider discrete communication channels. One of the key
components of our methods is the signal binarisation during the decentralised execution. This is
related to recent research on ﬁtting neural networks in low-powered devices with memory and
computational limitations using binary weights  e.g. [11]  and previous works on discovering binary
codes for documents [12].

3 Background

i ). Here  θ−

i

i

− Q(s  u; θi))2]  at each iteration i  with target yDQN

Deep Q-Networks (DQN). In a single-agent  fully-observable  RL setting [13]  an agent observes the
current state st ∈ S at each discrete time step t  chooses an action ut ∈ U according to a potentially
stochastic policy π  observes a reward signal rt  and transitions to a new state st+1. Its objective
is to maximise an expectation over the discounted return  Rt = rt + γrt+1 + γ2rt+2 + ···   where
rt is the reward received at time t and γ ∈ [0  1] is a discount factor. The Q-function of a policy π
is Qπ(s  u) = E [Rt|st = s  ut = u]. The optimal action-value function Q∗(s  u) = maxπ Qπ(s  u)
obeys the Bellman optimality equation Q∗(s  u) = Es(cid:48) [r + γ maxu(cid:48) Q∗(s(cid:48)  u(cid:48)) | s  u]. Deep Q-
learning [3] uses neural networks parameterised by θ to represent Q(s  u; θ). DQNs are optimised
by minimising: Li(θi) = Es u r s(cid:48)[(yDQN
=
r + γ maxu(cid:48) Q(s(cid:48)  u(cid:48); θ−
i are the parameters of a target network that is frozen for a number
of iterations while updating the online network Q(s  u; θi). The action u is chosen from Q(s  u; θi)
by an action selector  which typically implements an -greedy policy that selects the action that
maximises the Q-value with a probability of 1 −  and chooses randomly with a probability of .
DQN also uses experience replay: during learning  the agent builds a dataset of episodic experiences
and is then trained by sampling mini-batches of experiences.
Independent DQN. DQN has been extended to cooperative multi-agent settings  in which each agent
a observes the global st  selects an individual action ua
t   and receives a team reward  rt  shared
among all agents. Tampuu et al. [14] address this setting with a framework that combines DQN
with independent Q-learning  in which each agent a independently and simultaneously learns its
own Q-function Qa(s  ua; θa
i ). While independent Q-learning can in principle lead to convergence
problems (since one agent’s learning makes the environment appear non-stationary to other agents) 
it has a strong empirical track record [15  16]  and was successfully applied to two-player pong.
Deep Recurrent Q-Networks. Both DQN and independent DQN assume full observability  i.e.  the
agent receives st as input. By contrast  in partially observable environments  st is hidden and the
agent receives only an observation ot that is correlated with st  but in general does not disambiguate
it. Hausknecht and Stone [17] propose deep recurrent Q-networks (DRQN) to address single-agent 
partially observable settings. Instead of approximating Q(s  u) with a feed-forward network  they
approximate Q(o  u) with a recurrent neural network that can maintain an internal state and aggregate
observations over time. This can be modelled by adding an extra input ht−1 that represents the hidden
state of the network  yielding Q(ot  ht−1  u). For notational simplicity  we omit the dependence of Q
on θ.

4 Setting

In this work  we consider RL problems with both multiple agents and partial observability. All the
agents share the goal of maximising the same discounted sum of rewards Rt. While no agent can
observe the underlying Markov state st  each agent a receives a private observation oa
t correlated with
t ∈ U that affects the environment 
st. In every time-step t  each agent selects an environment action ua
t ∈ M that is observed by other agents but has no direct impact on the
and a communication action ma
environment or reward. We are interested in such settings because it is only when multiple agents and
partial observability coexist that agents have the incentive to communicate. As no communication
protocol is given a priori  the agents must develop and agree upon such a protocol to solve the task.
Since protocols are mappings from action-observation histories to sequences of messages  the space
of protocols is extremely high-dimensional. Automatically discovering effective protocols in this
space remains an elusive challenge. In particular  the difﬁculty of exploring this space of protocols
is exacerbated by the need for agents to coordinate the sending and interpreting of messages. For

3

example  if one agent sends a useful message to another agent  it will only receive a positive reward
if the receiving agent correctly interprets and acts upon that message. If it does not  the sender will be
discouraged from sending that message again. Hence  positive rewards are sparse  arising only when
sending and interpreting are properly coordinated  which is hard to discover via random exploration.
We focus on settings where communication between agents is not restricted during centralised
learning  but during the decentralised execution of the learned policies  the agents can communicate
only via a limited-bandwidth channel.

5 Methods

In this section  we present two approaches for learning communication protocols.

5.1 Reinforced Inter-Agent Learning

t−1  ha

u and Qa

t   ma(cid:48)
t as well as messages from other agents ma(cid:48)

The most straightforward approach  which we call reinforced inter-agent learning (RIAL)  is to
combine DRQN with independent Q-learning for action and communication selection. Each agent’s
Q-network represents Qa(oa
t−1  ua)  which conditions on that agent’s individual hidden
state ha
t−1 and observation oa
t−1.
To avoid needing a network with |U||M| outputs  we split the network into Qa
m  the Q-values
for the environment and communication actions  respectively. Similarly to [18]  the action selector
t and ma
separately picks ua
t from Qu and Qm  using an -greedy policy. Hence  the network requires
only |U| + |M| outputs and action selection requires maximising over U and then over M  but not
maximising over U × M.
Both Qu and Qm are trained using DQN with the following two modiﬁcations  which were found to be
essential for performance. First  we disable experience replay to account for the non-stationarity that
occurs when multiple agents learn concurrently  as it can render experience obsolete and misleading.
Second  to account for partial observability  we feed in the actions u and m taken by each agent
as inputs on the next time-step. Figure 1(a) shows how information ﬂows between agents and the
environment  and how Q-values are processed by the action selector in order to produce the action 
t   and message ma
t . Since this approach treats agents as independent networks  the learning phase is
ua
not centralised  even though our problem setting allows it to be. Consequently  the agents are treated
exactly the same way during decentralised execution as during learning.

(a) RIAL - RL based communication

(b) DIAL - Differentiable communication

Figure 1: The bottom and top rows represent the communication ﬂow for agent a1 and agent a2 
respectively. In RIAL (a)  all Q-values are fed to the action selector  which selects both environment
and communication actions. Gradients  shown in red  are computed using DQN for the selected
action and ﬂow only through the Q-network of a single agent. In DIAL (b)  the message ma
t bypasses
the action selector and instead is processed by the DRU (Section 5.2) and passed as a continuous
value to the next C-network. Hence  gradients ﬂow across agents  from the recipient to the sender.
For simplicity  at each time step only one agent is highlighted  while the other agent is greyed out.

Parameter Sharing. RIAL can be extended to take advantage of the opportunity for centralised
learning by sharing parameters among the agents. This variation learns only one network  which is
used by all agents. However  the agents can still behave differently because they receive different

4

ot1ut+12Q-Netut1Q-NetActionSelectmt1mt+12Agent 1Agent 2ot+12ActionSelectmt-12EnvironmentQ-NetActionSelectQ-NetActionSelectt+1tot1ut+12C-Netut1C-NetActionSelectDRUmt1mt+12Agent 1Agent 2ot+12ActionSelectEnvironmentC-NetActionSelectC-NetActionSelectDRUt+1tobservations and thus evolve different hidden states. In addition  each agent receives its own index
a as input  allowing it to specialise. The rich representations in deep Q-networks can facilitate
the learning of a common policy while also allowing for specialisation. Parameter sharing also
dramatically reduces the number of parameters that must be learned  thereby speeding learning.
Under parameter sharing  the agents learn two Q-functions Qu(oa
t−1  a  ua
t )
and Qm(oa
t ). During decentralised execution  each agent uses its
own copy of the learned network  evolving its own hidden state  selecting its own actions  and
communicating with other agents only through the communication channel.

t−1  a  ua

t   ma(cid:48)

t   ma(cid:48)

t−1  ha

t−1  ua

t−1  ma

t−1  ha

t−1  ua

t−1  ma

5.2 Differentiable Inter-Agent Learning

While RIAL can share parameters among agents  it still does not take full advantage of centralised
learning. In particular  the agents do not give each other feedback about their communication actions.
Contrast this with human communication  which is rich with tight feedback loops. For example 
during face-to-face interaction  listeners send fast nonverbal queues to the speaker indicating the level
of understanding and interest. RIAL lacks this feedback mechanism  which is intuitively important
for learning communication protocols.
To address this limitation  we propose differentiable inter-agent learning (DIAL). The main insight
behind DIAL is that the combination of centralised learning and Q-networks makes it possible  not
only to share parameters but to push gradients from one agent to another through the communication
channel. Thus  while RIAL is end-to-end trainable within each agent  DIAL is end-to-end trainable
across agents. Letting gradients ﬂow from one agent to another gives them richer feedback  reducing
the required amount of learning by trial and error  and easing the discovery of effective protocols.
DIAL works as follows: during centralised learning  communication actions are replaced with direct
connections between the output of one agent’s network and the input of another’s. Thus  while
the task restricts communication to discrete messages  during learning the agents are free to send
real-valued messages to each other. Since these messages function as any other network activation 
gradients can be passed back along the channel  allowing end-to-end backpropagation across agents.
In particular  the network  which we call a C-Net  outputs two distinct types of values  as shown in
Figure 1(b)  a) Q(·)  the Q-values for the environment actions  which are fed to the action selector 
and b) ma
t   the real-valued vector message to other agents  which bypasses the action selector and
is instead processed by the discretise/regularise unit (DRU(ma
t )). The DRU regularises it during
centralised learning  DRU(ma
t   σ))  where σ is the standard deviation of the noise
t > 0}.
added to the channel  and discretises it during decentralised execution  DRU(ma
Figure 1 shows how gradients ﬂow differently in RIAL and DIAL. The gradient chains for Qu  in
RIAL and Q  in DIAL  are based on the DQN loss. However  in DIAL the gradient term for m is the
backpropagated error from the recipient of the message to the sender. Using this inter-agent gradient
for training provides a richer training signal than the DQN loss for Qm in RIAL. While the DQN
error is nonzero only for the selected message  the incoming gradient is a |m|-dimensional vector
that can contain more information. It also allows the network to directly adjust messages in order to
minimise the downstream DQN loss  reducing the need for trial and error learning of good protocols.
While we limit our analysis to discrete messages  DIAL naturally handles continuous message spaces 
as they are used anyway during centralised learning. At the same time  DIAL can also scale to large
discrete message spaces  since it learns binary encodings instead of the one-hot encoding in RIAL 
|m| = O(log(|M|). Further algorithmic details and pseudocode are in the supplementary material.

t ) = Logistic(N (ma

t ) = 1{ma

6 Experiments

In this section  we evaluate RIAL and DIAL with and without parameter sharing in two multi-agent
problems and compare it with a no-communication shared-parameter baseline (NoComm). Results
presented are the average performance across several runs  where those without parameter sharing (-
NS)  are represented by dashed lines. Across plots  rewards are normalised by the highest average
reward achievable given access to the true state (Oracle). In our experiments  we use an -greedy
policy with  = 0.05  the discount factor is γ = 1  and the target network is reset every 100 episodes.
To stabilise learning  we execute parallel episodes in batches of 32. The parameters are optimised
using RMSProp [19] with a learning rate of 5 × 10−4. The architecture uses rectiﬁed linear units

5

(ReLU)  and gated recurrent units (GRU) [20]  which have similar performance to long short-term
memory [21] (LSTM) [22]. Unless stated otherwise  we set the standard deviation of noise added to
the channel to σ = 2  which was found to be essential for good performance.1

6.1 Model Architecture

RIAL and DIAL share the same individual model archi-
tecture. For brevity  we describe only the DIAL model
here. As illustrated in Figure 2  each agent consists of a re-
current neural network (RNN)  unrolled for T time-steps 
that maintains an internal state h  an input network for
producing a task embedding z  and an output network for
the Q-values and the messages m. The input for agent a is
deﬁned as a tuple of (oa
t−1  a). The inputs a and
t−1 are passed through lookup tables  and ma(cid:48)
t−1 through
ua
a 1-layer MLP  both producing embeddings of size 128.
t is processed through a task-speciﬁc network that pro-
oa
duces an additional embedding of the same size. The state
embedding is produced by element-wise summation of
these embeddings  za
We found that performance and stability improved when a batch normalisation layer [23]
was used to preprocess mt−1. za
1 t =
t
1 t−1)  which is used to approximate the agent’s action-observation history.
GRU[128  128](za
t   ha
Finally  the output ha
2 t of the top GRU layer  is passed through a 2-layer MLP Qa
t =
MLP[128  128  (|U| + |M|)](ha

t ) + MLP[|M|  128](mt−1) + Lookup(ua
is processed through a 2-layer RNN with GRUs  ha

t−1) + Lookup(a)(cid:1).

t =(cid:0)TaskMLP(oa

Figure 2: DIAL architecture.

t   ma

t   ma(cid:48)

t−1  ua

2 t).

6.2 Switch Riddle

Figure 3: Switch: Every day one pris-
oner gets sent to the interrogation room
where he sees the switch and chooses
from “On”  “Off”  “Tell” and “None”.

The ﬁrst task is inspired by a well-known riddle described
as follows: “One hundred prisoners have been newly
ushered into prison. The warden tells them that starting
tomorrow  each of them will be placed in an isolated cell 
unable to communicate amongst each other. Each day 
the warden will choose one of the prisoners uniformly
at random with replacement  and place him in a central
interrogation room containing only a light bulb with a
toggle switch. The prisoner will be able to observe the
current state of the light bulb. If he wishes  he can toggle
the light bulb. He also has the option of announcing that he believes all prisoners have visited the
interrogation room at some point in time. If this announcement is true  then all prisoners are set free 
but if it is false  all prisoners are executed[...]” [24].
t ∈ {0  1}  which indicates if
Architecture. In our formalisation  at time-step t  agent a observes oa
the agent is in the interrogation room. Since the switch has two positions  it can be modelled as a
t ∈ {“None” “Tell”};
1-bit message  ma
otherwise the only action is “None”. The episode ends when an agent chooses “Tell” or when the
maximum time-step  T   is reached. The reward rt is 0 unless an agent chooses “Tell”  in which
case it is 1 if all agents have been to the interrogation room and −1 otherwise. Following the riddle
deﬁnition  in this experiment ma
t−1 is available only to the agent a in the interrogation room. Finally 
we set the time horizon T = 4n − 6 in order to keep the experiments computationally tractable.
