2018,Automatic differentiation in ML: Where we are and where we should be going,We review the current state of automatic differentiation (AD) for array programming in machine learning (ML)  including the different approaches such as operator overloading (OO) and source transformation (ST) used for AD  graph-based intermediate representations for programs  and source languages. Based on these insights  we introduce a new graph-based intermediate representation (IR) which specifically aims to efficiently support fully-general AD for array programming. Unlike existing dataflow programming representations in ML frameworks  our IR naturally supports function calls  higher-order functions and recursion  making ML models easier to implement. The ability to represent closures allows us to perform AD using ST without a tape  making the resulting derivative (adjoint) program amenable to ahead-of-time optimization using tools from functional language compilers  and enabling higher-order derivatives. Lastly  we introduce a proof of concept compiler toolchain called Myia which uses a subset of Python as a front end.,Automatic differentiation in ML:

Where we are and where we should be going

Bart van Merriënboer

Mila  Google Brain
bartvm@google.com

Olivier Breuleux

Mila

breuleuo@iro.umontreal.ca

bergearn@iro.umontreal.ca

Arnaud Bergeron

Mila

Pascal Lamblin
Mila  Google Brain

lamblinp@google.com

Abstract

We review the current state of automatic differentiation (AD) for array program-
ming in machine learning (ML)  including the different approaches such as operator
overloading (OO) and source transformation (ST) used for AD  graph-based in-
termediate representations for programs  and source languages. Based on these
insights  we introduce a new graph-based intermediate representation (IR) which
speciﬁcally aims to efﬁciently support fully-general AD for array programming.
Unlike existing dataﬂow programming representations in ML frameworks  our IR
naturally supports function calls  higher-order functions and recursion  making
ML models easier to implement. The ability to represent closures allows us to
perform AD using ST without a tape  making the resulting derivative (adjoint) pro-
gram amenable to ahead-of-time optimization using tools from functional language
compilers  and enabling higher-order derivatives. Lastly  we introduce a proof of
concept compiler toolchain called Myia which uses a subset of Python as a front
end.

1

Introduction

Recent advances in ML  and deep learning in particular  have in part been driven by advances in
hardware [23  31]. This increase in computational power has spurred the development of a large
number of software libraries  compute kernels  programming languages  and compiler toolchains in
order to exploit it. We distinguish some features and objectives that separate these ML frameworks
from traditional array programming frameworks.
Firstly  many machine learning models use optimization algorithms which require access to derivatives
of the model. Automatic differentiation [16] comprises a collection of techniques that can be employed
to calculate the derivatives of a function speciﬁed by a computer program  and is a central feature of
popular ML frameworks such as TensorFlow [1] and PyTorch [28].
ML frameworks also put heavy emphasis on being able to iterate quickly on new models using
high-level  dynamically typed languages  while maintaining high performance through aggressively
exploiting resources (e.g.  through parallelism  distributed computing  accelerators  static optimiza-
tion). Moreover  since the derivative code is generated programmatically using AD  frameworks
cannot always rely on users writing hand-tuned code and must instead provide compiler optimizations.
Despite the growth in ML frameworks  many have been developed in isolation of the AD community 
and many of their insights regarding language design and interactions between source transformation
and compiler optimizations have gone largely ignored. Moreover  although many ML frameworks

32nd Conference on Neural Information Processing Systems (NeurIPS 2018)  Montréal  Canada.

have slowly been adopting functional language concepts (such as pure functions  immutable variables 
lazy evaluation) many of the standard approaches in use by functional language compilers to guarantee
high performance (A-normal form and continuation passing style representations  persistent data
structures  heap recycling  etc.) have not been applied.
In some cases popular ML frameworks have sacriﬁced ﬂexibility and generality compared to pop-
ular array programming packages such as NumPy [39] in order to provide AD and achieve high
performance. On the one hand  frameworks relying on computation graphs such as TensorFlow
and Theano [36] do not support higher-order functions or recursion  even though some ML models
(e.g. [35]) are more naturally expressed using recursion than loops. On the other hand  frameworks
relying on operator overloading such as PyTorch and Autograd [26] see performance degradation for
models with scalars or small vectors.1

2 Background and prior work

The development of ML frameworks has been driven by a wide range of ﬁelds and perspectives—
systems programming  automatic differentiation  programming languages  compiler design  applied
machine learning  etc.–which has lead to duplicated research and confused terminology (e.g. deﬁne-
by-run and operator overloading). To contextualize our proposed framework  the ﬁrst half of this
paper consists of a review which aims to synthesise these different perspectives. We will begin with
explaining the nature of AD and the various challenges associated with it. Then we will review
the different approaches to AD and relevant prior work from different domains  such as graph
representations from the compiler literature  and language and IR design from functional languages.
We will discuss the uses of these approaches in existing frameworks and how they affect performance 
expressive power  and usability.
Given this insight  our goal is to outline in the subsequent sections a proof of concept of a high-
performance ML framework with ﬁrst-class support for AD  but which has the ﬂexibility and
expressive power of a generic  high-level programming language so that it does not restrict the ability
of ML researchers to explore novel models and algorithms.

2.1 Automatic differentiation

Automatic differentiation (AD  also called algorithmic differentiation) relies on the ability to de-
compose a program into a series of elementary operations (primitives) for which the derivatives are
known and to which the chain rule can be applied. AD allows for the calculation of derivatives of any
order up to working precision.
AD has been studied since the 60s and 70s and has been employed in ﬁelds such as computational
ﬂuid dynamics  astronomy  and mathematical ﬁnance [16]. Both its implementation and its theory
are still an active area of research (e.g. [34] and [41]). We recommend [16] and [5] for a review of
AD in general and in the context of machine learning respectively. From an application perspective 
AD affects and interacts with the entire toolchain  from language design through intermediate
representations  static analysis  to code generation and program execution.
The runtime and memory complexity of AD depends on the order in which the chain rule is evaluated.
Evaluating the chain rule from right to left (from inputs to outputs) is referred to as forward mode 
whereas evaluating it from left to right (from outputs to inputs) is called reverse mode. Forward
mode has constant memory requirements and its runtime complexity scales with the number of inputs.
Reverse mode’s runtime complexity scales with the number of outputs  and its memory complexity
grows with the number of intermediate variables. In principle  forward and reverse mode can be
mixed  but ﬁnding the optimal way of doing so is NP-complete [27].
In forward mode  the partial derivatives of intermediate variables are calculated in step with the
original program. As such  forward mode is relatively straightforward to implement  e.g. using dual
numbers [13]. In reverse mode  the chain rule is evaluated in reverse order of the original program.
This is a more complex program transformation: an adjoint program must be constructed whose
control ﬂow is the reverse of the original (or primal) program. First  the primal program is run to
obtain the output  and then the adjoint program is run to compute the gradient  starting from that

1https://github.com/pytorch/pytorch/issues/2518

2

output and going backwards. In order to do so efﬁciently  each statement in the adjoint must have
access to the intermediate variables of the original program. Hence  the AD transformation must
guarantee that the intermediate variables are not destroyed or mutated.
In ML applications  large matrices of input parameters are typically updated using gradient descent
on a scalar output cost. Since the number of inputs is signiﬁcantly larger than the number of outputs 
reverse mode AD is to be preferred. The term ‘backpropagation’ is used to refer to the specialized
application of reverse mode AD in machine learning.
Two implementation methods of AD are generally distinguished: operator overloading (OO) and
source transformation (ST  also called source code transformation). Each method has its advantages
and disadvantages in terms of usability  implementation  and efﬁciency [9]. We will brieﬂy discuss
them in the context of reverse mode AD.

2.1.1 Operator overloading

OO relies on a language’s ability to redeﬁne the meaning of functions and operators. All primitives
are overloaded so that they additionally perform a tracing operation: The primitive is logged onto
a ‘tape’  along with its inputs to ensure that those intermediate variables are kept alive. At the end
of the function’s execution  this tape contains a linear trace of all the numerical operations in the
program. Derivatives can be calculated by walking this tape in reverse.
The main advantage of OO is that it is straightforward to implement. Because the tracing passes
through function calls and control ﬂow  the AD logic is simpliﬁed. A signiﬁcant downside is that a
separate ‘derivative interpreter’ is needed for the adjoint program. Having an embedded interpreter
inside of the host language can complicate debugging and performance analysis. Moreover  since the
program is traced and reversed at runtime  OO incurs overhead on each function call which can be
particularly problematic if the primitives are fast to execute relative to the tracing operation. OO also
does not allow for ahead-of-time optimizations on the adjoint program.
OO is the technique used by PyTorch  Autograd  and Chainer [37]. Non-ML oriented AD frameworks
using OO include ADOL-C [17] and CppAD [7].

2.1.2 Source transformation

ST explicitly constructs the adjoint program. Unlike OO  ST needs to explicitly construct a program
with a reversed control ﬂow  which means that it needs transformation rules for function calls and
control ﬂow statements such as loops and conditionals. Whereas OO operates within the language 
ST requires tooling such as parsers  tools to manipulate intermediate representations  and unparsers.
The advantage of ST is that the AD transformation is done only once per program and hence doesn’t
incur overhead at runtime  which makes ST performant for a wider range of workloads. Moreover 
the full adjoint program is available during compilation and can therefore be optimized ahead of time.
Although ST does not have to deal with the AD transformation at runtime  it must still ensure that
intermediate variables from the forward pass are accessible by the adjoint. There are a variety of
approaches to deal with this.

Tape-based Frameworks such as ADIFOR [8] and Tapenade [20] for Fortran and C use a global
stack also called a ‘tape’2 to ensure that intermediate variables are kept alive. The original (primal)
function is augmented so that it writes intermediate variables to the tape during the forward pass  and
the adjoint program will read intermediate variables from the tape during the backward pass. More
recently  tape-based ST was implemented for Python in the ML framework Tangent [38].
A problem of this approach is that the tape is a data structure constructed at runtime  analysis of which
requires custom compiler passes [19  20]. Moreover  adjoint programs have a particular symmetric
structure where intermediate variables from the ﬁrst primal statements are used by the last adjoint
statements. This highly non-local structure is unsuitable for traditional compiler optimizations which
act locally. Ways of addressing this interaction between AD and compiler optimizations is an ongoing
research topic [34  18]. Finally  reading and writing to the tape need to be made differentiable in

2The tape used in ST stores only the intermediate variables  whereas the tape in OO is a program trace that

stores the executed primitives as well.

3

order to compute higher-order derivatives which involve multiple applications of reverse mode. For
this reason most tape-based systems do not support reverse-over-reverse.

Closure-based To address some of the shortcomings of the tape-based approach  alternative ap-
proaches have been proposed which employ closures [29] or delimited continuations [40]. In both
cases  tools from functional programming are used which can capture the environment of a state-
ment during the forward pass  and execute the corresponding adjoint within that environment. The
advantage of this approach is that no AD-speciﬁc compiler passes are needed: a functional language
compiler will recognize the non-local use of the intermediate variables by the fact that they are free
variables in the generated closure or continuation. This avoids the need for custom compiler passes 
and allows for the application of all the tooling from functional compilers on the generated adjoint
program [32  33].

2.2 Dataﬂow programming

Popular ML frameworks such as Theano  TensorFlow  and MXNet [10] follow the dataﬂow program-
ming paradigm [21] and use computation graphs as their intermediate representation. These graph
representations do not have scoping or recursive function calls  which means that AD is much easier
to implement with ST. Since the adjoint program is part of the same dataﬂow graph  it can access
the intermediate variables from the forward pass directly from the global scope  so neither tapes nor
closures are required. Additionally  a simple liveness analysis makes it easy to keep intermediate
values from the primal alive only for as long as required by the adjoint computation.
Using dataﬂow graphs without function calls3 nor scoping4 introduces limitations. Some of these
limitations are addressed by the use of metaprogramming  but others affect the end-user (e.g.  the
lack of recursion and higher-order functions reduces the expressiveness of the language) and the
compiler pipeline (e.g.  loops cannot be represented in a principled way  which complicates their
implementation).
An advantage of dataﬂow programming is that graphs are a natural representation for distributed
computing [2]. This allows different operations to be easily distributed across different hosts  devices 
and cores.
Graph-based IRs are generally useful for compilers  since the absence of an explicit ordering can
simplify certain optimizations and scheduling. Theano’s graph representation in particular was
based on the representations used by computer algebra systems (CAS)  enabling aggressive algebraic
simpliﬁcation and pattern matching. An SSA5-based graph representation [12  25]  sometimes
referred to as sea-of-nodes  is used by the HotSpot Java compiler and the V8 TurboFan JavaScript
compiler  and a graph representation using continuation-passing style (CPS  an IR commonly used in
functional languages) called Thorin also exists [24].

2.3 Programming languages and compilers

Theano was one of the ﬁrst software packages to refer to itself as a ‘linear algebra compiler’.
Since then  more frameworks started approaching the deﬁnition and execution of ML models as a
compiler problem. In the case of Theano and TensorFlow  they can be considered compilers of a
custom language which must be metaprogrammed using Python as a metalanguage. The dataﬂow
graph is an intermediate representation which is optimized using a series of compiler passes. The
resulting program is compiled (e.g.  XLA) and/or interpreted (e.g.  the TensorFlow/Theano runtimes).
Similarly  PyTorch has started optimizing its traced Python programs using just-in-time (JIT) compiler
approaches.
More recently  projects such as DLVM [42] and Swift for TensorFlow6 have attempted to extend
existing compiler toolchains such as LLVM and Swift’s intermediate language (SIL) with array
programming and AD in order to create frameworks better suited for ML workﬂow needs.

3TensorFlow and Theano implement a type of subroutine through their Defun and OpFromGraph constructs 

but these must be explicitly constructed by the user and don’t support recursion.

4TensorFlow has a concept it refers to as ‘scoping’  but these scopes are not lexical and can be reentered at

any time  so the lifetime of a value is not affected by its scope.

5Static single assignment  which essentially means each variable is assigned to exactly once.
6https://www.tensorflow.org/community/swift

4

Viewing ML frameworks as compiler toolchains raises several questions. For example  on what
intermediate representations is it the easiest to apply AD and aggressive optimizations? IRs with
closures as ﬁrst-class objects will be able to use closure-based approaches to AD  whereas traditional
SSA-based representations (such as SIL) would need to use a tape-based approach. And which IRs
are most suitable for the heavy use of parallelism and distributed computing in ML?
Secondly  what should the source language be? The ML community is highly invested in Python 
an interpreted  dynamically typed programming language which does not have built-in support for
multidimensional arrays. More recently  frameworks have suggested using Swift (DLVM) or Julia
(JuliaDiff  [30])  languages with static typing and built-in multidimensional arrays respectively. On
the other hand  frameworks such as Theano and TensorFlow do not have an exposed source language
but can only be metaprogrammed. In the AD community  there has been strong push away from
traditional imperative languages such as Fortran and C to purely functional languages  since they
simplify the implementation of AD and are easier to optimize. Examples of this are VLAD  a dialect
of Lisp which is compiled with the Stalin∇ compiler [34  29  33]  DVL7  and DiffSharp [4].

2.3.1 Python

Because Python plays an important role in the ML community many popular ML frameworks
are Python-based. However  the language’s characteristics make it difﬁcult to implement a high-
performance AD-enabled ML framework in Python directly. The reference implementation of Python 
CPython  has effectively no support for concurrency  and the interpreter is relatively slow. Moreover 
its highly dynamic nature makes source transformation difﬁcult (Tangent imposes several restrictions
on the use of Python in order for it to perform ST). Python does not have built-in support for
multidimensional arrays  which are only supported through third-party frameworks such as NumPy.
How to reconcile users’ desire to work in Python because of its ﬂexibility with the need for high
performance and speed is an open question. ML frameworks have focused on metaprogramming
and using C extensions  but other approaches are possible. For example  Cython [6] is a superset
of Python which compiles to Python modules  whereas Numba [22] can compile individual Python
functions using LLVM.

3 Graph-based direct intermediate representation

We endeavor to combine several of the aforementioned techniques and insights from the compiler
and AD literature in order to provide a ﬂexible basis for an ML framework. This requires a well-
tailored intermediate representation which avoids the pitfalls of previous methods  while keeping
their strengths. Concretely  we propose an IR with the following properties:

Graph based Similar to Theano or TensorFlow  programs are represented as graphs. Graphs have
the advantage of being easy to optimize and ﬂexible about execution order  as operations that do not
depend on each other in the graph may be executed in any order  or in parallel. Unlike Theano and
TensorFlow  however  functions may be called recursively and they are ﬁrst-class objects. Functions
may be passed as parameters to other functions  or returned from a function and then called. A large
variety of control ﬂow constructs  ranging from simple loops to graph traversals  can be implemented
using these capabilities. Other graph frameworks tend to implement only a few of these as specialized
operators  such as Theano’s scan or TensorFlow’s while  leading to an IR which is both more
complex and less powerful than the general one we are proposing. A general IR does require more
work to transform and optimize in a provably correct way in the context of automatic differentiation 
but this work only needs to be done once.

Purely functional Mutation and side effects are problematic for reverse mode AD  where the
backward pass requires access to the unchanged intermediate variables from the forward pass. They
also interact poorly with complex optimizations because of aliasing. Restricting our language to be
purely functional therefore allows us to implement more robust AD and more advanced optimizations
compared to imperative languages.

7https://github.com/axch/dysvunctional-language

5

Note that Myia’s intended use case is not the writing of efﬁcient low-level kernels  which often
requires ﬁne-grained memory control. Similarly to  e.g.  TensorFlow  the user can write efﬁcient
low-level kernels and their derivatives in a low-level language such as CUDA or XLA  and expose
them to Myia as primitives.

Closure representation AD on functional languages involves storing the primal’s intermediate
results into closures which are then connected together to form the adjoint. It is therefore important
to have a natural representation for closures. As in Thorin  we represent a function’s graph’s free
variables as direct pointers to nodes that belong to other graphs  thereby creating an implicit nesting
relationship between them (a graph Gc is “nested” in Gp if it points to a node in Gp  or to a graph
nested in Gp  or to a node in a graph nested in Gp). This facilitates joint optimization of a closure
with the functions it is nested in. Closures are also a great means for abstraction and a natural way to
represent the methods of objects  so there is a concrete advantage in expressiveness from the user’s
perspective  which cannot be found in other frameworks.

Strongly typed In its canonical form  every node must be associated with a concrete type. This is
important to maximize performance. This is also important in ML applications  because operations
tend to be very costly and it is best to catch errors as early as possible. In addition to data types  there
is also a need to infer other properties such as the dimensions of vectors and matrices so that we can
guarantee that the inputs of all operations have compatible dimensions prior to executing them. Type
and shape inference are more complex and powerful on our proposed IR than in dataﬂow graphs
because of the need to support recursive calls and higher order functions.

3.1

IR speciﬁcation

Concretely  our representation represents a function as a graph object with a list of parameter nodes
and a single return node (multiple return values are supported through tuples). A node represents a
function application and has an ordered list of incoming edges. The ﬁrst incoming edge is a pointer
to the function to apply  and the rest point to the arguments. Constants are represented as nodes with
no incoming edges and a value ﬁeld. Links between nodes are bidirectional  so that graphs can be
traversed in either direction. Each non-constant node belongs to a single graph. See Figure 1 for a
visual representation of the IR.
Compared to other representations  our representation is more expressive than dataﬂow graphs  and
more ﬂexible than SSA or CPS representations which tend to be rigid about execution order. It is
closest to A-normal form (ANF  [15])  where every intermediate computation is assigned a unique
name  but it is graphical rather than syntactic and therefore easier to manipulate algorithmically.

3.2 Source transformation

AD can be implemented for this IR using ST with a closure-based method. We closely follow the
approach described in [29]. The transformed program constructs a chain of closures during the
forward computation. These closures contain the adjoint code required to compute the derivatives
along with the intermediate variables from the forward pass that are needed.
The transformation proceeds as follows: Each function call is transformed to return an additional
value  which is a closure called the ‘backpropagator’. The backpropagator computes the derivative
with respect to the inputs given the derivatives with respect to the outputs. The backpropagators of
primitives are known  whereas the backpropagators of user-deﬁned functions can be easily constructed
by calling the backpropagators of the function calls in the body in reverse order.
In order to ensure that our transformation can be applied again on the transformed program (so we
