2018,Multiple Instance Learning for Efficient Sequential Data Classification on Resource-constrained Devices,We study the problem of fast and efficient classification of sequential data (such as
time-series) on tiny devices  which is critical for various IoT related applications
like audio keyword detection or gesture detection. Such tasks are cast as a standard classification task by sliding windows over the data stream to construct data points. Deploying such classification modules on tiny devices is challenging as predictions over sliding windows of data need to be invoked continuously at a high frequency. Each such predictor instance in itself is expensive as it evaluates large models over long windows of data. In this paper  we address this challenge by exploiting the following two observations about classification tasks arising in typical IoT related applications: (a) the "signature" of a particular class (e.g. an audio keyword) typically occupies a small fraction of the overall data  and (b) class signatures tend to be discernible early on in the data. We propose a method  EMI-RNN  that exploits these observations by using a multiple instance learning formulation along with an early prediction technique to learn a model that achieves better accuracy compared to baseline models  while simultaneously reducing computation by a large fraction. For instance  on a gesture detection benchmark [ 25 ]  EMI-RNN improves standard LSTM model’s accuracy by up to 1% while requiring 72x less computation. This enables us to deploy such models for continuous real-time prediction on a small device such as Raspberry Pi0 and Arduino variants  a task that the baseline LSTM could not achieve. Finally  we also provide an analysis of our multiple instance learning algorithm in a simple setting and show that the proposed algorithm converges to the global optima at a linear rate  one of the first such result in this domain. The code for EMI-RNN is available at: https://github.com/Microsoft/EdgeML/tree/master/tf/examples/EMI-RNN,Multiple Instance Learning for Efﬁcient Sequential
Data Classiﬁcation on Resource-constrained Devices

Don Kurian Dennis

Chirag Pabbaraju

Microsoft Research  India

Harsha Vardhan Simhadri

Prateek Jain

{t-dodenn  t-chpab  harshasi  prajain}@microsoft.com

Abstract

We study the problem of fast and efﬁcient classiﬁcation of sequential data (such as
time-series) on tiny devices  which is critical for various IoT related applications
like audio keyword detection or gesture detection. Such tasks are cast as a standard
classiﬁcation task by sliding windows over the data stream to construct data points.
Deploying such classiﬁcation modules on tiny devices is challenging as predictions
over sliding windows of data need to be invoked continuously at a high frequency.
Each such predictor instance in itself is expensive as it evaluates large models
over long windows of data. In this paper  we address this challenge by exploiting
the following two observations about classiﬁcation tasks arising in typical IoT
related applications: (a) the "signature" of a particular class (e.g. an audio keyword)
typically occupies a small fraction of the overall data  and (b) class signatures
tend to be discernible early on in the data. We propose a method  EMI-RNN  that
exploits these observations by using a multiple instance learning formulation along
with an early prediction technique to learn a model that achieves better accuracy
compared to baseline models  while simultaneously reducing computation by a
large fraction. For instance  on a gesture detection benchmark [26]  EMI-RNN
requires 72x less computation than standard LSTM while improving accuracy by
1%. This enables us to deploy such models for continuous real-time prediction
on devices as small as a Raspberry Pi0 and Arduino variants  a task that the
baseline LSTM could not achieve. Finally  we also provide an analysis of our
multiple instance learning algorithm in a simple setting and show that the proposed
algorithm converges to the global optima at a linear rate  one of the ﬁrst such result
in this domain. The code for EMI-RNN is available at [14].

1

Introduction

Classiﬁcation of sequential data: Several critical applications  especially in the Internet of Things
(IoT) domain  require real-time predictions on sensor data. For example  wrist bands attempt to
recognize gestures or activities (such as walking  climbing) from Inertial Measurement Unit (IMU)
sensor data [2  26]. Similarly  several audio applications require detection of speciﬁc keywords like
"up"  "down" or certain urban sounds [35  32  29  5].
LSTM based models: Typically  such problems are modeled as a multi-class classiﬁcation problem
where each sliding window over the sensor data forms a sequential data point and each class represents
one category of events to be detected. Additionally  there is a "noise" class which denotes a no-event
data point. Recurrent Neural Networks (RNNs) like LSTMs [21] are a popular tool for modeling
such problems where the RNN produces an embedding of the given sequential data point that can
then be consumed by a standard classiﬁer like logistic regression to predict label of the point [20  30].
Deployment on tiny devices: Such event detection applications  especially in the IoT domain 
require deployment of inference on tiny edge devices with capabilities comparable to an Arduino
Uno [13] or a Raspberry Pi0 [19]. Further  the data is sampled at a high rate for good resolution

32nd Conference on Neural Information Processing Systems (NeurIPS 2018)  Montréal  Canada.

and the data buffer is often limited by small DRAMs. This means that the prediction needs to be
completed before the buffer is refreshed. For example  the GesurePod device [26] requires the buffer
to be refreshed every 100 ms and hence predictions must be completed in 100 ms using just 32KB of
RAM. Another critical requirement is that the lag between the event and the detection should be very
short. This not only requires fast but also “early” prediction  i.e.  the solution must classify an event
before even observing the entire event based on a preﬁx of the signature of the event.
Drawbacks of existing solutions: Unfortunately  existing state-of-the-art solutions like the ones
based on standard RNN models like LSTM are difﬁcult to deploy on tiny devices as they are
computationally expensive. Typically  the training data is collected “loosely” to ensure that the event
is captured somewhere in the time-series (see Figure 1). For example  in the case of the urban sound
detection problem [5]  the training data contains the relevant sound somewhere in the given 1-2 secs
clip  while the actual vehicle noise itself might last only for few hundreds of milliseconds. That is 
the sliding window length should be greater than 1 sec while ideally we should restrict ourselves
to 100ms window lengths. But  it is difﬁcult to pin-point the window of data where the particular
event occurred. This phenomenon holds across various domains such as keyword detection [35] 
gesture recognition [26] and activity recognition [2]. Due to the large number of time-steps required
to accommodate the buffer around the actual signature  the model size needs to be large enough to
capture a large amount of variations in the location of the signature in the data point. Moreover 
storing the entire data point can be challenging as the data for each time-step can be multidimensional 
e.g.  IMU data. Finally  due to the large computation time and the failure to tightly capture the
signature of the event  the lag in prediction can be large.
Our method: In this work  we propose a method that addresses above mentioned challenges in
deployment on tiny devices. In particular  our method is motivated by two observations: a) the actual
"signature" of the event forms a small fraction of the data point. So  we can split the data point into
multiple instances where only a few of the instances are positive instances  i.e.  they contain the
actual class/event while remaining instances represent noise (see Figure 1). b) The event class can
be discerned by observing a preﬁx of the signature of the class. For example  if the audio category
is that of repetitive sounds from a jack-hammer  then the class can be predicted with high accuracy
using only a few initial samples from the data. We also observe that in many such applications  a few
false positives are allowed as typically data from a positive event detection is uploaded to a powerful
cloud server that can further prune out false positives.
Based on the above observations  we propose a robust multi-instance learning (MIL) method with
early stopping. Our solution splits the given sequential data point into a collection of windows 
referred to here as instances (see Figure 1). All the instances formed from the sequential data point
are assigned it’s class label. Based on observation (a) above  each sequential data typically has
only a few consecutive positive instances  i.e.  instances (sub-windows) that contain the true class
"signature". The remaining negative instances have noisy labels and hence the classiﬁcation problem
with these labeled instances can be challenging. Our MIL algorithm uses the above mentioned
structure with an iterative thresholding technique to provide an efﬁcient and accurate algorithm. We
train our model to predict the label after observing the data only for a few time-steps of the instance.
That is  we jointly train our robust MIL model with an early classiﬁcation loss function to obtain an
accurate model that also reduces computation signiﬁcantly by predicting early. For simplicity  we
instantiate our algorithm for standard LSTM based architecture. However  our solution is independent
of the base architecture and can be applied to other RNN based models like GRU [9]  svdRNN [? ] 
UGRNN [11]  CNN-LSTM [28] etc.
We also provide theoretical analysis of our thresholding based robust MIL method. Note that existing
generic robust learning results [6  15] do not apply to sequential data based MIL problems  as the
number of incorrectly labeled instances form a large fraction of all instances (see Figure 1). Instead 
we study our algorithm in a simple separable setting and show that despite presence of a large amount
of noise  the algorithm converges to the optimal solution in a small number of iterations. Our analysis
represents one of the ﬁrst positive result for MIL in a more interesting non-homogeneous MIL setting
that is known to be NP-hard in general [4  27].
Empirical results: We present empirical results for our method when applied to ﬁve data sets
related to activity detection  gesture recognition [2  26]  keyword detection [35] etc. For each of the
benchmarks  we observe that our method is able to signiﬁcantly reduce the computational time while
also improving accuracy (in most of the benchmarks) over baseline LSTM architecture. In four of
the ﬁve data sets we examine  our methods save 65 − 90% of computation without losing accuracy

2

Figure 1: A time-series data point Xi bagged
into sliding windows of width ω 
just long
enough to contain the true class signature.

Figure 2: EMI-RNN architecture. Zi τ are
the “positive” instances from each data point
Xi which are then combined with E-RNN loss
(3.2.1) to train the model parameters.

compared to the baseline (LSTM trained on the entire time-series data) when compared at a ﬁxed
LSTM hidden dimension. In fact  for the keyword spotting task [35]  our method can provide up to
2% more accurate predictions while saving 2 − 3× in compute time. This enables deployment on a
Raspberry Pi0 device  a task beyond the reach of normal LSTMs. Additionally  in all the data sets 
our method is able to improve over baseline LSTM models using a much smaller hidden dimension 
thus making inference up to 72x less expensive.

1.1 Related Work
NN architectures for sequential data classiﬁcation: RNN based architectures are popular for
learning with sequential data as they are able to capture long-term dependencies and tend to have a
small working memory requirement. Gated architectures like LSTM [21]  GRU [8  10]  UGRNN
[11] have been shown to be successful for a variety of sequential data based applications. However 
they tend to be more expensive than vanilla RNN  so there has been a lot of recent work on stabilizing
training and performance of RNNs [3? ]. In addition  CNN based architectures [29] have also
been proposed such as CNN-LSTM [16]  but these methods tend to have a large working RAM
requirement. Our method is independent of underlying architecture and can be combined with any
of the above RNN-based techniques. For our experiments  we focus on the LSTM architecture as it
tends to be stable and provides nearly state-of-the-art accuracy on most datasets.
MIL/Robust learning: Multi-instance learning (MIL) techniques are popular for modeling one-sided
noise where positive bags of instances can have several negative instances as well. Existing practical
algorithms [1] iteratively reﬁne the set of positive instances to learn a robust classiﬁer but typically do
not have strong theoretical properties. On the other hand  [27] consider a homogeneous setting where
one can obtain strong theoretical bounds but the assumptions are too strong for any practical setting
and the resulting algorithm is just a standard classiﬁer. In contrast  our algorithm provides signiﬁcant
accuracy improvements on benchmarks  and at the same time  we can analyze the algorithm in a
non-homogeneous setting which represents one of the ﬁrst positive results in this setting.
Early classiﬁcation: Recently  several papers have studied the problem of early classiﬁcation in
sequential data [25  33  12  36  17]  however these techniques assume a pre-trained classiﬁer and
learn a policy for early classiﬁcation independently which can lead to signiﬁcant loss in accuracy.
[24] introduced an early-classiﬁcation method for the speciﬁc task of human activity detection in
video. Independent of our work  [7] developed an architecture to reduce computational cost of RNNs
by skipping certain hidden-state updates. They show that this technique leads to almost no loss
in accuracy. Their technique is complementary to our work as our focus is on early classiﬁcation 
i.e.  predicting the class before observing the entire sequential data point. Further  our EMI-RNN
architecture uses joint training with MIL formulation to ensure that such early classiﬁcation is
accurate for a large fraction of points.
2 Problem Formulation and Notation
Suppose we are given a dataset of labeled sequential data points Z = [(X1  y1)  . . .   (Xn  yn)] where
each sequential data point Xi = [xi1  xi2  . . .   xiT ] is a sequence of T data points with xi t ∈ Rd.
That is  the t-th time-step data point of the i-th sequential data point is xi t. Throughout the paper 
vi denotes the i-th component of a vector v. Let yi ∈ [L] denote the class of i-the data point Xi;
[L] := {−1  1  2  . . .   L}. Here yi = −1 denotes "noisy" points that do not correspond to any class.
For example  in keyword detection application  Xi is an audio clip with xit being the t-th sample
from the clip and the yi-th keyword spoken in the clip. If no keyword is present  yi = −1.

3

Given Z  the goal is to learn a classiﬁer f : Rd×T → RL that can accurately predict the class of
the input sequential data point X using arg maxb fb(X). In addition  for f to be deployable on tiny
devices in real-world settings  it must satisfy three key requirements: a) small memory footprint  b)
can be computed quickly on resource-constrained devices  c) should predict the correct class after
observing as few time-step data points of X as possible  i.e.  as early as possible.
We focus on problems where each class has a certain "signature" in the sequential data (see Figure 1).
The goal is to train f to identify the signature efﬁciently and with minimal lag. Further  due to the
architectural constraints of tiny devices  it might not be possible to buffer the entire sequential point
in memory. This implies that early classiﬁcation with small number of time-step data points is critical
to minimizing the lag in prediction.
Due to the sequential nature of data  existing approaches use recurrent neural network (RNN) based
solutions [21  8]. However  as mentioned in Section 1  such solutions do not fare well on the three
key requirements mentioned above due to training data inefﬁciency (see Section 1). That is  while the
actual class-signature is a small part of the entire data point  in absence of more ﬁne-grained labels 
existing methods typically process the entire sequential data point to predict the class label which
leads to expensive computation and large model sizes.
In the next section  we describe our method that addresses all the key requirements mentioned above
— low memory footprint  low computational requirement and small lag in prediction.
3 Method
As mentioned in the previous section  although the entire sequential data point Xi =
[xi1  xi2  . . .   xiT ] is labeled with class yi  there is a small subset of consecutive but unknown
time-steps that capture the signature of the label  for instance the part of audio clip where a particular
keyword is spoken (see Figure 1). Moreover  the label signature is signiﬁcantly distinct from other
labels  and hence can be detected reasonably early without even observing the entire signature. In
this section  we introduce a method that exploits both these insights to obtain a classiﬁer with smaller
prediction complexity as well as smaller "lag" in label prediction.
We would like to stress that our method is orthogonal to the actual neural-network architecture used
for classiﬁcation and can be used with any of the state-of-the-art classiﬁcation techniques employed
for sequential data. In this work we instantiate our method with a simple LSTM based architecture for
its ease of training [26  18  23]. Our method is based on two key techniques and next two subsections
describe both the techniques separately; Section 3.3 then describes our ﬁnal method that combines
both the techniques to provide an efﬁcient and "early" sequential data classiﬁer.

3.1 MI-RNN
As the true label signature can be a tiny fraction of a given sequential data point  we break the
data point itself into multiple overlapping instances such that at least one of the instance cover the
true label signature (see Figure 1). That is  given a sequential data point Xi  we construct a bag
Xi = [Zi 1  . . .   Zi T−ω+1] where Zi τ = [xi τ   . . .   xi τ +ω−1] ∈ Rd×ω represents the τ-th instance
(or sub-window) of data points. ω is the instance-length  i.e.  the number of time-steps in each
instance Zi τ   and should be set close to the typical length of the label signature. For example  if
keywords in our dataset can be all captured in 10 time-steps then ω should be set close to 10.
While a small number of Zi τ instances have label yi  the remaining instances are essentially noise
and should be set to have label yi τ = −1. Since we do not have this label information apriori the
label of each instance in the i-th sequential data point is initialized to yi. This leads to a heavily noisy
labelling. Because of this  the problem can be viewed as a multi-instance learning problem with only
"bag" level label available rather than instance level labels. Similarly  the problem can also be viewed
as a robust learning problem where the label for most of the instances is wrong.
Naturally  existing techniques for robust learning do not apply as they are not suitable for the large
amount of noise in this setting. Moreover  these methods and multi-instance learning methods fail to
exploit structure in the problem – the existence of consecutive set of instances with the given label.
Instead  we study a simple optimization problem that captures the above mentioned structure:

δi τ (cid:96)(f (Zi τ )  yi))  such that  δi τ =

(3.1.1)

(cid:88)

min

f si 1≤i≤n

1
n

i τ

4

(cid:26)1  τ ∈ [si  si + k − 1] 

0  τ /∈ [si  si + k − 1].

steps  instance-length ω  parameter k

Algorithm 1 MI-RNN: Multi-instance RNN
Require: Sequential data: {(X1  y1)  . . .   (Xn  yn)} with T
1: Create multiple instances: {Zi τ   1 ≤ τ ≤ T − ω + 1}
2: Initialize: f ←Train-LSTM({(Zi τ   yi)  ∀i  τ})
3: repeat
4:
1] ∀i})

f ←Train-LSTM({(Zi τ   yi τ )  τ ∈ [si  si + k −

with Zi τ = [xi τ   . . .   xi τ +ω−1] for all i

si = arg maxτ(cid:48) (cid:88)

fyi (Zi τ(cid:48) )  ∀i

5:

6: until Convergence

τ(cid:48)≤τ≤τ(cid:48)+k−1

Algorithm 2 Inference for E-RNN
Require: An instance Z = [x1  x2  . . .   xω] 

and a probability threshold ˆp.

1: for t = 1  2  . . .   ω do
pt ← MAX(wT ot)
2:
(cid:96)i t ← ARGMAX(wT ot)
3:
if pi t ≥ ˆp or t = ω then
4:
5:
end if
6:
7: end for

return [(cid:96)i t  pi t]

We propose a thresholding based method that exploits the structure in label noise and is still simple
enough to be implemented efﬁciently on top of LSTM training. Algorithm 1 presents a pseudo-code
of our algorithm. The Train-LSTM procedure can use any standard optimization algorithm such as
SGD+Momentum [31]  Adam [22] to train a standard LSTM with a multi-class logistic regression
layer. Input to this procedure is the instance level data constructed by windowing of the sequential
data along with the corresponding estimated instance labels. Naturally  our technique applies even if
we use any other architecture to learn the classiﬁer f.
We further reﬁne the trained LSTM by re-estimating the "correct" set of instances per sequential data
point using a simple thresholding scheme. In particular  we ﬁnd k (a parameter) consecutive instances
for which sum of predictions (using function f) for the data-point label y is highest and include it
in training set; the remaining set of instances are ignored for that particular iteration. The predicted
label of a given point X = [x1  . . .   xT ] is given by: y = arg maxb maxτ
While our algorithm is similar to the hard-thresholding approach popular in robust learning [6  15] 
both the thresholding operator and the setting are signiﬁcantly different. For example  robust learning
techniques are expected to succeed when the amount of noisy labels is small  but in our problem only
k out of T instances are correctly labeled (typically k (cid:28) T ). Nonetheless  we are still able to analyze
our method in a simple setting where the data itself is sampled from a well-separated distribution.
3.1.1 Analysis

t∈[τ τ +k−1] fb(xt).

(cid:80)

n   ¯yP

1   ¯yP

n   ¯yN

1   ¯yN

1 )  . . .   (Z P

1 )  . . .   (Z N

n )] be the given dataset where Z P

i de-
Let Z = [(Z P
n )  (Z N
i denotes the i-th "negative" bag. For simplicity  we assume that
notes the i-th "positive" bag and Z N
i denotes the label vector for i-th positive bag. For
each positive and negative bag contain T points. ¯yP
i ∈ {−1  1}T .
simplicity  we only consider binary classiﬁcation problem in this section. That is  ¯yP
Also  let number of positives (i.e. points with label +1) be k and let all the positives be consecutive
in index set 1 ≤ τ ≤ T . By deﬁnition  ¯yN
i are not
available apriori. Let S ⊆ [n] × [T ] be an index set of columns  i.e.  S = {(i1  τ1)  . . .   (i|S|  τ|S|)}.
Now  given Z P   Z N   the goal is to learn a linear classiﬁer w s.t. sign(wT Z P
i τ and
i τ ) = −1  i.e. each point in the positive/negative bag is correctly classiﬁed. To this end 
sign(wT Z N
we use the following modiﬁed version of Algorithm 1:

i τ = −1 for all instances in the bag. Note that ¯yP

i τ ) = ¯yP

(cid:88)

(cid:88)

w0 = arg min
w

(1 − wT Z P

i τ )2 +

(−1 − wT Z N

i τ )2 

i τ

i τ

(cid:88)

Sr+1 = ∪n

i=1 ∪k1+k

τ =k1

(i  τ )  where  k1 = arg max
k1

(cid:104)wr  Z P

i τ(cid:105) ∀i  ∀r ≥ 0

(1 − (cid:104)w  Z P

i τ(cid:105))2 +

(i τ )∈Sr+1

wr+1 = arg min
w

where k is a parameter that speciﬁes the number of true positives in each bag  i.e. (cid:80)

i τ > 0] = k.
Note that the above optimization algorithm is essentially an alternating optimization based algorithm
where in each iteration we alternately estimate the classiﬁer w and the correct set of positive points

(3.1.2)

I[yP

i τ

τ

(−1 − (cid:104)w  Z N

i τ(cid:105))2  ∀r ≥ 0

1
T

k1+k(cid:88)
(cid:88)

τ =k1

5

i τ and xN

i τ . Let gN
i τ

i τ )µ− + gP

i = [xP

i 1  . . .   xP

i T ] and Z N

1   . . .   Z P

n ]  Z N = [Z N

i τ = µ− + gN

i τ + 1)µ+ + 0.5(1 − yP

i τ be arbitrary vectors that satisfy: (cid:107)(cid:80)

in positive bags. Naturally the problem is non-convex and is in fact NP-hard in general  and hence the
above algorithm might not even converge. However  by restricting the noise in the bags to a class of
"nice" distributions  we can show that the above algorithm converges to the global optima at a linear
rate. That is  within a small number of steps the algorithm is able to learn the correct set of positive
points in each bag and hence the optimal classiﬁer w∗ as well.
Theorem 3.1. Let Z P = [Z P
n ] be the data matrix of positive and
1   . . .   Z N
negative bags  respectively  with each bag containing T points  i.e.  Z P
i =
i T ]. Let ¯yP be the true labels of each data point in positive bags. Let each data point be
[xN
i 1  . . .   xN
i.i.d∼ D
given by: xP
i τ = 0.5(yP
be sampled from D and let D be sub-Gaussian with sub-Gaussian norm ψ(D). Wlog  let each gN
i τ be
(i τ )(cid:107) ≤ γ|S|
isometric random vectors. Also  let gP
for all S where γ > 0 is a constant. Moreover  let n ≥ dT C2
ψ > 0 is a constant dependent
