2018,To Trust Or Not To Trust A Classifier,Knowing when a classifier's prediction can be trusted is useful in many applications and critical for safely using AI. While the bulk of the effort in machine learning research has been towards improving classifier performance  understanding when a classifier's predictions should and should not be trusted has received far less attention. The standard approach is to use the classifier's discriminant or confidence score; however  we show there exists an alternative that is more effective in many situations. We propose a new score  called the {\it trust score}  which measures the agreement between the classifier and a modified nearest-neighbor classifier on the testing example. We show empirically that high (low) trust scores produce surprisingly high precision at identifying correctly (incorrectly) classified examples  consistently outperforming the classifier's confidence score as well as many other baselines. Further  under some mild distributional assumptions  we show that if the trust score for an example is high (low)  the classifier will likely agree (disagree) with the Bayes-optimal classifier. Our guarantees consist of non-asymptotic rates of statistical consistency under various nonparametric settings and build on recent developments in topological data analysis.,To Trust Or Not To Trust A Classiﬁer

Heinrich Jiang∗
Google Research

heinrichj@google.com

Been Kim
Google Brain

beenkim@google.com

Melody Y. Guan†
Stanford University

mguan@stanford.edu

Maya Gupta

Google Research

mayagupta@google.com

Abstract

Knowing when a classiﬁer’s prediction can be trusted is useful in many applications
and critical for safely using AI. While the bulk of the effort in machine learning
research has been towards improving classiﬁer performance  understanding when
a classiﬁer’s predictions should and should not be trusted has received far less
attention. The standard approach is to use the classiﬁer’s discriminant or conﬁdence
score; however  we show there exists an alternative that is more effective in many
situations. We propose a new score  called the trust score  which measures the
agreement between the classiﬁer and a modiﬁed nearest-neighbor classiﬁer on
the testing example. We show empirically that high (low) trust scores produce
surprisingly high precision at identifying correctly (incorrectly) classiﬁed examples 
consistently outperforming the classiﬁer’s conﬁdence score as well as many other
baselines. Further  under some mild distributional assumptions  we show that if the
trust score for an example is high (low)  the classiﬁer will likely agree (disagree)
with the Bayes-optimal classiﬁer. Our guarantees consist of non-asymptotic rates
of statistical consistency under various nonparametric settings and build on recent
developments in topological data analysis.

1

Introduction

Machine learning (ML) is a powerful and widely-used tool for making potentially important decisions 
from product recommendations to medical diagnosis. However  despite ML’s impressive performance 
it makes mistakes  with some more costly than others. As such  ML trust and safety is an important
theme [1  2  3]. While improving overall accuracy is an important goal that the bulk of the effort in
ML community has been focused on  it may not be enough: we need to also better understand the
strengths and limitations of ML techniques.
This work focuses on one such challenge: knowing whether a classiﬁer’s prediction for a test example
can be trusted or not. Such trust scores have practical applications. They can be directly shown to
users to help them gauge whether they should trust the AI system. This is crucial when a model’s
prediction inﬂuences important decisions such as a medical diagnosis  but can also be helpful even
in low-stakes scenarios such as movie recommendations. Trust scores can be used to override the
classiﬁer and send the decision to a human operator  or to prioritize decisions that human operators
should be making. Trust scores are also useful for monitoring classiﬁers to detect distribution shifts
that may mean the classiﬁer is no longer as useful as it was when deployed.

∗All authors contributed equally.
†Work done while intern at Google Research.
An open-source implementation of Trust Scores can be found here: https://github.com/google/TrustScore

32nd Conference on Neural Information Processing Systems (NeurIPS 2018)  Montréal  Canada.

A standard approach to deciding whether to trust a classiﬁer’s decision is to use the classiﬁers’ own
reported conﬁdence or score  e.g. probabilities from the softmax layer of a neural network  distance
to the separating hyperplane in support vector classiﬁcation  mean class probabilities for the trees in
a random forest. While using a model’s own implied conﬁdences appears reasonable  it has been
shown that the raw conﬁdence values from a classiﬁer are poorly calibrated [4  5]. Worse yet  even if
the scores are calibrated  the ranking of the scores itself may not be reliable. In other words  a higher
conﬁdence score from the model does not necessarily imply higher probability that the classiﬁer is
correct  as shown in [6  7  8]. A classiﬁer may simply not be the best judge of its own trustworthiness.
In this paper  we use a set of labeled examples (e.g. training data or validation data) to help determine
a classiﬁer’s trustworthiness for a particular testing example. First  we propose a simple procedure
that reduces the training data to a high density set for each class. Then we deﬁne the trust score—the
ratio between the distance from the testing sample to the nearest class different from the predicted
class and the distance to the predicted class—to determine whether to trust that classiﬁer prediction.
Theoretically  we show that high/low trust scores correspond to high probability of agree-
ment/disagreement with the Bayes-optimal classiﬁer. We show ﬁnite-sample estimation rates when
the data is full-dimension and supported on or near a low-dimensional manifold. Interestingly  we
attain bounds that depend only on the lower manifold dimension and independent of the ambient
dimension without any changes to the procedure or knowledge of the manifold. To our knowledge 
these results are new and may be of independent interest.
Experimentally  we found that the trust score better identiﬁes correctly-classiﬁed points for low and
medium-dimension feature spaces than the model itself. However  high-dimensional feature spaces
were more challenging  and we demonstrate that the trust score’s utility depends on the vector space
used to compute the trust score differences.

2 Related Work

One related line of work is that of conﬁdence calibration  which transforms classiﬁer outputs into
values that can be interpreted as probabilities  e.g. [9  10  11  4]. In recent work  [5] explore the
structured prediction setting  and [12] obtain conﬁdence estimates by using ensembles of networks.
These calibration techniques typically only use the the model’s reported score (and the softmax
layer in the case of a neural network) for calibration  which notably preserves the rankings of the
classiﬁer scores. Similarly  [13] considered using the softmax probabilities for the related problem of
identifying misclassiﬁcations and mislabeled points.
Recent work explored estimating uncertainty for Bayesian neural networks and returning a distribution
over the outputs [14  15]. The proposed trust score does not change the network structure (nor does
it assume any structure) and gives a single score  rather than a distribution over outputs as the
representation of uncertainty.
The problem of classiﬁcation with a reject option or learning with abstention [16  17  18  19  20  21 
22] is a highly related framework where the classiﬁer is allowed to abstain from making a prediction
at a certain cost. Typically such methods jointly learn the classiﬁer and the rejection function. Note
that the interplay between classiﬁcation rate and reject rate is studied in many various forms e.g.
[23  24  25  26  27  28  29  30  31  32]. Our paper assumes an already trained and possibly black-box
classiﬁer and learns the conﬁdence scores separately  but we do not explicitly learn the appropriate
rejection thresholds.
Whether to trust a classiﬁer also arises in the setting where one has access to a sequence of classiﬁers 
but there is some cost to evaluating each classiﬁer  and the goal is to decide after evaluating each
classiﬁer in the sequence if one should trust the current classiﬁer decision enough to stop  rather than
evaluating more classiﬁers in the sequence (e.g. [33  34  35]). Those conﬁdence decisions are usually
based on whether the current classiﬁer score will match the classiﬁcation of the full sequence.
Experimentally we ﬁnd that the vector space used to compute the distances in the trust score matters 
and that computing trust scores on more-processed layers of a deep model generally works better.
This observation is similar to the work of Papernot and McDaniel [36]  who use k-NN regression on
the intermediate representations of the network which they showed enhances robustness to adversarial
attacks and leads to better calibrated uncertainty estimations.

2

Our work builds on recent results in topological data analysis. Our method to ﬁlter low-density
points estimates a particular density level-set given a parameter α  which aims at ﬁnding the level-
set that contains 1 − α fraction of the probability mass. Level-set estimation has a long history
[37  38  39  40  41  42]. However such works assume knowledge of the density level  which is
difﬁcult to determine in practice. We provide rates for Algorithm 1 in estimating the appropriate
level-set corresponding to α without knowledge of the level. The proxy α offers a more intuitive
parameter compared to the density value  is used for level-set estimation. Our analysis is also done
under various settings including when the data lies near a lower dimensional manifold and we provide
rates that depend only on the lower dimension.

3 Algorithm: The Trust Score

Our approach proceeds in two steps outlined in Algorithm 1 and 2. We ﬁrst pre-process the training
data  as described in Algorithm 1  to ﬁnd the α-high-density-set of each class  which is deﬁned as
the training samples within that class after ﬁltering out α-fraction of the samples with lowest density
(which may be outliers):
Deﬁnition 1 (α-high-density-set). Let 0 ≤ α < 1 and f be a continuous density function with
compact support X ⊆ RD. Then deﬁne Hα(f )  the α-high-density-set of f  to be the λα-level set of

f  deﬁned as {x ∈ X : f (x) ≥ λα} where λα := inf(cid:8)λ ≥ 0 :(cid:82)

X 1 [f (x) ≤ λ] f (x)dx ≥ α(cid:9).

In order to approximate the α-high-density-set  Algorithm 1 ﬁlters the α-fraction of the sample points
with lowest empirical density  based on k-nearest neighbors. This data ﬁltering step is independent of
the given classiﬁer h.
Then  the second step: given a testing sample  we deﬁne its trust score to be the ratio between the
distance from the testing sample to the α-high-density-set of the nearest class different from the
predicted class  and the distance from the test sample to the α-high-density-set of the class predicted
by h  as detailed in Algorithm 2. The intuition is that if the classiﬁer h predicts a label that is
considerably farther than the closest label  then this is a warning that the classiﬁer may be making a
mistake.
Our procedure can thus be viewed as a comparison to a modiﬁed nearest-neighbor classiﬁer  where
the modiﬁcation lies in the initial ﬁltering of points not in the α-high-density-set for each class.
Remark 1. The distances can be computed with respect to any representation of the data. For exam-
ple  the raw inputs  an unsupervised embedding of the space  or the activations of the intermediate
representations of the classiﬁer. Moreover  the nearest-neighbor distance can be replaced by other
distance measures  such as k-nearest neighbors or distance to a centroid.

Algorithm 1 Estimating α-high-density-set

Parameters: α (density threshold)  k.
Inputs: Sample points X := {x1  ..  xn} drawn from f.
Deﬁne k-NN radius rk(x) := inf{r > 0 : |B(x  r) ∩ X| ≥ k} and let ε := inf{r > 0 : |{x ∈ X :
rk(x) > r}| ≤ α · n}.

return (cid:99)Hα(f ) := {x ∈ X : rk(x) ≤ ε}.

Algorithm 2 Trust Score

Parameters: α (density threshold)  k.
Input: Classiﬁer h : X → Y. Training data (x1  y1)  ...  (xn  yn). Test example x.
{xj : 1 ≤ j ≤ n  yj = (cid:96)}. Then  return the trust score  deﬁned as:

For each (cid:96) ∈ Y  let (cid:99)Hα(f(cid:96)) be the output of Algorithm 1 with parameters α  k and sample points
where(cid:101)h(x) = argminl∈Y l(cid:54)=h(x) d

(cid:16)
(cid:17)
x (cid:99)Hα(f(cid:101)h(x))
(cid:17)
x (cid:99)Hα(fl)

ξ(h  x) := d

(cid:16)

.

(cid:16)

(cid:17)
x (cid:99)Hα(fh(x))

 

/d

The method has two hyperparameters: k (the number of neighbors  such as in k-NN) and α (fraction
of data to ﬁlter) to compute the empirical densities. We show in theory that k can lie in a wide range

3

and still give us the desired consistency guarantees. Throughout our experiments  we ﬁx k = 10  and
use cross-validation to select α as it is data-dependent.
Remark 2. We observed that the procedure was not very sensitive to the choice of k and α. As will
be shown in the experimental section  for efﬁciency on larger datasets  we skipped the initial ﬁltering
step of Algorithm 1 (leading to a hyperparameter-free procedure) and obtained reasonable results.
This initial ﬁltering step can also be replaced by other strategies. One such example is ﬁltering
examples whose labels have high disagreement amongst its neighbors  which is implemented in the
open-source code release but not experimented with here.

4 Theoretical Analysis

In this section  we provide theoretical guarantees for Algorithms 1 and 2. Due to space constraints 
all the proofs are deferred to the Appendix. To simplify the main text  we state our results treating δ 
the conﬁdence level  as a constant. The dependence on δ in the rates is made explicit in the Appendix.
We show that Algorithm 1 is a statistically consistent estimator of the α-high-density-level set with
ﬁnite-sample estimation rates. We analyze Algorithm 1 in three different settings: when the data lies
on (i) a full-dimensional RD; (ii) an unknown lower dimensional submanifold embedded in RD; and
(iii) an unknown lower dimensional submanifold with full-dimensional noise.
For setting (i)  where the data lies in RD  the estimation rate has a dependence on the dimension D 
which may be unattractive in high-dimensional situations: this is known as the curse of dimensionality 
suffered by density-based procedures in general. However  when the data has low intrinsic dimension
in (ii)  it turns out that  remarkably  without any changes to the procedure  the estimation rate depends
on the lower dimension d and is independent of the ambient dimension D. However  in realistic
situations  the data may not lie exactly on a lower-dimensional manifold  but near one. This reﬂects
the setting of (iii)  where the data essentially lies on a manifold but has general full-dimensional noise
so the data is overall full-dimensional. Interestingly  we show that we still obtain estimation rates
depending only on the manifold dimension and independent of the ambient dimension; moreover  we
do not require knowledge of the manifold nor its dimension to attain these rates.
We then analyze Algorithm 2  and establish the culminating result of Theorem 4: for labeled data
distributions with well-behaved class margins  when the trust score is large  the classiﬁer likely agrees
with the Bayes-optimal classiﬁer  and when the trust score is small  the classiﬁer likely disagrees with
the Bayes-optimal classiﬁer. If it turns out that even the Bayes-optimal classiﬁer has high-error in
a certain region  then any classiﬁer will have difﬁculties in that region. Thus  Theorem 4 does not
guarantee that the trust score can predict misclassiﬁcation  but rather that it can predict when the
classiﬁer is making an unreasonable decision.

4.1 Analysis of Algorithm 1

We require the following regularity assumptions on the boundaries of Hα(f )  which are standard
in analyses of level-set estimation [40]. Assumption 1.1 ensures that the density around Hα(f ) has
both smoothness and curvature. The upper bound gives smoothness  which is important to ensure
that our density estimators are accurate for our analysis (we only require this smoothness near the
boundaries and not globally). The lower bound ensures curvature: this ensures that Hα(f ) is salient
enough to be estimated. Assumption 1.2 ensures that Hα(f ) does not get arbitrarily thin anywhere.
Assumption 1 (α-high-density-set regularity). Let β > 0. There exists ˇCβ  ˆCβ  β  rc  r0  ρ > 0 s.t.
1. ˇCβ · d(x  Hα(f ))β ≤ |λα − f (x)| ≤ ˆCβ · d(x  Hα(f ))β for all x ∈ ∂Hα(f ) + B(0  rc).
2. For all 0 < r < r0 and x ∈ Hα(f )  we have Vol(B(x  r)) ≥ ρ · rD.

where ∂A denotes the boundary of a set A  d(x  A) := inf x(cid:48)∈A ||x−x(cid:48)||  B(x  r) := {x(cid:48) : |x−x(cid:48)| ≤
r} and A + B(0  r) := {x : d(x  A) ≤ r}.

Our statistical guarantees are under the Hausdorff metric  which ensures a uniform guarantee over
our estimator: it is a stronger notion of consistency than other common metrics [41  43].
Deﬁnition 2 (Hausdorff distance). dH (A  B) := max{supx∈A d(x  B)  supx∈B d(x  A)}.

4

We now give the following result for Algorithm 1. It says that as long as our density function satisﬁes
the regularity assumptions stated earlier  and the parameter k lies within a certain range  then we can
bound the Hausdorff distance between what Algorithm 1 recovers and Hα(f )  the true α-high-density
set  from an i.i.d. sample drawn from f of size n. Then  as n goes to ∞  and k grows as a function of
n  the quantity goes to 0.
Theorem 1 (Algorithm 1 guarantees). Let 0 < δ < 1 and suppose that f is continuous and has
compact support X ⊆ RD and satisﬁes Assumption 1. There exists constants Cl  Cu  C > 0
depending on f and δ such that the following holds with probability at least 1 − δ. Suppose that k
satisﬁes Cl · log n ≤ k ≤ Cu · (log n)D(2β+D) · n2β/(2β+D). Then we have

n−1/2D + log(n)1/2β · k−1/2β(cid:17)
dH (Hα(f ) (cid:99)Hα(f )) ≤ C ·(cid:16)
dH (Hα(f ) (cid:99)Hα(f )) (cid:46) max{n−1/2D  n−1/(2β+D)}.

.

Remark 3. The condition on k can be simpliﬁed by ignoring log factors: log n (cid:46) k (cid:46) n2β/(2β+D) 
which is a wide range. Setting k to its allowed upper bound  we obtain our consistency guarantee of

The ﬁrst term is due to the error from estimating the appropriate level given α (i.e. identifying the
level λα) and the second term corresponds to the error for recovering the level set given knowledge
of the level. The latter term matches the lower bound for level-set estimation up to log factors [39].

4.2 Analysis of Algorithm 1 on Manifolds

One of the disadvantages of Theorem 1 is that the estimation errors have a dependence on D  the
dimension of the data  which may be highly undesirable in high-dimensional settings. We next
improve these rates when the data has a lower intrinsic dimension. Interestingly  we are able to show
rates that depend only on the intrinsic dimension of the data  without explicit knowledge of that
dimension nor any changes to the procedure. As common to related work in the manifold setting  we
make the following regularity assumptions which are standard among works in manifold learning
(e.g. [44  45  46]).
Assumption 2 (Manifold Regularity). M is a d-dimensional smooth compact Riemannian manifold
without boundary embedded in compact subset X ⊆ RD with bounded volume. M has ﬁnite
condition number 1/τ  which controls the curvature and prevents self-intersection.
Theorem 2 (Manifold analogue of Theorem 1). Let 0 < δ < 1. Suppose that density function f
is continuous and supported on M and Assumptions 1 and 2 hold. Suppose also that there exists
λ0 > 0 such that f (x) ≥ λ0 for all x ∈ M. Then  there exists constants Cl  Cu  C > 0 depending
on f and δ such that the following holds with probability at least 1 − δ. Suppose that k satisﬁes
Cl · log n ≤ k ≤ Cu · (log n)d(2β(cid:48)+d) · n2β(cid:48)/(2β(cid:48)+d). where β(cid:48) := max{1  β}. Then we have

n−1/2d + log(n)1/2β · k−1/2β(cid:17)
dH (Hα(f ) (cid:99)Hα(f )) ≤ C ·(cid:16)
dH (Hα(f ) (cid:99)Hα(f )) (cid:46) max{n−1/2d  n−1/(2 max{1 β}+d)}.

.

Remark 4. Setting k to its allowed upper bound  we obtain (ignoring log factors) 

The ﬁrst term can be compared to that of the previous result where D is replaced with d. The second
term is the error for recovering the level set on manifolds  which matches recent rates [42].

4.3 Analysis of Algorithm 1 on Manifolds with Full Dimensional Noise

In realistic settings  the data may not lie exactly on a low-dimensional manifold  but near one. We
next present a result where the data is distributed along a manifold with additional full-dimensional
noise. We make mild assumptions on the noise distribution. Thus  in this situation  the data has
intrinsic dimension equal to the ambient dimension. Interestingly  we are still able to show that the
rates only depend on the dimension of the manifold and not the dimension of the entire data.
Theorem 3. Let 0 < η < α < 1 and 0 < δ < 1. Suppose that distribution F is a weighted
mixture (1 − η) · FM + η · FE where FM is a distribution with continous density fM supported on a
d-dimensional manifold M satisfying Assumption 2 and FE is a (noise) distribution with continuous
density fE with compact support over RD with d < D. Suppose also that there exists λ0 > 0 such

5

that fM (x) ≥ λ0 for all x ∈ M and H(cid:101)α(fM ) (where(cid:101)α := α−η
fM . Let (cid:98)Hα be the output of Algorithm 1 on a sample X of size n drawn i.i.d. from F. Then  there

1−η ) satisﬁes Assumption 1 for density

exists constants Cl  Cu  C > 0 depending on fM   fE  η  M and δ such that the following holds with
probability at least 1− δ. Suppose that k satisﬁes Cl· log n ≤ k ≤ Cu· (log n)d(2β(cid:48)+d)· n2β(cid:48)/(2β(cid:48)+d) 
where β(cid:48) := max{1  β}. Then we have

dH (H(cid:101)α(fM ) (cid:99)Hα) ≤ C ·(cid:16)

n−1/2d + log(n)1/2β · k−1/2β(cid:17)

.

The above result is compelling because it shows why our methods can work  even in high-dimensions 
despite the curse of dimensionality of non-parametric methods. In typical real-world data  even if
the data lies in a high-dimensional space  there may be far fewer degrees of freedom. Thus  our
theoretical results suggest that when this is true  then our methods will enjoy far better convergence
rates – even when the data overall has full intrinsic dimension due to factors such as noise.

4.4 Analysis of Algorithm 2: the Trust Score

the conditional distribution for label (cid:96) supported on M. Deﬁne M(cid:96) := H(cid:101)α(f(cid:96))  where(cid:101)α := α−η

We now provide a guarantee about the trust score  making the same assumptions as in Theorem 3 for
each of the label distributions. We additionally assume that the class distributions are well-behaved
in the following sense: that high-density-regions for each of the classes satisfy the property that for
any point x ∈ X   if the ratio of the distance to one class’s high-density-region to that of another is
smaller by some margin γ  then it is more likely that x’s label corresponds to the former class.
Theorem 4. Let 0 < η < α < 1. Let us have labeled data (x1  y1)  ...  (xn  yn) drawn from
distribution D  which is a joint distribution over X × Y where Y are the labels  |Y| < ∞  and
X ⊆ RD is compact. Suppose for each (cid:96) ∈ Y  the conditional distribution for label (cid:96) satisﬁes the
conditions of Theorem 3 for some manifold and noise level η. Let fM (cid:96) be the density of the portion of
1−η and
let n be the maximum Hausdorff error from estimating M(cid:96) over each (cid:96) ∈ Y in Theorem 3. Assume
that min(cid:96)∈Y PD(y = (cid:96)) > 0 to ensure we have samples from each label.
Suppose also that for each x ∈ X   if d(x  Mi)/d(x  Mj) < 1 − γ then P(y = i|x) > P(y = j|x)
for i  j ∈ Y. That is  if we are closer to Mi than Mj by a ratio of less than 1 − γ  then the
point is more likely to be from class i. Let h∗ be the Bayes-optimal classiﬁer  deﬁned by h∗(x) :=
argmax(cid:96)∈Y P(y = (cid:96)|x). Then the trust score ξ of Algorithm 2 satisﬁes the following with high
probability uniformly over all x ∈ X and all classiﬁers h : X → Y simultaneously for n sufﬁciently
large depending on D:

(cid:32) d(x  M(cid:101)h(x))
(cid:32)

d(x  Mh(x))

d(x  Mh(x))

d(x  M(cid:101)h(x))

(cid:33)
(cid:33)

+ 1

+ 1

ξ(h  x) < 1 − γ −

n

d(x  Mh(x)) + n

1

ξ(h  x)

< 1 − γ −

n

d(x  M(cid:101)h(x)) + n

·

·

5 Experiments

⇒ h(x) (cid:54)= h∗(x) 

⇒ h(x) = h∗(x).

In this section  we empirically test whether trust scores can both detect examples that are incorrectly
classiﬁed with high precision and be used as a signal to determine which examples are likely correctly
classiﬁed. We perform this evaluation across (i) different datasets (Sections 5.1 and 5.3)  (ii) different
families of classiﬁers (neural network  random forest and logistic regression) (Section 5.1)  (iii)
