2017,Successor Features for Transfer in Reinforcement Learning,Transfer in reinforcement learning refers to the notion that generalization should occur not only within a task but also across tasks. We propose a transfer framework for the scenario where the reward function changes between tasks but the environment's dynamics remain the same. Our approach rests on two key ideas: "successor features"  a value function representation that decouples the dynamics of the environment from the rewards  and "generalized policy improvement"  a generalization of dynamic programming's policy improvement operation that considers a set of policies rather than a single one. Put together  the two ideas lead to an approach that integrates seamlessly within the reinforcement learning framework and allows the free exchange of information across tasks. The proposed method also provides performance guarantees for the transferred policy even before any learning has taken place. We derive two theorems that set our approach in firm theoretical ground and present experiments that show that it successfully promotes transfer in practice  significantly outperforming alternative methods in a sequence of navigation tasks and in the control of a simulated robotic arm.,Successor Features for

Transfer in Reinforcement Learning

André Barreto  Will Dabney  Rémi Munos  Jonathan J. Hunt 

Tom Schaul  Hado van Hasselt  David Silver

{andrebarreto wdabney munos jjhunt schaul hado davidsilver}@google.com

DeepMind

Abstract

Transfer in reinforcement learning refers to the notion that generalization should
occur not only within a task but also across tasks. We propose a transfer frame-
work for the scenario where the reward function changes between tasks but the
environment’s dynamics remain the same. Our approach rests on two key ideas:
successor features  a value function representation that decouples the dynamics of
the environment from the rewards  and generalized policy improvement  a general-
ization of dynamic programming’s policy improvement operation that considers
a set of policies rather than a single one. Put together  the two ideas lead to an
approach that integrates seamlessly within the reinforcement learning framework
and allows the free exchange of information across tasks. The proposed method
also provides performance guarantees for the transferred policy even before any
learning has taken place. We derive two theorems that set our approach in ﬁrm
theoretical ground and present experiments that show that it successfully promotes
transfer in practice  signiﬁcantly outperforming alternative methods in a sequence
of navigation tasks and in the control of a simulated robotic arm.

1

Introduction

Reinforcement learning (RL) provides a framework for the development of situated agents that learn
how to behave while interacting with the environment [21]. The basic RL loop is deﬁned in an abstract
way so as to capture only the essential aspects of this interaction: an agent receives observations
and selects actions to maximize a reward signal. This setup is generic enough to describe tasks of
different levels of complexity that may unroll at distinct time scales. For example  in the task of
driving a car  an action can be to turn the wheel  make a right turn  or drive to a given location.
Clearly  from the point of view of the designer  it is desirable to describe a task at the highest level of
abstraction possible. However  by doing so one may overlook behavioral patterns and inadvertently
make the task more difﬁcult than it really is. The task of driving to a location clearly encompasses the
subtask of making a right turn  which in turn encompasses the action of turning the wheel. In learning
how to drive an agent should be able to identify and exploit such interdependencies. More generally 
the agent should be able to break a task into smaller subtasks and use knowledge accumulated in any
subset of those to speed up learning in related tasks. This process of leveraging knowledge acquired
in one task to improve performance on other tasks is called transfer [25  11].
In this paper we look at one speciﬁc type of transfer  namely  when subtasks correspond to different
reward functions deﬁned in the same environment. This setup is ﬂexible enough to allow transfer
to happen at different levels. In particular  by appropriately deﬁning the rewards one can induce
different task decompositions. For instance  the type of hierarchical decomposition involved in the
driving example above can be induced by changing the frequency at which rewards are delivered:

31st Conference on Neural Information Processing Systems (NIPS 2017)  Long Beach  CA  USA.

a positive reinforcement can be given after each maneuver that is well executed or only at the ﬁnal
destination. Obviously  one can also decompose a task into subtasks that are independent of each
other or whose dependency is strictly temporal (that is  when tasks must be executed in a certain
order but no single task is clearly “contained” within another).
The types of task decomposition discussed above potentially allow the agent to tackle more complex
problems than would be possible were the tasks modeled as a single monolithic challenge. However 
in order to apply this divide-and-conquer strategy to its full extent the agent should have an explicit
mechanism to promote transfer between tasks. Ideally  we want a transfer approach to have two
important properties. First  the ﬂow of information between tasks should not be dictated by a rigid
diagram that reﬂects the relationship between the tasks themselves  such as hierarchical or temporal
dependencies. On the contrary  information should be exchanged across tasks whenever useful.
Second  rather than being posed as a separate problem  transfer should be integrated into the RL
framework as much as possible  preferably in a way that is almost transparent to the agent.
In this paper we propose an approach for transfer that has the two properties above. Our method builds
on two conceptual pillars that complement each other. The ﬁrst is a generalization of Dayan’s [7]
successor representation. As the name suggests  in this representation scheme each state is described
by a prediction about the future occurrence of all states under a ﬁxed policy. We present a generaliza-
tion of Dayan’s idea which extends the original scheme to continuous spaces and also facilitates the
use of approximation. We call the resulting scheme successor features. As will be shown  successor
features lead to a representation of the value function that naturally decouples the dynamics of the
environment from the rewards  which makes them particularly suitable for transfer.
The second pillar of our framework is a generalization of Bellman’s [3] classic policy improvement
theorem that extends the original result from one to multiple decision policies. This novel result
shows how knowledge about a set of tasks can be transferred to a new task in a way that is completely
integrated within RL. It also provides performance guarantees on the new task before any learning
has taken place  which opens up the possibility of constructing a library of “skills” that can be reused
to solve previously unseen tasks. In addition  we present a theorem that formalizes the notion that an
agent should be able to perform well on a task if it has seen a similar task before—something clearly
desirable in the context of transfer. Combined  the two results above not only set our approach in
ﬁrm ground but also outline the mechanics of how to actually implement transfer. We build on this
knowledge to propose a concrete method and evaluate it in two environments  one encompassing a
sequence of navigation tasks and the other involving the control of a simulated two-joint robotic arm.

2 Background and problem formulation

As usual  we assume that the interaction between agent and environment can be modeled as a Markov
decision process (MDP  Puterman  [19]). An MDP is deﬁned as a tuple M ≡ (S A  p  R  γ). The sets
S and A are the state and action spaces  respectively; here we assume that S and A are ﬁnite whenever
such an assumption facilitates the presentation  but most of the ideas readily extend to continuous
spaces. For each s ∈ S and a ∈ A the function p(·|s  a) gives the next-state distribution upon taking
action a in state s. We will often refer to p(·|s  a) as the dynamics of the MDP. The reward received at
transition s a−→ s(cid:48) is given by the random variable R(s  a  s(cid:48)); usually one is interested in the expected
value of this variable  which we will denote by r(s  a  s(cid:48)) or by r(s  a) = ES(cid:48)∼p(·|s a)[r(s  a  S(cid:48))].
The discount factor γ ∈ [0  1) gives smaller weights to future rewards.
The objective of the agent in RL is to ﬁnd a policy π—a mapping from states to actions—that
i=0 γiRt+i+1 
where Rt = R(St  At  St+1). One way to address this problem is to use methods derived from
dynamic programming (DP)  which heavily rely on the concept of a value function [19]. The
action-value function of a policy π is deﬁned as

maximizes the expected discounted sum of rewards  also called the return Gt =(cid:80)∞

Qπ(s  a) ≡ Eπ [Gt | St = s  At = a]  

(1)
where Eπ[·] denotes expected value when following policy π. Once the action-value function of a
particular policy π is known  we can derive a new policy π(cid:48) which is greedy with respect to Qπ(s  a) 
that is  π(cid:48)(s) ∈ argmaxaQπ(s  a). Policy π(cid:48) is guaranteed to be at least as good as (if not better than)
policy π. The computation of Qπ(s  a) and π(cid:48)  called policy evaluation and policy improvement 
deﬁne the basic mechanics of RL algorithms based on DP; under certain conditions their successive
application leads to an optimal policy π∗ that maximizes the expected return from every s ∈ S [21].

2

In this paper we are interested in the problem of transfer  which we deﬁne as follows. Let T  T (cid:48) be
two sets of tasks such that T (cid:48) ⊂ T   and let t be any task. Then there is transfer if  after training on
T   the agent always performs as well or better on task t than if only trained on T (cid:48). Note that T (cid:48) can
be the empty set. In this paper a task will be deﬁned as a speciﬁc instantiation of the reward function
R(s  a  s(cid:48)) for a given MDP. In Section 4 we will revisit this deﬁnition and make it more formal.

3 Successor features

In this section we present the concept that will serve as a cornerstone for the rest of the paper. We
start by presenting a simple reward model and then show how it naturally leads to a generalization of
Dayan’s [7] successor representation (SR).
Suppose that the expected one-step reward associated with transition (s  a  s(cid:48)) can be computed as
(2)
where φ(s  a  s(cid:48)) ∈ Rd are features of (s  a  s(cid:48)) and w ∈ Rd are weights. Expression (2) is not
restrictive because we are not making any assumptions about φ(s  a  s(cid:48)): if we have φi(s  a  s(cid:48)) =
r(s  a  s(cid:48)) for some i  for example  we can clearly recover any reward function exactly. To simplify
the notation  let φt = φ(st  at  st+1). Then  by simply rewriting the deﬁnition of the action-value
function in (1) we have

r(s  a  s(cid:48)) = φ(s  a  s(cid:48))(cid:62)w 

Qπ(s  a) = Eπ [rt+1 + γrt+2 + ...| St = s  At = a]

= Eπ(cid:104)
= Eπ(cid:2)(cid:80)∞

φ

(cid:105)
t+2w + ...| St = s  At = a
(cid:62)

(cid:62)
t+1w + γφ

i=tγi−tφi+1 | St = s  At = a(cid:3)(cid:62)

w = ψπ(s  a)(cid:62)w.

(3)
The decomposition (3) has appeared before in the literature under different names and interpretations 
as discussed in Section 6. Since here we propose to look at (3) as an extension of Dayan’s [7] SR  we
call ψπ(s  a) the successor features (SFs) of (s  a) under policy π.
The ith component of ψπ(s  a) gives the expected discounted sum of φi when following policy π
starting from (s  a). In the particular case where S and A are ﬁnite and φ is a tabular representation
of S × A × S—that is  φ(s  a  s(cid:48)) is a one-hot vector in R|S|2|A|—ψπ(s  a) is the discounted sum
of occurrences  under π  of each possible transition. This is essentially the concept of SR extended
from the space S to the set S × A × S [7].
One of the contributions of this paper is precisely to generalize SR to be used with function approx-
imation  but the exercise of deriving the concept as above provides insights already in the tabular
case. To see this  note that in the tabular case the entries of w ∈ R|S|2|A| are the function r(s  a  s(cid:48))
and suppose that r(s  a  s(cid:48)) (cid:54)= 0 in only a small subset W ⊂ S × A × S. From (2) and (3)  it is
clear that the cardinality of W  and not of S × A × S  is what effectively deﬁnes the dimension of
the representation ψπ  since there is no point in having d > |W|. Although this fact is hinted at by
Dayan [7]  it becomes more apparent when we look at SR as a particular case of SFs.
SFs extend SR in two other ways. First  the concept readily applies to continuous state and action
spaces without any modiﬁcation. Second  by explicitly casting (2) and (3) as inner products involving
feature vectors  SFs make it evident how to incorporate function approximation: as will be shown 
these vectors can be learned from data.
The representation in (3) requires two components to be learned  w and ψπ. Since the latter is
the expected discounted sum of φ under π  we must either be given φ or learn it as well. Note
that approximating r(s  a  s(cid:48)) ≈ φ(s  a  s(cid:48))(cid:62) ˜w is a supervised learning problem  so we can use
well-understood techniques from the ﬁeld to learn ˜w (and potentially ˜φ  too) [9]. As for ψπ  we note
that

ψπ(s  a) = φt+1 + γEπ[ψπ(St+1  π(St+1))| St = s  At = a] 

(4)
that is  SFs satisfy a Bellman equation in which φi play the role of rewards—something also noted
by Dayan [7] regarding SR. Therefore  in principle any RL method can be used to compute ψπ [24].
The SFs ψπ summarize the dynamics induced by π in a given environment. As shown in (3)  this
allows for a modular representation of Qπ in which the MDP’s dynamics are decoupled from its

3

rewards  which are captured by the weights w. One potential beneﬁt of having such a decoupled
representation is that only the relevant module must be relearned when either the dynamics or the
reward changes  which may serve as an argument in favor of adopting SFs as a general approximation
scheme for RL. However  in this paper we focus on a scenario where the decoupled value-function
approximation provided by SFs is exploited to its full extent  as we discuss next.

4 Transfer via successor features

We now return to the discussion about transfer in RL. As described  we are interested in the scenario
where all components of an MDP are ﬁxed  except for the reward function. One way to formalize
this model is through (2): if we suppose that φ ∈ Rd is ﬁxed  any w ∈ Rd gives rise to a new MDP.
Based on this observation  we deﬁne

Mφ(S A  p  γ)≡ {M (S A  p  r  γ) | r(s  a  s(cid:48))= φ(s  a  s(cid:48))(cid:62)w} 

(5)
that is  Mφ is the set of MDPs induced by φ through all possible instantiations of w. Since what
differentiates the MDPs in Mφ is essentially the agent’s goal  we will refer to Mi ∈ Mφ as a task.
The assumption is that we are interested in solving (a subset of) the tasks in the environment Mφ.
Deﬁnition (5) is a natural way of modeling some scenarios of interest. Think  for example  how the
desirability of water or food changes depending on whether an animal is thirsty or hungry. One way
to model this type of preference shifting is to suppose that the vector w appearing in (2) reﬂects the
taste of the agent at any given point in time [17]. Further in the paper we will present experiments
that reﬂect this scenario. For another illustrative example  imagine that the agent’s goal is to produce
and sell a combination of goods whose production line is relatively stable but whose prices vary
considerably over time. In this case updating the price of the products corresponds to picking a new
w. A slightly different way of motivating (5) is to suppose that the environment itself is changing 
that is  the element wi indicates not only desirability  but also availability  of feature φi.
In the examples above it is desirable for the agent to build on previous experience to improve its
performance on a new setup. More concretely  if the agent knows good policies for the set of tasks
M ≡ {M1  M2  ...  Mn}  with Mi ∈ Mφ  it should be able to leverage this knowledge to improve
its behavior on a new task Mn+1—that is  it should perform better than it would had it been exposed
to only a subset of the original tasks  M(cid:48) ⊂ M. We can assess the performance of an agent on
task Mn+1 based on the value function of the policy followed after wn+1 has become available but
before any policy improvement has taken place in Mn+1.1 More precisely  suppose that an agent has
been exposed to each one of the tasks Mi ∈ M(cid:48). Based on this experience  and on the new wn+1 
the agent computes a policy π(cid:48) that will deﬁne its initial behavior in Mn+1. Now  if we repeat the
experience replacing M(cid:48) with M  the resulting policy π should be such that Qπ(s  a) ≥ Qπ(cid:48)
(s  a)
for all (s  a) ∈ S × A.
Now that our setup is clear we can start to describe our solution for the transfer problem discussed
above. We do so in two stages. First  we present a generalization of DP’s notion of policy improvement
whose interest may go beyond the current work. We then show how SFs can be used to implement
this generalized form of policy improvement in an efﬁcient and elegant way.

4.1 Generalized policy improvement

One of the fundamental results in RL is Bellman’s [3] policy improvement theorem. In essence  the
theorem states that acting greedily with respect to a policy’s value function gives rise to another policy
whose performance is no worse than the former’s. This is the driving force behind DP  and most RL
algorithms that compute a value function are exploiting Bellman’s result in one way or another.
In this section we extend the policy improvement theorem to the scenario where the new policy is
to be computed based on the value functions of a set of policies. We show that this extension can
be done in a natural way  by acting greedily with respect to the maximum over the value functions
available. Our result is summarized in the theorem below.

1Of course wn+1 can  and will be  learned  as discussed in Section 4.2 and illustrated in Section 5. Here we

assume that wn+1 is given to make our performance criterion clear.

4

Deﬁne

Then 

π(s) ∈ argmax

a

˜Qπi (s  a).

max

i

(6)

(7)

(8)

Theorem 1. (Generalized Policy Improvement) Let π1  π2  ...  πn be n decision policies and let
˜Qπ1  ˜Qπ2  ...  ˜Qπn be approximations of their respective action-value functions such that

|Qπi(s  a) − ˜Qπi(s  a)| ≤  for all s ∈ S  a ∈ A  and i ∈ {1  2  ...  n}.

Qπ(s  a) ≥ max

Qπi(s  a) − 2
1 − γ

i


for any s ∈ S and a ∈ A  where Qπ is the action-value function of π.
The proofs of our theoretical results are in the supplementary material. As one can see  our theorem
covers the case where the policies’ value functions are not computed exactly  either because function
approximation is used or because some exact algorithm has not be run to completion. This error is
captured by  in (6)  which re-appears as a penalty term in the lower bound (8). Such a penalty is
inherent to the presence of approximation in RL  and in fact it is identical to the penalty incurred in
the single-policy case (see e.g. Bertsekas and Tsitsiklis’s Proposition 6.1 [5]).
In order to contextualize generalized policy improvement (GPI) within the broader scenario of DP 
suppose for a moment that  = 0. In this case Theorem 1 states that π will perform no worse than
all of the policies π1  π2  ...  πn. This is interesting because in general maxi Qπi—the function used
to induce π—is not the value function of any particular policy. It is not difﬁcult to see that π will
be strictly better than all previous policies if no single policy dominates all other policies  that is 
if argmaxi maxa ˜Qπi(s  a) ∩ argmaxi maxa ˜Qπi(s(cid:48)  a) = ∅ for some s  s(cid:48) ∈ S. If one policy does
dominate all others  GPI reduces to the original policy improvement theorem.
If we consider the usual DP loop  in which policies of increasing performance are computed in
sequence  our result is not of much use because the most recent policy will always dominate all others.
Another way of putting it is to say that after Theorem 1 is applied once adding the resulting π to the
set {π1  π2  ...  πn} will reduce the next improvement step to standard policy improvement  and thus
the policies π1  π2  ...  πn can be simply discarded. There are however two situations in which our
result may be of interest. One is when we have many policies πi being evaluated in parallel. In this
case GPI provides a principled strategy for combining these policies. The other situation in which
our result may be useful is when the underlying MDP changes  as we discuss next.

4.2 Generalized policy improvement with successor features

i

i

i

We start this section by extending our notation slightly to make it easier to refer to the quantities
involved in transfer learning. Let Mi be a task in Mφ deﬁned by wi ∈ Rd. We will use π∗
i to refer
to an optimal policy of MDP Mi and use Qπ∗
to refer to its value function. The value function of π∗
i
when executed in Mj ∈ Mφ will be denoted by Qπ∗
j .
Suppose now that an agent has computed optimal policies for the tasks M1  M2  ...  Mn ∈ Mφ. Sup-
pose further that when presented with a new task Mn+1 the agent computes {Qπ∗
n+1} 
the evaluation of each π∗
i under the new reward function induced by wn+1. In this case  applying the
GPI theorem to the newly-computed set of value functions will give rise to a policy that performs at
least as well as a policy based on any subset of these  including the empty set. Thus  this strategy
satisﬁes our deﬁnition of successful transfer.
There is a caveat  though. Why would one waste time computing the value functions of π∗
2  ... 
π∗
n  whose performance in Mn+1 may be mediocre  if the same amount of resources can be allocated
to compute a sequence of n policies with increasing performance? This is where SFs come into play.
Suppose that we have learned the functions Qπ∗
i using the representation scheme shown in (3). Now  if
the reward changes to rn+1(s  a  s(cid:48)) = φ(s  a  s(cid:48))(cid:62)wn+1  as long as we have wn+1 we can compute
the new value function of π∗
i (s  a)(cid:62)wn+1. This reduces the
computation of all Qπ∗
Once the functions Qπ∗
performance on Mn+1 is no worse than the performance of π∗

n+1 have been computed  we can apply GPI to derive a policy π whose
n on the same task. A

n+1 to the much simpler supervised problem of approximating wn+1.

i by simply making Qπ∗

n+1  Qπ∗

n+1  ...  Qπ∗

1  π∗

2  ...  π∗

n+1(s  a) = ψπ∗

i

1  π∗

1

2

n

i

i

i

5

(cid:12)(cid:12)(cid:12)Q

π∗
π∗
i (s  a) − ˜Q
i (s  a)

j

j

1

i

(cid:12)(cid:12)(cid:12) ≤ 

question that arises in this case is whether we can provide stronger guarantees on the performance
of π by exploiting the structure shared by the tasks in Mφ. The following theorem answers this
question in the afﬁrmative.
π∗
Theorem 2. Let Mi ∈ Mφ and let Q
i
Mj ∈ Mφ when executed in Mi. Given approximations { ˜Qπ∗

be the action-value function of an optimal policy of

  ...  ˜Qπ∗

i } such that

  ˜Qπ∗

n

i

2

j

(9)

π∗
for all s ∈ S  a ∈ A  and j ∈ {1  2  ...  n}  let π(s) ∈ argmaxa maxj ˜Q
i (s  a). Finally  let
φmax = maxs a ||φ(s  a)||  where || · || is the norm induced by the inner product adopted. Then 

j

Qπ∗
i (s  a) − Qπ

i

i (s  a) ≤ 2
1 − γ

(φmax minj||wi − wj|| + ) .

(10)

i

i (s  a) − Qπ

Note that we used Mi rather than Mn+1 in the theorem’s statement to remove any suggestion of
order among the tasks. Theorem 2 is a specialization of Theorem 1 for the case where the set of value
functions used to compute π are associated with tasks in the form of (5). As such  it provides stronger
guarantees: instead of comparing the performance of π with that of the previously-computed policies
πj  Theorem 2 quantiﬁes the loss incurred by following π as opposed to one of Mi’s optimal policies.
As shown in (10)  the loss Qπ∗
i (s  a) is upper-bounded by two terms. The term
2φmaxminj||wi − wj||/(1− γ) is of more interest here because it reﬂects the structure of Mφ. This
term is a multiple of the distance between wi  the vector describing the task we are currently interested
in  and the closest wj for which we have computed a policy. This formalizes the intuition that the
agent should perform well in task wi if it has solved a similar task before. More generally  the term in
question relates the concept of distance in Rd with difference in performance in Mφ. Note that this
correspondence depends on the speciﬁc set of features φ used  which raises the interesting question
of how to deﬁne φ such that tasks that are close in Rd induce policies that are also similar in some
sense. Regardless of how exactly φ is deﬁned  the bound (10) allows for powerful extrapolations.
For example  by covering the relevant subspace of Rd with balls of appropriate radii centered at wj
