2018,Unsupervised Learning of Shape and Pose with Differentiable Point Clouds,We address the problem of learning accurate 3D shape and camera pose from a collection of unlabeled category-specific images. We train a convolutional network to predict both the shape and the pose from a single image by minimizing the reprojection error: given several views of an object  the projections of the predicted shapes to the predicted camera poses should match the provided views. To deal with pose ambiguity  we introduce an ensemble of pose predictors which we then distill to a single "student" model. To allow for efficient learning of high-fidelity shapes  we represent the shapes by point clouds and devise a formulation allowing for differentiable projection of these. Our experiments show that the distilled ensemble of pose predictors learns to estimate the pose accurately  while the point cloud representation allows to predict detailed shape models.,Unsupervised Learning of Shape and Pose

with Differentiable Point Clouds

Eldar Insafutdinov∗

Max Planck Institute for Informatics

eldar@mpi-inf.mpg.de

Alexey Dosovitskiy

Intel Labs

adosovitskiy@gmail.com

Abstract

We address the problem of learning accurate 3D shape and camera pose from a
collection of unlabeled category-speciﬁc images. We train a convolutional network
to predict both the shape and the pose from a single image by minimizing the
reprojection error: given several views of an object  the projections of the predicted
shapes to the predicted camera poses should match the provided views. To deal
with pose ambiguity  we introduce an ensemble of pose predictors which we then
distill to a single “student” model. To allow for efﬁcient learning of high-ﬁdelity
shapes  we represent the shapes by point clouds and devise a formulation allowing
for differentiable projection of these. Our experiments show that the distilled
ensemble of pose predictors learns to estimate the pose accurately  while the point
cloud representation allows to predict detailed shape models.

1

Introduction

We live in a three-dimensional world  and a proper understanding of its volumetric structure is
crucial for acting and planning. However  we perceive the world mainly via its two-dimensional
projections. Based on these projections  we are able to infer the three-dimensional shapes and poses
of the surrounding objects. How does this volumetric shape perception emerge from observing only
from two-dimensional projections? Is it possible to design learning systems with similar capabilities?
Deep learning methods have recently shown promise in addressing these questions [25  20]. Given
a set of views of an object and the corresponding camera poses  these methods learn 3D shape via
the reprojection error: given an estimated shape  one can project it to the known camera views and
compare to the provided images. The discrepancy between these generated projections and the
training samples provides training signal for improving the shape estimate. Existing methods of this
type have two general restrictions. First  these approaches assume that the camera poses are known
precisely for all provided images. This is a practically and biologically unrealistic assumption: a
typical intelligent agent only has access to its observations  not its precise location relative to objects
in the world. Second  the shape is predicted as a low-resolution (usually 323 voxels) voxelated
volume. This representation can only describe very rough shape of an object. It should be possible to
learn ﬁner shape details from 2D supervision.
In this paper  we learn high-ﬁdelity shape models solely from their projections  without ground
truth camera poses. This setup is challenging for two reasons. First  estimating both shape and
pose is a chicken-and-egg problem: without a good shape estimate it is impossible to learn accurate
pose because the projections would be uninformative  and vice versa  an accurate pose estimate is
necessary to learn the shape. Second  pose estimation is prone to local minima caused by ambiguity:
an object may look similar from two viewpoints  and if the network converges to predicting only one
of these in all cases  it will not be able to learn predicting the other one. We ﬁnd that the ﬁrst problem
can be solved surprisingly well by joint optimization of shape and pose predictors: in practice  good

∗Work done while interning at Intel.

32nd Conference on Neural Information Processing Systems (NeurIPS 2018)  Montréal  Canada.

shape estimates can be learned even with relatively noisy pose predictions. The second problem 
however  leads to drastic errors in pose estimation. To address this  we train a diverse ensemble of
pose predictors and distill those to a single student model.
To allow learning of high-ﬁdelity shapes  we use the point cloud representation  in contrast with
voxels used in previous works. Point clouds allow for computationally efﬁcient processing  can
produce high-quality shape models [6]  and are conceptually attractive because they can be seen as
“matter-centric”  as opposed to “space-centric” voxel grids. To enable learning point clouds without
explicit 3D supervision  we implement a differentiable projection operator that  given a point set and
a camera pose  generates a 2D projection – a silhouette  a color image  or a depth map. We dub the
formulation “Differentiable Point Clouds”.
We evaluate the proposed approach on the task of estimating the shape and the camera pose from a
single image of an object 2. The method successfully learns to predict both the shape and the pose 
with only a minor performance drop relative to a model trained with ground truth camera poses.
The point-cloud-based formulation allows for effective learning of high-ﬁdelity shape models when
provided with images of sufﬁciently high resolution as supervision. We demonstrate learning point
clouds from silhouettes and augmenting those with color if color images are available during training.
Finally  we show how the point cloud representation allows to automatically discover semantic
correspondences between objects.

2 Related Work

Reconstruction of three-dimensional shapes from their two-dimensional projections has a long history
in computer vision  constituting the ﬁeld of 3D reconstruction. A review of this ﬁeld goes outside of
the scope of this paper; however  we brieﬂy list several related methods. Cashman and Fitzgibbon
[2] use silhouettes and keypoint annotation to reconstruct deformable shape models from small
class-speciﬁc image collections  Vicente et al. [22] apply similar methods to a large-scale Pascal VOC
dataset  Tulsiani et al. [18] reduce required supervision by leveraging computer vision techniques.
These methods show impressive results even in the small data regime; however  they have difﬁculties
with representing diverse and complex shapes. Loper and Black [12] implement a differentiable
renderer and apply it for analysis-by-synthesis. Our work is similar in spirit  but operates on point
clouds and integrates the idea of differentiable rendering with deep learning. The approach of Rhodin
et al. [14] is similar to our technically in that it models human body with a set of Gaussian density
functions and renders them using a physics-motivated equation for light transport. Unlike in our
approach  the representation is not integrated into the learning framework and requires careful initial
placement of the Gaussians  making it unsuitable for automated reconstruction of arbitrary shape
categories. Moreover  the projection method scales quadratically with the number of Gaussians 
which limits the maximum ﬁdelity of the shapes being represented.
Recently the task of learning 3D structure from 2D supervision is being addressed with deep-learning-
based methods. The methods are typically based on reprojection error – comparing 2D projections
of a predicted 3D shape to the ground truth 2D projections. Yan et al. [25] learn 3D shape from
silhouettes  via a projection operation based on selecting the maximum occupancy value along a
ray. Tulsiani et al. [20] devise a differentiable formulation based on ray collision probabilities and
apply it to learning from silhouettes  depth maps  color images  and semantic segmentation maps. Lin
et al. [11] represent point clouds by depth maps and re-project them using a high resolution grid and
inverse depth max-pooling. Concurrently with us  Kato et al. [8] propose a differentiable renderer
for meshes and use it for learning mesh-based representations of object shapes. All these methods
require exact ground truth camera pose corresponding to the 2D projections used for training. In
contrast  we aim to relax this unrealistic assumption and learn only from the projections.
Rezende et al. [13] explore several approaches to generative modeling of 3D shapes based on their
2D views. One of the approaches does not require the knowledge of ground truth camera pose;
however  it is only demonstrated on a simple dataset of textured geometric primitives. Most related to
our submission is the concurrent work of Tulsiani et al. [21]. The work extends the Differentiable
Ray Consistency formulation [20] to learning without pose supervision. The method is voxel-based
and deals with the complications of unsupervised pose learning using reinforcement learning and

2The project website with code can be found at https://eldar.github.io/PointClouds/.

2

Figure 1: Learning to predict the shape and the camera pose. Given two views of the same object 
we predict the corresponding shape (represented as a point cloud) and the camera pose. Then we
use a differentiable projection module to generate the view of the predicted shape from the predicted
camera pose. Dissimilarity between this synthesized projection and the ground truth view serves as
the training signal.

a GAN-based prior. In contrast  we make use of a point cloud representation  use an ensemble to
predict the pose  and do not require a prior on the camera poses.
The issue of representation is central to deep learning with volumetric data. The most commonly
used structure is a voxel grid - a direct 3D counterpart of a 2D pixelated image [5  23]. This similarity
allows for simple transfer of convolutional network architectures from 2D to 3D. However  on the
downside  the voxel grid representation leads to memory- and computation-hungry architectures. This
motivates the search for alternative options. Existing solutions include octrees [17]  meshes [8  26] 
part-based representations [19  10]  multi-view depth maps [15]  object skeletons [24]  and point
clouds [6  11]. We choose to use point clouds in this work  since they are less overcomplete than
voxel grids and allow for effective networks architectures  but at the same time are more ﬂexible than
mesh-based or skeleton-based representations.

3 Single-view Shape and Pose Estimation

i=1{(cid:10)xi

(cid:11)}mi

j  pi
j

j=1. Here xi

j denotes a color image and pi

We address the task of predicting the three-dimensional shape of an object and the camera pose from
a single view of the object. Assume we are given a dataset D of views of K objects  with mi views
available for the i-th object: D = ∪K
j – the
projection of some modality (silhouette  depth map of a color image) from the same view. Each view
may be accompanied with the corresponding camera pose ci
j  but the more interesting case is when
the camera poses are not known. We focus on this more difﬁcult scenario in the remainder of this
section.
An overview of the model is shown in Figure 1. Assume we are given two images x1 and x2 of the
same object. We use parametric function approximators to predict a 3D shape (represented by a point
cloud) from one of them ˆP1 = FP (x1  θP )  and the camera pose from the other one: ˆc2 = Fc(x2  θc).
In our case  FP and Fc are convolutional networks that share most of their parameters. Both the
shape and the pose are predicted as ﬁxed-length vectors using fully connected layers.
Given the predictions  we render the predicted shape from the predicted view: ˆp1 2 = π( ˆP1  ˆc2) 
where π denotes the differentiable point cloud renderer described in Section 4. The loss function is
then the discrepancy between this predicted projection and the ground truth. We use standard MSE in
this work both for all modalities  summed over the whole dataset:

N(cid:88)

mi(cid:88)

(cid:13)(cid:13)ˆpi

− pi

j2

j1 j2

(cid:13)(cid:13)2

L(θP   θc) =

.

(1)

i=1

j1 j2=1

Intuitively  this training procedure requires that for all pairs of views of the same object  the renderings
of the predicted point cloud match the provided ground truth views.
Estimating pose with a distilled ensemble. We found that the basic implementation described
above fails to predict accurate poses. This is caused by local minima: the pose predictor converges to
either estimating all objects as viewed from the back  or all viewed from the front. Indeed  based on
silhouettes  it is difﬁcult to distinguish between certain views even for a human  see Figure 2 (a).

3

Point cloudCamera poseDifferentiablepoint cloud projection 𝜋(𝑃 𝑐)LossPredictedprojectionGround truth projectionℒ(𝜃𝑃 𝜃𝑐)𝑃𝑐(a) Pose ambiguity

(b) Training an ensemble of pose regressors

Figure 2: (a) Pose ambiguity: segmentation masks  which we use for supervision  look very similar
from different camera views. (b) The proposed ensemble of pose regressors designed to resolve this
ambiguity. The network predicts a diverse set {ck}K
k=1 of pose candidates  each of which is used to
compute a projection of the predicted point cloud P . The weight update (backward pass shown in
dashed red) is only performed for the pose candidate yielding the projection that best matches the
ground truth.

To alleviate this issue  instead of a single pose regressor Fc(·  θc)  we introduce an ensemble of K
pose regressors F k

c ) (see Figure 2 (b)) and train the system with the “hindsight” loss [7  4]:

c (·  θk

Lh(θP   θ1

c   . . .   θK

c ) = min
k∈[1 K]

L(θP   θk
c ).

(2)

The idea is that each of the predictors learns to specialize on a subset of poses and together they cover
the whole range of possible values. No special measures are needed to ensure this specialization: it
emerges naturally as a result of random weight initialization if the network architecture is appropriate.
Namely  the different pose predictors need to have several (at least 3  in our experience) non-shared
layers.
In parallel with training the ensemble  we distill it to a single regressor by using the best model from
the ensemble as the teacher. This best model is selected based on the loss  as in Eq. (2). At test
time we discard the ensemble and use the distilled regressor to estimate the camera pose. The loss
for training the student is computed as an angular difference between two rotations represented by
quaternions: L(q1  q2) = 1− Re(q1q−1
We found that standard MSE loss performs poorly when regressing rotation.
Network architecture. We implement the shape and pose predictor with a convolutional network
with two branches. The network starts with a convolutional encoder with a total of 7 layers  4 of
which have stride 2. These are followed by 2 shared fully connected layers  after which the network
splits into two branches for shape and pose prediction. The shape branch is an MLP with one hidden
layer. The point cloud of N points is predicted as a vector with dimensionality 3N (point positions)
or 6N (positions and RGB values). The pose branch is an MLP with one shared hidden layer and
two more hidden layers for each of the pose predictors. The camera pose is predicted as a quaternion.
In the ensemble model we use K = 4 pose predictors. The “student” model is another branch with
the same architecture.

(cid:13)(cid:13))  where Re denotes the real part of the quaternion.

2 /(cid:13)(cid:13)q1q−1

2

4 Differentiable Point Clouds

A key component of our model is the differentiable point cloud renderer π. Given a point cloud P
and a camera pose c  it generates a view p = π(P  c). The point cloud may have a signal  such as
color  associated with it  in which case the signal can be projected to the view.
The high-level idea of the method is to smooth the point cloud by representing the points with
density functions. Formally  we assume the point cloud is a set of N tuples P = {(cid:104)xi  si  yi(cid:105)}N
i=1 
each including the point position xi = (xi 1  xi 2  xi 3)  the size parameter si  and the associated
signal yi (for instance  an RGB color). In most of our experiments the size parameter is a two-
dimensional vector including the covariance of an isotropic Gaussian and a scaling factor. However 
in general si can represent an arbitrary parametric distribution: for instance  in the supplement we

4

...Point cloudEnsemble of pose regressors𝜋(𝑃 𝑐1)Predictedprojections𝑐1𝜋(𝑃 𝑐2)𝑐2𝜋(𝑃 𝑐𝐾)𝑐𝐾Loss𝑃Ground truthprojectionCNN...Figure 3: Differentiable rendering of a point cloud. We show 2D-to-1D projection for illustration
purposes  but in practice we perform 3D-to-2D projection. The points are transformed according to
the camera parameters  smoothed  and discretized. We perform occlusion reasoning via a form of ray
tracing  and ﬁnally project the result orthogonally.

show experiments with Gaussians with a full covariance matrix. The size parameters can be either
speciﬁed manually or learned jointly with the point positions.
The overall differentiable rendering pipeline is illustrated in Figure 3. For illustration purposes we
show 2D-to-1D projection in the ﬁgure  but in practice we perform 3D-to-2D projection. We start by
transforming the positions of points to the standard coordinate frame by the projective transformation
Tc corresponding to the camera pose c of interest: x(cid:48)
i = Tcxi. The transform Tc accounts for both
extrinsic and intrinsic camera parameters. We also compute the transformed size parameters s(cid:48) (the
exact transformation rule depends on the distribution used). We set up the camera transformation
matrix such that after the transform  the projection amounts to orthogonal projection along the third
axis.
To allow for the gradient ﬂow  we represent each point (cid:104)xi  si(cid:105) by a smooth function fi(·). In this
work we set fi to scaled Gaussian densities. The occupancy function of the point cloud is a clipped
sum of the individual per-point functions:

− 1
2

(x − x(cid:48)

i)T Σ−1

i

(x − x(cid:48)
i)

 

o(x) = clip(

fi(x)  [0  1]) 

fi(x) = ci exp

(3)
where (cid:104)ci  Σi(cid:105) = si are the size parameters. We discretize the resulting function to a grid of resolution
D1×D2×D3. Note that the third index corresponds to the projection axis  with index 1 being the
closest to the camera and D3 – the furthest from the camera.
Before projecting the resulting volume to a plane  we need to ensure that the signal from the
occluded points does not interfere with the foreground points. To this end  we perform occlusion
reasoning using a differentiable ray tracing formulation  similar to Tulsiani et al. [20]. We convert the
k3−1(cid:89)
occupancies o to ray termination probabilities r as follows:
(1 − ok1 k2 u) if k3 (cid:54) D3 

(1 − ok1 k2 u).

rk1 k2 k3 = ok1 k2 k3

rk1 k2 D3+1 =

D3(cid:89)

(4)

u=1

u=1

Intuitively  a cell has high termination probability rk1 k2 k3 if its occupancy value ok1 k2 k3 is high and
all previous occupancy values {ok1 k2 u}u<k3 are low. The additional background cell rk1 k2 D3+1
serves to ensure that the termination probabilities sum to 1.
Finally  we project the volume to the plane:

pk1 k2 =

rk1 k2 k3yk1 k2 k3 .

(5)

k3=1

Here y is the signal being projected  which deﬁnes the modality of the result. To obtain a silhouette 
we set yk1 k2 k3 = 1 − δk3 D3+1. For a depth map  we set yk1 k2 k3 = k3/D3. Finally  to project
a signal y associated with the point cloud  such as color  we set y to a discretized version of the

normalized signal distribution: y(x) =(cid:80)N

i=1 yifi(x)/(cid:80)N

i=1 fi(x).

4.1

Implementation details

Technically  the most complex part of the algorithm is the conversion of a point cloud to a volume.
We have experimented with two implementations of this step: one that is simple and ﬂexible (we

5

N(cid:88)

i=1

(cid:18)

(cid:19)

D3+1(cid:88)

Point cloudCamera poseInputTransformed point cloudDiscretized occupancy mapRay termination probabilitiesOrthogonal projectionOutput projectionrefer to it as basic) and another version that is less ﬂexible  but much more efﬁcient (we refer to it
as fast). We implemented both versions using standard Tensorﬂow [1] operations. At a high level 
in the basic implementation each function fi is computed on an individual volumetric grid  and
the results are summed. This allows for ﬂexibility in the choice of the function class  but leads to
both computational and memory requirements growing linearly with both the number of points N
and the volume of the grid V   resulting in the complexity O(N V ). The fast version scales more
gracefully  as O(N + V ). This comes at the cost of using the same kernel for all functions fi. The
fast implementation performs the operation in two steps: ﬁrst putting all points on the grid with
trilinear interpolation  then applying a convolution with the kernel. Further details are provided in the
supplement.

5 Experiments

5.1 Experimental setup

Datasets. We conduct the experiments on 3D models from the ShapeNet [3] dataset. We focus on 3
categories typically used in related work: chairs  cars  and airplanes. We follow the train/test protocol
and the data generation procedure of Tulsiani et al. [20]: split the models into training  validation and
test sets and render 5 random views of each model with random light source positions and random
camera azimuth and elevation  sampled uniformly from [0◦  360◦) and [−20◦  40◦] respectively.
Evaluation metrics. We use the Chamfer distance as our main evaluation metric  since it has been
shown to be well correlated with human judgment of shape similarity [16]. Given a ground truth point
cloud P gt = {xgt

n }  the distance is deﬁned as follows:

n } and a predicted point cloud P pr = {xpr
(cid:107)xpr − x(cid:107)2 +

(cid:88)

1
|P pr|

min
x∈P gt

xpr∈P pr

dChamf (P gt  P pred) =

(cid:88)

(cid:13)(cid:13)xgt − x(cid:13)(cid:13)2 . (6)

1
|P gt|

min
x∈P pr

xgt∈P gt

The two sums in Eq. (6) have clear intuitive meanings. The ﬁrst sum evaluates the precision of the
predicted point cloud by computing how far on average is the closest ground truth point from a
predicted point. The second sum measures the coverage of the ground truth by the predicted point
cloud: how far is on average the closest predicted point from a ground truth point.
For measuring the pose error  we use the same metrics as Tulsiani et al. [21]: accuracy (the percentage
of samples for which the predicted pose is within 30◦ of the ground truth) and the median error (in
degrees). Before starting the pose and shape evaluation  we align the canonical pose learned by the
network with the canonical pose in the dataset  using Iterative Closest Point (ICP) algorithm on the
ﬁrst 20 models in the validation set. Further details are provided in the supplement.
Training details. We trained the networks using the Adam optimizer [9]  for 600 000 mini-batch
iterations. We used mini-batches of 16 samples (4 views of 4 objects). We used a ﬁxed learning
rate of 0.0001 and the standard momentum parameters. We used the fast projection in most
experiments  unless mentioned otherwise. We varied both the number of points in the point cloud
and the resolution of the volume used in the projection operation depending on the resolution of the
ground truth projections used for supervision. We used the volume with the same side as the training
samples (e.g.  643 volume for 642 projections)  and we used 2000 points for 322 projections  8000
points for 642 projections  and 16 000 points for 1282 projections.
When predicting dense point clouds  we have found it useful to apply dropout to the predictions of the
network to ensure even distribution of points on the shape. Dropout effects in selecting only a subset
of all predicted points for projection and loss computation. In experiments reported in Sections 5.2
and 5.3 we started with a very high 90% dropout and linearly reduced it to 0 towards the end of
training. We also implemented a schedule for the point size parameters  linearly decreasing from
5% of the projection volume size to 0.3% over the course of training. The scaling coefﬁcient of the
points was learned in all experiments. An ablation study is shown in the supplement.
Computational efﬁciency. A practical advantage of a point-cloud-based method is that it does not
require using a 3D convolutional decoder as required by voxel-based methods. This improves the
efﬁciency and allows the method to better scale to higher resolution. For resolution 32 the training
times of the methods are roughly on par. For 64 the training time of our method is roughly 1 day in
contrast with 2.5 days for its voxel-based counterpart. For 128 the training time of our method is 3
days  while the voxel-based method does not ﬁt into 12Gb of GPU memory with our batch size.

6

DRC [20]

Resolution 32
PTN [25] Ours-V Ours

Resolution 64
Ours-V Ours

Resolution 128

EPCG [11] Ours

Airplane
Car
Chair
Mean

8.35
4.35
8.01

6.90

3.79
3.94
5.10

4.27

5.57
3.88
5.57

5.01

4.52
4.22
5.10

4.61

4.94
3.41
4.80

4.39

3.50
2.98
4.15

3.55

4.03
3.69
5.62
4.45

2.84
2.42
3.62

2.96

Table 1: Quantitative results on shape prediction with known camera pose. We report the Cham-
