2019,GNNExplainer: Generating Explanations for Graph Neural Networks,Graph Neural Networks (GNNs) are a powerful tool for machine learning on graphs.GNNs combine node feature information with the graph structure by 
recursively passing neural messages along edges of the input graph. However  incorporating both graph structure and feature information leads to complex models 
and explaining predictions made by GNNs remains unsolved. Here
we propose GNNExplainer  the first general  model-agnostic approach for providing interpretable explanations for predictions of any GNN-based model on any graph-based machine learning task. Given an instance  GNNExplainer identifies a compact subgraph structure and a small subset of node features that have a crucial role in GNN's prediction. 
Further  GNNExplainer  can generate consistent and concise explanations for an entire class of instances.
We formulate GNNExplainer as an optimization task that maximizes the mutual information between a GNN's prediction and distribution of possible subgraph structures. Experiments on synthetic and real-world graphs show that our approach can identify important graph structures as well as node features  and outperforms baselines by 17.1% on average. GNNExplainer  provides a variety of benefits  from the ability to visualize semantically relevant structures to interpretability  to giving insights into errors of faulty GNNs.,GNNExplainer: Generating Explanations

for Graph Neural Networks

Rex Ying†

Dylan Bourgeois† ‡

Jure Leskovec†

Marinka Zitnik†
†Department of Computer Science  Stanford University

Jiaxuan You†

‡Robust.AI

{rexying  dtsbourg  jiaxuan  marinka  jure}@cs.stanford.edu

Abstract

Graph Neural Networks (GNNs) are a powerful tool for machine learning on
graphs. GNNs combine node feature information with the graph structure by
recursively passing neural messages along edges of the input graph. However  in-
corporating both graph structure and feature information leads to complex models
and explaining predictions made by GNNs remains unsolved. Here we propose
GNNEXPLAINER  the ﬁrst general  model-agnostic approach for providing inter-
pretable explanations for predictions of any GNN-based model on any graph-based
machine learning task. Given an instance  GNNEXPLAINER identiﬁes a compact
subgraph structure and a small subset of node features that have a crucial role in
GNN’s prediction. Further  GNNEXPLAINER can generate consistent and concise
explanations for an entire class of instances. We formulate GNNEXPLAINER as an
optimization task that maximizes the mutual information between a GNN’s predic-
tion and distribution of possible subgraph structures. Experiments on synthetic and
real-world graphs show that our approach can identify important graph structures
as well as node features  and outperforms alternative baseline approaches by up to
43.0% in explanation accuracy. GNNEXPLAINER provides a variety of beneﬁts 
from the ability to visualize semantically relevant structures to interpretability  to
giving insights into errors of faulty GNNs.

1

Introduction

In many real-world applications  including social  information  chemical  and biological domains 
data can be naturally modeled as graphs [9  41  49]. Graphs are powerful data representations but
are challenging to work with because they require modeling of rich relational information as well
as node feature information [45  46]. To address this challenge  Graph Neural Networks (GNNs)
have emerged as state-of-the-art for machine learning on graphs  due to their ability to recursively
incorporate information from neighboring nodes in the graph  naturally capturing both graph structure
and node features [16  21  40  44].
Despite their strengths  GNNs lack transparency as they do not easily allow for a human-intelligible
explanation of their predictions. Yet  the ability to understand GNN’s predictions is important and
useful for several reasons: (i) it can increase trust in the GNN model  (ii) it improves model’s
transparency in a growing number of decision-critical applications pertaining to fairness  privacy and
other safety challenges [11]  and (iii) it allows practitioners to get an understanding of the network
characteristics  identify and correct systematic patterns of mistakes made by models before deploying
them in the real world.
While currently there are no methods for explaining GNNs  recent approaches for explaining other
types of neural networks have taken one of two main routes. One line of work locally approximates

33rd Conference on Neural Information Processing Systems (NeurIPS 2019)  Vancouver  Canada.

Figure 1: GNNEXPLAINER provides interpretable explanations for predictions made by any GNN model on any
graph-based machine learning task. Shown is a hypothetical node classiﬁcation task where a GNN model Φ is
trained on a social interaction graph to predict future sport activities. Given a trained GNN Φ and a prediction ˆyi
= “Basketball” for person vi  GNNEXPLAINER generates an explanation by identifying a small subgraph of the
input graph together with a small subset of node features (shown on the right) that are most inﬂuential for ˆyi.
Examining explanation for ˆyi  we see that many friends in one part of vi’s social circle enjoy ball games  and so
the GNN predicts that vi will like basketball. Similarly  examining explanation for ˆyj  we see that vj’s friends
and friends of his friends enjoy water and beach sports  and so the GNN predicts ˆyj = “Sailing.”
models with simpler surrogate models  which are then probed for explanations [25  29  30]. Other
methods carefully examine models for relevant features and ﬁnd good qualitative interpretations of
high level features [6  13  27  32] or identify inﬂuential input instances [23  38]. However  these
approaches fall short in their ability to incorporate relational information  the essence of graphs.
Since this aspect is crucial for the success of machine learning on graphs  any explanation of GNN’s
predictions should leverage rich relational information provided by the graph as well as node features.
Here we propose GNNEXPLAINER  an approach for explaining predictions made by GNNs. GNNEX-
PLAINER takes a trained GNN and its prediction(s)  and it returns an explanation in the form of a small
subgraph of the input graph together with a small subset of node features that are most inﬂuential for
the prediction(s) (Figure 1). The approach is model-agnostic and can explain predictions of any GNN
on any machine learning task for graphs  including node classiﬁcation  link prediction  and graph
classiﬁcation. It handles single- as well as multi-instance explanations. In the case of single-instance
explanations  GNNEXPLAINER explains a GNN’s prediction for one particular instance (i.e.  a node
label  a new link  a graph-level label). In the case of multi-instance explanations  GNNEXPLAINER
provides an explanation that consistently explains a set of instances (e.g.  nodes of a given class).
GNNEXPLAINER speciﬁes an explanation as a rich subgraph of the entire graph the GNN was
trained on  such that the subgraph maximizes the mutual information with GNN’s prediction(s).
This is achieved by formulating a mean ﬁeld variational approximation and learning a real-valued
graph mask which selects the important subgraph of the GNN’s computation graph. Simultaneously 
GNNEXPLAINER also learns a feature mask that masks out unimportant node features (Figure 1).
We evaluate GNNEXPLAINER on synthetic as well as real-world graphs. Experiments show that
GNNEXPLAINER provides consistent and concise explanations of GNN’s predictions. On synthetic
graphs with planted network motifs  which play a role in determining node labels  we show that
GNNEXPLAINER accurately identiﬁes the subgraphs/motifs as well as node features that determine
node labels outperforming alternative baseline approaches by up to 43.0% in explanation accuracy.
Further  using two real-world datasets we show how GNNEXPLAINER can provide important domain
insights by robustly identifying important graph structures and node features that inﬂuence a GNN’s
predictions. Speciﬁcally  using molecular graphs and social interaction networks  we show that
GNNEXPLAINER can identify important domain-speciﬁc graph structures  such as N O2 chemical
groups or ring structures in molecules  and star structures in Reddit threads. Overall  experiments
demonstrate that GNNEXPLAINER provides consistent and concise explanations for GNN-based
models for different machine learning tasks on graphs.

2 Related work

Although the problem of explaining GNNs is not well-studied  the related problems of interpretability
and neural debugging received substantial attention in machine learning. At a high level  we can
group those interpretability methods for non-graph neural networks into two main families.

2

GNN model training and predictionsExplaning GNN’s predictionsGNNExplainerFigure 2: A. GNN computation graph Gc (green and orange) for making prediction ˆy at node v. Some edges
in Gc form important neural message-passing pathways (green)  which allow useful node information to be
propagated across Gc and aggregated at v for prediction  while other edges do not (orange). However  GNN
needs to aggregate important as well as unimportant messages to form a prediction at node v  which can dilute the
signal accumulated from v’s neighborhood. The goal of GNNEXPLAINER is to identify a small set of important
features and pathways (green) that are crucial for prediction. B. In addition to GS (green)  GNNEXPLAINER
identiﬁes what feature dimensions of GS’s nodes are important for prediction by learning a node feature mask.

Methods in the ﬁrst family formulate simple proxy models of full neural networks. This can be done
in a model-agnostic way  usually by learning a locally faithful approximation around the prediction 
for example through linear models [29] or sets of rules  representing sufﬁcient conditions on the
prediction [3  25  47]. Methods in the second family identify important aspects of the computation  for
example  through feature gradients [13  43]  backpropagation of neurons’ contributions to the input
features [6  31  32]  and counterfactual reasoning [19]. However  the saliency maps [43] produced
by these methods have been shown to be misleading in some instances [2] and prone to issues like
gradient saturation [31  32]. These issues are exacerbated on discrete inputs such as graph adjacency
matrices since the gradient values can be very large but only on very small intervals. Because of that 
such approaches are not suitable for explaining predictions made by neural networks on graphs.
Instead of creating new  inherently interpretable models  post-hoc interpretability methods [1  14  15 
17  23  38] consider models as black boxes and then probe them for relevant information. However  no
work has been done to leverage relational structures like graphs. The lack of methods for explaining
predictions on graph-structured data is problematic  as in many cases  predictions on graphs are
induced by a complex combination of nodes and paths of edges between them. For example  in some
tasks  an edge is important only when another alternative path exists in the graph to form a cycle  and
those two features  only when considered together  can accurately predict node labels [10  12]. Their
joint contribution thus cannot be modeled as a simple linear combinations of individual contributions.
Finally  recent GNN models augment interpretability via attention mechanisms [28  33  34]. However 
although the learned edge attention values can indicate important graph structure  the values are the
same for predictions across all nodes. Thus  this contradicts with many applications where an edge is
essential for predicting the label of one node but not the label of another node. Furthermore  these
approaches are either limited to speciﬁc GNN architectures or cannot explain predictions by jointly
considering both graph structure and node feature information.

3 Formulating explanations for graph neural networks

Let G denote a graph on edges E and nodes V that are associated with d-dimensional node features
X = {x1  . . .   xn}  xi ∈ Rd. Without loss of generality  we consider the problem of explaining a
node classiﬁcation task (see Section 4.4 for other tasks). Let f denote a label function on nodes
f : V (cid:55)→ {1  . . .   C} that maps every node in V to one of C classes. The GNN model Φ is optimized
on all nodes in the training set and is then used for prediction  i.e.  to approximate f on new nodes.

3.1 Background on graph neural networks

At layer l  the update of GNN model Φ involves three key computations [4  45  46]. (1) First  the
model computes neural messages between every pair of nodes. The message for node pair (vi  vj) is a
function MSG of vi’s and vj’s representations hl−1
in the previous layer and of the relation
i
  rij). (2) Second  for each node vi  GNN aggregates
rij between the nodes: ml

ij = MSG(hl−1

and hl−1

j

  hl−1

j

i

3

   ...ABi = AGG({ml

messages from vi’s neighborhood Nvi and calculates an aggregated message Mi via an aggregation
ij|vj ∈ Nvi})  where Nvi is neighborhood of node vi whose
method AGG [16  35]: M l
deﬁnition depends on a particular GNN variant. (3) Finally  GNN takes the aggregated message M l
i
along with vi’s representation hl−1
from the previous layer  and it non-linearly transforms them to
obtain vi’s representation hl
). The ﬁnal embedding for node vi
i at layer l: hl
after L layers of computation is zi = hL
i . Our GNNEXPLAINER provides explanations for any GNN
that can be formulated in terms of MSG  AGG  and UPDATE computations.

i = UPDATE(M l

i

i   hl−1

i

3.2 GNNEXPLAINER: Problem formulation

Our key insight is the observation that the computation graph of node v  which is deﬁned by the
GNN’s neighborhood-based aggregation (Figure 2)  fully determines all the information the GNN
uses to generate prediction ˆy at node v. In particular  v’s computation graph tells the GNN how to
generate v’s embedding z. Let us denote that computation graph by Gc(v)  the associated binary
adjacency matrix by Ac(v) ∈ {0  1}n×n  and the associated feature set by Xc(v) = {xj|vj ∈ Gc(v)}.
The GNN model Φ learns a conditional distribution PΦ(Y |Gc  Xc)  where Y is a random variable
representing labels {1  . . .   C}  indicating the probability of nodes belonging to each of C classes.
A GNN’s prediction is given by ˆy = Φ(Gc(v)  Xc(v))  meaning that it is fully determined by the
model Φ  graph structural information Gc(v)  and node feature information Xc(v). In effect  this
observation implies that we only need to consider graph structure Gc(v) and node features Xc(v)
to explain ˆy (Figure 2A). Formally  GNNEXPLAINER generates explanation for prediction ˆy as
S )  where GS is a small subgraph of the computation graph. XS is the associated feature of
(GS  X F
j |vj ∈
GS  and X F
GS}) that are most important for explaining ˆy (Figure 2B).

S is a small subset of node features (masked out by the mask F   i.e.  X F

S = {xF

4 GNNEXPLAINER

Next we describe our approach GNNEXPLAINER. Given a trained GNN model Φ and a prediction
(i.e.  single-instance explanation  Sections 4.1 and 4.2) or a set of predictions (i.e.  multi-instance
explanations  Section 4.3)  the GNNEXPLAINER will generate an explanation by identifying a
subgraph of the computation graph and a subset of node features that are most inﬂuential for the
model Φ’s prediction. In the case of explaining a set of predictions  GNNEXPLAINER will aggregate
individual explanations in the set and automatically summarize it with a prototype. We conclude this
section with a discussion on how GNNEXPLAINER can be used for any machine learning task on
graphs  including link prediction and graph classiﬁcation (Section 4.4).

4.1 Single-instance explanations
Given a node v  our goal is to identify a subgraph GS ⊆ Gc and the associated features XS =
{xj|vj ∈ GS} that are important for the GNN’s prediction ˆy. For now  we assume that XS is a
small subset of d-dimensional node features; we will later discuss how to automatically determine
which dimensions of node features need to be included in explanations (Section 4.2). We formalize
the notion of importance using mutual information M I and formulate the GNNEXPLAINER as the
following optimization framework:

M I (Y  (GS  XS)) = H(Y ) − H(Y |G = GS  X = XS).

(1)

max
GS

For node v  M I quantiﬁes the change in the probability of prediction ˆy = Φ(Gc  Xc) when v’s
computation graph is limited to explanation subgraph GS and its node features are limited to XS.
For example  consider the situation where vj ∈ Gc(vi)  vj (cid:54)= vi. Then  if removing vj from Gc(vi)
strongly decreases the probability of prediction ˆyi  the node vj is a good counterfactual explanation
for the prediction at vi. Similarly  consider the situation where (vj  vk) ∈ Gc(vi)  vj  vk (cid:54)= vi. Then 
if removing an edge between vj and vk strongly decreases the probability of prediction ˆyi then the
absence of that edge is a good counterfactual explanation for the prediction at vi.
Examining Eq. (1)  we see that the entropy term H(Y ) is constant because Φ is ﬁxed for a trained
GNN. As a result  maximizing mutual information between the predicted label distribution Y and

4

explanation (GS  XS) is equivalent to minimizing conditional entropy H(Y |G = GS  X = XS) 
which can be expressed as follows:

H(Y |G = GS  X = XS) = −EY |GS  XS [log PΦ(Y |G = GS  X = XS)] .

(2)

Explanation for prediction ˆy is thus a subgraph GS that minimizes uncertainty of Φ when the GNN
computation is limited to GS. In effect  GS maximizes probability of ˆy (Figure 2). To obtain a
compact explanation  we impose a constraint on GS’s size as: |GS| ≤ KM   so that GS has at most
KM nodes. In effect  this implies that GNNEXPLAINER aims to denoise Gc by taking KM edges
that give the highest mutual information with the prediction.
GNNEXPLAINER’s optimization framework. Direct optimization of GNNEXPLAINER’s objective
is not tractable as Gc has exponentially many subgraphs GS that are candidate explanations for ˆy. We
thus consider a fractional adjacency matrix1 for subgraphs GS  i.e.  AS ∈ [0  1]n×n  and enforce the
subgraph constraint as: AS[j  k] ≤ Ac[j  k] for all j  k. This continuous relaxation can be interpreted
as a variational approximation of distribution of subgraphs of Gc. In particular  if we treat GS ∼ G
as a random graph variable  the objective in Eq. (2) becomes:

EGS∼GH(Y |G = GS  X = XS) 

minG

With convexity assumption  Jensen’s inequality gives the following upper bound:

minG H(Y |G = EG[GS]  X = XS).

(3)

(4)

(j k)∈Gc

multivariate Bernoulli distribution as: PG(GS) =(cid:81)

In practice  due to the complexity of neural networks  the convexity assumption does not hold.
However  experimentally  we found that minimizing this objective with regularization often leads to a
local minimum corresponding to high-quality explanations.
To tractably estimate EG  we use mean-ﬁeld variational approximation and decompose G into a
AS[j  k]. This allows us to estimate the
expectation with respect to the mean-ﬁeld approximation  thereby obtaining AS in which (j  k)-th
entry represents the expectation on whether edge (vj  vk) exists. We observed empirically that this
approximation together with a regularizer for promoting discreteness [40] converges to good local
minima despite the non-convexity of GNNs. The conditional entropy in Equation 4 can be optimized
by replacing the EG[GS] to be optimized by a masking of the computation graph of adjacency matrix 
Ac (cid:12) σ(M )  where M ∈ Rn×n denotes the mask that we need to learn  (cid:12) denotes element-wise
multiplication  and σ denotes the sigmoid that maps the mask to [0  1]n×n.
In some applications  instead of ﬁnding an explanation in terms of model’s conﬁdence  the users care
more about “why does the trained model predict a certain class label”  or “how to make the trained
model predict a desired class label”. We can modify the conditional entropy objective in Equation 4
with a cross entropy objective between the label class and the model prediction2. To answer these
queries  a computationally efﬁcient version of GNNEXPLAINER’s objective  which we optimize using
gradient descent  is as follows:

− C(cid:88)

c=1

min
M

1[y = c] log PΦ(Y = y|G = Ac (cid:12) σ(M )  X = Xc) 

(5)

The masking approach is also found in Neural Relational Inference [22]  albeit with different
motivation and objective. Lastly  we compute the element-wise multiplication of σ(M ) and Ac and
remove low values in M through thresholding to arrive at the explanation GS for the GNN model’s
prediction ˆy at node v.

4.2 Joint learning of graph structural and node feature information

To identify what node features are most important for prediction ˆy  GNNEXPLAINER learns a feature
selector F for nodes in explanation GS. Instead of deﬁning XS to consists of all node features  i.e. 

1For typed edges  we deﬁne GS ∈ [0  1]Ce×n×n where Ce is the number of edge types.
2The label class is the predicted label class by the GNN model to be explained  when answering “why does
the trained model predict a certain class label”. “how to make the trained model predict a desired class label”
can be answered by using the ground-truth label class.

5

XS = {xj|vj ∈ GS}  GNNEXPLAINER considers X F
are deﬁned through a binary feature selector F ∈ {0  1}d (Figure 2B):

S as a subset of features of nodes in GS  which

S = {xF
X F

j |vj ∈ GS} 

(6)
j has node features that are not masked out by F . Explanation (GS  XS) is then jointly

j = [xj t1  . . .   xj tk ] for Fti = 1 
xF

where xF
optimized for maximizing the mutual information objective:

M I (Y  (GS  F )) = H(Y ) − H(Y |G = GS  X = X F
S ) 

max
GS  F

(7)

random variable X we reparametrize X as: X = Z + (XS − Z) (cid:12) F s.t.(cid:80)

which represents a modiﬁed objective function from Eq. (1) that considers structural and node feature
information to generate an explanation for prediction ˆy.
S as XS (cid:12) F   where F acts as a feature mask
Learning binary feature selector F . We specify X F
that we need to learn. Intuitively  if a particular feature is not important  the corresponding weights in
GNN’s weight matrix take values close to zero. In effect  this implies that masking the feature out
does not decrease predicted probability for ˆy. Conversely  if the feature is important then masking it
out would decrease predicted probability. However  in some cases this approach ignores features that
are important for prediction but take values close to zero. To address this issue we marginalize over
all feature subsets and use a Monte Carlo estimate to sample from empirical marginal distribution for
nodes in XS during training [48]. Further  we use a reparametrization trick [20] to backpropagate
gradients in Eq. (7) to the feature mask F . In particular  to backpropagate through a d-dimensional
j Fj ≤ KF   where Z
is a d-dimensional random variable sampled from the empirical distribution and KF is a parameter
representing the maximum number of features to be kept in the explanation.
Integrating additional constraints into explanations. To impose further properties on the explana-
tion we can extend GNNEXPLAINER’s objective function in Eq. (7) with regularization terms. For
example  we use element-wise entropy to encourage structural and node feature masks to be discrete.
Further  GNNEXPLAINER can encode domain-speciﬁc constraints through techniques like Lagrange
multiplier of constraints or additional regularization terms. We include a number of regularization
terms to produce explanations with desired properties. We penalize large size of the explanation by
adding the sum of all elements of the mask paramters as the regularization term.
Finally  it is important to note that each explanation must be a valid computation graph. In particular 
explanation (GS  XS) needs to allow GNN’s neural messages to ﬂow towards node v such that
GNN can make prediction ˆy. Importantly  GNNEXPLAINER automatically provides explanations that
represent valid computation graphs because it optimizes structural masks across entire computation
graphs. Even if a disconnected edge is important for neural message-passing  it will not be selected
for explanation as it cannot inﬂuence GNN’s prediction. In effect  this implies that the explanation
GS tends to be a small connected subgraph.

4.3 Multi-instance explanations through graph prototypes

The output of a single-instance explanation (Sections 4.1 and 4.2) is a small subgraph of the input
graph and a small subset of associated node features that are most inﬂuential for a single prediction.
To answer questions like “How did a GNN predict that a given set of nodes all have label c?”  we
need to obtain a global explanation of class c. Our goal here is to provide insight into how the
identiﬁed subgraph for a particular node relates to a graph structure that explains an entire class.
GNNEXPLAINER can provide multi-instance explanations based on graph alignments and prototypes.
Our approach has two stages:
First  for a given class c (or  any set of predictions that we want to explain)  we ﬁrst choose a
reference node vc  for example  by computing the mean embedding of all nodes assigned to c. We
then take explanation GS(vc) for reference vc and align it to explanations of other nodes assigned to
class c. Finding optimal matching of large graphs is challenging in practice. However  the single-
