2010,Semi-Supervised Learning with Adversarially Missing Label Information,We address the problem of semi-supervised learning in an adversarial setting. Instead of assuming that labels are missing at random  we analyze a less favorable scenario where the label information can be missing partially and arbitrarily  which is motivated by several practical examples. We present nearly matching upper and lower generalization bounds for learning in this setting under reasonable assumptions about available label information. Motivated by the analysis  we formulate a convex optimization problem for parameter estimation  derive an efficient algorithm  and analyze its convergence. We provide experimental results on several standard data sets showing the robustness of our algorithm to the pattern of missing label information  outperforming several strong baselines.,Semi-Supervised Learning with Adversarially

Missing Label Information

Umar Syed

Ben Taskar

Department of Computer and Information Science

University of Pennsylvania

Philadelphia  PA 19104

{usyed taskar}@cis.upenn.edu

Abstract

We address the problem of semi-supervised learning in an adversarial setting. In-
stead of assuming that labels are missing at random  we analyze a less favor-
able scenario where the label information can be missing partially and arbitrarily 
which is motivated by several practical examples. We present nearly matching
upper and lower generalization bounds for learning in this setting under reason-
able assumptions about available label information. Motivated by the analysis  we
formulate a convex optimization problem for parameter estimation  derive an efﬁ-
cient algorithm  and analyze its convergence. We provide experimental results on
several standard data sets showing the robustness of our algorithm to the pattern
of missing label information  outperforming several strong baselines.

1

Introduction

Semi-supervised learning algorithms use both labeled and unlabeled examples. Most theoretical
analyses of semi-supervised learning assume that m + n labeled examples are drawn i.i.d. from a
distribution  and then a subset of size n is chosen uniformly at random and their labels are erased
[1]. This missing-at-random assumption is best suited for a situation where the labels are acquired
by annotating a random subset of all available data. But in many applications of semi-supervised
learning  the partially-labeled data is “naturally occurring”  and the learning algorithm has no control
over which examples were labeled.

For example  pictures on popular websites like Facebook and Flikr are tagged by users at their dis-
cretion  and it is difﬁcult to know how users decide which pictures to tag. A similar problem occurs
when data is submitted to an online labor marketplace  such as Amazon Mechanical Turk  to be
manually labeled. The workers who label the data are often poorly motivated  and may deliberately
skip examples that are difﬁcult to correctly label. In such a setting  a learning algorithm should not
assume that the examples were labeled at random.

Additionally  in many semi-supervised learning settings  the partial label information is not provided
on a per-example basis. For example  in multiple instance learning [2]  examples are presented to
a learning algorithm in sets  with either zero or one positive examples per set.
In graph-based
regularization [3]  a learning algorithm is given information about which examples are likely to
have the same label  but not necessarily the identity of that label. Recently  there has been much
interest in algorithms that learn from labeled features [4]; in this setting  the learning algorithm is
given information about the expected value of several features with respect to the true distribution
on labeled examples.

To summarize  in a typical semi-supervised learning problem  label information is often missing in
an arbitrary fashion  and even when present  does not always have a simple form  like one label per
example. Our goal in this paper is to develop and analyze a learning algorithm that is explicitly

1

designed for these types of problems. We derive our learning algorithm within a framework that is
expressive enough to permit a very general notion of label information  allowing us to make minimal
assumptions about which examples in a data set have been labeled  how they have been labeled 
and why. We present both theoretical upper and lower bounds for learning in this framework  and
motivated by these bounds  derive a simple yet provably optimal learning algorithm. We also provide
experimental results on several standard data sets  which show that our algorithm is effective and
robust when the label information has been provided by “lazy” or “unhelpful” labelers.
Related Work: Our learning framework is related to the malicious label noise setting  in which
the labeler is allowed to mislabel a small fraction of the training set (this is a special case of the
even more challenging malicious noise setting [5]  where an adverary can inject a small number
of arbitrary examples into the training set). Learning with this type of label noise is known to be
quite difﬁcult  and positive results often make quite restrictive assumptions about the underlying
data distribution [6  7]. By contrast  our results apply far more generally  at the expense of assuming
a more benign (but possibly more realistic) model of label noise  where the labeler can adversarially
erase labels  but not change them. In other words  we assume that the labeler equivocates  but does
not lie. The difference in these assumptions shows up quite clearly in our analysis: As we point out
in Section 3  our bounds become vacuous if the labeler is allowed to mislabel data.

In Section 2 we describe how our framework encodes label information in a label regularization
function  which closely resembles the idea of a compatibility function introduced by Balcan & Blum
[8]. However  they did not analyze a setting where this function is selected adversarially.

2 Learning Framework

Let X be the set of all possible examples  and Y the set of all possible labels  where |Y| = k. Let D
be an unknown distribution on X × Y. We write x and y as abbreviations for (x1  . . .   xm) ∈ X m
and (y1  . . .   ym) ∈ Y m  respectively. We write (x  y) ∼ Dm to denote that each (xi  yi) is drawn
i.i.d. from the distribution D on X × Y  and x ∼ Dm to denote that each xi is drawn i.i.d. from the
marginal distribution of D on X .
Let (ˆx  ˆy) ∼ Dm be the m labeled training examples. In supervised learning  one assumes access to
the entire training set (ˆx  ˆy). In semi-supervised learning  one assumes access to only some of the
labels ˆy  and in most theoretical analyses  the missing components of ˆy are assumed to have been
selected uniformly at random.

We make a much weaker assumption about what label information is available. We assume that 
after the labeled training set (ˆx  ˆy) has been drawn  the learning algorithm is only given access to
the examples ˆx and to a label regularization function R. The function R encodes some information
about the labels ˆy of ˆx  and is selected by a potentially adversarial labeler from a family R(ˆx  ˆy).
A label regularization function R maps each possible soft labeling q of the training examples ˆx to a
real number R(q) (a soft labeling is natual generalization of a labeling that we will deﬁne formally
in a moment). Except for knowing that R belongs to R(ˆx  ˆy)  the learner can make no assumptions
about how the labeler selects R. We give examples of label regularization functions in Section 2.1.

Let ∆ denote the set of distributions on Y. A soft labeling q ∈ ∆m of the training examples ˆx
is a doubly-indexed vector  where q(i  y) is interpreted as the probability that example ˆxi has label
y ∈ Y. The correct soft labeling has q(i  y) = 1{y = ˆyi}  where the indicator function 1{·} is 1
when its argument is true and 0 otherwise; we overload notation and write ˆy to denote the correct
soft labeling.

Although the labeler is possibly adversarial  the family R(ˆx  ˆy) of label regularization functions
restricts the choices the labeler can make. We are interested in designing learning algorithms that
work well when each R ∈ R(ˆx  ˆy) assigns a low value to the correct labeling ˆy. In the examples we
describe in Section 2.1  the correct labeling ˆy will be near the minimum of R  but there will be many
other minima and near-minima as well. This is the sense in which label information is “missing” —
it is difﬁcult for any learning algorithm to distinguish among these minima.

We emphasize that  while our algorithms work best when ˆy is close to the minimum of each R ∈
R(ˆx  ˆy)  nothing in our framework requires this to be true; in Section 3 we will see that our learning
bounds degrade gracefully as this condition is violated.

2

We are interested in learning a parameterized model that predicts a label y given an example x. Let
L(θ  x  y) be the loss of parameter θ ∈ Rd with respect to labeled example (x  y). While some of
the development in this paper will apply to generic loss functions  but two loss functions that will
particularly interest us are the negative log-likelihood of a log-linear model

Llike(θ  x  y) = − log pθ(y|x) = − log

exp(θT φφφ(x  y))

Py′ exp(θT φφφ(x  y′))

where φφφ(x  y) ∈ Rd is the feature function  and the 0-1 loss of a linear classiﬁer

L0 1(θ  x  y) = 1{arg max
y′∈Y

θT φφφ(x  y′) 6= y}.

Given training examples ˆx  label regularization function R  and loss function L  the goal of a learn-
ing algorithm is to ﬁnd a parameter θ that minimizes the expected loss ED[L(θ  x  y)]  where ED[·]
denotes expectation with respect to (x  y) ∼ D.
Let Eˆx q[f (x  y)] denote the expected value of f (x  y) when example x is chosen uniformly at
random from the training examples ˆx and — supposing that this is example ˆxi — label y is chosen
from the distribution q(i  ·). Accordingly  Eˆx ˆy[f (x  y)] denotes the expected value of f (x  y) when
labeled example (x  y) is chosen uniformly at random from the labeled training examples (ˆx  ˆy).

2.1 Examples of Label Regularization Functions

To make the concept of a label regularization function more clear  we describe several well-known
learning settings in which the information provided to the learning algorithm is less than the fully
labeled training set. We show that  for each these settings  there is a natural deﬁnition of R that
captures the information that is provided to the learning algorithm  and thus each of these settings
can be seen as special cases of our framework.

Before proceeding with the partially labeled cases  we explain how supervised learning can be
expressed in our framework. In the supervised learning setting  the label of every example in the
training set is revealed to the learner. In this setting  the label regularization function family R(ˆx  ˆy)
contains a single function Rˆy such that Rˆy(q) = 0 if q = ˆy  and Rˆy(q) = ∞ otherwise.
In the semi-supervised learning setting  the labels of only some of the training examples are revealed.
In this case  there is a function RI ∈ R(ˆx  ˆy) for each I ⊆ [m] such that RI (q) = 0 if q(i  y) =
1{y = ˆyi} for all i ∈ I and y ∈ Y  and RI (q) = ∞ otherwise. In other words  RI (q) is zero
if and only if the soft labeling q agrees with ˆy on the examples in I. This implies that RI (q) is
independent of how q labels examples not in I — these are the examples whose labels are missing.

In the ambiguous learning setting [9  10]  which is a generalization of semi-supervised learning 
the labeler reveals a label set ˆYi ⊆ Y for each training example ˆxi such that ˆyi ∈ ˆYi. That is 
for each training example  the learning algorithm is given a set of possibile labels the example can
have (semi-supervised learning is the special case where each label set has size 1 or k). Letting
ˆY = ( ˆY1  . . .   ˆYm) be all the label sets revealed to the learner  there is a function R ˆY ∈ R(ˆx  ˆy) for
each possible ˆY such that R ˆY (q) = 0 if supp(qi) ⊆ ˆYi for all i ∈ [m] and RY(q) = ∞ otherwise.
Here qi   q(i  ·) and supp(qi) is the support of label distribution qi. In other words  R ˆY (q) is
zero if and only if the soft labeling q is supported on the sets ˆY1  . . .   ˆYm.
The label regularization functions described above essentially give only local information; they spec-
ify  for each example in the training set  which labels are possible for that example. In some cases 
we may want to allow the labeler to provide more global information about the correct labeling.

One example of providing global information is Laplacian regularization  a kind of graph-based
regularization [3] that encodes information about which examples are likely to have the same labels.
For any soft labeling q  let q[y] be the m-length vector whose ith component is q(i  y). The Lapla-

cian regularizer is deﬁned to be RL(q) = Py∈Y q[y]T L(ˆx)q[y]  where L(ˆx) is an m × m positive

semi-deﬁnite matrix deﬁned so that RL(q) is large whenever examples in ˆx that are believed to have
the same label are assigned different label distributions by q.

Another possibility is posterior regularization. Deﬁne a feature function f (x  y) ∈ Rℓ; these features
may or may not be related to the model features φφφ deﬁned in Section 2. As noted by several authors

3

[4  11  12]  it is often convenient for a labeler to provide information about the expected value of
f (x  y) with respect to the true distribution. A typical posterior regularizer of this type will have
the form Rf  b(q) = kEˆx q[f (x  y)] − bk2
2  where the vector b ∈ Rℓ is the labeler’s estimate of the
expected value of f. This term penalizes soft labelings q which cause the expected value of f on the
training set to deviate from b.

Label regularization functions can also be added together. So  for instance  ambiguous learning can
be combined with a Laplacian  and in this case the learner is given a label regularization function of
the form R ˆY (q)+RL(q). We will experiment with these kinds of combined regularization functions
in Section 5.

Note that  in all the examples described above  while the correct labeling ˆy is at or close to the
minimum of each function R ∈ R(ˆx  ˆy)  there may be many labelings meeting this condition.
Again  this is the sense in which label information is “missing”.

It is also important to note that we have only speciﬁed what information the labeler can reveal to the
learner (some function from the set R(ˆx  ˆy))  but we do not specify how that information is chosen
by the labeler (which function R ∈ R(ˆx  ˆy)?). This will have a signiﬁcant impact on our analysis of
this framework. To see why  consider the example of semi-supervised learning. Using the notation
deﬁned above  most analyses of semi-supervised learning assume that RI is chosen be selecting a
random subset I of the training examples [13  14]. By constrast  we make no assumptions about
how RI is chosen  because we are interested in settings where such assumptions are not realistic.

3 Upper and Lower Bounds

In this section  we state upper and lower bounds for learning in our framework. But ﬁrst  we provide
a deﬁnition of the well-known concept of uniform convergence.
Deﬁnition 1 (Uniform Convergence). Loss function L has ǫ-uniform convergence if with probability
1 − δ

sup
θ∈Θ

(cid:12)(cid:12)(cid:12)(cid:12)(cid:12)

ED[L(θ  x  y)] − Eˆx ˆy[L(θ  x  y)](cid:12)(cid:12)(cid:12)(cid:12)(cid:12)

≤ ǫ(δ  m)

where (ˆx  ˆy) ∼ Dm and ǫ(·  ·) is an expression bounding the rate of convergence.

For example  if kφφφ(x  y)k ≤ c for all (x  y) ∈ X × Y and Θ = {θ : kθk ≤ 1} ⊆ Rd  then the

loss function Llike has ǫ-uniform convergence with ǫ(δ  m) = O(cid:18)cq d log m+log(1/δ)

m

(cid:19)  which fol-

lows from standard results about Rademacher complexity and covering numbers. Other commonly
used loss functions  such as hinge loss and 0-1 loss  also have ǫ-uniform convergence under similar
boundedness assumptions on φφφ and Θ.
We are now ready to state an upper bound for learning in our framework. The proof is contained in
the supplement.
Theorem 1. Suppose loss function L has ǫ-uniform convergence. If (ˆx  ˆy) ∼ Dm then with proba-
bility at least 1 − δ for all parameters θ ∈ Θ and label regularization functions R ∈ R(ˆx  ˆy)

ED[L(θ  x  y)] ≤ max
q∈∆m

(Eˆx q[L(θ  x  y)] − R(q)) + R(ˆy) + ǫ(δ  m).

Theorem 2 below states a lower bound that nearly matches the upper bound in Theorem 1  in certain
cases. As we will see  the existence of a matching lower bound depends strongly on the structure
of the label regularization function family R. Note that  given a labeled training set (x  y)  the set
R(x  y) essentially constrains what information the labeler can reveal to the learning algorithm 
thereby encoding our assumptions about how the labeler will behave. We make three such assump-
tions  described below. For the remainder of this section  we let the set of all possible examples
X = {˜x1  . . .   ˜xN } be ﬁnite.
Recall that all the label regularization functions described in Section 2.1 use the value ∞ to indicate
which labelings of the training set are impossible. Our ﬁrst assumption is that  for each R ∈ R(x  y) 
the set of possible labelings under R is separable over examples.

4

Assumption 1 (∞-Separability). For all labeled training sets (x  y) and R ∈ R(x  y) there ex-
ists a collection of label sets {Y˜x : ˜x ∈ X } and real-valued function F such that R(q) =
Pm
i=1 χ{supp(qi) ⊆ Yxi } + F (q)  where the characteristic function χ{·} is 0 when its argument

is true and ∞ otherwise  and F (q) < ∞ for all q ∈ ∆m.

It is easy to verify that all the examples of label regularization function families given in Section 2.1
satisfy Assumption 1. Also note that Assumption 1 allows the ﬁnite part of R (denoted by F ) to
depend on the entire soft labeling q in a basically arbitrarily manner.

Before describing our second assumption  we need a few additional deﬁnitions. We write h to
denote a labeling function that maps examples X to labels Y. Also  for any labeling function h and
unlabeled training set x ∈ X m  we let h(x) ∈ Y m denote the vector of labels whose ith component
is h(xi). Let px be an N-length vector that represents unlabeled training set x as a distribution on
X   whose ith component is px(i)   |{j : xj =˜xi}|
Our second assumption is the labeler’s behavior is stable: If training sets (x  y) and (x′  y′) are
“close” (by which we mean that they are consistently labeled and kpx − px′ k∞ is small) then the
label regularization functions available to the labeler for each training set are the “same”  in the
sense that the sets of possible labelings under each of them are identical.
Assumption 2 (γ-Stability). For any labeling function h∗ and unlabeled training sets x  x′ such that
kpx − px′ k∞ ≤ γ the following holds: For all R ∈ R(x  h∗(x)) there exists R′ ∈ R(x′  h∗(x′))
such that R(h(x)) < ∞ if and only if R′(h(x′)) < ∞  for all labeling functions h.

m

.

Our ﬁnal assumption  which we call reciprocity  states there is no way to deduce which of the
possible labelings under R is the correct one only by examining R.
Assumption 3 (Reciprocity). For all labeled training sets (x  y) and R ∈ R(x  y)  if R(y′) < ∞
then R ∈ R(x  y′).

Of all our assumptions  reciprocity seems to be the most unnatural and unmotivated. We argue it is
necessary for two reasons: Firstly  all the examples of label regularization function families given in
Section 2.1 satisfy this assumption  and secondly  in Theorem 3 we show that lifting the reciprocity
assumption makes the upper bound in Theorem 1 very loose.

We are nearly ready to state our lower bound. Let A be a (possibly randomized) learning algorithm
that takes a set of unlabeled training examples ˆx and a label regularization function R as input  and
outputs an estimated parameter ˆθ. Also  if under distribution D each example x ∈ X is associated
with exactly one label h∗(x) ∈ Y  then we write D = DX · h∗  where the data distribution DX is
the marginal distribution of D on X . Theorem 2 proves the existence of a true labeling function h∗
such that a nearly tight lower bound holds for all learning algorithms A and all data distributions
DX whenever the training set is drawn from DX · h∗. The fact that our lower bound holds for all
data distributions signiﬁcantly complicates the analysis  but this generality is important: since DX
is typically easy to estimate  it is possible that the learning algorithm A has been tuned for DX . The
proof of Theorem 2 is contained in the supplement.
Theorem 2. Suppose Assumptions 1  2 and 3 hold for label regularization function family R  the
loss function L is 0-1 loss  and the set of all possible examples X is ﬁnite. For all learning algorithms
A and data distributions DX there exists a labeling function h∗ such that if (ˆx  ˆy) ∼ Dm (where
γ 2 log |X |
D = DX · h∗) and m ≥ O( 1
δ ) then with probability at least 1
1
q∈∆m(cid:16)Eˆx q[L(ˆθ  x  y)] − R(q)(cid:17) + min
4

ED[L(ˆθ  x  y)] ≥

R(q) − ǫ(δ  m)

max

4 − 2δ

q∈∆m

for some R ∈ R(ˆx  ˆy)  where ˆθ is the parameter output by A  and γ is the constant from Assumption
2.

Obviously  Assumptions 1  2 and 3 restrict the kinds of label regularization function families to
which Theorem 2 can be applied. However  some restriction is necessary in order to prove a mean-
ingful lower bound  as Theorem 3 below shows. This theorem states that if Assumption 3 does not
hold  then it may happen that each family R(x  y) has a structure which a clever (but computation-
ally infeasible) learning algorithm can exploit to perform much better than the upper bound given in
Theorem 1. The proof of Theorem 3  which is contained in the supplement  constructs an example
of such a family.

5

Theorem 3. Suppose the loss function L is 0-1 loss. There exists a label regularization function
family R that satisﬁes Assumptions 1 and 2  but not Assumption 3  and a learning algorithm A such
that for all distributions D if (ˆx  ˆy) ∼ Dm then with probability at least 1 − δ

ED[L(ˆθ  x  y)] ≤ max

q∈∆m(cid:16)Eˆx q[L(ˆθ  x  y)] − R(q)(cid:17) + min

q∈∆m

R(q) + ǫ(δ  m) − 1

for some R ∈ R(ˆx  ˆy)  where ˆθ is the parameter output by A.

Whenever limm→∞ ǫ(δ  m) = 0 the gap between the upper and lower bounds in Theorems 1 and
2 approaches R(ˆy) − minq R(q) as m → ∞ (ignoring constant factors). Therefore  these bounds
are asymptotically matching if the labeler always chooses a label regularization function R such
that R(ˆy) = minq R(q). We emphasize that this is true even if ˆy is a nonunique minimum of R.
Several of the example learning settings described in Section 2.1  such as semi-supervised learning
and ambiguous learning  meet this criteria. On the other hand  if R(ˆy) − minq R(q) is large  then
the gap is very large  and the utility of our analysis degrades. In the extreme case that R(ˆy) = ∞
(i.e.  the correct labeling of the training set is not possible under R)  our upper bound is vacuous. In
this sense  our framework is best suited to settings in which the information provided by the labeler
is equivocal  but not actually untruthful  as it is in the malicious label noise setting [6  7].
Finally  note that if limm→∞ ǫ(δ  m) = 0  then the upper bound in Theorem 3 is smaller than
the lower bound in Theorem 2 for all sufﬁciently large m  which establishes the importance of
Assumption 3.

4 Algorithm

Given the unlabeled training examples ˆx and label regularization function R  the bounds in Section
3 suggest an obvious learning algorithm: Find a parameter θ∗ that realizes the minimum

min

θ

max
q∈∆m

(Eˆx q[L(θ  x  y)] − R(q)) + α kθk2 .

(1)

The objective (1) is simply the minimization of the upper bound in Theorem 1  with one difference:
for algorithmic convenience  we do not minimize over the set Θ  but instead add the quantity α kθk2
to the objective and leave θ unconstrained (here  and in the rest of the paper  k·k denotes L2 norm).
If we assume that Θ = {θ : kθk ≤ c} for some c > 0  then this modiﬁcation is without loss of
generality  since there exists a constant αc for which this is an equivalent formulation.
In order to estimate θ∗  throughout this section we make the following assumption about the loss
function L and label regularization function R.
Assumption 4. The loss function L is convex in θ  and the label regularization function R is convex
in q.

It is easy to verify that all of the loss functions and label regularization functions we gave as examples
in Sections 2 and 2.1 satisfy Assumption 4.
Instead of ﬁnding θ∗ directly  our approach will be to “swap” the min and max in (1)  ﬁnd the
soft labeling q∗ that realizes the maximum  and then use q∗ to compute θ∗. For convenience  we
abbreviate the function that appears in the objective (1) as F (θ  q)   Eˆx q[L(θ  x  y)] − R(q) +
α kθk2. A high-level version of our learning algorithm — called GAME due to the use of a game-
theoretic minimax theorem in its proof of correctness — is given in Algorithm 1; the implementation
details for each step are given below Theorem 4.

Algorithm 1 GAME: Game for Adversarially Missing Evidence
1: Given: Constants ǫ1  ǫ2 > 0.
2: Find ˜q such that minθ F (θ  ˜q) ≥ maxq∈∆m minθ F (θ  q) − ǫ1
