2019,E2-Train: Training State-of-the-art CNNs with Over 80% Energy Savings,Convolutional neural networks (CNNs) have been increasingly deployed to edge devices. Hence  many efforts have been made towards efficient CNN inference on resource-constrained platforms. This paper attempts to explore an orthogonal direction: how to conduct more energy-efficient training of CNNs  so as to enable on-device training? We strive to reduce the energy cost during training  by dropping unnecessary computations  from three complementary levels: stochastic mini-batch dropping on the data level; selective layer update on the model level; and sign prediction for low-cost  low-precision back-propagation  on the algorithm level. Extensive simulations and ablation studies  with real energy measurements from an FPGA board  confirm the superiority of our proposed strategies and demonstrate remarkable energy savings for training. For example  when training ResNet-74 on CIFAR-10  we achieve aggressive energy savings of >90% and >60%  while incurring a top-1 accuracy loss of only about 2% and 1.2%  respectively. When training ResNet-110 on CIFAR-100  an over 84% training energy saving is achieved without degrading inference accuracy.,E2-Train: Training State-of-the-art CNNs with Over

80% Less Energy

Yue Wang(cid:5) ∗  Ziyu Jiang† ∗  Xiaohan Chen† ∗  Pengfei Xu(cid:5)  Yang Zhao(cid:5) 

Yingyan Lin(cid:5) and Zhangyang Wang†

†Department of Computer Science and Engineering  Texas A&M University

(cid:5)Department of Electrical and Computer Engineering  Rice University

†{jiangziyu  chernxh  atlaswang}@tamu.edu
(cid:5){yw68  px5  zy34  yingyan.lin}@rice.edu
https://rtml.eiclab.net/?page_id=120

Abstract

Convolutional neural networks (CNNs) have been increasingly deployed to edge
devices. Hence  many efforts have been made towards efﬁcient CNN inference
in resource-constrained platforms. This paper attempts to explore an orthogonal
direction: how to conduct more energy-efﬁcient training of CNNs  so as to enable
on-device training? We strive to reduce the energy cost during training  by dropping
unnecessary computations  from three complementary levels: stochastic mini-batch
dropping on the data level; selective layer update on the model level; and sign
prediction for low-cost  low-precision back-propagation  on the algorithm level.
Extensive simulations and ablation studies  with real energy measurements from an
FPGA board  conﬁrm the superiority of our proposed strategies and demonstrate
remarkable energy savings for training. For example  when training ResNet-74
on CIFAR-10  we achieve aggressive energy savings of >90% and >60%  while
incurring a top-1 accuracy loss of only about 2% and 1.2%  respectively. When
training ResNet-110 on CIFAR-100  an over 84% training energy saving is achieved
without degrading inference accuracy.

Introduction

1
The increasing penetration of intelligent sensors has revolutionized how Internet of Things (IoT)
works. For visual data analytics  we have witnessed the record-breaking predictive performance
achieved by convolutional neural networks (CNNs) [1  2  3]. Although such high performance CNN
models are initially learned in data centers and then deployed to IoT devices  we have witnessed
increasing necessity for the model to continue learning and updating itself in situ  such as for
personalization for different users  or incremental/lifelong learning. Ideally  this learning/retraining
process should take place on device. Comparing to cloud-based retraining  training locally helps
avoid transferring data back and forth between data centers and IoT devices  reduce communication
cost/latency  and enhance privacy.
However  training on IoT devices is non-trivial  more consuming yet much less explored than in-
ference. IoT devices  such as smart phones and wearables  have limited computation and energy
resources  that are even stringent for inference. Training CNNs consumes magnitudes higher com-
putations than one inference. For example  training ResNet-50 for only one 224 × 224 image can
take up to 12 GFLOPs (vs. 4GFLOPS for inference)  which can easily drain a mobile phone battery
when training with batch images [4]. This mismatch between the limited resources of IoT devices
and the high complexity of CNNs is only getting worse because the network structures are getting
more complex as they are designed to solve harder and larger-scale tasks [5].
∗The ﬁrst three authors (Yue Wang  Ziyu Jiang  Xiaohan Chen) contributed equally.

33rd Conference on Neural Information Processing Systems (NeurIPS 2019)  Vancouver  Canada.

This paper considers the most standard CNN training setting  assuming both the model structure
and the dataset to be given. This “basic” training setting is not usually the realistic IoT case  but
we address it as a starting point (with familiar benchmarks)  and an opening door towards obtaining
a toolbox that may be later extended to online/transfer learning too (see Section 5). Our goal is
to reduce the total energy cost in training  which is complicated by a myriad of factors: from
per-sample (mini-batch) complexity (both feed-forward and backward computations)  to the empirical
convergence rate (how many epochs it takes to converge)  and more broadly  hardware/architecture
factors such as data access and movements [6  7]. Despite a handful of works on efﬁcient  accelerated
CNN training [8  9  10  11  12]  they mostly focus on reducing the total training time in resource-rich
settings  such as by distributed training in large-scale GPU clusters. In contrast  our focus is to trim
down the total energy cost for in-situ  resource-constrained training. It represents an orthogonal
(and less studied) direction to [8  9  10  11  12  13  14]  although the two can certainly be combined.
To unleash the potential of more energy-efﬁcient in-situ training  we look at the full CNN training
lifecycle closely. With the goal to “squeeze out” unnecessary costs  we raise three curious questions:
• Q1: Are all samples always required throughout training: is it necessary to use all training samples
• Q2: Are all parts of the entire model equally important during training: does every layer or ﬁlter
• Q3: Are precise gradients indispensable for training: can we efﬁciently compute and update the

have to be updated every time?

in all epochs?

model with approximate gradients?

The above three questions only represent our “ﬁrst stab” ideas to explore energy-efﬁcient training 
whose full scope is much more profound. By no means do our above questions represent all possible
directions. We envision that many other recipes can be blended too  such as training on lower bit
precision or input resolution [15  16]. We also recognize that energy-efﬁcient CNN training should be
jointly considered with hardware/architecture co-design [17  18]  which is beyond the current work.
Motivated by the above questions  this paper proposes a novel energy efﬁcient CNN training frame-
work dubbed E2-Train. It consists of three complementary aspects of efforts to trim down unnecessary
training computations and data movements  each addressing one of the above questions:
• Data-Level: Stochastic mini-batch dropping (SMD). We show that CNN training could be
accelerated by a “frustratingly easy” strategy: randomly skipping mini-batches with 0.5 probability
throughout training. This could be interpreted as data sampling with (limited) replacements  and is
found to incur minimal accuracy loss (sometimes even increase).

• Model-Level: Input-dependent selective layer update (SLU). For each minibatch  we select a
different subset of CNN layers to be updated. The input-adaptive selection is based on a low-cost
gating function jointly learned during training. While similar ideas were explored in efﬁcient
inference [19]  for the ﬁrst time it is applied and evaluated for training.

• Algorithm-Level: Predictive sign gradient descent (PSG). We explore the usage of an ex-
tremely low-precision gradient descent algorithm called SignSGD  which has recently found both
theoretical and experimental grounds [20]. The original algorithm still requires the full gradient
computation and therefore does not save energy. We create a novel “predictive” variant  that could
obtain the sign without computing the full gradient  via low-cost  bit-level prediction. Combined
with mixed-precision design  it decreases computation and data-movement costs.

Besides mainly experimental explorations  we ﬁnd E2-Train has many interesting links to recent CNN
training theories  e.g.  [21  22  23  24]. We evaluate E2-Train in comparison with its closest state-of-
the-art competitors. To measure its actual performance  E2-Train is also implemented and evaluated
on an FPGA board. The results show that the CNN model applied with E2-Train consistently
achieves higher training energy efﬁciency with marginal accuracy drops.

2 Related Work
Accelerated CNN training. A number of works have been devoted to accelerating training  in a
resource-rich setting  by utilizing communication-efﬁcient distributed optimization and larger mini-
batch sizes [8  9  10  11]. The latest work [12] combined distributed training with a mixed precision
framework  leading to training AlexNet within 4 minutes. However  their goals and settings are
distinct from ours - while the distributed training strategy can reduce time  it will actually incur more
total energy overhead  and is clearly not applicable to on-device resource-constrained training.

2

Low-precision training. It is well known that CNN training can be performed under substantial
lower precision [15  14  13]  rather than using full-precision ﬂoats. Speciﬁcally  training with
quantized gradients has been well studied in the distributed learning  whose main motivation is to
reduce the communication cost during gradient aggregations between workers [25  26  27  28  29  20].
A few works considered to only transmit the coordinates of large magnitudes [30  31  32]. Recently 
the SignSGD algorithm [25  20] even showed the feasibility of using one-bit gradients (signs) during
training  without notably hampering the convergence rate or ﬁnal result. However  most algorithms
are optimized for distributed communication efﬁciency  rather than for reducing training energy costs.
Many of them  including [20]  need ﬁrst compute full-precision gradients and then quantize them.
Efﬁcient CNN inference: Static and Dynamic. Compressing CNNs and speeding up their inference
have attracted major research interests in recent years. Representative methods include weight pruning 
weight sharing  layer factorization  bit quantization  to just name a few [33  34  35  36  37].
While model compression presents “static” solutions for improving inference efﬁciency  a more
interesting recent trend looks at dynamic inference [19  38  39  40  41] to reduce the latency  i e 
selectively executing subsets of layers in the network conditioned on each input. That sequential
decision making process is usually controlled by low-cost gating or policy networks. This mechanism
was also applied to improve inference energy efﬁciency [42  43].
In [44]  a unique bit-level prediction framework called PredictiveNet was presented to accelerate
CNN inference at a lower level. Since CNN layer-wise activations are usually highly sparse  the
authors proposed to predict those zero locations using low-cost bit predictors  thereby bypassing a
large fraction of energy-dominant convolutions without modifying the CNN structure.
Energy-efﬁcient training is different from and more complicated than its inference counterpart.
However  many insights gained from the latter can be lent to the former. For example  the recent
work [45] showed that performing active channel pruning during training can accelerate the empirical
convergence. Our proposed model-level SLU is inspired by [19]. The algorithm-level PSG also
inherits the idea of bit-level low-cost prediction from [44].

3 The Proposed Framework

3.1 Data-Level: Stochastic mini-batch dropping (SMD)

We ﬁrst adopt a straightforward  seemingly naive  yet surprisingly effective stochastic mini-batch
dropping (SMD) strategy (see Fig. 1)  to aggressively reduce the training cost by letting it see less
mini-batches. At each epoch  SMD simply skips every mini-batch with a default probability of 0.5.
All other training protocols  such as learning rate schedule  remain unchanged. Compared to the
normal training  SMD can directly half the training cost  if both were trained with the same number of
epochs. Yet amazingly  we observe in our experiments that SMD usually leads to negligible accuracy
decrease  sometimes even increase (see Sec. 4). Why? We discuss possible explanations below.
SMD can be interpreted as sampling with limited replacement. To understand this  think of combing
two consecutive SMD-enforced epochs into one  then it has the same number of mini-batches as one
full epoch; but within it each training sample now has 0.25  0.5  and 0.25 probability  to be sampled 2 
1  and 0 times  respectively. The conventional wisdom is that for stochastic gradient descent (SGD) 
in each epoch  the mini-batches are sampled i.i.d. from data without replacement (i.e.  each sample
occurs exactly once per epoch) [46  47  48  49  50]. However  [21] proved that sampling mini-batches
with replacement has a large variance than sampling without replacement  and consequently SGD
may have better regularization properties.
Alternatively  SMD could also be viewed as a special data augmentation way that injects more
sampling noise to perturb training distribution every epoch. Past works [51  52  53] have shown
that speciﬁc kinds of random noise aid convergence through escaping from saddle points or less
generalizable minima. The structured sampling noise caused by SMD might aid the exploration.
Besides  [22  54  55] also showed that an importance sampling scheme that focuses on training more
with “informative” examples leads to faster convergence under resource budgets. They implied that
the mini-batch dropping can be selective based on certain information criterion instead of stochastic.
We use SMD because it has zero overhead  but more effective dropping options might be available if
low-cost indicators of mini-batch importance can be identiﬁed: we leave this as future work.

3

Figure 1: Illustration of proposed framework. SLU: each blue circle G indicates an RNN gate and each blue
square under G indicates one block of layers in the base model. Green arrows denote the backward propagation.
To reduce the training cost  the RNN gates generate strategies to select which layers to train for each input.
In this speciﬁc example  the second and fourth blocks are “skipped” for both feedforward and backward
computations. Only the ﬁrst and third blocks are updated. SMD and PSG: details are described in the main text.

3.2 Model-Level: Input-dependent selective layer update (SLU)
[19] proposed to dynamically skip a subset of layers for different inputs  in order to adaptively
accelerate the feed-forward inference. However  [19] called for a post process after supervised
training  i.e.  to reﬁne the dynamic skipping policy via reinforcement learning  thus causing undesired
extra training overhead. We propose to extend the idea of dynamic inference to the training stage 
i.e.  dynamically skipping a subset of layers during both feed-forward and back-propagation.
Crucially  we show that by adding an auxiliary regularization  such dynamic skipping can be learned
from scratch and obtain satisfactory performance: no post reﬁnement nor extra training iterations
is required. That is critical for dynamic layer skipping to be useful for energy-efﬁcient training: we
term this extended scheme as input-dependent selective layer update (SLU).
As depicted in Fig. 1  given a base CNN to be trained  we follow [19] to add a light-weight RNN
gating network per layer block. Each gate takes the same input as its corresponding layer  and outputs
soft-gating outputs between [0 1] for the layer  which are then used as the skipping probability  in
which the higher the value is  more probably that layer will be selected. Therefore  each layer will be
adaptively selected or skipped  depending on the inputs. We will only select the layers activated by
gates. Those RNN gates cost less than 0.04% feed-forward FLOPs than the base models; hence their
energy overheads are negligible. More details can be found in the supplementary.
[19] ﬁrst trained the gates in a supervised way together with the base model. Observing that such
learned routing policies were often not sufﬁciently efﬁcient  they used reinforcement learning post-
processing to learn more aggressive skipping afterwards. While this is ﬁne for the end goal of dynamic
inference  we hope to get rid of the post-processing overhead. We incorporate the computational
complexity regularization into the objective function to overcome this hurdle  deﬁned as

min
W G

L(W  G) + αC(W  G)

(1)
Here  α is a weighting coefﬁcient of the computational complexity regularization. W and G denote
the parameters of the base model and the gating network  respectively. Also  L(W  G) denotes
the prediction loss  and C(W  G) is calculated by accumulating the computational cost (FLOPs)
of the layers that are selected. The regularization explicitly encourages to learn more “parismous”
selections throughout the training. We ﬁnd that such SLU-regularized training leads to almost
the same number of epochs to converge compared to standard training  i.e.  SLU does not sacriﬁce
empirical convergence speed. As a side effect  SLU will naturally yield CNNs with dynamic inference
capability. Though not the focus of this paper  we ﬁnd the CNN trained with SLU reaches comparable
accuracy-efﬁciency trade-off over one trained with the approach in [19].
The practice of SLU seems to align with several recent theories on CNN training. In [56]  the authors
suggested that “not all layers are created equal” for training. Speciﬁcally  some layers are critical to be
intensively updated for improving ﬁnal predictions  while others are insensitive along training. There
exist “non-critical” layers that barely change their weights throughout training: even resetting those
layers in a trained model to their initial value has few negative consequences. The more recent work
[24] further conﬁrmed the phenomenon  though how to identify those non-critical model parts at the

4

early training stage remains unclear. [57  58] also observed different samples might activate different
sub-models. Those inspiring theories  combined with the dynamic inference practice  motivate us to
propose SLU for more efﬁcient training.
3.3 Algorithm-Level: Predictive sign gradient descent (PSG)
It is well recognized that low-precision ﬁxed-point implementation is a very effective knob for
achieving energy efﬁcient CNNs  because both CNNs’ computational and data movement costs are
approximately a quadratic function of their employed precision. For example  a state-of-the-art design
[59] shows that adopting 8-bit precision for a multiplication  adder  and data movement can reduce
the energy cost by 95%  97%  and 75%  respectively  as compared to that of a 32-bit ﬂoating point
design when evaluated in a commercial 45nm CMOS technology.
The successful adoption of extremely low-precision (binary) gradients in SignSGD [20] is appealing 
as it might lead reducing both weight update computation and data movements. However  directly
applying the original SignSGD algorithm for training will not save energy  because it actually
computes the full-precision gradient ﬁrst before taking the signs. We propose a novel predictive
sign gradient descent (PSG) algorithm  which predicts the sign of gradients using low-cost bit-level
predictors  therefore completely bypassing the costly full-gradient computation.
We next introduce how the gradients of weights are updated in PSG. Assume the following notations:
the full precision and most signiﬁcant bits (the latter  MSB part  is adopted by PSG’s low-cost
predictors) of the input x and the gradient of the output gy are denoted as (Bx  Bg) and (Bmsb
) 
  Bmsb
respectively  where the corresponding input and the gradient of the output for PSG’s predictors are
denoted as xmsb and gmsb
  respectively. As such  the quantization noise for the input and the gradient
of the output are qx = x− xmsb and qgy = gy − gmsb
  respectively. Similarly  after back-propagation 
we denote the full-precision and low-precision (i.e.  taking the most signiﬁcant bits (MSBs)) gradient
of the weight as gw and gmsb
w   respectively  the latter of which is computed using xmsb and gmsb
.
Then  with an empirically pre-selected threshold τ  PSG updates the i-th weight gradient as follows:

x

y

y

y

g

(cid:26)sgn(gmsb

w [i])

sgn(gw[i])

˜gw[i] =

w [i]| ≥ τ

 |gmsb
  otherwise

w

(2)

x

gy

gy

(e.g.  Bmsb

(e.g.  Bmsb

x =4) and Bmsb

is embedded within that of gw.

Note that in hardware implementation  the computation to obtain gmsb
Therefore  the PSG’s predictors do not incur energy overhead.
PSG for energy-efﬁcient training. Recent work [15] has shown that most of the training process is
robust to reduced precision (e.g.  8 bits instead of 32 bits)  except for the weight gradient calculations
and updates. Taking their learning  we similarly adopt a higher precision for the gradients than the
inputs and weights  i.e.  Bgy > Bx =Bw. Speciﬁcally  when training with PSG  we ﬁrst compute
the predictors using Bmsb
=10)  and then update the weights’
gradients following Eq. (2). The further energy savings of training with PSG over the ﬁxed-point
training [15] are resulted from the fact that the predictors computed using xmsb and gmsb
require
exponentially less computational and data movement energy.
Prediction guarantee of PSG. We analyze the probability of PSG’s prediction failure to discuss its
performance guarantee. Speciﬁcally  if denoting the sign prediction failure produced by Eq. (2) as H 
it can be proved that this probability is upbounded as follows 
E2 

(3)
xE1 + ∆2
gy
−1) are the quantization noise step sizes of xmsb
where ∆x = 2−(Bmsb
and gmsb
  respectively. E1 and E2 are given in the Appendix along with the proof of Eq. (3).
Eq. (3) shows that the prediction failure probability of PSG is upbounded by a term that degrades
exponentially with the precision assigned to the predictors  indicating that this failure probability can
be very small if the predictors are designed properly.
Adaptive threshold. Training with PSG might lead to sign ﬂips in the weight gradients as compared
to that of the ﬂoating point one  which only occurs when the latter has a small magnitude and thus the
quantization noise of the predictors causes the sign ﬂips. Therefore  it is important to properly select
a threshold (e.g.  τ in Eq.(2)) that can optimally balance this sign ﬂip probability and the achieved
energy savings. We adopt an adaptive threshold selection strategy because the dynamic range of
gradients differ signiﬁcantly from layers to layers: instead of using a ﬁxed number  we will tune a
ratio β ∈ (0  1) which yields the adaptive threshold as ˜τ = β maxi{gmsb

P (H) ≤ ∆2
−(Bmsb

x −1) and ∆gy = 2

w [i]}.

gy

y

y

5

4 Experiments
4.1 Experiment setup
Datasets: We evaluate our proposed techniques on two datasets: CIFAR-10 and CIFAR-100. Common
data augmentation methods (e.g.  mirroring/shifting) are adopted  and data are normalized as in
[60]. Models: Three popular backbones  ResNet-74  ResNet-110 [61]  and MobileNetV2 [62]  are
considered. For evaluating each of the three proposed techniques (i.e.  SMD  SLU  and PSG)  we
consider various experimental settings using ResNet-74 and CIFAR-10 dataset for ablation study  as
described in Sections 4.2-4.5. ResNet-110 and MobileNetV2 results are reported in Section 4.6. Top-1
accuracies are measured for CIFAR-10  and both top-1 and top-5 accuracies for CIFAR-100. Training
settings: We adopt the training settings in [61] for the baseline default conﬁgurations. Speciﬁcally  we
use an SGD with a momentum of 0.9 and a weight decaying factor of 0.0001  and the initialization
introduced in [63]. Models are trained for 64k iterations. For experiments where PSG is used  the
initial learning rate is adjusted to 0.03 as SignSGD[20] suggested small learning rates to beneﬁt
convergence. For others  the learning rate is initially set to be 0.1 and then decayed by 10 at the 32k
and 48k iterations  respectively. We also employed the stochastic weight averaging (SWA) technique
[64] when PSG is adopted  that was found to notably stabilize training.
Real energy measurements using FPGA: As the energy cost of CNN inference/training consists
of both computational and data movement costs  the latter of which is often dominant but can
not captured by the commonly used metrics  such as the number of FLOPs [6]  we evaluate the
proposed techniques against the baselines in terms of accuracy and real measured energy consumption.
Speciﬁcally  unless otherwise speciﬁed  all the energy or energy savings are obtained through real
measurements by training the corresponding models and datasets in a state-of-the-art FPGA [65] 
which is a digilent ZedBoard Zynq-7000 ARM/FPGA SoC Development Board. Fig. 2 shows our
FPGA measurement setup  in which the FPGA board is connected to a laptop through a serial port
and a power meter. In particular  the training settings are downloaded from the laptop to the FPGA
board  and the real-measured energy consumption is obtained via the power meter for the whole
