2019,Combinatorial Inference against Label Noise,Label noise is one of the critical sources that degrade generalization performance of deep neural networks significantly. To handle the label noise issue in a principled way  we propose a unique classification framework of constructing multiple models in heterogeneous coarse-grained meta-class spaces and making joint inference of the trained models for the final predictions in the original (base) class space. Our approach reduces noise level by simply constructing meta-classes and improves accuracy via combinatorial inferences over multiple constituent classifiers. Since the proposed framework has distinct and complementary properties for the given problem  we can even incorporate additional off-the-shelf learning algorithms to improve accuracy further. We also introduce techniques to organize multiple heterogeneous meta-class sets using $k$-means clustering and identify a desirable subset leading to learn compact models. Our extensive experiments demonstrate outstanding performance in terms of accuracy and efficiency compared to the state-of-the-art methods under various synthetic noise configurations and in a real-world noisy dataset.,Combinatorial Inference against Label Noise

Paul Hongsuck Seo†‡
†Computer Vision Lab.

POSTECH

hsseo@postech.ac.kr

Geeho Kim‡

Bohyung Han‡

‡Computer Vision Lab. & ASRI

Seoul National University

{snow1234  bhhan}@snu.ac.kr

Abstract

Label noise is one of the critical sources that degrade generalization performance of
deep neural networks signiﬁcantly. To handle the label noise issue in a principled
way  we propose a unique classiﬁcation framework of constructing multiple models
in heterogeneous coarse-grained meta-class spaces and making joint inference of
the trained models for the ﬁnal predictions in the original (base) class space. Our
approach reduces noise level by simply constructing meta-classes and improves
accuracy via combinatorial inferences over multiple constituent classiﬁers. Since
the proposed framework has distinct and complementary properties for the given
problem  we can even incorporate additional off-the-shelf learning algorithms
to improve accuracy further. We also introduce techniques to organize multiple
heterogeneous meta-class sets using k-means clustering and identify a desirable
subset leading to learn compact models. Our extensive experiments demonstrate
outstanding performance in terms of accuracy and efﬁciency compared to the state-
of-the-art methods under various synthetic noise conﬁgurations and in a real-world
noisy dataset.

1

Introduction

Construction of a large-scale dataset is labor-intensive and time-consuming  which makes it inevitable
to introduce a substantial level of label noise and inconsistency. This issue is aggravated if the
data collection relies on crowd-sourcing [1  2] or internet search engines [3  4] without proper
curation. More importantly  many real-world problems inherently involve a signiﬁcant amount of
noise and it is extremely important to train machine learning models that can handle such a challenge
effectively. Figure 1 presents several noisy examples in WebVision benchmark [4]  where training
examples are collected from Google and Flickr by feeding queries corresponding to the ImageNet
class labels. Although a moderate level of noise is sometimes useful for regularization  label noise is
a critical source of underﬁtting or overﬁtting. In the case of deep neural networks  models can easily
memorize a large number of noisy labels and  consequently  are prone to degrade their generalization
performance [5].
To tackle various kinds of label noise  existing mainstream approaches either attempt to ﬁlter noisy
examples out [6–11] or correct noisy labels based on the network predictions [12–15]. However 
these methods are similar to solving the chicken-and-egg problem and their unstable on-the-ﬂy noise
recognition process may result in poor generalization performance. On the other hand  [16–21]
assume the correct labels to be latent and learn the networks inferring the latent correct labels by
estimating noise transition matrices. Although these methods estimate the noise injection process
directly  they are also suboptimal when the network is capable of adapting to label noise as discussed
in [10].
While the prior approaches typically focus on developing noise-resistant training algorithms given
noise levels  our algorithm takes a totally different perspective of reducing noise level and learning a

33rd Conference on Neural Information Processing Systems (NeurIPS 2019)  Vancouver  Canada.

Figure 1: Examples of 259-pomeranian class in WebVision [4]. In addition to clean samples  the
dataset contains closed- and open-set noises  where the examples with closed-set noise are mislabeled
with known classes while the ones with open-set noise are associated with unknown class labels.

representation robust to label noise. In our framework  we automatically generate multiple coarse-
grained meta-class sets  each of which constructs a heterogeneous partition of the original class set.
Then  we train classiﬁers on individual meta-class sets and make the ﬁnal prediction using an output
combination of the classiﬁers. Note that the combination process allows us to uniquely identify
the original classes despite the coarse representation learning on meta-class spaces. Learning on
meta-class spaces actually reduces the level of label noise because multiple classes in an original
class space collapse to a single meta-class and the label noise within the same meta-class becomes
invisible on the meta-class space.
The contribution of this paper is three-fold; (1) we successfully reduce the amount of label noise by
constructing meta-classes of multiple base classes; (2) we propose a novel combinatorial classiﬁcation
framework  where inference on the original class space is given by combining the predictions on
multiple meta-class spaces; (3) we demonstrate the robustness of the proposed method through
extensive controlled experiments as well as the evaluation on a real-world dataset with label noise.
The rest of this paper is organized as follows. Section 2 reviews previous approaches against datasets
with label noise and other related techniques. Then  we formally describe the proposed compositional
classiﬁcation method  and demonstrate the effectiveness of our method in Section 3 and 4  respectively.
Finally  we conclude our paper in Section 5.

2 Related Work

One common approach to learning with noisy data is to correct or ﬁlter out noisy examples during
training [6–15  22–25]. Existing methods adopt their own criteria to identify the noisy samples.
There exist several techniques to employ the conﬁdence scores of models as the signal of noise in
[11–14] while [8] incorporates a contrastive loss term to iteratively identify noisy samples. Deep
bilevel learning [9] attempts to ﬁnd reliable mini-batches based on the distances between the mini-
batches in training and validation datasets. Multiple networks have often been adopted to identify
noisy examples. For example  two networks with an identical architecture are jointly trained to
identify noisy samples in each batch [6  11] whereas a separate teacher network is employed to
select samples for training a student network. Contrary to the approaches making hard decisions
on noisy sample selection  there are a handful of algorithms relying on the soft penalization of
potentially noisy examples by designing noise-robust loss functions [10  23]  using knowledge
distillation [24] and adding regularizers [22]. Although these methods are often motivated by intuitive
understanding of classiﬁcation models  their ad-hoc procedures often lack theoretical support and
hamper reproducibility.
Another line of methods estimates a noise transition matrix capturing transition probabilities from
correct labels to corrupted ones [16–21]. Some of them [16–18] adopt the standard backpropagation
to estimate the transition matrix and train the network simultaneously while a pretrained network is
often used for the transition matrix estimation [19]. To improve the quality of the estimated transition
matrices  additional clean data [21] or manually deﬁned constraints [20] are sometimes integrated
during the matrix estimation process.
Although all these existing approaches cover various aspects of training with noisy data  they typically
assume that the noise-level of a dataset is irrevocable and therefore focus on developing algorithms that

2

97-drake526-deskclean samplesclosed-set noiseopen-set noiseFigure 2: Motivation and concept of combinatorial classiﬁcation.
(left) Empirical noise-level
reduction by use of meta-class labels on CUB-200 with closed-set noise; the noise rates in the meta-
class level show the average of all meta-class sets. (right) Illustration of combinatorial classiﬁcation
with two binary meta-class sets on four original classes. By combining the coarse-grained meta-
classes  it is possible to predict ﬁne-grained original class labels.

avoid overﬁtting to a noisy training set by identifying noisy examples or modeling noise distribution.
In contrast  we propose a novel output representation method that directly reduces the noise-level of
a given dataset  and a model that predicts class labels based on the proposed representations.
The proposed combinatorial classiﬁcation solves the target problem by combining solutions of
multiple subproblems encoded by class codewords and there are several related methods in this aspect.
Product quantization [27  28] measures distances in multiple quantized subspaces and combines them
to perform the approximate nearest neighbor search in the original space. A recently proposed an
image geolocalization technique by classiﬁcation achieves the ﬁne-grained quantization by combining
multiple coarse-grained classiﬁcations [29]  while a similar approach is proposed for metric learning
for retrieval tasks [30]. Unlike these works targeting regression or retrieval tasks on continuous
spaces  our approach deals with a classiﬁcation problem on a discrete output space. Ensemble
methods [31–37] also have the similar concept to our algorithm but are different in the sense that
their constituent models have the common output space. One of the most closely related work
is the classiﬁcation by error-correcting output code [26]. This technique combines the results of
binary classiﬁers to solve multi-class classiﬁcation problems and proposes deterministic processes to
generate and predict the binarized codewords based on Hamming distance. In contrast  we generate
codewords by exploiting the semantics of the original classes and combine the predicted scores to
construct the compositional classiﬁer robust to label noise.

3 Combinatorial Classiﬁcation

3.1 Class Codewords
As in the ordinary classiﬁcation  our goal is to predict a class label y ∈ C given an input x  where
C = {c1  . . .   cK} is a set of K disjoint classes. Unlike conventional classiﬁcation approaches that
directly predict the output class y  our model estimates y by predicting its corresponding unique
codeword. To construct the class codewords  we deﬁne M meta-class sets  each of which is given
by a unique partitioning of C. Speciﬁcally  each meta-class set denoted by Cm (m = 1  . . .   M) has
K(cid:48)}  where multiple original classes are merged into a
K(cid:48)((cid:28) K) meta-classes  i.e.  Cm = {cm
single meta-class  which results in a coarse-grained class deﬁnition. Then  each class ci is represented
im corresponds to a meta-class to which ci belongs in a
by a M-ary codeword  c1
meta-class set Cm.
i1
When training data have label noise  classiﬁcation on a coarse-grained meta-class set naturally reduces
noise level of the dataset. Formally  let η( ˆD) be the noise level of a dataset ˆD = {(xi  ˆyi)}N
i=1  which
is given by

iM   where cm

1   . . .   cm

c2
i2

. . . cM

N(cid:88)

i=1

η( ˆD) = E ˆD[1(y (cid:54)= ˆy)] =

1
N

1(yi (cid:54)= ˆyi) 

(1)

where ˆyi means a label potentially corrupted from a clean label yi and 1 is an indicator function.
Although two examples xi and xj belong to the same class but the label of xj is corrupted from
yj(= yi) to ˆyj  the two classes corresponding to yi and ˆyj can be merged into the same meta-class 
which removes the label noise in the meta-class level. Consequently  the noise level with the meta-

3

uniformnearest0.00.20.40.6noise levelclass labelmeta-class labelclasses:meta-classes:predicted class×=i )N

class representations is lower than that with the original class space  i.e.  η( ˆDm) ≤ η( ˆD)  where
i=1 is the dataset associated with meta-class labels in Cm. In Figure 2(left)  we make
ˆDm = (xi  ˆym
empirical observations of the noise-level reduction on CUB-200 with two different noise injection
schemes1. The noise levels are signiﬁcantly reduced regardless of noise-types by converting the
original class spaces into meta-class representations.
Although a coarse-grained meta-class representation reduces noise level  it is not capable of distin-
guishing the base classes in the original class space C. We resolve this limitation by introducing
multiple heterogeneous meta-class sets and exploiting their compositions. Even if multiple classes
are collapsed to a single meta-class within a meta-class set  it is possible to provide a unique class
codeword to each of the original classes by using a sufﬁciently large number of meta-class sets. In
this way  we convert noisy labels in ˆD to partially noisy codewords.

3.2 Classiﬁcation with Class Codewords

Given noise-robust class codewords deﬁned above  we now discuss the classiﬁcation method that
predicts the class codewords to identify the class label y. Unlike ordinary classiﬁers directly predicting
the class label on C  we construct M constituent classiﬁers  each of which estimates a distribution on
a meta-class set Cm (m = 1  . . .   M)  and combine their predictions to obtain class labels on C. This
process is referred to as combinatorial classiﬁcation and is illustrated in Figure 2(right).

k |x) on a meta-class
Inference A constituent classiﬁer estimates the conditional distribution P (cm
set Cm. Given M constituent classiﬁers  we obtain the conditional probability of ck ∈ C by combining
the predictions of constituent classiﬁers as follows:

(cid:81)M
(cid:80)K
(cid:81)M
m=1 P (meta(ck; m)|x)
m=1 P (meta(cj; m)|x)

j=1

P (ck|x) =

set. The denominator in Eq. (2) is the normalization term deriving(cid:80)K

where meta(ck; m) returns the meta-class label containing the base class ck in the m-th meta-class

k=1 P (ck|x) = 1.

 

(2)

Training We train our model by minimizing the sum of negative log-likelihoods with respect to the
ground-truth meta-class labels meta(y; m) that contain the ground-truth label y ∈ C  i.e. 

log P (meta(y; m)|x).

(3)

− M(cid:88)

m=1

− log P (y|x) = − M(cid:88)

K(cid:88)

M(cid:89)

This objective encourages the constituent classiﬁers to maximize the prediction scores of the true
meta-classes. Our algorithm employs the objective in Eq. (3) even though the following objective 
minimizing the negative log-likelihood of the ground-truth class label y  is also a reasonable option:

log P (meta (y; m)|x) + log

P (meta(ck; m)|x).

(4)

m=1

k=1

m=1

Although this objective is directly related to the inference procedure in Eq. (2)  it turns out to be
not effective. Note that the second term of the right hand side in this equation corresponds to the
denominator in Eq. (2)  and penalizes the scores of the classes other than the true one  i.e.  C \ {y}.
Since a ground truth meta-class may contain non-ground-truth original class labels  the penalty
given to these non-ground-truth class labels can be propagated to the ground-truth meta-classes.
Consequently  the optimization of each constituent classiﬁer becomes more challenging.
Deep combinatorial classiﬁer We implement our model using a deep neural network with a shared
feature extractor and M parallel branches corresponding to the individual constituent classiﬁers.
Since the shared feature extractor receives the supervisory signal from all the M classiﬁers  we scale
down the gradients of the shared feature extractor by a factor of M for backpropagation. Note that
our approach uses the exactly same number of parameters with a ﬂat classiﬁer in the feature extractor
and its model size is rather smaller in total even with multiple network branches. This is mainly
because the number of meta-classes is much less than the number of base classes (K(cid:48) (cid:28) K) and 
consequently  each classiﬁer requires fewer parameters.

1Refer to Section 4.2 for noise injection conﬁgurations.

4

3.3 Conﬁguring Meta-class Sets

To implement our method  one needs to deﬁne heterogeneous meta-class sets. A naive approach for
determining a meta-class set conﬁguration is to randomly assign each class to one of meta-classes
in a meta-class set. However  this method may result in large intra-class variations by grouping
base classes without common properties. We instead sample M meta-class sets by running k-means
clustering algorithms with random seeds. Since the clustering algorithm often results in redundant
meta-class sets despite the random seeds  we diversify the clustering results by randomly sampling
Q-dimensional axis-aligned subspaces of class representation vectors. We obtain class embedding
from the weights of the classiﬁcation layer in a convolutional neural network  which is ﬁne-tuned
using noisy labels in the original class space.
While the clustering-based method is sufﬁciently good at mining reasonable meta-class sets  we can
further optimize the conﬁgurations of meta-class sets by searching for their combinations. To achieve
this  we oversample candidate meta-class sets  and search for the optimal subset using a search agent
trained by reinforcement learning. Given a set of all candidate meta-class sets P = {Cm}M
m=1  the
search agent predicts a probability distribution over a binary selection variable um for each candidate
meta-class set. We train the agent by a policy gradient method  speciﬁcally REINFORCE rule [38] 
and iteratively update the parameters by the empirical approximation of the expected policy gradient 
which is given by

S(cid:88)

M(cid:88)

s=1

m=1

(cid:53)θJ (θ) =

1
S

(cid:53)θ log P (u(s)

m ; θ)(R(s) − B) 

(5)

where S is the number of meta-class set combinations2  θ is a model parameter of the search agent 
R(s) is the reward obtained by the s-th sample  and B is the baseline injected to reduce the variance.
Our main goal is to select the optimal collection of meta-class sets in terms of accuracy on the
validation dataset  but we employ in-batch validation accuracy as the primary reward for training
efﬁciency. In addition  we encourage the number of selected meta-class sets to be small in each
combination by providing the negative reward in proportion to its size. Then  the total reward for the
selection is given by

M(cid:88)

R = Racc − α

ui 

i=1

(cid:80)
where Racc is the in-batch validation accuracy and α is a hyper-parameter balancing the two terms.
s R(s). At
Finally  we set the baseline to the average reward of the batch samples  i.e.  B = 1
S
every T epoch during training  we evaluate all the S samples on the entire validation set and store the
meta-class set combination with the highest accuracy. At the end of the training  the agent returns the
best meta-class set combination among the stored ones. According to our empirical observations 
the search cost by RL is just as much as the cost for training a classiﬁer. Note that we employ a
simple two-layer perceptron to optimize the agent  which is also helpful to reduce the computational
complexity together with the in-batch validation strategy described above.

(6)

3.4 Discussions

In addition to the beneﬁt of noise level reduction  the coarse-grained meta-class representation
also brings several desirable characteristics. The meta-classes naturally introduce some inter-class
relationships to the model and lead to better generalization performance by grouping multiple classes
that potentially have shared information. Moreover  the representation learning based on meta-
classes makes the trained model more robust to data-deﬁciency since each coarse-grained meta-class
obviously contains more training examples compared to the original classes. As multiple meta-class
sets construct a large number of class codewords by their Cartesian product  a small number of
constituent classiﬁers are sufﬁcient to recover the original class set and the proposed method can
reduce the number of parameters. Finally  since the proposed method utilizes multiple constituent
classiﬁers  it brings some ensemble effects and lead to accuracy improvement.

2Each combination is composed of the meta-class sets and each of the meta-class sets is selected by um.

5

(a) Standard classiﬁer

(b) Combinatorial classiﬁers with one  two and three meta-class sets

Figure 3: Sample results from (a) a standard classiﬁer and (b) combinatorial classiﬁers on the
examples from a 2D Gaussian mixture model with ﬁve components. The accuracy is shown at the
top-right corner in each case. For the combinatorial classiﬁers  we gradually add meta-classiﬁers
one-by-one. Gray dots correspond to noisy samples with random labels while purple dashed and
black solid lines represent decision boundaries on clean and noisy datasets  respectively.

(a) Open-set: uniform

(b) Open-set: nearest

(c) Closed-set: uniform

(d) Closed-set: nearest

Figure 4: Example noise transition matrices with eight output classes. For open-set noise  four classes
are used as target classes while the remaining four classes are reserved for noisy labels.

4 Experiments

4.1 Experiments on a Toy Set

To illustrate and visualize the effectiveness of the proposed method  we build a toy set that contains
150 clean samples drawn from a two-dimensional Gaussian mixture model with ﬁve components. To
simulate a dataset with signiﬁcant noise  we generate 300 noisy examples from a random Gaussian
distribution with a larger variance and assign noisy labels selected from a uniform distribution.
Figure 3 demonstrates the decision boundaries of a standard method and the proposed combinatorial
classiﬁers with their accuracies. Our model is based on logistic regressors on three binary meta-class
sets  which are gradually added one by one as shown in Figure 3b. With these results  we put
emphases on the following three observations. First  the combinatorial classiﬁer becomes capable
of identifying all original classes as we add more meta-class sets. The decision boundaries and
accuracies also illustrate the noise-robustness of the our method. Finally  the proposed technique
requires fewer parameters (three weight vectors in the logistic regressors) than the standard classiﬁer
(ﬁve weight vectors corresponding to each class).

4.2 Evaluation on CUB-200

Experimental settings We conduct a set of experiments on Caltech-UCSD Birds-200-2011 (CUB-
200) dataset [39] with various noise settings. CUB-200 is a ﬁne-grained classiﬁcation benchmark
with 200 bird species and contains ∼30 images per class in the training and validation sets. Note that
CUB-200 is more natural and realistic compared to the simple datasets—MNIST and CIFAR—used
for the evaluation of many previous methods.
We consider both open- and closed-set noise artiﬁcially injected to training examples. The open-set
noise is created by giving one of the target labels to the images sampled from unseen categories. To
simulate open-set noise  we use 100 (out of 200) classes as the target labels and the remaining 100
classes assume to be unknown. Noise level η controls the ratio between clean and noisy examples.
On the other hand  examples with the closed-set noise have wrong labels within the target classes
and we use all 200 classes in CUB-200 as the target labels. For both types of noise  we use two label
corruption schemes: uniform transition and nearest label transfer. The uniform transition injects label

6

86.7%43.3%78.7%100%1.1.1.1..25assignednon-target labelassignedtarget labeltruetarget labeltruenon-target label1.1.1.1..40.50.03.07.10.00.20.70.05.40.30.25.15.10.75.00assignednon-target labelassignedtarget labeltruetarget labeltruenon-target label.50.50114.50.50.50114.50.50.50assignedtarget labeltruetarget label.50.30.00.05.03.00.12.00.20.50.00.00.10.00.20.00.00.00.50.10.00.35.02.03.05.04.00.50.05.10.01.25.00.10.05.35.50.05.00.05.00.05.40.00.00.50.00.05.15.20.02.00.00.03.50.10.10.00.03.30.02.00.05.50assignedtarget labeltruetarget labelTable 1: Accuracies [%] on CUB-200 with different levels of open-set noise.
High noise level

Clean dataset

(η = 0)

Moderate noise level
Nearest

Uniform

Uniform

Nearest

80.57 ± 0.37
79.32 ± 0.83
80.66 ± 0.60
80.75 ± 0.37
80.39 ± 0.36
81.55 ± 0.52
82.19 ± 0.58
75.15 ± 1.96
80.90 ± 0.13
82.80 ± 0.36
82.86 ± 0.25

73.37 ± 0.34
71.42 ± 0.70
73.55 ± 0.70
73.52 ± 0.47
73.53 ± 0.56
75.04 ± 0.46
77.51 ± 0.53
71.02 ± 1.68
75.37 ± 0.54
79.38 ± 0.83
79.93 ± 0.44

77.14 ± 0.27
76.07 ± 0.40
77.03 ± 0.29
77.13 ± 0.97
77.27 ± 0.49
78.09 ± 0.40
78.58 ± 0.46
47.40 ± 1.16
77.41 ± 0.36
79.28 ± 0.52
80.22 ± 0.31

70.04 ± 0.71
66.79 ± 0.44
69.76 ± 0.59
70.06 ± 0.65
70.34 ± 0.42
71.84 ± 0.95
75.40 ± 0.66
67.16 ± 1.29
74.02 ± 0.29
79.19 ± 0.29
80.50 ± 0.61

75.45 ± 0.50
74.80 ±0.46
75.52 ± 0.32
75.59 ± 0.33
75.75 ± 0.62
76.32 ± 0.65
76.47 ± 0.34
32.60 ± 2.38
75.57 ± 0.22
77.95 ± 0.53
78.26 ± 0.43

Methods
Standard
Decoupling [6]
F-correction [19]
S-model [18]
MentorNet [7]
