2016,Yggdrasil: An Optimized System for Training Deep Decision Trees at Scale,Deep distributed decision trees and tree ensembles have grown in importance due to the need to model increasingly large datasets.  However  PLANET  the standard distributed tree learning algorithm implemented in systems such as \xgboost and Spark MLlib  scales poorly as data dimensionality and tree depths grow.  We present Yggdrasil  a new distributed tree learning method that outperforms existing methods by up to 24x.  Unlike PLANET  Yggdrasil is based on vertical partitioning of the data (i.e.  partitioning by feature)  along with a set of optimized data structures to reduce the CPU and communication costs of training. Yggdrasil (1) trains directly on compressed data for compressible features and labels; (2) introduces efficient data structures for training on uncompressed data; and (3) minimizes communication between nodes by using sparse bitvectors.  Moreover  while PLANET approximates split points through feature binning  Yggdrasil does not require binning  and we analytically characterize the impact of this approximation. We evaluate Yggdrasil against the MNIST 8M dataset and a high-dimensional dataset at Yahoo; for both  Yggdrasil is faster by up to an order of magnitude.,Yggdrasil: An Optimized System for Training Deep

Decision Trees at Scale

Firas Abuzaid1  Joseph Bradley2  Feynman Liang3  Andrew Feng4  Lee Yang4 

Matei Zaharia1  Ameet Talwalkar5

1MIT CSAIL  2Databricks  3University of Cambridge  4Yahoo  5UCLA

Abstract

Deep distributed decision trees and tree ensembles have grown in importance due
to the need to model increasingly large datasets. However  PLANET  the standard
distributed tree learning algorithm implemented in systems such as XGBOOST
and Spark MLLIB  scales poorly as data dimensionality and tree depths grow. We
present YGGDRASIL  a new distributed tree learning method that outperforms
existing methods by up to 24×. Unlike PLANET  YGGDRASIL is based on ver-
tical partitioning of the data (i.e.  partitioning by feature)  along with a set of
optimized data structures to reduce the CPU and communication costs of train-
ing. YGGDRASIL (1) trains directly on compressed data for compressible features
and labels; (2) introduces efﬁcient data structures for training on uncompressed
data; and (3) minimizes communication between nodes by using sparse bitvectors.
Moreover  while PLANET approximates split points through feature binning  YG-
GDRASIL does not require binning  and we analytically characterize the impact of
this approximation. We evaluate YGGDRASIL against the MNIST 8M dataset and
a high-dimensional dataset at Yahoo; for both  YGGDRASIL is faster by up to an
order of magnitude.

1

Introduction

Decision tree-based methods  such as random forests and gradient-boosted trees  have a rich and
successful history in the machine learning literature. They remain some of the most widely-used
models for both regression and classiﬁcation tasks  and have proven to be practically advantageous
for several reasons: they are arbitrarily expressive  can naturally handle categorical features  and are
robust to a wide range of hyperparameter settings [4].
As datasets have grown in scale  there is an increasing need for distributed algorithms to train decision
trees. Google’s PLANET framework [12] has been the de facto approach for distributed tree learning 
with several popular open source implementations  including Apache Mahout  Spark MLLIB  and
XGBOOST [1  11  7]. PLANET partitions the training instances across machines and parallelizes the
computation of split points and stopping criteria over them  thus effectively leveraging a large cluster.
While PLANET works well for shallow trees and small numbers of features  it has high communication
costs when tree depths and data dimensionality grow. PLANET’s communication cost is linear in the
number of features p  and is linear in 2D  where D is the tree depth. As demonstrated by several
studies [13  3  8]  datasets have become increasingly high-dimensional (large p) and complex  often
requiring high-capacity models (e.g.  deep trees with large D) to achieve good predictive accuracy.
We present YGGDRASIL  a new distributed tree learning system that scales well to high-dimensional
data and deep trees. Unlike PLANET  YGGDRASIL is based on vertical partitioning of the data [5]: it
assigns a subset of the features to each worker machine  and asks it to compute an optimal split for
each of its features. These candidate splits are then sent to a master  which selects the best one. On
top of the basic idea of vertical partitioning  YGGDRASIL introduces three novel optimizations:

30th Conference on Neural Information Processing Systems (NIPS 2016)  Barcelona  Spain.

• Training on compressed data without decompression: YGGDRASIL compresses features via
run-length encoding and encodes labels using dictionary compression. We design a novel split-
ﬁnding scheme that trains directly on compressed data for compressible features  which reduces
runtime by up to 20%.
• Efﬁcient training on uncompressed data: YGGDRASIL’s data structures let each worker implic-
itly store the split history of the tree without introducing any memory overheads. Each worker
requires only a sequential scan over the data to perform greedy split-ﬁnding across all leaf nodes
in the tree  and only one set of sufﬁcient statistics is kept in memory at a time.
• Minimal communication between nodes: YGGDRASIL uses sparse bit vectors to reduce inter-
machine communication costs during training.

Together  these optimizations yield an algorithm that is asymptotically less expensive than PLANET
on high-dimensional data and deep trees: YGGDRASIL’s communication cost is O(2D + Dn)  in
contrast to O(2Dp) for PLANET-based methods  and its data structure optimizations yield up to 2×
savings in memory and 40% savings in time over a naive implementation of vertical partitioning.
These optimizations enable YGGDRASIL to scale up to thousands of features and tree depths up to 20.
On tree depths greater than 10  YGGDRASIL outperforms MLLIB and XGBOOST by up to 6× on the
MNIST 8M dataset  and up to 24× on a dataset with 2 million training examples and 3500 features
modeled after the production workload at Yahoo.
Notation We deﬁne n and p as the number of instances and features in the training set  D as the
maximum depth of the tree  B as the number of histogram buckets to use in PLANET  k as the number
of workers in the cluster  and Wj as the jth worker.

2 PLANET: Horizontal Partitioning

express the splitting criterion Split(·) for node i as Split(i) = arg maxs∈S f ((cid:80)

We now describe the standard algorithm for training a decision tree in a distributed fashion via
horizontal partitioning  inspired by PLANET [12]. We assume that B potential thresholds for each
of the p features are considered; thus  we deﬁne S as the set of cardinality pB containing all split
candidates. For a given node i  deﬁne the set I as the instances belonging to this node. We can then
x∈I g(x  s)) for
functions f and g where f : Rc → R  g : Rp × N → Rc  and c ∈ O(1). Intuitively  for each split
candidate s ∈ S  g(x  s) computes the c sufﬁcient statistics for each point x; f (·) aggregates these
sufﬁcient statistics to compute the node purity for candidate s; and Split(i) returns the split candidate
that maximizes the node purity. Hence  if worker j contains instances in the set J   we have:

(cid:33)

Split(i) = arg max

s∈S

f

gj(s)

where

gj(s) =

g(x  s)

(1)

This observation suggests a natural distributed algorithm. We assume a star-shaped distributed
architecture with a master node and k worker nodes. Data are distributed using horizontal partitioning;
i.e.  each worker node stores a subset of the n instances. For simplicity  we assume that we train our
tree to a ﬁxed depth D. On the tth iteration of the algorithm  we compute the optimal splits for all
nodes on the tth level of the tree via a single round trip of communication between the master and the
workers. Each tree node i is split as follows:
1. The jth worker locally computes sufﬁcient statistics gj(s) from Equation 1 for all s ∈ S.
2. Each worker communicates all statistics gj(s) to the master (Bp in total).
3. The master computes the best split s∗ = Split(i) from Equation 1.
4. The master broadcasts s∗ to the workers  who update their local states to keep track of which

instances are assigned to which child nodes.

Overall  the computation is linear in n  p  and D  and is trivially parallelizable. Yet the algorithm
is communication-intensive. For each tree node  step 2 above requires communicating kBp tuples
of size c. With 2D total nodes  the total communication is 2DkpBc ﬂoating point values  which is
exponential in tree depth D  and linear in B  the number of thresholds considered for each feature.
Moreover  using B < n thresholds results in an approximation of the tree trained on a single machine 
and can result in adverse statistical consequences  as noted empirically by [7]. We present a theoretical
analysis of the impact of this approximation in Section 4.

2

(cid:32) k(cid:88)

j=1

(cid:88)

x∈I∩J

3 YGGDRASIL: Vertical Partitioning

k

We propose an alternative algorithm to address the aforementioned shortcomings. Rather than
partition the data by instance  we partition by feature: each of the k worker machines stores all feature

(cid:7) of the features  as well the labels for all instances. This organizational strategy has

values for(cid:6) p

two crucial beneﬁts: (1) each worker can locally compute the node purity for a subset of the split
candidates  which signiﬁcantly reduces the communication bottleneck; and (2) we can efﬁciently
consider all possible B = n − 1 splits.
We can derive an expression for Split(i) with vertical partitioning analogous to Equation 1. Redeﬁn-
ing J to be the set of features stored on the jth worker  we have
fj = arg max

(cid:32)(cid:88)

Split(i) = arg max

fj where

(cid:33)

j

s∈J

f

g(x  s)

x∈I

(2)

Intuitively  each worker identiﬁes its top split candidate among its set of features  and the master then
chooses the best split candidate among these top k candidates.
As with horizontal partitioning  computation is linear in n  p  and D  and is easily parallelizable.
However  the communication proﬁle is quite different  with two major sources of communication.
For each node  each worker communicates one tuple of size c  resulting in 2Dkc communication
for all nodes. When training each level of the tree  n bits are communicated to indicate the split
direction (left/right) for each training point. Hence  the overall communication is O(2Dk + Dnk).
In contrast to the O(2DkpB) communication cost of horizontal partitioning  vertical partitioning has
no dependence on p  and  for large n  the O(Dnk) term will likely be the bottleneck.

(a) Regimes of (n  p) where each partitioning
strategy dominates for D = 15  k = 16  B =
32.

(b) Regimes of (n  D) where each partitioning
strategy dominates for p = 2500  k = 16  B =
32.

Figure 1: Communication cost tradeoffs between vertical and horizontal partitioning

Thus  there exists a set of tradeoffs between horizontal and vertical partitioning across different
regimes of n  p  and D  as illustrated in Figure 1. The overall trend is clear: for large p and D  vertical
partitioning can drastically reduce communication.

3.1 Algorithm

The YGGDRASIL algorithm works as follows: at iteration t  we compute the optimal splits for all
nodes on the tth level of the tree via two round trips of communication between the master and the
workers. Like PLANET  all splits for a single depth t are computed at once. For each node i at depth
t  the following steps are performed:
ComputeBestSplit(i):
• The jth worker locally computes fj from Equation 2 and sends this to the master.
• The master selects s∗ = Split(i). Let f∗
the worker containing this optimal feature: f∗
bitV ector = CollectBitVector(W ∗
j ):

j denote the optimal feature selected for s∗  and let W ∗

j ∈ W ∗
j .

j be

3

n2n4n8nNum.Instances LogScalep2p3p4p5p6p7p8pNum.FeaturesHorizontalPartitioningBetterVerticalPartitioningBettern2n4n8nNum.Instances LogScaleD2D3D4D5DTreeDepthHorizontalPartitioningBetterVerticalPartitioningBetter• The master requests a bitvector from W ∗
right) each training point x ∈ I should be assigned to.
BroadcastSplitInfo(bitV ector):
• The master then broadcasts the bitvector to all k workers. Each worker then updates its internal

j in order to determine which child node (either left or

state to prepare for the next iteration of training.

3.2 Optimizations

As we previously showed  vertical partitioning leads to asymptotically lower communication costs as
p and D increase. However  this asymptotic behavior does not necessarily translate to more efﬁcient
tree learning; on the contrary  a naive implementation may easily lead to high CPU and memory
overheads  communication overhead  and poor utilization of the CPU cache. In YGGDRASIL  we
introduce three novel optimizations for vertically partitioned tree learning that signiﬁcantly improve
its scalability  memory usage and performance.

3.2.1 Sparse Bitvectors for Reduced Communication Overhead
Once the master has found the optimal split s∗ for each leaf node i in the tree  each worker must
then update its local features to reﬂect that the instances have been divided into new child nodes.
To accomplish this while minimizing communication  the workers and master communicate using
bitvectors. Speciﬁcally  after ﬁnding the optimal split  the master requests from worker W ∗
j a
corresponding bitvector for s∗; this bitvector encodes the partitioning of instances between the two
children of i. Once the master has collected all optimal splits for all leaf nodes  it broadcasts the
bitvectors out to all workers. This means that (assuming a fully balanced tree)  for every depth t
during training  2t bitvectors – for a total of n bits – are sent from the k workers.
Additionally  the n bits are encoded in a sparse format [6]  which offers much better compression
via packed arrays than a naive bitvector. This sparse encoding is particularly useful for imbalanced
trees: rather than allocate memory to encode a potential split for all nodes at depth t  we only allocate
memory for the nodes in which an optimal split was found. By taking advantage of sparsity  we can
send the n bits between the master and the workers at only a fraction of the cost.

3.2.2 Training on Compressed Data without Decompression

In addition to its more favorable communication cost for large p and D  YGGDRASIL’s vertical
partitioning strategy presents a unique optimization opportunity: the ability to efﬁciently compress
data by feature. Furthermore  because the feature values must be in sorted order to perform greedy
split-ﬁnding  we can use this to our advantage to perform lossless compression without sacriﬁcing
recoverability. This leads to a clear optimization: feature compression via run-length encoding (RLE) 
an idea that has been explored extensively in column-store databases [10  14]. In addition to the
obvious in-memory savings  this technique also impacts the runtime performance of split-ﬁnding 
since the vast majority of feature values are now able to reside in the L3 cache. To the best of our
knowledge  YGGDRASIL is the ﬁrst system to apply this optimization to decision tree learning.
Many features compress well using RLE: sparse features  continuous features with few distinct
values  and categorical features with low arity. However  to train directly on compressed data without
decompressing  we must maintain the feature in sorted order throughout the duration of training 
a prerequisite for RLE. Therefore  to compute all splits for a given depth t  we introduce a data
structure to record the most recent splits at depth t − 1. Speciﬁcally  we create a mapping between
each feature value and the node i at depth t that it is currently assigned to.
At the end of an iteration of training  each worker updates this data structure by applying the bitvector
it receives from the master  which requires a single sequential scan over the data. All random accesses
are conﬁned to the labels  which we also encode (when feasible) using dictionary compression. This
gives us much better cache density during split-ﬁnding: all random accesses no longer touch DRAM
and instead read from the last-level cache.
To minimize the number of additional passes  we compute the optimal split across all leaf nodes as
we iterate over a given feature. This means that each feature requires only two sequential scans over
the data for each iteration of training: one to update the value-node mapping  and one to compute
the entire set of optimal splits for iteration t + 1. However  as a tradeoff  we must maintain the

4

sufﬁcient statistics for all splits in memory as we scan over the feature. For categorical features
(especially those with high arity)  this cost in memory overhead proves to be too exorbitant  and the
runtime performance suffers despite obtaining excellent compression. For sparse continuous features 
however  the improvements are signiﬁcant: on MNIST 8M  we achieve 2× compression (including
the auxiliary data structure) and obtain a 20% reduction in runtime.

3.2.3 Efﬁcient Training on Uncompressed Data

For features that aren’t highly compressible  YGGDRASIL uses a different scheme that  in contrast 
does not use any auxiliary data structures to keep track of the split history. Since features no longer
need to stay sorted in perpetuity  YGGDRASIL implicitly encodes the split partitions by recursively
dividing its features into sub-arrays – each feature value is assigned to a sub-array based on the
bit assigned to it and its previous sub-array assignment. Because the feature is initially sorted 
a sequential scan over the sub-arrays maintains the sorted-order invariant  and we construct the
sub-arrays for the next iteration of training in O(n) time  requiring only a single pass over the feature.
By using this implicit representation of the split history  we’re left only with the feature values and
label indices stored in memory. Therefore  the memory load does not increase during training for
uncompressed features – it remains constant at 2×.
This scheme yields another additional beneﬁt: when computing the next iteration of splits for depth
t + 1  YGGDRASIL only maintains the sufﬁcient statistics for one node at a time  rather than for
all leaf nodes. Furthermore  YGGDRASIL still only requires a single sequential scan through the
entire feature to compute all splits. This means that  as was the case for compressed features  every
iteration of training requires only two sequential scans over each feature  and all random accesses are
again conﬁned to the dictionary-compressed labels. Finally  for imbalanced trees  we can skip entire
sub-arrays that no longer need to be split  which saves additional time as trees grow deeper.

Figure 2: Overview of one iteration of uncompressed training in YGGDRASIL. Left side: Root node
i0 is split into nodes i1 and i2; the split is encoded by a bitvector. Right side: Prior to training  the
feature ci is sorted to optimize split-ﬁnding. Once a split has been found  ci is re-sorted into two
sub-arrays: the 1st  4th  and last values (the “on” bits) are sorted into i1’s sub-array  and the “off” bits
are sorted into i2’s sub-array. Each sub-array is in sorted order for the next iteration of training.

4 Discretization Error Analysis

Horizontal partitioning requires each worker to communicate the impurity on its subset of data for
all candidate splits associated with each of the p features  and to do so for all 2D tree nodes. For
continuous features where each training instance could have a distinct value  up to n candidate splits
are possible so the communication cost is O(2Dkpn). To improve efﬁciency  continuous features
are instead commonly discretized to B discrete bins such that only B rather than n − 1 candidate
splits are considered at each tree node [9]. In contrast  discretization of continuous features is not
required in YGGDRASIL  since all n values for a particular feature are stored on a single worker (due
to vertical partitioning). Hence  the impurity for the best split rather than all splits is communicated.
This discretization heuristic results in the approximation of continuous values by discrete repre-
sentatives  and can adversely impact the statistical performance of the resulting decision tree  as
demonstrated empirically by [7]. Prior work has shown that the number of bins can be chosen such
that the decrease in information gain at any internal tree node between the continuous and discretized

5

ci = bitVector = 100101 0 1 0 2 3 1 0 0 1 1 2 3 0 1 2 0 1 3 sort by value split found  sort by bitvector i0 i1 i2 sorted feature before training 2) original feature 1) after 1st iteration of training 3) Entire Cluster Single Worker feature can be made arbitrarily small [2]. However  their proof does not quantify the effects of
discretization on a decision tree’s performance.
To understand the impact of discretization on accuracy  we analyze the simpliﬁed setting of training
a decision stump classiﬁer on a single continuous feature x ∈ [0  1]. Suppose the feature data is
drawn i.i.d. from a uniform distribution  i.e.  x(i) iid
∼ U[0  1] for i = 1  2  . . .   n  and that labels are
generated according to some threshold ttruth ∼ U[0  1]  i.e.  y(i) = sgn(x(i) − ttruth). The decision
stump training criterion seeks to choose a splitting threshold at one of the training instances x(i) in
order to minimize ˆtn = arg maxt∈{x(i)} f (t)  where f (t) is some purity measure. In our analysis 
we will deﬁne the purity measure to be information gain. In our simpliﬁed setting  we show that there
is a natural relationship between the misclassiﬁcation probability Perr(t)  and the approximation
error of our decision stump  i.e.  |t − ttruth|. All proofs are deferred to the appendix.
Observation 1. For an undiscretized decision stump  as n → ∞  Perr(ˆtn)
Observation 2. Maximizing information gain is equivalent to minimizing absolute distance  i.e. 

→ 0.

a.s.

ˆtn = arg max
t∈{x(i)}n

i=1

f (t) = arg min
t∈{x(i)}n

i=1

|t − ttruth| .

Moreover  Perr(t) = |t − ttruth|.
We now present our main result. This intuitive result shows that increasing the number of discretization
bins B leads to a reduction in the expected probability of error.
Theorem 1. Let ˆtN B denote the threshold learned by a decision stump on n training instances

discretized to B + 1 levels. Then E(cid:2)Perr(ˆtN B)(cid:3) a.s.

4B .
→ 1

5 Evaluation

We developed YGGDRASIL on top of Spark 1.6.0 with an API compatible with MLLIB. Our
implementation is 1385 lines of code  excluding comments and whitespace. Our implementation
is open-source and publicly available.1 Our experimental results show that  for large p and D 
YGGDRASIL outperforms PLANET by an order of magnitude  corroborating our analysis in Section 3.

5.1 Experimental Setup

We benchmarked YGGDRASIL against two implementations of PLANET: Spark MLLIB v1.6.0  and
XGBOOST4J-SPARK v0.47. These two implementations are slightly different from the algorithm
from Panda et al. In particular  the original PLANET algorithm has separate subroutines for distributed
vs. “local” training. By default  PLANET executes the horizontally partitioned algorithm in Section 2
using on-disk data; however  if the instances assigned to a given tree node ﬁt in-memory on a single
worker  then PLANET moves all the data for that node to one worker and switches to in-memory
training on that worker. In contrast  MLLIB loads all the data into distributed memory across the
cluster at the beginning and executes all training passes in memory. XGBOOST extends PLANET
with several additional optimizations; see [7] for details.
We ran all experiments on 16 Amazon EC2 r3.2xlarge machines. Each machine has an Intel Xeon
E5-2670 v2 CPU  61 GB of memory  and 1 Gigabit Ethernet connectivity. Prior to our experiments 
we tuned Spark’s memory conﬁguration (heap memory used for storage  number of partitions  etc.)
for optimal performance. All results are averaged over ﬁve trials.

5.2 Large-scale experiments

To examine the performance of YGGDRASIL and PLANET  we trained a decision tree on two large-
scale datasets: the MNIST 8 million dataset  and another modeled after a private Yahoo dataset that
is used for search ranking. Table 1 summarizes the parameters of these datasets.

1Yggdrasil has been published as a Spark package at the following URL: https://spark-packages.

org/package/fabuzaid21/yggdrasil

6

Figure 3: Training time vs. tree depth for MNIST 8M and Yahoo 2M.

Dataset
# instances
MNIST 8M 8.1×106
Yahoo 2M
2×106

Table 1: Parameters of the datasets for our experiments

# features

784
3500

Size

Task

18.2 GiB classiﬁcation
52.2 GiB
regression

Figure 3 shows the training time across various tree depths for MNIST 8M and Yahoo 2M. For both
datasets  we carefully tuned XGBOOST to run on the maximum number of threads and the optimal
number of partitions. Despite this  XGBOOST was unable to train trees deeper than D = 13 without
crashing due to OutOfMemory exceptions. While Spark MLLIB’s implementation of PLANET is
marginally faster for shallow trees  its runtime increases exponentially as D increases. YGGDRASIL 
on the other hand  scales well up to D = 20  for which it runs up to 6× faster. For the Yahoo dataset 
YGGDRASIL’s speed-up is even greater because of the higher number of features p – recall that the
