2019,Semi-supervisedly Co-embedding Attributed Networks,Deep generative models (DGMs) have achieved remarkable advances. Semi-supervised variational auto-encoders (SVAE) as a classical DGM offers a principled framework to effective generalize from small labelled data to large unlabelled ones  but it is difficult to incorporate rich unstructured relationships within the multiple heterogeneous entities. In this paper  to deal with the problem  we present a semi-supervised co-embedding model for attributed networks (SCAN) based on the generalized SVAE for the heterogeneous data  which collaboratively learns low- dimensional vector representations of both nodes and attributes for partially labelled attributed networks semi-supervisedly. The node and attribute embeddings obtained in a unified manner by our SCAN can benefit not only for capturing the proximities between nodes but also the affinities between nodes and attributes. Moreover  our model also trains a discriminative network to learn the label predictive distribution of nodes. Experimental results on real-world networks demonstrate that our model yields excellent performance in a number of applications such as attribute inference  user profiling and node classification compared to the state-of-the-art baselines.,Semi-supervisedly Co-embedding Attributed

Networks

Zaiqiao Meng⇤

Department of Computing Science

Sun Yat-sen University  and University of Glasgow

zaiqiao.meng@gmail.com

Shangsong Liang†

School of Data and Computer Science

Sun Yat-sen University

liangshangsong@gmail.com

School of Data and Computer Science

School of Data and Computer Science

Jinyuan Fang

Sun Yat-sen University
fangjy6@gmail.com

Teng Xiao

Sun Yat-sen University
tengxiao01@gmail.com

Abstract

Deep generative models (DGMs) have achieved remarkable advances. Semi-
supervised variational auto-encoders (SVAE) as a classical DGM offer a principled
framework to effectively generalize from small labelled data to large unlabelled
ones  but it is difﬁcult to incorporate rich unstructured relationships within the
multiple heterogeneous entities. In this paper  to deal with the problem  we present
a semi-supervised co-embedding model for attributed networks (SCAN) based on
the generalized SVAE for heterogeneous data  which collaboratively learns low-
dimensional vector representations of both nodes and attributes for partially labelled
attributed networks semi-supervisedly. The node and attribute embeddings obtained
in a uniﬁed manner by our SCAN can beneﬁt for capturing not only the proximities
between nodes but also the afﬁnities between nodes and attributes. Moreover  our
model also trains a discriminative network to learn the label predictive distribution
of nodes. Experimental results on real-world networks demonstrate that our model
yields excellent performance in a number of applications such as attribute inference 
user proﬁling and node classiﬁcation compared to the state-of-the-art baselines.

1

Introduction

Network embedding has been receiving signiﬁcant attention in recent years due to the ubiquity
of networks in our daily lives. The goal of network embedding is to encode entities  e.g. nodes
and attributes  of a speciﬁc network into low-dimensional representation vectors  while features
of the network  e.g. nodes’ topological structure [1] and their communities [2]  can be decoded
from the inferred embedding vectors. Various graph-based applications  e.g. node classiﬁcation and
clustering [3  4]  community detection [2  5]  link prediction [6] and expert cognition [7]  have been
shown to be able to beneﬁt from network embedding techniques.
Attributed networks as one category of the most important networks are ubiquitous in a myriad of
critical domains  ranging from online social networks to academic collaborative networks  where rich
attributes  e.g. nationalities of the users and journals/conferences the authors published at  describing
the properties of the nodes  are available. Many embedding methods for attributed networks [8  9  10]
have been proposed to learn the low-dimensional vector representations of nodes via leveraging their

33rd Conference on Neural Information Processing Systems (NeurIPS 2019)  Vancouver  Canada.

⇤This work was done when the ﬁrst author was with the Sun Yat-sen University.
†Shangsong Liang is the corresponding author.

topological structure and the associated attributes. In this paper  to further enhance the effectiveness
of the learned representations  we jointly consider whatever information of the network we have
in most real-world scenarios: topological structure and attributes of all nodes  and a few labels
associated with some of the nodes. We refer to such kind of networks owning these information as
partially labelled attributed networks. Embeddings trained with partially label information can be
used to boost the performance of related tasks  where not all the label data are available. For instance 
in tag recommendation for social network users  tags manually labelled for the expertise of some
users can be utilized to train an embedding model to predict tags of those users missing their tags.
A number of works has been proposed to learn low-dimensional representations for networks either in
unsupervised [8  9  10] or semi-supervised [11  12  13  14] ways. However  both of the existing unsu-
pervised and semi-supervised attributed network embedding methods learn representations for nodes
only  and thus are not able to capture the afﬁnities/similarities between nodes and attributes  which
are the key to the success of many attributed network applications  such as attribute inference [15  16]
and user proﬁling [17]. Moreover  a vast majority of existing works predominately represent node
embeddings by a single point in a low-dimensional continuous space  resulting in the fact that the
uncertainty of nodes’ representations can not be captured.
Deep generative models (DGM) have achieved remarkable advances due to their profound basis in
theoretic probability and ﬂexible and scalable optimizing ability of deep neural networks. Semi-
supervised variational auto-encoders [18  19] as a classical DGM offer a principled framework to
effective generalize from small labelled data to large unlabelled ones  but have limited applicability
to incorporate rich unstructured relationships within the multiple heterogeneous entities. To alleviate
the aforementioned problems  we introduce a Semi-supervised Co-embedding Attributed Network
algorithm  SCAN  built based on the generalized SVAE for the heterogeneous data  that is able
to co-embed both attributes and nodes of partial labelled networks in the same semantic space.
SCAN collaboratively learns low-dimensional vector representations of both attributes and nodes
in the same semantic space in a semi-supervised way  such that the afﬁnities between them can be
effectively measured and the partial labels of nodes can be fully utilized. The learned nodes’ and
attributes’ embeddings in the same semantic space are  in turn  utilized to boost the performance of
many down-stream applications  e.g.  user proﬁling [17]  where the relevance of users (nodes) and
keywords (attributes) can be directly measured by  e.g.  cosine similarity. In our SCAN  we infer
the embeddings of both nodes and attributes and represent them by means of Gaussian distributions.
With the natural property of latent presentations (i.e.  Gaussian embeddings in our case)  SCAN
innately represents their uncertainty with the corresponding variances of the inferred embeddings.
Our contributions can be summarized as follows: 1(1) We generalize SVAE to the heterogeneous
data and propose a novel semi-supervised co-embedding model for attributed networks  SCAN  to
collaboratively learn representations of nodes and attributes in the same space such that proximities
between nodes as well as afﬁnities between nodes and attributes of networks can be effectively
measured. (2) Our SVAE model jointly optimizes a variational evidence lower bound consisting
of ﬁve atomic observations based on two entities and two relationships  to obtain the Gaussian
embeddings of nodes and attributes and a discriminator for node classiﬁcation  where the mean
vectors denote the position of nodes and attributes and the variances capture uncertainty of their
representations. (3) We perform extensive experiments on real-world attributed networks to verify
the effectiveness of our embedding model in terms of three network mining tasks  and the results
demonstrate that our model is able to signiﬁcantly outperforms state-of-the-art methods.

2 Related Work

Many unsupervised representation learning methods have been proposed to embed various networks
into low-dimensional vectors of nodes. Approaches such as DeepWalk [1]  node2vec [2] and LINE [3]
learn embeddings for plain networks  where only topological structure information is utilized based
on random walks or edge sampling. The Structural Deep Network Embedding [20] model embeds a
network by capturing the highly non-linear network structure so as to preserve the global and local
structure of the network. Wang et al. [5] incorporate the community structure of network into result
embeddings to preserve both of the microscopic and community structures. Some other work obtains
embeddings for non-plain networks with rich auxiliary information  such as labels  node attributes

1The code of our SCAN is publicly available from: https://github.com/mengzaiqiao/SCAN.

2

and text contents  in addition to the topological structure networks [21  22]. Hamilton et al. [10]
propose the GraphSAGE model that learns node representations by sampling and aggregating features
from nodes’ local neighbourhoods. Zhang et al. [9] and Gao et al. [23] propose their customized
deep neural network architectures to learn node embeddings  while capturing the underlying high
non-linearity in both topological structure and attributes. CAN [24] is a model that unsupervisedly
learns embedding for both nodes and attributes by their customized DGM. Their results show that
combining different types of auxiliary information  rather than using only the topological features 
can provide different insights of embedding of nodes. Recently  a few approaches embed nodes by
distributions and capture the uncertainty of the embeddings [25  26  6]. For example  the KG2E
model [25] represents each entity/relation of knowledge graphs as a Gaussian distribution. In terms
of embedding attributed networks  Aleksandar et al. [6] embed each node as Gaussian distribution
according to the energy-based loss of personalized ranking formulation.
Recently  learning representations of entities for networks by semi-supervised ways has also been
widely studied. Planetoid [11] is a network representation learning model for semi-supervised node
classiﬁcation but not for capturing afﬁnities between embeddings of nodes and attributes. Kipf
et.al [12] propose a graph convolutional neural network model for attributed networks for semi-
supervised classiﬁcation task  which also outputs embedding for nodes only. Liang et.al [13] propose
a semi-supervised learning model  called SEANO  which utilizes dual-input and dual-output deep
neural networks to learn node embedding encompassing information related to structure  attributes 
and labels explicitly alleviating noise effects from outliers. More recently  a semi-supervised deep
generative model for attributed network embedding has been proposed [14]  which applies the
generative adversarial nets (GANs) to generates fake samples in low-density areas in networks and
leverages clustering property to help classiﬁcation. However  it still learns embeddings for nodes
only. Therefore  the embeddings obtained by these models might not be directly utilized in other
applications such as attribute inference and user proﬁling.

3 Semi-supervised Variational Auto-encoder

The Semi-supervised Variational Auto-encoders (SVAEs) are a kind of generative semi-supervised
models for partially labelled data that learn representations of data by jointly training a probabilistic
encoder  probabilistic decoder as well as a label predictive neural networks [18  19]  while the small
labelled data sets can be generalized to large unlabelled ones. SVAEs have received a lot of attention
due to their wide applicability in domains such as text classiﬁcation [27]  machine translation [28] and
syntactic annotation [29]. In this section  we ﬁst review the construction of an SVAE for homogeneous
entities  and then extend it to the setting of heterogeneous data.

3.1 Semi-supervised Learning for Homogeneous Data
We ﬁrst consider the homogeneous data that appear as pairs O = {(x1  y1)   . . .   (xN   yN )}  with
yi 2{ 0  1}1⇥K being the one-hot vector representing the label of i-th observation xi 2 RF where K
is the number of classes and F is the feature dimension. In order to incorporate unlabeled data in the
learning process  previous work on deep generative semi-supervised models optimize a variational
bound J on the marginal likelihood for N1 labelled data points and N2 unlabelled data points:

J =

L(xi  yi) +

U(xj) 

(1)

N1Xi=1

N2Xj=1

where L(xi  yi) is the evidence lower bound (ELBO) for a labelled data point and U(xj) is the
ELBO for an unlabelled one. Normally  a SVAE model also incorporates a classiﬁcation loss into Eq.
1 to impose the label posterior inference model q(y|x) to be able to act as a classiﬁer:
(2)
where hyper-parameter ↵ controls the weight between generative and purely discriminative learning.
While these models are conceptually simple and easy to train  one potential limitation of this approach
is that marginalization over all K classes becomes prohibitively expensive for a large number of
classes. We leave the discussion of the solution for this limitation to subsection 4.2.
Another limitation is that they only learn representations for the homogeneous observations  which
are generated independently according to a homogeneous prior  ignoring that heterogeneous data

J ↵ = J + ↵ · Eepl(x y) [ log q(y|x)]  

3

observations are ubiquitous in the real world. For example  in recommender system items and users
are two independent observations but they are associated with purchase or interaction behaviours.
Many efforts have been paid to co-embedding multiple entities for heterogeneous systems in a fully
unsupervised learning procedure [24  30]. However  to our knowledge  no model in the literature can
learn embeddings for heterogeneous data with multiple entities in a semi-supervised way. Hence  in
the next subsection we will present a model that allows to learn multiple entity observations having
arbitrary conditional dependency structures and arbitrary label for each type of entity.

3.2 Semi-supervised Learning for Heterogeneous Data

We consider a generalized form of semi-supervised model for heterogeneous data that appear as
triples instead of pairs. Let O = (X  Y R) be a triple set of the heterogeneous observation data 
where X = (X1 ···   XT ) is the entity set with multiple types (e.g. T types)  R = {rij | xg
i 2
j 2 Xh} is a set containing relationships with rij being the relationship strength of two entities
Xg  xh
in same/different types  and Y = (Y1 ···   YT ) is the partially labelled set for all types of entities.
Without loss of generality  we can formulate the semi-supervised learning model by ﬁrst considering
only two entity types  e.g. Xg and Xh. We let Oij = (xg
j   rij  Yl) be an atomic data point of the
observation where Yl are the labels of entities if there are  Zij = (zg
j   Yu) be the collection of
latent variables of the two entities where Yu are the predicted labels for entities without a label  and
Y = (Yu  Yl). Fij = ((xg
j )) is the conditional variables of variational posterior where 
i )  (xh
is a function taking entities’ feature as input for ﬁltering posteriors. Then  the logarithm marginal
likelihood of Oij can be written as:

i   xh

i   zh

log p(Oij) Eq(Zij|Fij )[log p✓(Oij Zij)  log q(Zij | Fij)] 

(3)

where the joint distribution  i.e. p✓(Oij Zij)  can be represented as:

i   xh

p✓(Oij Zij) = p✓(xg

(4)
In most real-world scenarios  such as recommender systems [31] and network embeddings [24] 
people only concern about the reconstruction of relations between entities rather than the feature
of the entities  thus p✓(xg
j   rij | Zij  Y) can be simpliﬁed to be p✓(rij | Zij  Y). With the
mean-ﬁeld approximate inference of the variational posterior q(Zij | Fij)  Eq. 3 can be written as:

j   rij | Zij  Y)p(Y)p(zg

i )p(zh
j ).

i   xh

log p(Oij) Eq(Zij|Fij )[log p✓(rij |Zij  Y)] KL(q(Zij | Fij) | p(zg

i )p(zh

j ))

  L(Oij) 

(5)
where L(Oij) is denoted as the ELBO of Oij. Note that  can be different types depending on
the heterogeneity of the observation entities. Incorporating an additional weighted discriminative
component as in Eq. 2 leads to the following lower bound for overall observations:

J ↵(O) = Xrij2R

L(Oij) + ↵ · Eepl(x y) [ log q(y|x)] .

(6)

4 Deep Semi-supervised Attributed Co-embedding

We now turn to the semi-supervised learning problem for the partially labelled attributed networks.

4.1 Problem Deﬁnition
Let G = (V A  A  X  Yl) be a Partially Labelled Attributed Network  with V and A being the
sets of nodes and attributes  respectively  A 2 RN⇥N and X 2 RN⇥M being the weighted adjacency
matrix and node attribute matrix  respectively  where N = |V| is the number of nodes and M = |A|
is the number of attributes. Yl is the label matrix representing the node labels. Since most nodes’
labels are unknown  V can be divided into two subsets: labelled nodes V l and unlabelled nodes V u
with their label matrix being Yl and Yu respectively.
The problem of Semi-supervised Attributed Network Co-embedding is deﬁned as:

4

Problem. Given a partially labelled attributed network G  learn a mapping function ⌅ that satisﬁes
the following in a semi-supervised way:

G = (V A  A  X  Yl) ⌅! Zn  Za  Yu 

(7)
such that both network structure  node attributes and the partial labels can be preserved as much as
possible by Zn  Za and Yu  where Zn 2 RN⇥D and Za 2 RM⇥D represent the latent representation
matrices for all the nodes and attributes  respectively  and Yu represents the learned labels for all
the unlabelled nodes. Here D is the size of the embeddings.

4.2 The Semi-supervised Co-embedding Model

Input Data

Embeddings & Labels

Reconstructed Data

Node Label: Yl
i

<latexit sha1_base64="i7Eb96cjatEd93K16r4yV+vKTPQ=">AAACC3icbZC7SgNBFIZnvcZ4i1raDAmCVdgVQbEK2FiIRDAXSdYwOzmbDJm9MHNWDEt6G1/FxkIRW1/AzrdxskmhiT8MfPznHM6c34ul0Gjb39bC4tLyympuLb++sbm1XdjZresoURxqPJKRanpMgxQh1FCghGasgAWehIY3OB/XG/egtIjCGxzG4AasFwpfcIbG6hSKbYQHTK+iLtBL5oE8oyOaeZ6f3o7uZEd0CiW7bGei8+BMoUSmqnYKX+1uxJMAQuSSad1y7BjdlCkUXMIo3040xIwPWA9aBkMWgHbT7JYRPTBOl/qRMi9Emrm/J1IWaD0MPNMZMOzr2drY/K/WStA/dVMRxglCyCeL/ERSjOg4GNoVCjjKoQHGlTB/pbzPFONo4subEJzZk+ehflR2DF8flyr2NI4c2SdFckgcckIq5IJUSY1w8kieySt5s56sF+vd+pi0LljTmT3yR9bnD8n7mtI=</latexit>
<latexit sha1_base64="i7Eb96cjatEd93K16r4yV+vKTPQ=">AAACC3icbZC7SgNBFIZnvcZ4i1raDAmCVdgVQbEK2FiIRDAXSdYwOzmbDJm9MHNWDEt6G1/FxkIRW1/AzrdxskmhiT8MfPznHM6c34ul0Gjb39bC4tLyympuLb++sbm1XdjZresoURxqPJKRanpMgxQh1FCghGasgAWehIY3OB/XG/egtIjCGxzG4AasFwpfcIbG6hSKbYQHTK+iLtBL5oE8oyOaeZ6f3o7uZEd0CiW7bGei8+BMoUSmqnYKX+1uxJMAQuSSad1y7BjdlCkUXMIo3040xIwPWA9aBkMWgHbT7JYRPTBOl/qRMi9Emrm/J1IWaD0MPNMZMOzr2drY/K/WStA/dVMRxglCyCeL/ERSjOg4GNoVCjjKoQHGlTB/pbzPFONo4subEJzZk+ehflR2DF8flyr2NI4c2SdFckgcckIq5IJUSY1w8kieySt5s56sF+vd+pi0LljTmT3yR9bnD8n7mtI=</latexit>
<latexit sha1_base64="i7Eb96cjatEd93K16r4yV+vKTPQ=">AAACC3icbZC7SgNBFIZnvcZ4i1raDAmCVdgVQbEK2FiIRDAXSdYwOzmbDJm9MHNWDEt6G1/FxkIRW1/AzrdxskmhiT8MfPznHM6c34ul0Gjb39bC4tLyympuLb++sbm1XdjZresoURxqPJKRanpMgxQh1FCghGasgAWehIY3OB/XG/egtIjCGxzG4AasFwpfcIbG6hSKbYQHTK+iLtBL5oE8oyOaeZ6f3o7uZEd0CiW7bGei8+BMoUSmqnYKX+1uxJMAQuSSad1y7BjdlCkUXMIo3040xIwPWA9aBkMWgHbT7JYRPTBOl/qRMi9Emrm/J1IWaD0MPNMZMOzr2drY/K/WStA/dVMRxglCyCeL/ERSjOg4GNoVCjjKoQHGlTB/pbzPFONo4subEJzZk+ehflR2DF8flyr2NI4c2SdFckgcckIq5IJUSY1w8kieySt5s56sF+vd+pi0LljTmT3yR9bnD8n7mtI=</latexit>
<latexit sha1_base64="i7Eb96cjatEd93K16r4yV+vKTPQ=">AAACC3icbZC7SgNBFIZnvcZ4i1raDAmCVdgVQbEK2FiIRDAXSdYwOzmbDJm9MHNWDEt6G1/FxkIRW1/AzrdxskmhiT8MfPznHM6c34ul0Gjb39bC4tLyympuLb++sbm1XdjZresoURxqPJKRanpMgxQh1FCghGasgAWehIY3OB/XG/egtIjCGxzG4AasFwpfcIbG6hSKbYQHTK+iLtBL5oE8oyOaeZ6f3o7uZEd0CiW7bGei8+BMoUSmqnYKX+1uxJMAQuSSad1y7BjdlCkUXMIo3040xIwPWA9aBkMWgHbT7JYRPTBOl/qRMi9Emrm/J1IWaD0MPNMZMOzr2drY/K/WStA/dVMRxglCyCeL/ERSjOg4GNoVCjjKoQHGlTB/pbzPFONo4subEJzZk+ehflR2DF8flyr2NI4c2SdFckgcckIq5IJUSY1w8kieySt5s56sF+vd+pi0LljTmT3yR9bnD8n7mtI=</latexit>

<latexit sha1_base64="Ulv01tgv/a2kVKrJ98OAxs9D6tc=">AAACMnicbVBNSwMxEM3Wr1q/qh69BIvgQWRXBMVTwYtepIKtH20t2XTWRrPZJZkVy7K/yYu/RPCgB0W8+iNMaxFrfRB4894MmXl+LIVB1312cmPjE5NT+enCzOzc/EJxcalmokRzqPJIRvrMZwakUFBFgRLOYg0s9CWc+jf7Pf/0FrQRkTrBbgzNkF0pEQjO0Eqt4mED4Q7To6gNezSjjZBhxw/Si+xStcTGUHn9U55nl/KX2y+vW8WSu+n2QUeJNyAlMkClVXxstCOehKCQS2ZM3XNjbKZMo+ASskIjMRAzfsOuoG6pYiGYZto/OaNrVmnTINL2KaR99fdEykJjuqFvO3tbmr9eT/zPqycY7DZToeIEQfHvj4JEUoxoLz/aFho4yq4ljGthd6W8wzTjaFMu2BC8vyePktrWpmf58Xap7A7iyJMVskrWiUd2SJkckAqpEk7uyRN5JW/Og/PivDsf3605ZzCzTIbgfH4BJZKr3A==</latexit>
<latexit sha1_base64="Ulv01tgv/a2kVKrJ98OAxs9D6tc=">AAACMnicbVBNSwMxEM3Wr1q/qh69BIvgQWRXBMVTwYtepIKtH20t2XTWRrPZJZkVy7K/yYu/RPCgB0W8+iNMaxFrfRB4894MmXl+LIVB1312cmPjE5NT+enCzOzc/EJxcalmokRzqPJIRvrMZwakUFBFgRLOYg0s9CWc+jf7Pf/0FrQRkTrBbgzNkF0pEQjO0Eqt4mED4Q7To6gNezSjjZBhxw/Si+xStcTGUHn9U55nl/KX2y+vW8WSu+n2QUeJNyAlMkClVXxstCOehKCQS2ZM3XNjbKZMo+ASskIjMRAzfsOuoG6pYiGYZto/OaNrVmnTINL2KaR99fdEykJjuqFvO3tbmr9eT/zPqycY7DZToeIEQfHvj4JEUoxoLz/aFho4yq4ljGthd6W8wzTjaFMu2BC8vyePktrWpmf58Xap7A7iyJMVskrWiUd2SJkckAqpEk7uyRN5JW/Og/PivDsf3605ZzCzTIbgfH4BJZKr3A==</latexit>
<latexit sha1_base64="Ulv01tgv/a2kVKrJ98OAxs9D6tc=">AAACMnicbVBNSwMxEM3Wr1q/qh69BIvgQWRXBMVTwYtepIKtH20t2XTWRrPZJZkVy7K/yYu/RPCgB0W8+iNMaxFrfRB4894MmXl+LIVB1312cmPjE5NT+enCzOzc/EJxcalmokRzqPJIRvrMZwakUFBFgRLOYg0s9CWc+jf7Pf/0FrQRkTrBbgzNkF0pEQjO0Eqt4mED4Q7To6gNezSjjZBhxw/Si+xStcTGUHn9U55nl/KX2y+vW8WSu+n2QUeJNyAlMkClVXxstCOehKCQS2ZM3XNjbKZMo+ASskIjMRAzfsOuoG6pYiGYZto/OaNrVmnTINL2KaR99fdEykJjuqFvO3tbmr9eT/zPqycY7DZToeIEQfHvj4JEUoxoLz/aFho4yq4ljGthd6W8wzTjaFMu2BC8vyePktrWpmf58Xap7A7iyJMVskrWiUd2SJkckAqpEk7uyRN5JW/Og/PivDsf3605ZzCzTIbgfH4BJZKr3A==</latexit>
<latexit sha1_base64="ck8pdC+ekZH4nUmSP+ZG7r8lEyk=">AAAB2XicbZDNSgMxFIXv1L86Vq1rN8EiuCozbnQpuHFZwbZCO5RM5k4bmskMyR2hDH0BF25EfC93vo3pz0JbDwQ+zknIvSculLQUBN9ebWd3b/+gfugfNfzjk9Nmo2fz0gjsilzl5jnmFpXU2CVJCp8LgzyLFfbj6f0i77+gsTLXTzQrMMr4WMtUCk7O6oyaraAdLMW2IVxDC9YaNb+GSS7KDDUJxa0dhEFBUcUNSaFw7g9LiwUXUz7GgUPNM7RRtRxzzi6dk7A0N+5oYkv394uKZ9bOstjdzDhN7Ga2MP/LBiWlt1EldVESarH6KC0Vo5wtdmaJNChIzRxwYaSblYkJN1yQa8Z3HYSbG29D77odOn4MoA7ncAFXEMIN3MEDdKALAhJ4hXdv4r15H6uuat66tDP4I+/zBzjGijg=</latexit>
<latexit sha1_base64="7Ez32J/T/uLhSFZ2TkT/5ShK/zQ=">AAACJ3icbVDLSgMxFL3j2/qqbt0Ei+BCZMaN4kpwoxtRsFpta8mkdzSayQzJHbEM801u/BLBhS4U8UdMH0h9HAicR0LuPWGqpCXff/FGRsfGJyanpkszs3PzC+XF2VObZEZgVSQqMbWQW1RSY5UkKaylBnkcKjwLb/e6+dkdGisTfUKdFJsxv9IykoKTs1rlgwbhPeWHSRt3WMEaMafrMMovikvdkus/5M23PC8u1VDakzetcsXf8Htgf0kwIBUY4KhVfmq0E5HFqEkobm098FNq5tyQFAqLUiOzmHJxy6+w7qjmMdpm3lu5YKvOabMoMe5oYj13+EXOY2s7cehudqe0v7Ou+V9WzyjabuZSpxmhFv2PokwxSli3P9aWBgWpjiNcGOlmZeKaGy7ItVxyJQS/V/5LTjc3AsePfZiCZViBNQhgC3ZhH46gCgIe4Bne4N179F69j35dI96gtyX4Ae/zC88eqlE=</latexit>
<latexit sha1_base64="7Ez32J/T/uLhSFZ2TkT/5ShK/zQ=">AAACJ3icbVDLSgMxFL3j2/qqbt0Ei+BCZMaN4kpwoxtRsFpta8mkdzSayQzJHbEM801u/BLBhS4U8UdMH0h9HAicR0LuPWGqpCXff/FGRsfGJyanpkszs3PzC+XF2VObZEZgVSQqMbWQW1RSY5UkKaylBnkcKjwLb/e6+dkdGisTfUKdFJsxv9IykoKTs1rlgwbhPeWHSRt3WMEaMafrMMovikvdkus/5M23PC8u1VDakzetcsXf8Htgf0kwIBUY4KhVfmq0E5HFqEkobm098FNq5tyQFAqLUiOzmHJxy6+w7qjmMdpm3lu5YKvOabMoMe5oYj13+EXOY2s7cehudqe0v7Ou+V9WzyjabuZSpxmhFv2PokwxSli3P9aWBgWpjiNcGOlmZeKaGy7ItVxyJQS/V/5LTjc3AsePfZiCZViBNQhgC3ZhH46gCgIe4Bne4N179F69j35dI96gtyX4Ae/zC88eqlE=</latexit>
<latexit sha1_base64="75o1PpybTvZCD3vWXMH+MDxc8iM=">AAACMnicbVBNSwMxEM36WetX1aOXYBE8iOx6UTwVvOhFKtj60daSTWdt2mx2SWbFsuxv8uIvETzoQRGv/gjTWsRWHwTevDdDZp4fS2HQdZ+dicmp6ZnZ3Fx+fmFxabmwslo1UaI5VHgkI33hMwNSKKigQAkXsQYW+hLO/e5h3z+/BW1EpM6wF0MjZDdKBIIztFKzcFxHuMP0JGrBAc1oPWTY9oP0KrtWTbE9UnZ+ysvsWv5yB2WnWSi6O+4A9C/xhqRIhig3C4/1VsSTEBRyyYypeW6MjZRpFFxClq8nBmLGu+wGapYqFoJppIOTM7pplRYNIm2fQjpQf0+kLDSmF/q2s7+lGff64n9eLcFgv5EKFScIin9/FCSSYkT7+dGW0MBR9ixhXAu7K+VtphlHm3LehuCNn/yXVHd3PMtP3WLJHcaRI+tkg2wRj+yREjkiZVIhnNyTJ/JK3pwH58V5dz6+Wyec4cwaGYHz+QUkUqvY</latexit>
<latexit sha1_base64="Ulv01tgv/a2kVKrJ98OAxs9D6tc=">AAACMnicbVBNSwMxEM3Wr1q/qh69BIvgQWRXBMVTwYtepIKtH20t2XTWRrPZJZkVy7K/yYu/RPCgB0W8+iNMaxFrfRB4894MmXl+LIVB1312cmPjE5NT+enCzOzc/EJxcalmokRzqPJIRvrMZwakUFBFgRLOYg0s9CWc+jf7Pf/0FrQRkTrBbgzNkF0pEQjO0Eqt4mED4Q7To6gNezSjjZBhxw/Si+xStcTGUHn9U55nl/KX2y+vW8WSu+n2QUeJNyAlMkClVXxstCOehKCQS2ZM3XNjbKZMo+ASskIjMRAzfsOuoG6pYiGYZto/OaNrVmnTINL2KaR99fdEykJjuqFvO3tbmr9eT/zPqycY7DZToeIEQfHvj4JEUoxoLz/aFho4yq4ljGthd6W8wzTjaFMu2BC8vyePktrWpmf58Xap7A7iyJMVskrWiUd2SJkckAqpEk7uyRN5JW/Og/PivDsf3605ZzCzTIbgfH4BJZKr3A==</latexit>
<latexit sha1_base64="Ulv01tgv/a2kVKrJ98OAxs9D6tc=">AAACMnicbVBNSwMxEM3Wr1q/qh69BIvgQWRXBMVTwYtepIKtH20t2XTWRrPZJZkVy7K/yYu/RPCgB0W8+iNMaxFrfRB4894MmXl+LIVB1312cmPjE5NT+enCzOzc/EJxcalmokRzqPJIRvrMZwakUFBFgRLOYg0s9CWc+jf7Pf/0FrQRkTrBbgzNkF0pEQjO0Eqt4mED4Q7To6gNezSjjZBhxw/Si+xStcTGUHn9U55nl/KX2y+vW8WSu+n2QUeJNyAlMkClVXxstCOehKCQS2ZM3XNjbKZMo+ASskIjMRAzfsOuoG6pYiGYZto/OaNrVmnTINL2KaR99fdEykJjuqFvO3tbmr9eT/zPqycY7DZToeIEQfHvj4JEUoxoLz/aFho4yq4ljGthd6W8wzTjaFMu2BC8vyePktrWpmf58Xap7A7iyJMVskrWiUd2SJkckAqpEk7uyRN5JW/Og/PivDsf3605ZzCzTIbgfH4BJZKr3A==</latexit>
